id,created_at,text
482803279739379712,2014-06-28 08:30:46,"@SluppyB 'Morello' could be Morel lo, Morel-lo, Morel, Mirella, Mirelle, Merell, Murillo, Morally, Mireille, Marcello or Moral."
482797743807533056,2014-06-28 08:08:46,"@klausyblue_eyes @KLAAAUUSSS 'KLAAAUUSSS' could be KLAUS'S, CLAUS'S, CALAIS'S, GLASS'S, CLASS'S, KILAUEA'S, LAIUS'S or CALLUS'S."
482794220801900545,2014-06-28 07:54:46,@TJsMovieBlog @beckygracelea 'Giacomo' was the correct spelling. I always think it's wrong too :)
482784909107294208,2014-06-28 07:17:46,"@PauMusico @Rob_miller91 'omeprazol' could be imperial, imperil, imperials, imperils, imperially, imperiously or imprison."
482783651613007872,2014-06-28 07:12:46,"@ciruya 'siteings' could be sitings, sittings, steins, stings, sitting's, Stein's, sidings, stein's, settings or suiting's."
482781386592358401,2014-06-28 07:03:46,@mjdavis3 @garbage @ChiliPeppers @LauraJaneGrace @X929 'chumbawamba' could be chambermaid or .
482776100255191040,2014-06-28 06:42:46,"@melissaafusco @Shelby317 Congratulations, your spelling of 'Frankel' is perfect!"
482755464883470338,2014-06-28 05:20:46,"@TarotDarrow @expatina 'Schafer' could be Shaffer, Chafe, Safer, Shaver, Scoffer, Safe, Chiefer, Chaff, Saver or Shave."
482753454972997632,2014-06-28 05:12:47,"@sourtape 'gramercy' could be Kramer's, Graeme's, grammes, creamery, framers, grams, Grammy, Kramer, crammers, creamers or gamers."
482752700153462784,2014-06-28 05:09:47,"@NazifaSakinun @ckclae 'rennaisance' could be Renaissance, renaissance, Renaissances, renaissances, reconnaissance or Renascence."
482749175126167552,2014-06-28 04:55:47,"@ThePaigeRandall @writing4kix @Jackson_D_Chase 'Onamotapeia' could be Onomatopoeia, Onomatopoeic or Onomatopoeia's."
482747916184866816,2014-06-28 04:50:46,"@ThePaigeRandall @writing4kix @Jackson_D_Chase 'megalomaniacally' could be megalomaniac ally, megalomaniac-ally or megalomaniacs."
482747666665705472,2014-06-28 04:49:47,"@BeggsSpencer 'Wiliam' could be William, Wilma, Willem, Wilmar, Whilom, Williams, Vilma, Liam, Gilliam, Wilie, Willa or Wilda."
482735333004431360,2014-06-28 04:00:46,"@Cody2488 @dustinlong @Tbayne21 @mattbirdsong 'Krashneski' could be Krishna's, Garishness, Kerensky, Krishnah's or Garishness's."
482730050651824129,2014-06-28 03:39:47,"@kenzyluvsbreezy 'bareable' could be bare able, bare-able, bearable, bearably, arable, variable, parable, shareable or bailable."
482729796305027072,2014-06-28 03:38:46,"@DaMilliMan 'cabun' could be ca bun, ca-bun, cabin, cabana, carbon, Cobain, Cajun, cabbing, carbine, Cuban, Gabon or cabins."
482729041095426048,2014-06-28 03:35:46,"@THEmattjamieson @wildelotus @pansyfilmmaker 'pati' could be Patti, pa ti, pa-ti, Pat, pat, Patin, patio, Pate, pate or pats."
482727783807090688,2014-06-28 03:30:46,"@_DrLee_ 'Bernesha' could be Bernese, Burnish, Bernetta, Berne's, Berna, Bench, Barnes, Bern's, Banish, Burnisher or Benetta."
482724009293774848,2014-06-28 03:15:47,"@snowy_ume @sobsob_0301 'baowl' could be bawl, bowl, Bail, bail, Baal, Ball, ball, biol, blow, boil, boll, Bale, bale or bole."
482715198654922752,2014-06-28 02:40:46,"@SassyFemEren @BloodForChico @Genelyn_Silva 'ochinchin' could be Inchon, inching, technician, machination or ordination."
482714446159036416,2014-06-28 02:37:47,@AnnaGraceNoel Our team of dedicated staff working around the clock has determined that 'monsoon' is spelt correctly.
482709663801040896,2014-06-28 02:18:46,"@kawaicara 'Feeny' could be Ferny, Fern, Fen, Ferne, Teeny, Weeny, Fanny, Finny, Funny, Deeyn, Deny, Erny, Frey, Feet or Fine."
482700856106557440,2014-06-28 01:43:46,"@Slightdelirium @SirEvisiae 'Neilson' could be Neil son, Neil-son, Neils on, Neils-on, Nelson, Nilson, Nealson, Nielsen or Nelsen."
482699094410801153,2014-06-28 01:36:46,"@darryljordan @LauraStraightUp 'Libereel' could be Liberal, Liberally, Libel, Libeler, Liberals, Liberace, Liberate or Libero."
482698841347473408,2014-06-28 01:35:46,"@bohacek64 @KathyLammers1 'kambree' could be jamboree, Kimbra, jamborees, cambered, Kimberlee, camber, jambed, cambers or gambler."
482697835649847296,2014-06-28 01:31:46,"@CactusWren75 @ShingetsuMoon 'Lusch' could be Lu sch, Lu-sch, Kusch, Lush, Lurch, Busch, Lunch, Such, Lucho, Sch or Leach."
482697082260574208,2014-06-28 01:28:47,@VinnyMags @wivawat04 'whippersnappers' is a tricky word. You spelt it perfectly!
482695570281078784,2014-06-28 01:22:46,"@mel_agardiner 'Daedrea' could be Dedra, Deidre, Deerdre, Dierdre, Adrea, Daydream, Tedra, Deader, Darda, Deirdre or Ardra."
482694061422153728,2014-06-28 01:16:46,"@Ulanna94 @plsiza 'macumba' could be Macumba, Macumba's or mamba."
482692299181137920,2014-06-28 01:09:46,"@RAWFShowtime @UltraLiger 'hermaphodites' could be hermaphrodites, hermaphrodite's, Hermaphroditus, hermaphrodite or Hermaphroditus's."
482691798083444736,2014-06-28 01:07:47,"@Burnowski @megynkelly Yes, 'Ayers' was correctly spelt!"
482690791337250817,2014-06-28 01:03:47,"@darryljordan @LauraStraightUp 'McConough' could be McCullough, Macon, McCain, Marconi, McCoy, Mocking, Mucking or McKnight."
482684246679883776,2014-06-28 00:37:46,"@zakkanaction 'ringabel' could be runnable, singable, Rosabel, Anabel, winnable, tunable, enable, unable, Annabel or relabel."
482682740030980096,2014-06-28 00:31:47,"@jakeMivill @mofgimmers 'Jonze' could be Jones, Jone, Jounce, Jonie, Jon's, Jonas, Jonis, Gonzo, Joane, Joannes, Jone's or Johns."
482681985022717952,2014-06-28 00:28:47,"@Pixei @RoxBBFan57 @asafix_9 @cjensen23 @DerekMiles17 'Matzek' could be Mates, Matzo, Mattes, Matzoh, Matzos, Matzot or Mate's."
482676194333040641,2014-06-28 00:05:47,"@YellowHammerNFC @Nashville_FC 'Fefana' could be Fafnir, Fifine, Faina, Fania, Fauna, Fran, Fan, Fen, Fianna, Devan or Evania."
482675691087859712,2014-06-28 00:03:47,"@YellowHammerNFC 'Fefana' could be Fafnir, Fifine, Faina, Fania, Fauna, Fran, Fan, Fen, Fianna, Devan, Evania, Fenian or Fern."
482674432956055555,2014-06-27 23:58:47,@ZedEhSea 'Ritchie' is correct! Try using http://t.co/LDs25IoGHY if you're ever in doubt again.
482674180240859136,2014-06-27 23:57:46,"@Deus_Ex_Human 'Pinkette' could be Pinkeye, Pinked, Pinsetter, Pickett, Pinkest, Picketer, Pinker, Pinkerton, Puckett or Punkest."
482672670820282368,2014-06-27 23:51:47,"@ID0ntGivaFuck 'LABEAOUF' could be LABIUM, LABIA, LABOR, LABAN, LABEL, LARBOARD, LABIAL, LABORS, LAYOFF, LIBERO, LAVA or LAVE."
482669397866065920,2014-06-27 23:38:46,"@otlbates 'Google' could be Go ogle, Go-ogle, Goggle, Googly, Gogol, Giggle, Gaggle, Gargle, Gurgle, Joggle, Googlies or Gogol's."
482666629981929473,2014-06-27 23:27:46,"@dougiejr61 'Draisaitl' could be Drastic, Diarist, Distill, Distal, Driest, Bristol, Diarists, Draftily, Drusilla or Diastole."
482666380051763200,2014-06-27 23:26:47,"@tidus_37 'Reinhart' could be Rein hart, Rein-hart, Reinhard, Reinhardt or Reinhard's."
482658076768489472,2014-06-27 22:53:47,"@GDConte @DatKidArod 'goldonbi' could be Goldina, Golding, Golden, golden, goldener, Golden's, gilding, Goldwyn or Goldina's."
482657571027697665,2014-06-27 22:51:46,"@Raptor_Slut @D_Talvi 'royalteacat' could be royalties, royalty, altercate, royalty's, reelect, reflect or reallocate."
482651281635295232,2014-06-27 22:26:47,@_MichaelSum_ 'Ventriloquist' is spelt correctly - feel free to shower me with gratitude.
482647507009150976,2014-06-27 22:11:47,"@aGirl_aDroid @Adeligirl 'Mpumalonga' could be Pummeling, Memling, Pamelina, Prolong, Memling's, Mammalian, Pommeling or Melange."
482640208857276416,2014-06-27 21:42:47,"@elongor @MicahBallou 'Cleburn' could be Cliburn, Claiborn, Clayborn, Claybourne, Claiborne, Clayborne, Caliban or Cleon."
482637688722292736,2014-06-27 21:32:46,"@LauraLeslie23 @hedgeryhoops 'Abramovitch' could be Abramo, Abramo's, Abram, Abrams, Abrasive, Abram's, Abrasives or Abrasive's."
482635423710064641,2014-06-27 21:23:46,@CBCharlsie 'Spock' is right... and to think that you doubted yourself!
482629136444162048,2014-06-27 20:58:47,"@llikeafoxx 'Asha' could be Aisha, As ha, As-ha, Ashia, Ash, Ashla, Asa, Aha, Ashe, Asia, OSHA, Ashy, Dasha, Masha or Sasha."
482627370877067264,2014-06-27 20:51:46,"@MomOverseas @alanizalex__ 'chema' could be chem, chemo, chm, Shem, chum, chime, chyme, Chimu, charm, chroma, chimer or cheap."
482622087966621697,2014-06-27 20:30:47,@bobby__peru @Somewhataldente 'Gabriela' is the correct spelling. You should have more faith in yourself :)
482614286842200064,2014-06-27 19:59:47,"@Miraskye 'Rocephin' could be Josephina, Josephine, Receiving, Roselin, Resin, Rosin, Roughing, Roseline, Receding or Rouvin."
482614285676199936,2014-06-27 19:59:46,"@rachaelcmclean @WillyHall5 'Tellani' could be Telling, Delano, Tulane, Bellini, Cellini, Fellini, Tallinn, Tilling or Tolling."
482612272359944193,2014-06-27 19:51:46,"@collzoc @fuckstradamus 'satter' could be setter, sitter, stater, scatter, spatter, swatter, sate, shatter, settee or sorter."
482611770696024064,2014-06-27 19:49:47,"@jenlynn2291 @BMW_LifeMorals 'cornelius' could be Cornelius, Cornelius's, Cornelia's, Cornela's, Cornell's or Cornelle's."
482603969324134400,2014-06-27 19:18:47,"@Potus_Geeks @Marnecheck 'Lollebrigida' could be Lollobrigida, Lollobrigida's, Brigida or Brigid."
482603968283959296,2014-06-27 19:18:47,"@Teya_Tamsen @WFMVan @gortzgouda @WoodfordCKNW980 'gortzgouda' could be cottaged, goutiest, catgut, curtsied, ghettoized or goatskin."
482597173884755968,2014-06-27 18:51:47,"@Zikayoka @PeterLaBarbera 'manimi' could be minim, Manama, manumit, Mani, Mimi, maim, mania, Mandi, manic, Minni or Naomi."
482593399912939520,2014-06-27 18:36:47,"@swasutra @Raj_Shake_Her 'McCann' could be McCain, Macon, Mann, McClain, Meghann, Megan, McCall, Manny, Mecca, Canny or Manna."
482591384449200129,2014-06-27 18:28:46,"@andie_walsh 'LeBoeuf' could be Lobed, Lebbie, Levey, Beef, Lobe, Leif, Levier, Lobes, Labor, Levee, Lever, Lubed or Rebuff."
482588367259832320,2014-06-27 18:16:47,"@jorgebdamian @rich_sherri @ExBreau 'Jaden' could be Jasen, Jade, Garden, Jading, Aden, Baden, Jaded, Jades, Laden or Judon."
482586856924512258,2014-06-27 18:10:47,"@kermike @JeremyWGR 'Drieseital' could be Distal, Driest, Recital, Cristal, Dristan, Kristal, Drusilla, Distill or Trestle."
482584589668319232,2014-06-27 18:01:46,@SarahEdwards0 @tillygirl3 @dawneywawney @chutneybuttons @GenevieveD_ @RosieBalls @crapolatombola 'boppers' could be coppers or hoppers.
482580313927720960,2014-06-27 17:44:47,"@gloryjolras @danedehaan 'romdram' could be humdrum, rostrum, mudroom or restroom."
482574020903047168,2014-06-27 17:19:47,"@Apple6reen 'LaBeouf' could be Labium, Labor, Label, Labors, Layoff, Leif, Lave, Lab, Labia, Labor's, Laborer, Libero or Lobed."
482571755827888128,2014-06-27 17:10:47,"@rupertx @musotim @YourLocalGP 'quiddich' could be kiddish, Yiddish, Kurdish, caddish, kaddish, quiche, quids, quid or Murdoch."
482564207141859329,2014-06-27 16:40:47,@fromthecor @eleanorjburgess After throwing several bananas at our spelling monkeys they have confirmed that 'Chow' is correct :)
482563201565851648,2014-06-27 16:36:47,"@NotGayDalek @Snifit @anarchic_teapot 'BESTIALISTS' could be BESTIALITY'S, BESTIALITY, SOCIALISTS, RECITALISTS or SOCIALIST'S."
482553638124916736,2014-06-27 15:58:47,"@rvatito 'Coulter' could be Colder, Jolter, Counter, Clutter, Colet, Cutler, Collete, Quilter, Coulee, Colt, Cult or Coiled."
482546340564463617,2014-06-27 15:29:47,@sarahinthepark @Tabz_ You spelt 'dressings' correctly. Find the definition by tweeting it to @_define
482545835377324034,2014-06-27 15:27:47,"@GeminiCyberFM @LeeDeWyze Believe it or not, you got it right - 'Sunny' is the correct spelling."
482545834270019584,2014-06-27 15:27:46,@hottweelz @LeeDeWyze You spelt 'Sunny' the right way - this calls for celebration. Hit it -&gt; http://t.co/WQHLXfflYl
482542061619400705,2014-06-27 15:12:47,"@AM1230KBCQ 'klotskis' could be klutz's, klutzes, glottises, classics, cultists, geodesics, cultism's, cultist's or klutziness."
482540552060010496,2014-06-27 15:06:47,@Cyber_FM @LeeDeWyze 'Sunny' is right... and to think that you doubted yourself!
482540551011459072,2014-06-27 15:06:47,"@GeminiCyberFM @LeeDeWyze Congratulations, your spelling of 'Sunny' is perfect!"
482540549954490368,2014-06-27 15:06:46,@hottweelz @LeeDeWyze 'Sunny' is right. Your sensational spelling is super solid. So is my alliteration.
482538791576428544,2014-06-27 14:59:47,"@fudgyokra @DigitallyRhi 'gaiman' could be gamin, gasman, Maiman, gamine, gaming, Cayman, German, cayman, gammon or Haman."
482522933709922305,2014-06-27 13:56:46,"@ryanholota 'Bodet' could be Bidet, Boded, Bode, Bodied, Bodes, Bidets, Border, Bide, Body, Boote, Bet, Bod, Bot or Boated."
482517401645617152,2014-06-27 13:34:47,@SteveWBIR 'Baker' is right... and to think that you doubted yourself!
482510101891125248,2014-06-27 13:05:47,"@xXc4tCh22Xx 'picknick' could be pick nick, pick-nick, picnic, Pickwick, picnicker, picnics or picnic's."
482507332673232896,2014-06-27 12:54:47,"@yntungol 'Tubulan' could be Tubular, Tubule, Tubman, Tuvaluan, Dublin, Tabular, Tubules, Tubal, Tulane, Turban, Turbulent or Tabla."
482505066465615873,2014-06-27 12:45:47,"@ESPjrIsland 'Cocorite' could be Coco rite, Coco-rite, Concrete, Coconut, Corporate, Cockpit, Jacobite, Decorate or Jocosity."
482504565606989825,2014-06-27 12:43:47,"@Rachel__xoxo @whitefairytails 'daazzzzzz' could be daze, dizzy, dazzle, dazzler, dz, Dasi, Zzz, dizzier, d'Arezzo or doz."
482501040642609153,2014-06-27 12:29:47,@ashtonlogy @isabelkho @Tafsy_Yap 'pythagoras' could be Pythagoras or Pythagoras's.
482498273807052800,2014-06-27 12:18:47,@thelyanscott @gingerisaspice Booting up... Starting Word 2003... (just kidding) 'Herring' is correctly spelt!
482490973520285697,2014-06-27 11:49:46,@hramsaeg Hey guess what? You spelt 'Mark' right! Bet you didn't expect that!
482481665575383040,2014-06-27 11:12:47,"@Aappaannddii 'margeherita' could be Margarita, margarita, Marguerite, Margareta, Margaretta or Margarito."
482466058733756416,2014-06-27 10:10:46,"@humancatalyst 'Serafinowicz' could be Slavonic's, Sarongs, Stravinsky's, Sarong's, Sphinx, Ironworks, Sarawak's or Srinagar's."
482461026470748160,2014-06-27 09:50:47,"@guyhodge @Rinha @philosophicalz @ProtoKun 'Rhodan' could be Rhoda, Riordan, Rodin, Rodina, Rhona, Radian, Rhonda or Rhodia."
482445929161576450,2014-06-27 08:50:47,"@RoyalHoops @Golden_FM @_Paddy_Smyth_ 'Kolisanic' could be Colonic, Clinic, Galvanic, Glissandi, Jolson, Classic or Jolson's."
482445173448658944,2014-06-27 08:47:47,@its_idahibrahim Gold star for you - 'assessment' is the correct spelling.
482439635457413121,2014-06-27 08:25:47,"@ozziewoman01 @theprojecttv @BickmoreCarrie 'mechelle' could be Mechelle, Michelle, Marchelle, Michele, Michell or Eachelle."
482432336630280192,2014-06-27 07:56:46,"@LadySassQuatch 'Themba' could be Thimbu, Themas, Them, Thumbs, Themes, Thoma, Theme, Thumb, Themed, Thermal, Therms or Therm."
482416734901526528,2014-06-27 06:54:47,"@csgcecchi @curlywurlyfi 'Bloodvessel' could be Blood vessel, Blood-vessel, Bloodlessly, Bloodless, Bloodiness or Bloodies."
482409185062043648,2014-06-27 06:24:47,@Kaity_Lou @BigBroLiveFeeds You are correct spelling 'Paola' that way. Good on you!
482404404033630208,2014-06-27 06:05:47,"@amandarjohnsen @BigBroLiveFeeds 'jacosta' could be Acosta, Jocasta, Costa, jocosity, costar, accost, jackstraw, cost or jacks."
482401132552019968,2014-06-27 05:52:47,"@SawyerBean21 @mishaconradie 'soudsokakia' could be loudspeaker, sidekick, sods, studbook, subsonic, suds, sudsier or sudsy."
482399119789412352,2014-06-27 05:44:47,"@NoNotWashington 'circumsized' could be circumcised, circumcises, circumcise or circularized."
482396602603024385,2014-06-27 05:34:47,"@Cheyenne_Jewel 'Urkle' could be URL, Uriel, Oakley, Argyle, Urge, Ural, Elke, Okla, UCLA, Ogle, Ugly, Kele, Buckle or Burgle."
482394088247808000,2014-06-27 05:24:47,@Cyber_FM @LeeDeWyze Booting up... Starting Word 2003... (just kidding) 'Sunny' is correctly spelt!
482394087165657088,2014-06-27 05:24:47,@hottweelz @LeeDeWyze My owl sense tells me that 'Sunny' is the right spelling!
482394086049984512,2014-06-27 05:24:47,@GeminiCyberFM @LeeDeWyze According to http://t.co/LDs25IoGHY 'Sunny' is spelt the right way!
482390313219006464,2014-06-27 05:09:47,"@_kaulani @nicolegafare 'medori' could be metro, Dori, Medici, Madurai, Maori, Madeira, Fedora, fedora, memory, merit or Doria."
482389808841388032,2014-06-27 05:07:47,"@sana__6 'Souchiro' could be Schizo, Socorro, Spiro, Ciro, Such, Charo, Shire, Shirr, Sushi, Sucre, Schmo, Sorcha or Sourer."
482388800568455169,2014-06-27 05:03:47,"@patchak21 'Kazemi' could be Karim, Jazmin, Jami, Semi, Karma, Kazoo, Kareem, Katmai, Kazan, Cami, Cozmo, Kama or Gaze."
482386539188871169,2014-06-27 04:54:47,@dominik @jessiechar After throwing several bananas at our spelling monkeys they have confirmed that 'Valuing' is correct :)
482382511050203137,2014-06-27 04:38:47,@Analogist @snobiwan My owl sense tells me that 'spinnaker' is the right spelling!
482376468643586048,2014-06-27 04:14:46,"@frau_frau_98 @goxldensadie 'ramune' could be Ramon, romaine, Ramona, Raine, ramie, ramming, reaming, roaming, amine or Romney."
482370681900777472,2014-06-27 03:51:47,"@RealRoninRose @trinalanay 'aquantinces' could be acquaintances, acquaintance's, acquaintance, Argentines or abundances."
482369928876421120,2014-06-27 03:48:47,"@itsadaline @agirlandaboy 'Stobbe' could be Stabber, Stubby, Sobbed, Strobe, Stubbier, Stone, Stove, Tobe, Stabbed or Stubbed."
482368920058212353,2014-06-27 03:44:47,@worldhero 'tiddlywinks' is correct. You're almost as smart as I am...
482367915052638208,2014-06-27 03:40:47,"@DenaVidaSalsera 'Goong' could be Gong, Going, Goon, Cong, Kong, Gang, Gonk, Goons, Goings, Gongs, Pong, Congo, Gog or Kongo."
482366405199659009,2014-06-27 03:34:47,"@Irahphs 'Maleficient' could be Maleficent, Maleficence, Melicent, Mellicent, Milicent, Malevolent, Millicent or Munificent."
482359356386590720,2014-06-27 03:06:47,"@sirdiesel 'Melchioni' could be Melchior, Mulching, Melchior's or Belching."
482358099047481345,2014-06-27 03:01:47,"@eeksta1 @SourceRyan @SethroOnTheTV 'whoopie' could be whoopee, whooper, whoop, whopper, whooped, whop, whoopees or whooping."
482351809533464576,2014-06-27 02:36:47,"@rmfaris @ChoppedCanada @PLoker Don't worry, you spelt 'Evelyn' correctly! It just looks wrong :)"
482347530886209536,2014-06-27 02:19:47,"@etcgtimc @jtLOL 'Lazowski' could be Lazies, Lazes, Laziest, Laces, Lases, Lassos, Lacework, Lazar's, Lasses, Lasso's or Loses."
482346018197876736,2014-06-27 02:13:46,"@paulalfordjones @Romaine33 'levern' could be Lavern, leaven, Laverna, Laverne, lever, Levin, Levon, liven, Severn or levers."
482344761257259009,2014-06-27 02:08:47,"@digitalteacup 'Versechel' could be Versicle, Vachel, Vesicle, Ezechiel, Vessel, Versatile, Satchel or Seashell."
482340735807533056,2014-06-27 01:52:47,"@jloz_3 @ItTakesAChurch 'quata' could be qua ta, qua-ta, quota, Qatar, quart, quanta, quarto, Kata, quad, quit, quot or Quito."
482338220005281792,2014-06-27 01:42:47,"@ajhoward09 @Unsilent 'Shelburne' could be Melbourne, Shebeen, Sherline, Shelbi, Shelby, Shipborne, Shelving, Shelden or Shalne."
482337715304673280,2014-06-27 01:40:47,"@lakeyia_ 'onessen' could be ones sen, ones-sen, unseen, Essen, insane, Essene, ones, Jensen, onuses, Inessa, unease or ensign."
482337462509764608,2014-06-27 01:39:47,"@Farney_fool @Just_jch24 'McDermett' could be Micrometer, McAdam, Magnetometer, Marketed, McAdam's, Multimeter or Macadam."
482336709091131392,2014-06-27 01:36:47,@italianmushroom @strudelarry You spelt that correctly! I know this because I once had a pet called 'madden'... seriously.
482336456799571968,2014-06-27 01:35:47,"@BrianEschler @Nate_Timmons 'Nurkic' could be Turkic, Nunki, Nordic, Niki, Nucleic, NRC, Nicki, Nikki, Nuking, Narc or Nuke."
482330416003559424,2014-06-27 01:11:47,@AmberLStover @PatternBar 'Herrera' is right. Your sensational spelling is super solid. So is my alliteration.
482329915069448194,2014-06-27 01:09:47,"@daaani_marie 'Benyai' could be Benni, Benji, Kenya, Bunyan, Banyan, Banzai, Bonsai, Benita, Benny, Berna, Berni or Berny."
482327901509926915,2014-06-27 01:01:47,"@EminemBERZERK_ @EminemSyndromee 'Delevigne' could be Delving, Delphine, Deluging, Delivering, Selvaging, Televising or Telephone."
482325385229508609,2014-06-27 00:51:47,"@DRAM100 @ChiTownProspect 'Serzbiak' could be Setback, Sabik, Seebeck, Seasick, Acerbic, Sleazebag, Swayback, Uzbek or Seaborg."
482324628182822913,2014-06-27 00:48:47,"@YOMAHA4REAL 'Joal' could be Joel, Coal, Goal, Jowl, Joan or Foal."
482324379154386945,2014-06-27 00:47:47,@DeerOccultism You are correct spelling 'vinaigrette' that way. Good on you!
482323873380040704,2014-06-27 00:45:47,@akahnnyc You spelt that correctly! I know this because I once had a pet called 'Sczczczerbiak'... seriously.
482315067384283136,2014-06-27 00:10:47,"@VeNT666 @GreyTheTick 'apologise' could be apologies, apologize, apologias, apologist, apologizes, apologia's or apologia."
482310538223837185,2014-06-26 23:52:47,"@JamesSmith1963 @pkedrosky 'sadarach' could be starch, Saudra, Sadr, starchy, scratch, Sudra, stretch, Saudra's or Sadr's."
482305504614432769,2014-06-26 23:32:47,@fottojourno Hey guess what? You spelt 'Garner' right! Bet you didn't expect that!
482303489523990528,2014-06-26 23:24:47,@ElizabethND04 @BloominBrands @Outback You spelt 'Nicki' correctly. Find the definition by tweeting it to @_define
482302734196957184,2014-06-26 23:21:47,"@WarmCigarette 'unspecial' could be unsocial, especial, especially or unessential."
482302232692412416,2014-06-26 23:19:47,"@papercrowned @poshe @strayarrowsblog 'poshe' could be posher, posh, poshed, poshes, pusher, pose, push, Moshe, poacher or posse."
482298204474470400,2014-06-26 23:03:47,"@AlfredoCocozza 'Pennell' could be Penn ell, Penn-ell, Pernell, Parnell, Penile, Panel, Penal, Penney, Renell, Fennel or Kennel."
482296694873128960,2014-06-26 22:57:47,"@SmithCassie 'Warnet' could be War net, War-net, Warned, Waneta, Warner, Want, Waned, Garnet, Wained, Wander, Went or Weaned."
482292671457673216,2014-06-26 22:41:48,"@NotPinnock @scotip23 'Iole' could be Ole, Viole, Idle, Isle, Cole, Dole, Pole, Bole, Hole, Mole, Role, Sole, Tole or Vole."
482288640878338048,2014-06-26 22:25:47,@eammon @k_addis Gold star for you - 'Daphne' is the correct spelling.
482287130995994624,2014-06-26 22:19:47,"@BOOLlN @Bulls_Jay 'paine' could be Paine, pain, pane, pine, Payne, pone, pained, patine, PIN, Pan, pan, piano, pin or Pawnee."
482283859224977408,2014-06-26 22:06:47,"@RevRichardColes @jatrius 'praevalebit' could be prevalent, prevailed, prefabbed, provability or privileged."
482283357955321857,2014-06-26 22:04:47,"@FrancisinMD 'Cisse' could be Cissy, Cissiee, Sissie, Cease, Nisse, Circe, Sissy, Coses, Vises, Sis, Cissies, Cusses or SASE."
482281849041874944,2014-06-26 21:58:47,"@EvilPilgrim @Spideyellis 'Omalley' could be Om alley, Om-alley, Amalle, Oakley, Alley, Marley, Oralle, Orally, Amalea or Amalee."
482278072201138177,2014-06-26 21:43:47,"@RyOfTheDead 'Yakizowa' could be Kiowa, Yakima, Yaks, Kiowas, Taxiway, Yak's, Yalow's, Yakima's, Kiowa's, Okinawa, Kazoo or Yak."
482274044960460801,2014-06-26 21:27:47,@literatesavant @ok4bx @NT7S 'Gorky' is correct!
482271025866895361,2014-06-26 21:15:47,@mrjamieyates @realjahwobble @prodnose 'Peer' is correct!
482267501711982592,2014-06-26 21:01:47,"@therealgoyabean @ronnierocketz 'pedophilic' could be pedophilia, pedophile, pedophiles or paedophilia's."
482257940531781632,2014-06-26 20:23:47,"@RachelSB Yes, 'Peterson' was correctly spelt!"
482257183304732672,2014-06-26 20:20:47,"@clairejharper @Pete_C7 I always think 'Meniscus' looks wrong, but don't worry, it's right!"
482253157032943616,2014-06-26 20:04:47,"@Rivorniel @kwatschmitsauce @mybookworld2 'drindl' could be dirndl, trundle, brindle, dwindle, friendly, drained or droned."
482251899177930752,2014-06-26 19:59:47,"@Finn_aka_Jeremy @usopencup @AlanLeonard 'Tica' could be Ti ca, Ti-ca, Tic, Tics, Rica, Tick, Tia, FICA, Tina, Mica or Pica."
482241582121250817,2014-06-26 19:18:47,"@scvjohn @Bullseye @JesseThorn 'Salonen' could be Salon en, Salon-en, Saline, Salon, Salomon, Salines, Saloon, Salons or Sloven."
482240073362980866,2014-06-26 19:12:47,"@joeparlock 'Malamut' could be Malamute, Malamud, Malamutes, Malt, Malamute's, Malamud's or Mamet."
482236548142735360,2014-06-26 18:58:47,"@XBA83 @sealshockey 'niskenen' could be nosecone, sickening, skeining, nosecones, signing or skinning."
482227237819645952,2014-06-26 18:21:47,"@erinireland @LesPetiteBon 'ecka' could be Becka, Elka, Eyck, Ericka, EC, Eva, RCA, CA, Ca, ca, ck, ea, Seka, ceca or Eco."
482225729988329472,2014-06-26 18:15:48,"@SunshinesDad @PrimeBane 'Draisatl' could be Distal, Cristal, Dristan, Kristal, Diarist, Driest, Crustal, Diarists or Trista."
482225728935579649,2014-06-26 18:15:47,"@Stads20 @trentcondon 'Bernier' could be Berni er, Berni-er, Bernie, Berni, Vernier, Barnie, Bennie, Beanie, Bonier or Burner."
482220947806494721,2014-06-26 17:56:47,"@LaMonicaBuzz @BrianSNolan 'Labierint' could be Laboring, Labyrinth, Laurent, Liberian, Liberians, Aberrant, Brent or Briant."
482217676643631104,2014-06-26 17:43:47,@NikkiLouWrites You spelt 'Suarez' the right way - this calls for celebration. Hit it -&gt; http://t.co/WQHLXfflYl
482212893522272257,2014-06-26 17:24:47,"@garbii93 'Zendae' could be Zonda, Sendai, Sundae, Senate, Zena, Sender, Zenned, Send, Zenia, Jenda, Wenda, Zelda or Endue."
482211888726413313,2014-06-26 17:20:47,"@KyleBYoung @titlefightsux 'swinekisser' could be swine kisser, swine-kisser, swankies, swankier, swankiest, swines or Twinkies."
