id,created_at,text
491272291498459137,2014-07-21 17:23:36,"@andrewlynch27 @SBNLukeThomas 'Jaworski' could be Kawasaki, Casework, Kiosk, Jewess, Jaywalk, Whisk, Wesak, Coworker or Cowers."
491264741403140096,2014-07-21 16:53:36,"@DaliaHatuqa @dimireider @_Ms_R 'Hirshhorn' could be Highborn, Shoehorn, Heshvan, Shorthorn, Hushing, Hitchhike or Harsher."
491259206620553217,2014-07-21 16:31:36,@ApeseyApril @MagnifiqueEtoil @Epsom1780 @LisaF713 @TopTonto @Realburntoakboy @WThumper @GolanWay @KingsbarnsHorse 'Tagrooda' could be...
491227748916920320,2014-07-21 14:26:36,@DavidALigon You spelt 'OrvilleReddinbacher' the right way - this calls for celebration. Hit it -&gt; http://t.co/WQHLXfflYl
491226489996591104,2014-07-21 14:21:36,"@cafc4ever1 @ShaneWarne 'Reighly' could be Reilly, Rightly, Rely, Roughly, Richly, Highly, Wriggly, Really, Relight or Riley."
491223973674242049,2014-07-21 14:11:36,"@VoiceOfOSW 'Maxer' could be Max er, Max-er, Mixer, Maxie, Max, Makers, Maxi, Maxy, Maker, Maser, Maxed, Maxes, Laxer or Taxer."
491219445180669952,2014-07-21 13:53:36,"@speedsterstark @charmcitykate 'salasylic' could be salicylic, salesgirl, saleslady, salesclerk, sleazily, Selznick or sylphlike."
491217682172112896,2014-07-21 13:46:36,"@momisnowtweetin @MimbsPhotograph @peddoc63 @slaboe @IGVinyl 'niktu' could be Nikita, Niki, nit, Nikki, nifty, Nike or Niko."
491213154819395584,2014-07-21 13:28:37,"@thehannahphipps @halseymusic 'frangipani' could be franking, Franklin, Franglais, ranging, francophone, Francklin or orangutan."
491207616563929089,2014-07-21 13:06:36,"@eskelator15 @DanceBiker 'Cosacs' could be Co sacs, Co-sacs, Cossacks, Cossack's, Corsages, Casks, Sacs, Coasts or Cossack."
491207363420901376,2014-07-21 13:05:36,"@TARDIS_Blue12 @HlDDLE @signofjohnlock 'Rotenburg' could be Rosenberg, Gutenberg, Rydberg, Roddenberry, Ratbag or Tanbark."
491159299981185024,2014-07-21 09:54:37,"@uruparococo @zuubahlok 'psicosomatic' could be psychosomatic, psychosomatics, prismatic, schismatic, cosmetic or axiomatic."
491158041010532352,2014-07-21 09:49:36,"@HugoFitzpatrick @andgoseek 'Wasneaki' could be Sneak, Sneaky, Wozniak, Sneakier, Sneaker, Snake, Wesak, Snaky or Wasn't."
491122808198402050,2014-07-21 07:29:36,"@LunaLove1031 'mahalo' could be ma halo, ma-halo, Mahala, Mahalia, Margalo, halo, Marlo, Rahal, Manolo, Mala, Hali or Mali."
491115258413473794,2014-07-21 06:59:36,"@ouidameruvia @siri 'johnson' could be Johnson, john son, john-son, johns on, johns-on, Jonson, Johnston, Johns, Johnson's or johns."
491077762216513536,2014-07-21 04:30:36,"@madamemiserable 'Renweb' could be Renewed, Renewal, Renewing, Renewable, Runway, Renumber, Runaway, Runways or Runway's."
491072979569111040,2014-07-21 04:11:36,"@ellisooot 'chengteng' could be changing, chanting, Shantung, shantung, Chongqing, changeling, chantings, Chengdu or changed."
491070968035430400,2014-07-21 04:03:37,"@mzneisha0005 'Wakalies' could be Wallies, Weeklies, Waggles, Walkies, Wallie's, Weakliest, Kalie's, Wallis, Wales or Wakes."
491070715248914432,2014-07-21 04:02:36,"@RoxProgressive @DantePakistan 'Palistinean' could be Palestinian, Palestine, Palestinians, Palestine's or Palestrina."
491067694012063745,2014-07-21 03:50:36,@harpsichordz @alex_cimmino 'dowsing' is correct. You're almost as smart as I am...
491056120362848256,2014-07-21 03:04:37,"@InTransit74 @LPfanatic4ev 'Mosspoeda' could be Mossed, Misspend, Misspeak, Misspoke, Missed, Mopped, Moussed, Gossiped or Moped."
491051335320469504,2014-07-21 02:45:36,"@sekinsolving 'gayo' could be GAO, Gay, gay, Gaye, kayo, Mayo, gays, mayo or Gay's."
491049826839056385,2014-07-21 02:39:36,"@90steenziam 'dimandis' could be demands, diamonds, diamond's, Mandi's, dandies, Amandi's, demand, mantis, Mandie's or Manda's."
491047561231208448,2014-07-21 02:30:36,@sundogfarm @_JAM_News You spelt 'Shark' correctly. Find the definition by tweeting it to @_define
491032968039649280,2014-07-21 01:32:37,"@John_Hao 'wepa' could be we pa, we-pa, EPA, wept, wrap, weep, weeps, pea, Wes, weak, weal, wean, wear, weepy, PA, Pa or WA."
491032209805946880,2014-07-21 01:29:36,"@chmayer 'Artanian' could be Iranian, Attaining, Armenian, Tainan, Attain, Attuning, Artisan, Atoning, Athenian or Antonina."
491030451805356032,2014-07-21 01:22:37,"@alexanicole316 @LoveMeeshaa 'cerosi' could be cerise, Ceres, zeros, serous, Ciro's, zero's, zeroes, Eros, Ceres's or Cross."
491028186210127873,2014-07-21 01:13:37,"@NerveCenterCT 'SCROTUMblog' could be SCROTUM blog, SCROTUM-blog, Scrambling, Scramble, Scrambler, Scrambled or Scrambles."
491024159313362944,2014-07-21 00:57:37,"@jakestover1989 'ovaltine' could be oval tine, oval-tine, ovulating, ovating, overtone, ovulation, evaluating, ovulate or Aveline."
491011071767871488,2014-07-21 00:05:36,"@Gardentstate 'Harajuku' could be Habakkuk, Harangue, Hajji, Hajj, Hijack, Hayrick, Hayricks, Herrick, Haycock or Hancock."
490994713340567553,2014-07-20 23:00:36,@DavidLeake 'catchy' is a tricky word. You spelt it perfectly!
490994461040603136,2014-07-20 22:59:36,"@J3ssicaBitchh 'payut' could be payout, payed, payouts, Pat, pat, put, Paiute, payer, layout, peanut, part, peyote or pout."
490975840260202496,2014-07-20 21:45:36,@agreatwatson @AdamSanto @EmmyYoshida 'Clytemnestra' is the correct spelling. You should have more faith in yourself :)
490971058271289344,2014-07-20 21:26:36,"@summerdaze7 @CaroWallis 'Masstricht' could be Mistrust, Montrachet, Misdirect, Mistreat, Mastered, Mustached or Mysteried."
490955454432825345,2014-07-20 20:24:36,"@NeediZayMoore @ThechosenGOLDIE 'sensou' could be sen sou, sen-sou, sensor, sens, sense, censor, sensory, sensuous or Xenos."
490940104295186433,2014-07-20 19:23:36,@oKaiyte @CopperknobMusic My owl sense tells me that 'henna' is the right spelling!
490935575055433728,2014-07-20 19:05:36,"@TH_Southampton 'Ballou' could be Bally, Ball, Ballot, Tallou, Barlow, Baylor, Bellow, Billow, Bali, Baillie, Billowy or Alloy."
490931298240712704,2014-07-20 18:48:37,"@OctoberRose94 @Lucycl17 'autswitch' could be switch, twitch, Ipswich, outwith, autistic, twitchy, swatch, outwit or putsch."
490930037151899648,2014-07-20 18:43:36,"@Countrylitefun 'Crocosmia' could be Crocks, Crocus, Macrocosm, Microcosm, Crocus's, Crocuses, Crooks, Cricks, Crock's or Crook's."
490926265549869057,2014-07-20 18:28:37,"@MzMinaKahn 'Marinuicci' could be Moronic, Marin's, Marines, Maniacs, Maniocs, Marinas, Marina's, Mariners, Marians or Manioc's."
490924753146765313,2014-07-20 18:22:36,"@TheBubbaMaster 'Weinershizel' could be Winchell, Wenches, Winches, Venezuela, Windowsill, Winslow, Winchester or Vanishes."
490915947679453185,2014-07-20 17:47:37,"@RyBen3 'Baleadas' could be Ballads, Ballad's, Ballades, Balds, Bald's, Blades, Bleats, Bleeds, Ballard's, Ballade's or Valeda's."
490910912669179904,2014-07-20 17:27:36,"@TheKickIsGood @Falstaff_20 'seantrel' could be Central, central, senatorial, Cantrell, sentinel, sentries, sentry or antral."
490908646901940224,2014-07-20 17:18:36,"@IrishRose23525 @Emecs 'ColAlanWest' could be Callowest, Cleanest, Cleanliest, Colonist, Columnist, Goldenest or Cleansed."
490908143518355456,2014-07-20 17:16:36,"@NyAngelina_12 'Ligeous' could be Ligneous, Lieges, Loges, Logos, Luges, Lego's, Liege's, Loge's, Logo's, Luge's or Lagos."
490896318563229696,2014-07-20 16:29:37,"@Sagesaturn 'Digglet' could be Toggled, Piglet, Wiglet, Giggled, Jiggled, Niggled, Wiggled, Digest, Doggiest, Dialect or Dogged."
490894808353746944,2014-07-20 16:23:37,"@Jade44_4 @elegantdame 'Decluttering' could be De cluttering, De-cluttering, Cluttering, Clattering, Glittering or Declaring."
490894559748960257,2014-07-20 16:22:38,"@LauraBoustani @IrishJayhawk66 @DannyDeraney 'Dibbeyeh' could be Bibbye, Dibble, Dubber, Dubbers, Dabber, Bobbye or Dobbed."
490889521475514368,2014-07-20 16:02:36,"@ottchip @ChristianInst @morris64rick @AnitaG39342039 'significense' could be significance, significances, magnificence or signifies."
490888011681251328,2014-07-20 15:56:36,"@jamescockrum1 @AmandaMDanger 'FuckYou' could be Fuck You, Fuck-You, Fuck, Fucks, Fucker, Fucked, Fuckers, Fucking or Fukuoka."
490887509585321986,2014-07-20 15:54:37,"@alwayscoffee @muchadoaboutJC 'deet' could be deer, feet, Dee, deed, diet, duet, debt, deft, dent, dept, beet, deem or deep."
490886502709092352,2014-07-20 15:50:37,@jamescockrum1 @AmandaMDanger 'Niko' is spelt correctly! Who needs Google when you have me?
490870898669281280,2014-07-20 14:48:36,"@michaela__jane 'jonesin' could be Jonson, Johnson, Jansen, Jensen, Jones, consign, consing, Joneses, Jonis, Jone's or jouncing."
490869388061339649,2014-07-20 14:42:36,@iamshayee @TheBlackHermit According to http://t.co/LDs25IoGHY 'Cantrell' is spelt the right way!
490868638958620672,2014-07-20 14:39:38,"@kocosports @K1LLAK1N9 'BotchaMania' could be Brahmani, Botching, Buchanan, Pitchman, Bushman, Charmain, Brahman or Dutchman."
490864104588845056,2014-07-20 14:21:37,"@Prince_II 'Alagba' could be Algieba, Alba, Alga, Algebra, Algae, Alga's, Algal, Alb, Elba, Elga, Olag or Olga."
490838436371124226,2014-07-20 12:39:37,"@Fubsy @mrchrisaddison 'Krantz' could be Grants, Grant, Grant's, Rants, Koontz, Krauts, Frants, Grands, Grunts, Kant's or Korans."
490809751731597312,2014-07-20 10:45:38,"@robinhosking @markalannixon 'Donohue' could be Donahue, Dinghy, Donor, Done, Donnie, Dengue, Tongue, Donahue's, Donne or Donut."
490791880997605376,2014-07-20 09:34:37,"@TheBustyStClair @jordannem1 'Anucsunamoon' could be Incarnation, Inclination, Nicknaming, Uncommon, Insinuation or Accustoming."
490778038972338176,2014-07-20 08:39:37,"@eld246 'Bontempelli' could be Temple, Contempt, Contemplate, Contumely, Montpelier, Interpol, Templar, Bounteously or Interplay."
490760674520203264,2014-07-20 07:30:37,"@Trisity_ 'Vergara' could be Viagra, Vergers, Verger, Vagary, Verges, Verge, Vegas, Vega, Vera, Verger's, Vargas or Vega's."
490759415042015232,2014-07-20 07:25:37,"@mgerrydoyle 'commandotroepen' could be commandeering, commendatory, communitarian or commentating."
490755135711109121,2014-07-20 07:08:36,"@Johno_37 'ellio' could be Elli, Ellie, Elliot, Eli, ell, Alli, Elia, Elie, Ella, Elle, Elly, Ellis, Allie, Ollie or Eloy."
490715877172449280,2014-07-20 04:32:36,"@PetraNicks 'syrus' could be Cyrus, syrups, Sayres, Sirius, saris, serous, Tyrus, syrup, seres, sires, sores, Syria or Syria's."
490715627649114112,2014-07-20 04:31:37,"@Halderwoman @liviablackwood 'Halva' could be Halve, Alva, Half, Malva, Helve, Halves, Lava, Helluva, Hals, Halal or Hal."
490700781750726656,2014-07-20 03:32:37,"@BabyJelloChe @itsJessAndrea 'Sambello' could be Somberly, Amabelle, Symbol, Mabelle, Smell, Samuel, Smelly, Amabel or Samuele."
490693230258712577,2014-07-20 03:02:37,"@amyemoeller 'Mahones' could be Ma hones, Ma-hones, Machines, Hones, Manes, Malone's, Marines, Macons, Masons, Machine's or Manors."
490689202514706432,2014-07-20 02:46:37,@istiVargas_ako @jonalyn_viray 'stalagmites' is right. Your sensational spelling is super solid. So is my alliteration.
490671086028066816,2014-07-20 01:34:37,"@Hooper @TheJackalopeTX 'Mckitry' could be Military, Mockery, McCarty, Musketry, Monitory, Rocketry, Marquetry, Ctr or McCray."
490665798860419072,2014-07-20 01:13:37,"@TheMountainista @KyWildViolet 'Torgei' could be Toge, Togo, Torque, Torie, Dogie, Tog, Dirge, Tiger, Tore, Tori or Torrie."
490657244589993986,2014-07-20 00:39:37,"@CrappyAirBags @Kronykal 'seltezer' could be seltzer, seltzers, sleetier, salter, waltzer, sultrier, sleets, saltier or settees."
490633083171770369,2014-07-19 23:03:37,@TWEETsoSWEET888 @Jews4BIG @IJAN_Network @jewssf Gold star for you - 'Braze' is the correct spelling.
490616725902090240,2014-07-19 21:58:37,"@pinpanPamm @12MarceloV @CaptainFabFro 'Fellaini' could be Fellini, Felling, Fulani, Feline, Bellini, Cellini, Falling or Feeling."
490616472314462209,2014-07-19 21:57:36,"@SkusSkus @SkusSkus 'Citrulus' could be Citrus, Citrus's, Citruses, Stimulus, Citrons, Strolls, Cirilo's, Citron's or Trula's."
490614712871030784,2014-07-19 21:50:37,"@fullmetaIhomo 'farquuad' could be farad, fraud, squad, Marquita, facade, quad, Frayda, fajita, Freud, Jacquard or fathead."
490611692942794752,2014-07-19 21:38:37,@michaonthemoon @tiftif56 'lush' is correct. You're almost as smart as I am...
490610434597072896,2014-07-19 21:33:37,"@Winterkind0105 @niwatori_san 'Howanietz' could be Hornets, Howitzer, Wants, Wandie's, Hornet's, Wanders, Hollanders or Wanids."
490609678334709760,2014-07-19 21:30:37,@Firstduechartrs @stevenrinella Gold star for you - 'tartar' is the correct spelling.
490607667707015169,2014-07-19 21:22:37,"@Gh05t365 'Serita' could be Sarita, Seurat, Nerita, Serra, Surat, Serial, Rita, Senorita, Serrate, Scrota, Dorita or Series."
490605904027324416,2014-07-19 21:15:37,"@_DVance_ 'Schimmel' could be Schlemiel, Schmoes, Schiller, Chummily, Simile, Schmo, Ishmael, Schmuck, Samuel or Schmo's."
490605650984960001,2014-07-19 21:14:36,"@Aeromom322Carol @Ringham7 @Sleepwalker64 @thetennisspace @Yolitatennis 'Strycova' could be Strove, Strive, Struck or Stroke."
490605399729373184,2014-07-19 21:13:36,"@MamaJ1101 @caahjumma 'interesting' is correct. Look out, here comes the next Einstein!"
490602380673564672,2014-07-19 21:01:37,"@caahjumma @MamaJ1101 'sharpei' could be sharpie, Sharpe, sharper, Sharp, shape, sharp, sharped, sharpen or Sharpe's."
490594075356065792,2014-07-19 20:28:37,"@loomishamilton @VincentVanIke 'Hahnemann' could be Hangman, Harman, Hermann, Handyman, Hangmen, Honeymoon, Hartman or Anemone."
490592567277281280,2014-07-19 20:22:37,"@tanna_bby @GhostfaceChase 'yuquane' could be Yuan, yuan, quine, Yukon, Yolane, Yunnan, equine, Queen, queen, yucking or yukking."
490588541764644864,2014-07-19 20:06:37,@DavidLengling @Delta 'Anya' is correct!
490577466071597056,2014-07-19 19:22:37,"@unauthored @cocobyname @erghargh @NancyGryspeerdt 'baot' could be boat, bait, Bat, bat, bot, Bart, Boot, baht, boot or bast."
490556076643729409,2014-07-19 17:57:37,"@OhYeahShowtime Yes, 'laying' was correctly spelt!"
490552049029758977,2014-07-19 17:41:37,"@Queen_Me_Q 'ellyton' could be Elton, Ellyn, Alton, Eldon, Ellynn, Elston, Layton, Allyson, Clayton, Ellison, elating or Eldin."
490547520805015552,2014-07-19 17:23:37,"@empress_ajm 'roth' could be Roth, wroth, rot, Ruth, broth, froth, troth, Goth, Roch, both, doth, goth, moth, rota or rote."
490541228132282369,2014-07-19 16:58:37,"@comic_writer 'colloquel' could be colloquial, colloquies, colloquy, colloquially, colloquials, colloq, colonel or colloquium."
490530912761700352,2014-07-19 16:17:37,"@chriswangagency @tyoung594 'Woziniak' could be Wozniak, Wozniak's, Wink, Wooziness, Wozzeck, Sink or Zinc."
490524116252782593,2014-07-19 15:50:37,"@SNBalzac @ZaidaGrunes 'Accupuncturist' could be Acupuncturist, Acupuncturists or Acupuncture's."
490511030150107136,2014-07-19 14:58:37,"@TraceHudzn Believe it or not, you got it right - 'Moll' is the correct spelling."
490504488810061824,2014-07-19 14:32:37,"@Oya_Audra @anegorina @sayahappyslalu 'purri' could be purr, Perri, Peri, pure, purer, puree, Parr, purrs, Prue, Parry or Perry."
490503229776465920,2014-07-19 14:27:37,@soyuul My owl sense tells me that 'HERA' is the right spelling!
490502976348225536,2014-07-19 14:26:37,"@RyanHovey 'pharell' could be Harrell, Farrell, Darell, Ferrell, phalli, Farrel, Arel, thrall, Darelle, Darrell or payroll."
490498195437281280,2014-07-19 14:07:37,"@MallillinMarco @noeIIemercado 'Katsudon' could be Gadsden, Gaston, Catsuit, Judson, Caxton, Kerstin, Kirstin or Catsuits."
490497690782797824,2014-07-19 14:05:37,"@panIC_ultimate 'Nonsuch' could be Non such, Non-such, Nonesuch, Nonesuch's, Nonesuches, Mensch, Nonce, Nonuser, Nones or Noons."
490493415574888448,2014-07-19 13:48:37,"@orion99da @OneLungMcLung @ugliestaltarboy 'Teleco' could be Telex, TLC, Talc, Toledo, Telugu, Tel, Teller, Toltec or Deleon."
490490899294457856,2014-07-19 13:38:37,"@dorothyk98 'Lenieve' could be Lenee, Lenitive, Lenore, Levee, Lennie, Leonie, Live, Levier, Lenette, Lender, Leonine or Lanie."
490476805581582336,2014-07-19 12:42:37,"@MrsAleciaJones 'kindorf' could be kinder, kind, condor, kindle, kingdom, kinda, kinds, condors, kindlier, candor or Kendra."
490467742856650752,2014-07-19 12:06:37,"@marthakins 'Edray' could be Ed ray, Ed-ray, Dray, Deary, Eudora, Erda, Ardra, Esra, Adara, Adora, Adrea, Adria, Derry or ERA."
490445096672690177,2014-07-19 10:36:37,"@ArmchairCritic_ 'Ygritte' could be Gritter, Gritty, Grittier, Gritted, Grit, Gyrate, Critter, Grotto, Grotty, Grete or Grate."
490441574103265281,2014-07-19 10:22:37,"@Feymich @RealCharlaine @Harlee_S 'Hevereaux' could be Hoverer's, Beverages, Leverages, Haversacks, Averages, Beverage's or Heroics."
490429491890515968,2014-07-19 09:34:37,"@philcarter007 'Cooly' could be Cooley, Coolly, Cool, Colly, Corly, Coyly, Colo, Cloy, Coil, Coley, COL, Cly, Col or Color."
490424962235105280,2014-07-19 09:16:37,"@frankiemcjohn 'phaneng' could be phoning, phonon, fang, phonemic, faining, fanning, fawning, phalanger, phonetic or phonon's."
490415652637642752,2014-07-19 08:39:37,"@YehudaShapiro @joshspero 'broche' could be brioche, broach, brooch, Roche, brioches, broached, broaches, brooches or Baruch."
490372114138943488,2014-07-19 05:46:37,"@PRISSY_LYSSI 'grenadene' could be grenadine, Grenadian, grenade, Grenadines, grenades, grenade's, grenadier, Randene or grandee."
490345941258342400,2014-07-19 04:02:37,"@TheVic 'Shafer' could be Shaffer, Shaver, Safer, Chafe, Shave, Shaker, Sharer, Shiver, Shadier, Sheaf, Share, Shaft or Sheff."
490337891361386496,2014-07-19 03:30:38,"@ChrisUlvinen @PhilzCoffee Yes, 'Kelsey' was correctly spelt!"
490336127530713088,2014-07-19 03:23:37,"@mikaelala7 'zeppoles' could be peoples, Poles, poles, spools, supplies, people's, spool's, apples, zeppelins, sepals or Poole's."
490335877239824384,2014-07-19 03:22:37,@ChrisUlvinen @PhilzCoffee You spelt that correctly! I know this because I once had a pet called 'Kelsey'... seriously.
490331348125511681,2014-07-19 03:04:37,@_phaun 'Legend' was the correct spelling. I always think it's wrong too :)
490330341190533123,2014-07-19 03:00:37,"@_phaun 'midol' could be middle, modal, model, idol, modulo, Mikol, Madel, medal, Milo, medial, MIDI, midi, module or moduli."
490329838746497024,2014-07-19 02:58:38,"@wokkax3 'Johannsseennn' could be Johannes, Johann's, Johanna's, Hansen, Jansen, Johan's, Johannah's or Jehanna's."
490315994514993152,2014-07-19 02:03:37,"@pdstewart_ @MarkOdum 'Wellcommen' could be Welcome, Welcoming, Welcomed, Welcomes or Welshmen."
490301903658434560,2014-07-19 01:07:37,"@Davrinho 'Joffrey' could be Jeffrey, Jeffery, Jefferey, Jeffry, Geoffrey, Jorey, Godfrey, Coffey, Geoffry or Jeffrey's."
490284285115383808,2014-07-18 23:57:37,"@LfcDan 'Joffrey' could be Jeffrey, Jeffery, Jefferey, Jeffry, Geoffrey, Jorey, Godfrey, Coffey, Geoffry or Jeffrey's."
490277238747570176,2014-07-18 23:29:37,"@Carney_10 @KyleRyan46 'Marquinos' could be Marquis, Margins, Margin's, Markings, Marquis's, Marquises, Marquise or Aquino's."
490274220006313984,2014-07-18 23:17:37,"@formerlywelloff @iowahawkblog 'Mazeratti' could be Maserati, Macerate, Macerated, Macerates, Marat, Maserati's or Macerating."
490270446323900416,2014-07-18 23:02:37,"@klashklack @CompulsionJane 'diloden' could be Wilden, duodena, dildo, olden, Dillon, Dalton, dilled, Golden, Holden or Wildon."
490268936068268032,2014-07-18 22:56:37,"@asectual 'Vinzen' could be Vin zen, Vin-zen, Vinson, Vixen, Vincent, Vincenz, Vince, Vines, Venison, Vernen, Vine's or Vining."
490267425053478913,2014-07-18 22:50:37,"@SEAR20704 'Buttevent' could be Butt event, Butt-event, Butte vent, Butte-vent, Butternut, Betterment, Butterfat or Battened."
490266418617667584,2014-07-18 22:46:37,"@SunriseSunset7 'Gasa' could be GSA, Gas, Asa, Gaza, Gaea, Gasp, Gama, NASA, Gaga, Gala, Gash, Gas's or Ga's."
490260378559840256,2014-07-18 22:22:37,@DirtyVegas5 @sallymell @skinnypresident 'Lusitania' is right. Your sensational spelling is super solid. So is my alliteration.
490259120940130305,2014-07-18 22:17:37,"@TheTweetsOfMP @ObservantLynn 'Fascitis' could be Fascists, Fasts, Fascist's, Facets, Fascias, Facet's, Faucets or Faustus."
490251067787997184,2014-07-18 21:45:37,"@TylerNapier33 @TySparks12 'Verajo' could be Virago, Vera, Vera's, Veejay, Raj, Merak, Vega, Vere, Very, Terrijo or Vertigo."
490250818730213376,2014-07-18 21:44:38,"@RudyHellzapop @Dodslaw @aoifemrtn @KathOMeara 'myrrdral' could be Myrdal, Maridel, Meridel, marital, mistral, Myrtle or myrtle."
490226908190085120,2014-07-18 20:09:37,"@beckyyaworski 'Javon' could be Gavin, Kevon, Avon, Davon, Jason, Gavan, Gaven, Garvin, Jain, Jovian, Kevin, Caving or Jiving."
490210300004560896,2014-07-18 19:03:37,@hannibalburess 'Girl' is a tricky word. You spelt it perfectly!
490200234127921152,2014-07-18 18:23:37,"@atBeutel 'Thicke' could be Thicker, Thick, Thicko, Thicken or Thicket."
490195198979239936,2014-07-18 18:03:37,"@seanzo123x @PhillyD 'Panettiere' could be Panderer, Pantie, Pantries, Portiere, Paltrier, Pantry, Panties, Pantie's or Parterre."
490190165516615680,2014-07-18 17:43:37,"@IamNeyski @ladeesweetz 'Schweeeps' could be Schweppes, Sweeps, Schweppes's, Schleps, Sweepers, Sweeper's or Sweeps's."
490189661885562880,2014-07-18 17:41:37,@LaughOutMacLeod 'metamorphmaging' could be metamorphosing or metamorphic.
490188152481398784,2014-07-18 17:35:37,"@Megan89Alyss @cyn_dominguez 'braelyn' could be barely, brawling, brawny, brawl, brawn, Braden, barreling, brazen or Boleyn."
490185636544925697,2014-07-18 17:25:37,"@cyclelicious @spingineer Believe it or not, you got it right - 'Cousins' is the correct spelling."
490179346024255489,2014-07-18 17:00:37,"@Whipitup4food @CookLime 'cryptanite' could be captained, krypton, cropland, krypton's or competent."
490172552501665793,2014-07-18 16:33:38,"@CollegeScenes Yes, 'broad' was correctly spelt!"
490166006535311362,2014-07-18 16:07:37,@tristyn08 @tarynpaige27 After throwing several bananas at our spelling monkeys they have confirmed that 'parka' is correct :)
490154181282373633,2014-07-18 15:20:38,@GabeJohansson @carlyincontro No need to ask. You spelt 'Stuttered' correctly. No need to thank me either.
490143105979387904,2014-07-18 14:36:37,"@ndhapple 'Downton' could be Down ton, Down-ton, Downtown, Downturn, Danton, Dentin or Downtown's."
490140089503084544,2014-07-18 14:24:38,"@Hokey1951 @Cameron_Gray @mamaswati 'Priven' could be Riven, Driven, Privet, Prove, Proving, Pren, Prevent, Privier or Prover."
490101836724973568,2014-07-18 11:52:38,"@summerdaze7 'Rieu' could be Riel, Lieu, Roue, Rue, Rey, Roe, Riley, Thieu, Ire, RI, Re, Ru, Rice, Ride, Rife, Rile or Rime."
490101584282402816,2014-07-18 11:51:38,"@KristineBamBam @SkeeryJones @RadioBethany @theCarlaMarie @ElvisDuranShow 'Drunkyaoke' could be Drinkable, Drunkard or Drunker."
490096551495081984,2014-07-18 11:31:38,@Goodwithcolour You spelt 'Krishna' the right way - this calls for celebration. Hit it -&gt; http://t.co/WQHLXfflYl
490095040396394498,2014-07-18 11:25:37,"@mel_b_angel @missyjack @raley80 'Gilian' could be Gillian, Gillan, Kilian, Giuliani, Golan, Galina, Jillian, Julian or Killian."
490063581728092161,2014-07-18 09:20:37,"@svprima 'Tempah' could be Temp ah, Temp-ah, Temp, Tampa, Tempe, Tempo, Temper, Temps, Templar, Tamp, Tempt, Temp's or Temple."
490032378882969601,2014-07-18 07:16:38,"@aprilptx 'mortiqi' could be Mortie, martini, mortify, mortise, Martica, Mort, Morton, Marti, Morty, motif, Martino or Mortie's."
490032126733983744,2014-07-18 07:15:38,"@KeaghlanAshley @MiissMonica 'chankla' could be Chandal, Chantal, Chanel, channel, chancel, Chang, chink, chunk, shank or ankle."
490025081091796992,2014-07-18 06:47:38,"@bril_light Congratulations, your spelling of 'bomb' is perfect!"
490014763422711808,2014-07-18 06:06:38,"@rudemoon_ 'merishino' could be perishing, Merino, merino, derision, meshing, maraschino, erosion, meriting or meridian."
489990099984068608,2014-07-18 04:28:38,@chmayer 'Horse' is the right spelling :)
489980032991784960,2014-07-18 03:48:37,"@MsLegal_Eagle1 '2Chanz' could be Chan, Chan's, Chance, Chains, Chancy, Chane, Chang, Chant, Chins, Chaunce, Chain or Chain's."
489979782570864640,2014-07-18 03:47:38,"@SciaccaTweets @SouthPark @MikeSnider 'Tinniman' could be Tinning, Tannin, Trainman, Binman, Townsman, Funnyman or Tillman."
489978775094824960,2014-07-18 03:43:38,@BhavikML @ppmn You spelt 'Esther' correctly. Find the definition by tweeting it to @_define
489974498196598784,2014-07-18 03:26:38,@cooIkidzouis Good news! 'palates' is correct!
489974247419150336,2014-07-18 03:25:38,@beardchaser @johnnyoiIer You spelt 'supercalifragilisticexpialidoccious' correctly. Find the definition by tweeting it to @_define
489970473531228160,2014-07-18 03:10:38,"@TerrieWilliams 'Samm' could be Sammy, SAM, Sam, Same or Sam's."
489969213855891456,2014-07-18 03:05:38,"@Brojas_91 @gorelikeal 'Musika' could be Musk, Muskie, Music, Musky, Moussaka, Musks, Muzak, Muskier, Musical, Musics or Mask."
489963173496119297,2014-07-18 02:41:38,"@imfundy @MORTENEYE @ravi_layer 'Bombaclart' could be Bombast, Bobcat, Bombard, Bumbled, Bombardier, Immaculate or Bumbler."
489962421251883008,2014-07-18 02:38:38,"@iam_krisdior @thatdudehibbitt @ItsEricaNicole 'Jereremy' could be Jeremy, Jereme, Jeramey, Jeromy, Jerrome or Jeremie."
489962419465105408,2014-07-18 02:38:38,"@LakeLes @smilingsandra 'brahm' could be Brahma, bra hm, bra-hm, Bram, Byram, bream, Brahms, brim, Brahe, broom, beam or brash."
489950089180217345,2014-07-18 01:49:38,"@Hannah_Still93 @MadisonLeighT 'serieses' could be series es, series-es, series's, Arieses, cerise's, series, Erises or serenes."
