id,created_at,text
485966610046255104,2014-07-07 02:00:43,@danimal @LibrarianRy 'Mine' is correct. You're almost as smart as I am...
485965603497181184,2014-07-07 01:56:43,"@PNutButtaGellz 'Haddon' could be Had don, Had-don, Haydon, Hardin, Haydn, Hadron, Hayden, Harden, Hidden, Hading or Harding."
485957046538231808,2014-07-07 01:22:43,"@hoosercharles58 @mrmcd172 'epidymiology' could be epidemiology, epidemiology's, epistemology, etymology or epidemically."
485940938905120768,2014-07-07 00:18:42,"@ddot11003 'Mamajuama' could be Marijuana, Managua, Magma, Maugham, Managua's, Pajama, Macadamia, Macadam, Mammogram or Amalgam."
485940688429662208,2014-07-07 00:17:43,"@miss_lil_vicki @T_RoyCarlson 'Samardzjia' could be Smarties, Smarts, Somatic, Smartest or Semitic."
485933388742676481,2014-07-06 23:48:42,@CanasianMe Our team of dedicated staff working around the clock has determined that 'Stiles' is spelt correctly.
485914262682877953,2014-07-06 22:32:42,"@JNotha 'bobokie' could be bookie, Bobbie, boogie, boobies, Booker, Bobine, Brooke, book, Bibbie, Boigie, Bourbaki or Brockie."
485913510061174785,2014-07-06 22:29:43,@Brown_Ajah @ConcertiGrossi1 'Moran' is correct. You're almost as smart as I am...
485907973630214144,2014-07-06 22:07:43,"@mikeecorpuz 'colory' could be color, Clary, Glory, glory, colliery, colony, colors, Cooley, Kilroy, coley, Clarey or Colo."
485905706168504320,2014-07-06 21:58:42,"@mooks19 'endometriosis' could be optometrists, industrious, optometrist's, enterprises, optometrist, Enterprise's or enterprise's."
485895388830777344,2014-07-06 21:17:42,"@FatuousSunbeam @RevRichardColes 'feeg' could be Fee, fee, EEG, feed, feel, fees, feet, Fee's or fee's."
485893126288994305,2014-07-06 21:08:43,@TheDarrenSharp @queenbitched No need to ask. You spelt 'Zack' correctly. No need to thank me either.
485891110837841923,2014-07-06 21:00:42,"@hafmcg 'Voschel' could be Vesicle, Vocal, Versicle, Visceral, Vessel, Herschel, Visage, Scale, Viscose, School or Scowl."
485883059472830465,2014-07-06 20:28:43,"@StrongnStretchy 'ashtanga' could be Ashton, Ashton's, Asiatic, Chattanooga, acetonic or isotonic."
485873745739800577,2014-07-06 19:51:42,"@DrDePozzi @QuizMeBio 'hippocampus' could be hippo campus, hippo-campus, Hippocrates, campus, Hippocrates's, pompous or camps."
485870224613187584,2014-07-06 19:37:43,"@ingeniarius08 @PME2014 'saunamakkari' could be Sankara, Wanamaker, Annamaria, Annamarie, rainmaker, Sanskrit or Samaria."
485863932091842560,2014-07-06 19:12:42,"@cericme 'Demaris' could be Damaris, Dearies, Maris, Demetris, Demerits, Damaris's, Damara's, Demurs, Debris, Deloris or Demerit."
485854874349756417,2014-07-06 18:36:43,"@georgeensolomon @Lance_Sanchez 'Jolla' could be Joella, Joela, Jolly, Jill, Joell, Kola, Jilli, Jilly, Joelle, Joelly or Collar."
485844804345921536,2014-07-06 17:56:42,"@MEMcreative 'Luanna' could be Lianna, Lanna, Luann, Leanna, Liana, Lynna, Lana, Luna, Lianne, Laina, Lanni, Lanny or Leann."
485840023195885568,2014-07-06 17:37:42,@The_Road_Guy You spelt that correctly! I know this because I once had a pet called 'Gillespie'... seriously.
485832725094338565,2014-07-06 17:08:42,"@BearLoves14 'Djok' could be Jock, Dock, Dork, Joke, DJ, Dijon, Doc, Dog, Jog, Cook, Deck, Derk, Dick, Dirk, Dark or Duck."
485830963914502144,2014-07-06 17:01:42,"@kdreezy @ccrock10 'jimador' could be humidor, midair, Jamar, Amado, jihad, Kmart, mikado, jimmied, Jade, commode or jade."
485829705161916416,2014-07-06 16:56:42,"@KelseyFireheart @CassLifeblossom 'Deveaux' could be Deva's, Deaves, Devious, Decays, Deejays, Defeats, Devalues or FedEx."
485827693766660096,2014-07-06 16:48:43,"@PineappleyEren 'graffitti' could be graffiti, graffito, graft, gravity, graffito's, grafter, Graffias, Griffith or graphite."
485826434368143361,2014-07-06 16:43:42,"@vASHLEYs @robyntoledo_ 'saaw' could be Saw, saw, Saar, Saab, slaw or Shaw."
485802277345566722,2014-07-06 15:07:43,"@henryandsara @nafnlausi 'Poupoulina' could be Poplin, Peopling, Paolina, Paulina, Pipeline, Pooling, Opalina or Coupling."
485794977759244289,2014-07-06 14:38:42,"@Inkybat @momeraths Congratulations, your spelling of 'Poirot' is perfect!"
485780130787110912,2014-07-06 13:39:43,"@starlingseyes @Kats_my_Name__ 'shakshuka' could be Shaka, Shikoku, shakeups, shaikhs, shakeup, sharkskin, shakeouts or shaky."
485779880680767488,2014-07-06 13:38:43,"@BradHines 'synesthetic' could be anesthetic, synthetic, unaesthetic, anesthetics, synthetics, aesthetic or anesthetic's."
485777615072923648,2014-07-06 13:29:43,"@pprfldr @CBSSunday 'Capel' could be Carpel, Capella, Capek, Cpl, Chapel, Cape, Carpal, Caper, Camel, Capet, Caped or Capes."
485777613961437185,2014-07-06 13:29:43,"@kgollop @DavidJ_GF 'machet' could be machete, marched, matched, cachet, sachet, mashed, marcher, matcher, Chet, Mach or mach."
485770313829863424,2014-07-06 13:00:42,"@RRDCDance @TempCamKen 'Schlosser' could be Schlockier, Schiller, Schmoozer, Schmoes, Celisse, Scholars, Chlo's or Sloshes."
485748169783783426,2014-07-06 11:32:43,@RugerBlue @Charshy_pup 'cliched' is right... and to think that you doubted yourself!
485721997997903872,2014-07-06 09:48:43,"@emilyhwilson @christiemoffat 'warlberg' could be Walker, walker, Wilbert, Weinberg, warlike, Wilbur, wallboard or warlock."
485721996903215104,2014-07-06 09:48:43,"@Maynezee 'Abians' could be Avians, Fabians, Asians, Bairns, Bans, Bins, Abran's, Ania's, Anions, Cabins, Abbas or Beans."
485711176475480064,2014-07-06 09:05:43,"@jefference @llcooljer 'entendre' could be entente, ententes, intended, untended, intend, indenture, intends, entente's or intent."
485694819910443008,2014-07-06 08:00:43,@baileyeckert You are correct spelling 'lama' that way. Good on you!
485691044000854016,2014-07-06 07:45:43,"@VivaLaBussii @Sean_PA 'zandaya' could be Zandra, Sandye, Nadya, Nadiya, Zaneta, Sandy, Zonda, sandy, Sundays, Zonda's or Sunday."
485687018995716097,2014-07-06 07:29:43,@cupcaksandwitch 'governor' is spelt correctly! Who needs Google when you have me?
485684250113351680,2014-07-06 07:18:43,"@percyisinhell 'balotelli' could be bagatelle, Blondell, balloted, Bartel, Blondelle, bordello, belittle, ballot or balletic."
485674936082522112,2014-07-06 06:41:42,"@alexgould17 'unmysogynistic' could be misogynistic, antagonistic or interscholastic."
485668647285706752,2014-07-06 06:16:43,@rageahol @ShrillCosby You are correct spelling 'ferrule' that way. Good on you!
485655058738970624,2014-07-06 05:22:43,@ASamantha You spelt 'Pontchartrain' the right way - this calls for celebration. Hit it -&gt; http://t.co/WQHLXfflYl
485653547132801024,2014-07-06 05:16:43,"@ZoroastrianFunk @stevesalaita 'Darwish' could be Dar wish, Dar-wish, Darkish, Dwarfish, Danish, Darwin, Dervish or Tarnish."
485651785323782145,2014-07-06 05:09:43,@lllllletsstop 'ingrown' is right. Your sensational spelling is super solid. So is my alliteration.
485647506286444545,2014-07-06 04:52:43,"@CoolCalmCam 'buffoonary' could be buffoonery, buffoons, buffoon, buffoonery's, buffoon's or buffoonish."
485647005041975296,2014-07-06 04:50:43,"@JDGirl25 'Machida' could be Marched, Matched, Mashed, Macias, Machine, Mahdi, Machete, Marcia, Machined, Macho, Machs or Magda."
485644737873842176,2014-07-06 04:41:43,"@Jessikaz @jt_brinton @PalomaEpp @JThorneNJ @thejerzinator 'smegol' could be smugly, smell, smuggle, smegma, smog or Senegal."
485642473146822656,2014-07-06 04:32:43,"@jayhunnay 'bepedies' could be bipeds, biped's, bodies, bredes, besides, betides, birdies, Bordie's, bloodies, Brodie's or beeped."
485641215639949312,2014-07-06 04:27:43,"@McNicholMT9 @MarkyGaga Don't worry, you spelt 'Serena' correctly! It just looks wrong :)"
485639202474717184,2014-07-06 04:19:43,@jessica_mattes @StephAndTheGoat You spelt that correctly! I know this because I once had a pet called 'Leigh'... seriously.
485636433894322176,2014-07-06 04:08:43,@canakatydid @kelce5 You are correct spelling 'Asgard' that way. Good on you!
485631655135023104,2014-07-06 03:49:43,"@mommy2ejdnh @GordonRamsay 'kaesha' could be Keisha, Kassia, Kessia, Kessiah, geisha, Ganesha, Katusha, Cash, Marsha or Tawsha."
485627625503608833,2014-07-06 03:33:43,"@ahickman2 @kertjk 'Difranco' could be Franco, Franc, Franck, Frank, Drank or Franky."
485611266753327104,2014-07-06 02:28:42,"@Ben_Mendenhall @TheGabbieShow 'kardashin' could be dashing, Jordain, Katalin, crashing, Cardin, cardamon, stashing or Cartesian."
485608249006096384,2014-07-06 02:16:43,@kwetoday @hilarypetersonn 'satsuma' is spelt correctly! Who needs Google when you have me?
485605229782503424,2014-07-06 02:04:43,@mothertoevans No need to ask. You spelt 'Allen' correctly. No need to thank me either.
485585346382405632,2014-07-06 00:45:42,"@BillMcCabe @scottmerkin @Frank_The_K 'Edelstein' could be Elston, Dalston, Everlasting, Enlisting, Idlest, Alston or Adulating."
485584339837542400,2014-07-06 00:41:43,"@thiskillsthezan 'magnanimousman' could be magnanimous man, magnanimous-man, magnanimous, magnanimously or magnanimosity."
485579309575176193,2014-07-06 00:21:43,"@ginisimov @jaysonbuford 'cherepanov' could be cheeping, hereupon, Cherianne, thereupon, whereupon, cheapen, cheering or cheapens."
485571759643447296,2014-07-05 23:51:43,"@BYOP88 @SoCalKindOfGal 'Beckinsale' could be Beckons, Kinsley, Backings, Console, Begins, Kingsley, Beacons, Reconcile or Counsel."
485570248444108800,2014-07-05 23:45:43,"@Mastermind1808 'Lindergard' could be Landward, Laundered, Landed, Linked, Linted, Undercoat, Landlord, Bandaged or Undercut."
485569998652313600,2014-07-05 23:44:43,"@Liv3_th3_lif3 @AdamBongo 'COSGROVE' could be COS GROVE, COS-GROVE, CONGREVE, KASPAROV, CASCARA, CASCARAS, GEOGRAPHER or SCRUFF."
485567478815158272,2014-07-05 23:34:43,"@MegTao @aimeeeface @dustinadustbin @jojodacrow 'sama' could be Samar, Samoa, SAM, Sam, samba, Sana, AMA, same, Asama or Gama."
485560181883817985,2014-07-05 23:05:43,@rahnekat @gorgeousnerd 'Reilly' was the correct spelling. I always think it's wrong too :)
485556153619722240,2014-07-05 22:49:42,"@JuicyLipsJW 'Krul' could be Karil, Karyl, Krill, Jul, Karl, Raul, Rule, Karel, Karol, Koral, Cruel, Gruel, Kraal or Kr."
485555904385777664,2014-07-05 22:48:43,"@CitizenCotto 'Krul' could be Karil, Karyl, Krill, Jul, Karl, Raul, Rule, Karel, Karol, Koral, Cruel, Gruel, Kraal or Kr."
485554895852814336,2014-07-05 22:44:43,@SeanJA Gold star for you - 'Ruiz' is the correct spelling.
485554142258020352,2014-07-05 22:41:43,@ChrisCrobert According to http://t.co/LDs25IoGHY 'Forrest' is spelt the right way!
485549863254257664,2014-07-05 22:24:43,"@TomNovell 'balanos' could be balance, balloons, Balkans, Alano's, Blane's, blinis, balances, Balinese, baleen's or blanks."
485543071044468737,2014-07-05 21:57:43,"@CthatPath @beYOUtiful316 'Quinciera' could be Quinces, Quince, Quince's, Quincey, Jouncier, Quincey's, Quincy or Quincy's."
485536778095304704,2014-07-05 21:32:43,"@joeklaas 'ephus' could be Orpheus, phis, phys, Ephesus, Cepheus, effuse, pH's, ecus, emus, opus, Ev's, effs, eves or typhus."
485524698843725824,2014-07-05 20:44:43,"@_spanican Congratulations, your spelling of 'Cruz' is perfect!"
485522936451715074,2014-07-05 20:37:43,"@KTF4Ever 'aspertaum' could be aspartame, septum, sputum or aseptic."
485519918083751936,2014-07-05 20:25:43,"@fantagor 'Sumarjia' could be Samaria, Sumeria, Marja, Marji, Sumac, Marjie, Samara, Somalia, Mejia, Marj, Marga or Margi."
485518408163680256,2014-07-05 20:19:43,"@_JoyHan @ryanschuessler1 Congratulations, your spelling of 'boondoggle' is perfect!"
485516644593041408,2014-07-05 20:12:43,"@beniyukis @maidotsuki Yes, 'chrysanthemum' was correctly spelt!"
485508592791871488,2014-07-05 19:40:43,@jmcnally My owl sense tells me that 'Carlie' is the right spelling!
485500790857928704,2014-07-05 19:09:43,"@bay_estrian @JohnMiddlekauff 'Manziel' could be Manuel, Mandel, Mantel, Manlier, Manuela, Menzies, Manila, Mainsail or Manciple."
485491229312839680,2014-07-05 18:31:43,"@Vesthis @imNickiTaylor 'insulinoma' could be insulin, insulin's, Ursulina, insulting, Anselma, insulation, insuring or insignia."
485489214637633536,2014-07-05 18:23:43,"@springrounds @ZoraVredeveld 'doozy' could be dozy, doz, dizzy, oozy, doze, boozy, woozy, doors, dz, Doy, sooty or DOS."
485477135859978241,2014-07-05 17:35:43,"@FelskeFiles @Hegelbon 'Samardzja' could be Smarts, Smarties, Smartest or Somatic."
485473613827428352,2014-07-05 17:21:43,"@Iamdrewling No need for uncertainty, you spelt 'potty' correctly!"
485472606976360448,2014-07-05 17:17:43,"@SMFCFTOF 'januzai' could be Janus, banzai, Janis, Jacuzzi, jacuzzi, Jania, Kaunas, Janus's, Jania's, Jany's, Jan's or Jana."
485463295273349120,2014-07-05 16:40:43,"@PogalJoners 'Fellaini' could be Fellini, Felling, Fulani, Feline, Bellini, Cellini, Falling, Feeling, Filling, Fulling or Flin."
485457755705073664,2014-07-05 16:18:42,@Keeping_Secrets @Ascend_Descend According to http://t.co/LDs25IoGHY 'Tehran' is spelt the right way!
485456248016367616,2014-07-05 16:12:43,"@TheDeemerReamer 'Windhorst' could be Windiest, Wintriest or Wanderlust."
485455494488674304,2014-07-05 16:09:43,"@DreadJesterBatt 'Higuian' could be Hogan, Hagan, Guiana, Higgins, Hogging, Hugging, Iguana, Gian, Hiking, Haitian or Hagging."
485454484575772672,2014-07-05 16:05:43,"@jenclapp 'Martis' could be Mart is, Mart-is, Marti's, Marts, Mart's, Matti's, Martins, Marris, Martie's, Mats, Marta's or Marti."
485447942891782145,2014-07-05 15:39:43,@pifflepockle @Woodlandrefugee @SandsideScholar 'separate' is correct. You're almost as smart as I am...
485437372364910594,2014-07-05 14:57:43,"@dmalerk @mjo5988 @Gibbs11Brian 'Kobiashi' could be Kibosh, Basho, Bash, Josiah, Jobi's, Abash, Hibachi, Keisha or Gobi's."
485434355154554881,2014-07-05 14:45:43,@PrincessofVP No need to ask. You spelt 'Lamprey' correctly. No need to thank me either.
485433093323374592,2014-07-05 14:40:43,"@notout50 @BitwIct 'Yamakazi' could be Yamagata, Yamaha's, Kamikaze, Tameka's, Tamika's, Bamako's or Yamagata's."
485422526407774208,2014-07-05 13:58:43,"@pamhalperts 'prolethean' could be Promethean, polythene, Perelman, prowling, parathion, paroling or plaything."
485421771747627008,2014-07-05 13:55:43,"@MrsSaxobeat_ 'hipni' could be hairpin, hipping, hoping, hyping, Hopi, hip, hippie, hippo, hing, hips, hooping, Hanni or hip's."
485419507402297344,2014-07-05 13:46:43,"@sallysetsforth @siandart @catspyjamasnz 'fafa' could be fa fa, fa-fa, FAA, faff, Fara or Rafa."
485411453050957824,2014-07-05 13:14:43,"@funkelrot 'Picknick' could be Pick nick, Pick-nick, Picnic, Pickwick, Picnicker, Picnics or Picnic's."
485398114375725056,2014-07-05 12:21:43,@dallastfios @dallastfu 'AFFECTION' is a tricky word. You spelt it perfectly!
485384528106512385,2014-07-05 11:27:44,"@donneltinhead @mizuudere 'kuroo' could be Karroo, curio, juror, Karo, Kori, Kiri, Kora, Kore, Kory, Kr, Kari, Keri or Kira."
485378738176028672,2014-07-05 11:04:43,"@WeAreBrisbane @melapaku 'luchadore' could be lurched, ligature, leched, laudatory, lavatory, lechery, Leodora, lecture or Landry."
485374961079422976,2014-07-05 10:49:43,@ebonyoma 'packs' is correct!
485355586666520577,2014-07-05 09:32:43,@lelio_rising_ @subIimes 'joaquin' could be Joaquin or Joaquin's.
485354577193996288,2014-07-05 09:28:43,@EpicNiceTweets @lalacaust My owl sense tells me that 'Minor' is the right spelling!
485335452803530752,2014-07-05 08:12:43,"@seansthomas 'Keizcha' could be Keisha, Kirsch, Kusch, Krisha, Ketch, Geisha, Mischa, Koch, Ketch's, Ketches, Czech or Jecho."
485325636974555136,2014-07-05 07:33:43,"@pwilson24 @SteveBacon1 'kimosabe' could be Kim's, Mesabi, Jim's, jumbos, Kimmi's, Cosby, Kym's, comber, Kama's or casaba."
485324377462820864,2014-07-05 07:28:43,"@JeffGordonDoll 'Aleve' could be Al eve, Al-eve, Alive, Alvie, Alva, Alvy, Elev, Alene, Cleve, Elver, Alfie, Olive or Albee."
485313307440455680,2014-07-05 06:44:43,@aribarry @ellochristina 'Thai' was the correct spelling. I always think it's wrong too :)
485299213786296320,2014-07-05 05:48:43,"@biggeazy206 'Samardzjia' could be Smarties, Smarts, Somatic, Smartest or Semitic."
485296949784870913,2014-07-05 05:39:43,@BenBritton81 You spelt 'Sheffield' the right way - this calls for celebration. Hit it -&gt; http://t.co/WQHLXfflYl
485296192603963392,2014-07-05 05:36:43,@leprchaunrabbit You spelt 'ease' the right way - this calls for celebration. Hit it -&gt; http://t.co/WQHLXfflYl
485295941423861760,2014-07-05 05:35:43,"@HawkfrysNest @iamtheliquorr @airanimechiic 'Catalena' could be Catalina, Catalan, Catlaina, Catalonia, Catlin or Catalina's."
485294683656945664,2014-07-05 05:30:43,"@AaronWorthing @powerloci 'santeria' could be Santeria, Sandra, sangria, Sinatra, saunters, saunter, sanitarian or sauntering."
485277823788019712,2014-07-05 04:23:43,"@BelieveInZito 'Ariadna' could be Ariadne, Ariana, Adriana, Adrianna, Adiana, Oriana or Ariadne's."
485276060678770688,2014-07-05 04:16:43,"@ThatsKellie4Ya 'tunk' could be trunk, thunk, tun, dunk, tank, stunk, Tuck, Turk, tuck, tuna, tune, bunk, funk, gunk or hunk."
485269266459918340,2014-07-05 03:49:43,"@DurGallant @CFL @PaulOttoNeumann 'Gelebermens' could be Lieberman's, Clemens, Klemens, Gilbertine's, Gleamings or Albumen's."
485268511652970497,2014-07-05 03:46:43,@Leazyy_f_babyy @CodyBrown330 'riveter' is spelt correctly - feel free to shower me with gratitude.
485256181766582272,2014-07-05 02:57:44,"@Mistah_Boo 'zombiism' could be zombi's, zombies, zombie's, Zomba's or Zambia's."
485250643221688320,2014-07-05 02:35:43,"@Madamecrepue 'freeida' could be Freida, Fredia, Frieda, Freda, freed, Fredi, fried, Friday, Fred, Freddi or Freida's."
485247623964553217,2014-07-05 02:23:43,"@_OroroMunroe @itoldmeso @walpurgisnuit 'patrounus' could be patrons, patron's, patroons, patroon's, patroness, patronize or patron."
485246617671331840,2014-07-05 02:19:43,"@matthewsuxx 'Grande' could be Grandee, Grander, Grand, Grained, Grenade, Groaned, Craned, Grandeur, Granada, Grade or Granite."
485244603142897665,2014-07-05 02:11:43,"@voodooshuffler 'YUCIOHO' could be YAHOO, SOHO, YAHOOS, FUZHOU, SUZHOU, XUZHOU, YEAHS, YAHOO'S or YAMAHA."
485233531874840576,2014-07-05 01:27:43,@furf88 No need to ask. You spelt 'trilobite' correctly. No need to thank me either.
485226737911873538,2014-07-05 01:00:44,@FrancescaTysse @gardenrumpus 'yodels' is a tricky word. You spelt it perfectly!
485223466077937666,2014-07-05 00:47:43,@ChrisTragic 'chop' is spelt correctly - feel free to shower me with gratitude.
485218431721934848,2014-07-05 00:27:43,"@Mike93434086 @Roarzz 'Menous' could be Me nous, Me-nous, Menus, Menu's, Menes, Minos, Men's, Minus, Venous, Mano's or Mingus."
485213149704908800,2014-07-05 00:06:44,"@jake_frink 'Kracker' could be Cracker, Tracker, Karaoke, Crackers, Crack, Kicker, Rocker, Kramer, Krakow, Kroger or Kruger."
485210125716557826,2014-07-04 23:54:43,"@wendimclendonco @suzannewhang 'culottes' is correct. Look out, here comes the next Einstein!"
485208367892144128,2014-07-04 23:47:44,@AuthorizedMusin @jennreese You spelt 'Apple' correctly. Find the definition by tweeting it to @_define
485205092400766976,2014-07-04 23:34:43,@the_real_keg 'budget' is the right spelling :)
485203838157090817,2014-07-04 23:29:44,@andygenaille @E_84 'licerish' could be lickerish or liverish.
485199807514832896,2014-07-04 23:13:43,"@JamesOwens22 @Milanfan1988 @PhilaUnion @UnionRumors 'miglioranzi' could be migraines, Gloriana's, Gloriane's, migraine's or microns."
485199558297649152,2014-07-04 23:12:43,"@ShineEyeShay 'renner' could be runner, Renee, Rennie, rennet, Rene, tenner, runnier, Brenner, Reine, Renae, Renie or renew."
485194777055338496,2014-07-04 22:53:43,"@BarMas 'Zoigl' could be Coil, Soil, Soggily, Zonal, Gil, Ziegler, Skill, Zola, Gogol, Mogul, Ogle, Vigil, Googly or Zelig."
485188486824079361,2014-07-04 22:28:44,"@TankMenzies @PucksofaFeather 'Glassskamp' could be Classical, Classmate, Classroom, Scamp, Skimp, Classrooms or Gazump."
485187480031744000,2014-07-04 22:24:44,@jsmith1872 @Budweiser 'Squeegeeing' is right... and to think that you doubted yourself!
485186219597627392,2014-07-04 22:19:43,"@deeper_shallow @tovesunden 'parasanger' could be paras anger, paras-anger, passenger, parsonage, presage, prisoner or personage."
485180685380902912,2014-07-04 21:57:44,"@loveitloveit @semiBad @MostlyYummy 'DiCampo' could be Decamp, Decamps, Duchamp, Scampi, Scamp, Camp, Damp, Campy or Compo."
485179927533068288,2014-07-04 21:54:43,"@amelielamont @AnneWheaton 'Rahman' could be Rah man, Rah-man, Brahman, Ramon, Roman, Ramona, Arman, Haman, Brahmani or Rama."
485175650374791168,2014-07-04 21:37:43,"@blackgirlinmain @NewBlackWoman 'agist' could be ageist, Agosto, Aguste, August, august, aghast, egoist, gist, Augusta or Auguste."
485175397701545984,2014-07-04 21:36:43,"@_yourfoolish @CallmeMrPink 'nada' could be Nada, Nadia, Nadya, Mada, NASA, Ada, Nady, Nata, Neda, Dada, Eada, Jada or Nana."
485162562909003776,2014-07-04 20:45:43,"@I_R_BUCKAROO @tickton69 'neive' could be naive, nerve, nevi, never, Nev, naiver, Neva, nave, nervier, Neile, nervy or Nieves."
485160551492763651,2014-07-04 20:37:43,"@LingardJack @tfBettsy1892 'Griezmann' could be Guzman, Grumman, Crewman, Griming, Grimacing, Crimean, Grozny or Grizzling."
485160299419299840,2014-07-04 20:36:43,"@happybadr 'luiz' could be Liz, Luz, Luis, Ruiz or quiz."
485151491766755328,2014-07-04 20:01:43,"@AWDtwit 'Parsi' could be Pars, Parse, Paris, Pairs, Par's, Pears, Pas, Psi, Parser, Pa's, Pass, Paws, Pays, Farsi or Tarsi."
485147213106917376,2014-07-04 19:44:43,"@chalkontheboots @JongsmaJongsma @noverheul 'totaalvoetball' could be tattletale, deletable, deliverable, delectable or delectably."
485146459713437696,2014-07-04 19:41:44,"@ilovepickles44 'attrocious' could be atrocious, atrociously, avaricious, atrocities, atrocity's, Patricio's, atrocity or Atropos."
485141174424842240,2014-07-04 19:20:44,"@cherchezlacurl 'scrummi' could be scrum mi, scrum-mi, scrum, scrim, sacrum, scrumming, scrummed, scram, crummy or scrump."
485112230648631296,2014-07-04 17:25:43,"@MikeyHamilton @MzIndy52 'Kobyashi' could be Boyish, Kyushu, Kibosh, Babyish, Jobye's or Jobye."
485110472773890049,2014-07-04 17:18:44,"@Bayuze 'Sambisa' could be Sambas, Samosa, Samba, Samba's, Zambia, Zambia's, Mambas, Sahibs, Bambi's, Sam's, Sames or Semis."
485105688872370176,2014-07-04 16:59:43,@cupcakesmashtxn @Torikangas You spelt 'Raging' correctly. Find the definition by tweeting it to @_define
485105184834465792,2014-07-04 16:57:43,"@Viquarius 'Tiga' could be Taiga, Toga, Riga, Tia or Tina."
485101664387338240,2014-07-04 16:43:44,"@TTrueman @vero10000yo 'Espanial' could be Spaniel, Especial, Spinal, Espalier, Espousal or ESPN."
485099398041309184,2014-07-04 16:34:43,"@knit1pug2 @hehenabobena @Sploops @bioniclaura @sarahpink 'guiafesen' could be gaffes, guffaws, coarsen, Geffen, Gaven or Jasen."
485097638056820736,2014-07-04 16:27:44,"@SQBthatsme @Naninoodle 'Krug' could be Rug, Drug or Trug."
485095624333737985,2014-07-04 16:19:44,@dakishimeta @randomkeys Gold star for you - 'serendipity' is the correct spelling.
485094868130095104,2014-07-04 16:16:43,@indyrallen @aprildgregory No need to ask. You spelt 'Dionne' correctly. No need to thank me either.
485094867035381760,2014-07-04 16:16:43,"@craftybecky @NRVLiving 'Himilayan' could be Himalayan, Himalayans, Himalaya, Himalayas, Malayan or Himalaya's."
485091850693271552,2014-07-04 16:04:44,"@fatgazbo Yes, 'Serengeti' was correctly spelt!"
485091352640647168,2014-07-04 16:02:45,"@ivanjsarabia 'Schweinstieger' could be Schwinger's, Schwarzenegger or Schwinn's."
485088575965261825,2014-07-04 15:51:43,"@abigailb @lizbatty 'Begley' could be Beagle, Berkley, Bugle, Bugler, Burgle, Barkley, Berkeley, Bagel, Beget, Beguile or Berkly."
485087318290612226,2014-07-04 15:46:43,"@rachfatcat 'Gulit' could be Guilt, Guilty, Gilt, Glut, Guild, Quilt, Juliet, Julita, Gullet, Cult, Gelid, Glint, Glitz or Gild."
485082537018920960,2014-07-04 15:27:43,"@horrifiqt 'wobuffet' could be buffet, webfeet, buffed, webfoot, rebuffed, biffed or woofed."
485078258203910145,2014-07-04 15:10:43,"@sborjaaaa @rxiglecias 'brayden' could be bray den, bray-den, Braden, broaden, Bradan, Branden, Bradney, Baden, Brade or Brande."
485073730670837760,2014-07-04 14:52:44,"@SteelerRonn @1SwiftieLove3 'Cmuhru' could be Camry, Curry, Murry, Cmdr, Curr, Camera, Cure, Guru, Cahra, Muire, Curium or Amaru."
485066934182871041,2014-07-04 14:25:43,@iNiyama 'crochet' is right... and to think that you doubted yourself!
485066179816337409,2014-07-04 14:22:44,@mariocobos2001 You spelt that correctly! I know this because I once had a pet called 'Mayer'... seriously.
485038495195357186,2014-07-04 12:32:43,"@aKEInSHA_ @CaaathyLynnn @cRASHkitaa @jeejaaaw Congratulations, your spelling of 'Grinch' is perfect!"
485031704340336640,2014-07-04 12:05:44,@Gildy55 'denier' is correct! Try using http://t.co/LDs25IoGHY if you're ever in doubt again.
485024907864985601,2014-07-04 11:38:44,"@rxiglecias @MarynitaC 'tongets' could be ton gets, ton-gets, tonged, tongues, tongs, tangents, tongue's, tenets or Tonga's."
485024654537392129,2014-07-04 11:37:43,"@mactherxbel @staggyleotlela 'tebello' could be Tarbell, Bellow, bellow, tarball, rebel, table, Bell, Tell, bell or tell."
485019621984972800,2014-07-04 11:17:43,"@asanagirl31 'HeMan' could be He Man, He-Man, Herman, Haman, Hyman, Human, Harman, Hermann, Hermon, Humane, Hymn or Hymen."
484999993023946752,2014-07-04 09:59:43,"@annaroseshull 'dabishow' could be Danish, danish, Basho, dash, dish, dabs, darkish, dovish, Dasha, dishy, abash or Tanisha."
484992947838914560,2014-07-04 09:31:44,"@mcat_eebooks @meekin_ 'sirens' is correct. Look out, here comes the next Einstein!"
