id,created_at,text
505196973322797056,2014-08-29 03:35:19,"@EvansvilleWatch 'Welworth' could be Woolworth, Wealth, Woolworth's or Wealthy."
504278171626115073,2014-08-26 14:44:19,"@biobabbler @shaenasaurus 'claratin' could be clareting, lariating, Clarine, clarion, crating, Clarita, clarity or coloration."
504125176544362496,2014-08-26 04:36:22,"@MalnurturedSnay 'Lovett' could be Loved, Levitt, Lover, Lovey, Ivett, Overt, Lott, Love, Lived, Lofty, Livest or Left."
504076093037367296,2014-08-26 01:21:20,"@buhbuhbilly No need for uncertainty, you spelt 'mcaguhagbhus' correctly!"
503980213118582784,2014-08-25 19:00:20,@AnxiousDaydream @malprin My owl sense tells me that 'Lester' is the right spelling!
503924843528474626,2014-08-25 15:20:19,"@ShifuPhemmy_MD I always think 'Moccasin' looks wrong, but don't worry, it's right!"
503734087975059456,2014-08-25 02:42:20,"@peACEkeeper08 'Derullo' could be Drill, Darill, Droll, Darell, Derril, Derail, Drolly, Darelle, Dorella, Dorelle or Darrell."
503732581108441088,2014-08-25 02:36:20,"@Khrysweetie 'Azelea' could be Azalea, Azaleas, Aurelea, Ascella, Adela, Adele, Aisle, Zarla, Adella, Amalea, Amelia or Ales."
503720248323743746,2014-08-25 01:47:20,"@jonasmother @teryakiandtearz 'JANORA' could be JAN ORA, JAN-ORA, JANIA, ANNORA, JANOS, JANOT, JANA, NORA, JANUARY or JANETA."
503713957769510912,2014-08-25 01:22:20,"@Melissa_Arnelle 'LIPSINGING' could be LIP SINGING, LIP-SINGING, LOOSENING, LAPSING, POISONING or LESSENING."
503668406202015746,2014-08-24 22:21:20,"@NikitasDad @catwahler 'Barbery' could be Barberry, Barbary, Barber, Barbey, Bayberry, Barbra, Barbers, Barbara or Barbee."
503652302436061184,2014-08-24 21:17:20,"@CWKnotts 'Suge' could be Surge, Sue, Sage, Huge, Luge or Sure."
503550380811116544,2014-08-24 14:32:20,"@marla_arreza 'VEDANES' could be DANES, VEDAS, VANES, VEDANTA, VEDA'S, VERDUN'S, EDAN'S, SEDANS, VEGANS, DEANE'S or MEDAN'S."
503321372513169408,2014-08-23 23:22:21,"@volCHASEfive 'Goob' could be Go ob, Go-ob, Gob, Goon, Goo, Glob, Good, Boob, Goof, Gook, Goop or Goo's."
503266009818472448,2014-08-23 19:42:21,"@kaitharshayr 'Moffet' could be Miffed, Muffed, Monet, Motet, Offed, Moved, Buffet, Doffed, Moder, Moppet, Mote, Mort or Miff."
503161320477192193,2014-08-23 12:46:21,@AUBkooors_8555 @LyzThereseC You spelt that correctly! I know this because I once had a pet called 'baccalaureate'... seriously.
502655238319640576,2014-08-22 03:15:22,"@scottmatkovich @tferriss 'Policosinol' could be Policing, Polygonal, Polyvinyl, Pleasingly, Polyclinic, Poulticing or Poleaxing."
502597102384742402,2014-08-21 23:24:21,"@Jtfawver 'legarret' could be Garret, garret, Learjet, legatee, legate, Garrett, Legree, egret, legated, Garrot or Jarret."
502518837493784576,2014-08-21 18:13:21,@rod_c Sumptuous spelling! 'savviest' is right!
502466495033520128,2014-08-21 14:45:22,"@timhrenchir 'Bornyak' could be Born yak, Born-yak, Bonk, Boink, Barnyard, Bunyan, Banyan, Bianka, Bink, Bank, Bong or Bunk."
502431763742740480,2014-08-21 12:27:21,@ACyanni 'hashish' is spelt correctly - feel free to shower me with gratitude.
502281526696894465,2014-08-21 02:30:22,"@AaronAccurso @ReaganTMan 'cajones' could be Cajuns, cajoles, Cajun's, canoes, caginess, Jones, canes, cones, Camoens or Capone's."
502277249425346560,2014-08-21 02:13:22,"@LuvDanceDream @mlmcdonald32 'koozie' could be Kizzie, oozier, Josie, cozier, ooze, boozier, kookier, woozier, Kissie or Kizzee."
502185896586670080,2014-08-20 20:10:22,@Chris3012 'used' is the right spelling :)
502180865196040192,2014-08-20 19:50:22,"@Chris3012 @StanBirgii 'acteercariere' could be aftercare, aftercare's, actuaries, gatecrasher, categories, categorize or actuarial."
502126002986700800,2014-08-20 16:12:22,"@Umm_J @EveMaryCoffee Believe it or not, you got it right - 'underrepresented' is the correct spelling."
502013006553706496,2014-08-20 08:43:22,"@ZuulHmz @FHvziqvh I always think 'proboscis' looks wrong, but don't worry, it's right!"
501933483019608064,2014-08-20 03:27:22,"@ItsJordynWright @BiancaCortez19 'fras' could be fr as, fr-as, frays, Frans, frags, frats, Fr's, Frau, fray, Fran or IRAs."
501926941960593408,2014-08-20 03:01:22,"@JaySear @KarenGillan2 'Asaj' could be Asa, ASAP, Asap or Asa's."
501885416488697857,2014-08-20 00:16:22,"@aprilrenee_xo 'pepperoncinies' could be pepperonis, peperoni's, propensities, reappearances, pronounces, appearances or pauperizes."
501869311921635328,2014-08-19 23:12:22,"@SoPiousMuslimah 'rupenzal' could be Rapunzel, ripens, ripeness, pencil, reprisal, Pennzoil, reopens or Rapunzel's."
501839363420856320,2014-08-19 21:13:22,"@leighgillencork 'ukeleles' could be ukuleles, ukulele's, ukulele, alleles, allele's, guileless, Kelila's, Elul's or eagles."
501833826809561089,2014-08-19 20:51:22,"@Gravel_Itsu @LkwdHurd 'Suey' could be Sue, Sukey, Suet, Suety, Suez, Susy, Suzy, Sued, Sues, Huey or Sue's."
501764119263838208,2014-08-19 16:14:23,"@mostly10 @madctarroza @fremples 'philipino' could be Philippine, Filipino, Philippians, Philippines, Philip or Filipinos."
501745494603751426,2014-08-19 15:00:22,"@stefanzekopitar @hope_smoke 'Varadaro' could be Variate, Verdure, Veradis, Varied, Redraw, Variates, Fredra, Varietal or Retro."
501704726325362690,2014-08-19 12:18:22,"@EpicNiceTweets 'merengue' could be meringue, meringues, mering, meringue's, derange or melange."
501688620755849217,2014-08-19 11:14:22,"@tompl 'Grisha' could be Gris ha, Gris-ha, Krisha, Garish, Geisha, Trisha, Gish, Crush, Gris, Gresham, Keisha, Krishna or Gris's."
501592237138915328,2014-08-19 04:51:23,@daltonwb 'Socs' is correct!
501550461791379456,2014-08-19 02:05:23,"@soleilstiles 'BRUNSKI' could be BRINKS, BRINK, BRISK, BRUINS, BRUNSWICK, BRYN'S, BRAINS, BRINGS, BRUIN'S, BRUNO'S or BRINK'S."
501549205014319104,2014-08-19 02:00:23,"@RevoChik 'Tulum' could be Thulium, Tum, Talcum, Tulip, Tull, Alum, Glum, Plum, Slum, Tully, Tulle, Tatum, Tulsa or Durum."
501547442379051008,2014-08-19 01:53:23,"@MHenryMitchell @PogMoThoin13 @tracyblevins 'Welchade' could be Welshed, Belched, Wellhead, Leched, Wallchart, Welder or Welded."
501544170717073408,2014-08-19 01:40:23,"@ApplewarePotter 'gnosis' could be nosies, noses, Niseis, noises, Knossos, gneiss, noeses, nooses, nose's, nosy's or Genesis."
501528064556158976,2014-08-19 00:36:23,"@michael_marolla @QueenLesli @Schmackarys @MatildaBroadway @jjaxtweets 'blasphemour' could be blasphemer, blasphemous or blaspheme."
501524793976315904,2014-08-19 00:23:23,@KatieEubanks 'Heard' is right. Your sensational spelling is super solid. So is my alliteration.
501510699944660992,2014-08-18 23:27:23,"@JadeiteRP @DaddySpencey 'serogacy' could be surrogacy, Xerox, xerox, secrecy, Syriac, Syriac's, scrogs, serous or sprogs."
501509947138396161,2014-08-18 23:24:23,"@mikezeman2377 @bmorrissey @mikezeman2377 @saralivingston 'centerport' could be center port, center-port, centerboard or counterpart."
501429414752575490,2014-08-18 18:04:23,"@LoCardozo28 @SteveSantos6 @NelsonL08 @Nivekslb @TimoC508 'fodido' could be Dido, Fido, dido, foetid, forded, faded or fetid."
501416832318701569,2014-08-18 17:14:23,"@HannahEO1212 @esmechambersxx 'Lowri' could be Lori, Lorri, Loria, Lorie, Lorrie, Lari, Lora, Lory, Lore, Lauri, Lawry or Loire."
501379839761203200,2014-08-18 14:47:23,"@Nivekslb @NelsonL08 @Peter1678 @TimoC508 @LoCardozo28 'fodido' could be Dido, Fido, dido, foetid, forded, faded or fetid."
501377322348322819,2014-08-18 14:37:23,"@HoranosauruSAM 'Grafitti' could be Graffiti, Graffito, Graft, Gravity, Grafter, Crafty, Craft, Kraft, Grafting or Grafts."
501206194875150336,2014-08-18 03:17:23,@ethanbrown72 Good news! 'Todd' is correct!
501144289028489216,2014-08-17 23:11:23,@PrimaDonna001 @MichelleAkers10 No need to ask. You spelt 'sickle' correctly. No need to thank me either.
501120128583352320,2014-08-17 21:35:23,"@JohnStamosFans1 @JohnStamos @billyhazzard 'Villaeh' could be Villa eh, Villa-eh, Villa, Ville, Village, Vila, Vile or Volley."
501052938442129410,2014-08-17 17:08:24,"@JustJayWright 'Levita' could be Le vita, Le-vita, Levi ta, Levi-ta, Levitt, Levity, Evita, Levied, Levis, Leta, Levi or Lita."
501050419955519488,2014-08-17 16:58:23,"@CatTBowen @tblanchfield 'cervelo' could be servile, revel, cereal, chervil, Cello, cello, saveloy, serve, servo or bevel."
501020725675708416,2014-08-17 15:00:24,"@McLola182 'oreganato' could be oregano, originator, originate or oregano's."
501001851458691073,2014-08-17 13:45:24,"@hutchable 'Bledel' could be Bleed, Bled, Bleeds, Blondel, Bleeder, Betel, Blade, Beadle, Baldly, Boldly, Bladed or Blades."
500986502080249858,2014-08-17 12:44:24,"@KorexMetallis @Scarletr0seTTV 'Fivefel' could be Fivefold, Firefly, Fitful, FOFL, Fiberfill, Forceful, Fateful or Fearful."
500976937620094976,2014-08-17 12:06:24,"@SamLemos 'MALONG' could be MA LONG, MA-LONG, ALONG, MALONE, MALIGN, MAILING, MALLING, MAULING, MEALING, MARLON or LONG."
500950009957728257,2014-08-17 10:19:24,"@austinjock @wild_sperm 'rudeboiz' could be rodeos, rudeness, reboots, redbird, robotize, rodeo's, turbos, rubes or rebids."
500869984365449216,2014-08-17 05:01:24,"@abcdeerebecca 'Jhoult' could be Holt, Jolt, Hilt, Jilt, Gould, Colt, Cult, Halt, Hold, Guilt, Glut, Clout, Could or Julita."
500840033180327937,2014-08-17 03:02:23,"@mumblo 'Sandhiya' could be Sand hiya, Sand-hiya, Sandhog, Sandye, Sindhi, Sindhi's, Nadiya, Sandi, Sandy, Sandhogs or Sandi's."
500836510971592704,2014-08-17 02:48:23,"@ThePlay2Win @sfiq12 'Manetrike' could be Mane trike, Mane-trike, Mandrake, Mantra, Metric, Monetarily, Mandrakes or Mandrill."
500826192799215619,2014-08-17 02:07:23,"@tl_2015 @_CollegeHumor_ @desiree_nicole9 'razberita' could be sybarite, reburied, sobriety, resubmit, sobered or reverberate."
500811850510893058,2014-08-17 01:10:24,"@JeanJAuthor @Lou_bookpushers @has_bookpushers 'Hodgewell' could be Hodge well, Hodge-well, Hopewell, Howell, Honeywell or Jewell."
500783661902340096,2014-08-16 23:18:23,"@kateyalyn123 @alexa_chisolm 'friendaversary' could be friendless, friendliest or friendlies."
500738620257353728,2014-08-16 20:19:25,"@cam761 @OnTheRoadCBS @CBSSunday 'Kuralt' could be Jerald, Koral, Karat, Kraut, Kraft, Gearalt, Garald, Gerald, Kilt or Kraal."
500717979319824384,2014-08-16 18:57:23,"@savkilluhkris 'Misao' could be Miss, Masai, Missy, Mesa, Misdo, Missie, Mizar, Miser, Moss, Muss, Mas, Mi's, Mos or Mus."
500713199046365186,2014-08-16 18:38:24,"@CALM_Hemmings78 'Morano' could be Mora no, Mora-no, Moran, Moreno, Moron, Miran, Mariano, Moroni, Moraine, Morin or Morena."
500711440240492545,2014-08-16 18:31:24,@joemacare 'Nadine' is spelt correctly! Who needs Google when you have me?
500680738115551232,2014-08-16 16:29:24,"@lubaekhun @SYKR7 'noorimah' could be Norina, Norah, Norma, Nkrumah, nourish, Porrima, Noriega, Normie, norm, Nehemiah or Norine."
500675453279940611,2014-08-16 16:08:24,"@HighRantDistric @StereoSerieA @CatenaccioNA 'Ferogosto' could be Frost, Frogs, Frog's, Frosty, Ferocity, Frigs or Foremost."
500666896178368513,2014-08-16 15:34:24,"@Darren_Infinity @MissSysiphe 'Novans' could be No vans, No-vans, Nov ans, Nov-ans, Novenas, Novas, Nova's, Nirvanas or Nevins."
500643488745025537,2014-08-16 14:01:23,"@Fattcheeked 'bourbonaire' could be Bourbons, bourbons, Bourbon, bourbon, boutonniere, Bourbon's, bourbon's, billionaire or bubonic."
500490987068608514,2014-08-16 03:55:24,@jmotoki87 'Tatum' is spelt correctly! Who needs Google when you have me?
500454750291128321,2014-08-16 01:31:25,"@herodfel @jovanowitz @UkrConsulateNY @Ruben_NYC 'skillit' could be skill it, skill-it, skillet, skilled, skill or skillets."
500451479488962560,2014-08-16 01:18:25,"@ugh__sigh @wastesyourtime @DNRshow 'Hostiss' could be Hostess, Hosts, Host's, Hists, Hoists, Hostess's, Horst's or Hostiles."
500432600800841728,2014-08-16 00:03:24,"@shygemini68 'Fagiole' could be Fragile, Agile, Faille, Facile, Fragiler, Gaile, Fidole, Agiler, Cagoule, Fail, Fickle or File."
500430839960719361,2014-08-15 23:56:24,"@LeChatNoire4 @RF_burns_red 'Gaetz' could be Gates, Gets, Gaits, Gate, Ghats, Get, Goats, Gate's, Gated, Gaiety, Keats or Gites."
500418508832772096,2014-08-15 23:07:24,"@nerdwreckers @WideEyedAxolotl 'acela' could be ace la, ace-la, Ascella, Adela, Osceola, azalea, Axel, Celia, Sela or aces."
500411462406246400,2014-08-15 22:39:24,"@PaulPwaytz 'porchetteria' could be Pretoria, pottery, portiere, Pietra, portray, chatterer, Pechora, poulterer or posterior."
500392338120667136,2014-08-15 21:23:24,@ChrisWelshh @UberFacts Go wash your mouth out right now! I won't spell check that.
500371701666828289,2014-08-15 20:01:24,"@trentjones1856 @dspalding991 @THEbradykingrey 'tazers' could be taxers, teasers, dazes, gazers, hazers, takers or tamers."
500369184836956160,2014-08-15 19:51:24,"@StargazerBleu @gdzeek 'Koda' could be Kodak, Coda, Kora, Roda, Yoda, Kola or Soda."
500352827927953408,2014-08-15 18:46:24,"@Doshin @alamedabrewing 'Wolfenstein' could be Wallenstein, Wittgenstein, Wallenstein's or Valentin."
500302749377241088,2014-08-15 15:27:25,@BodyBySmith You are correct spelling 'poly' that way. Good on you!
500292679003934720,2014-08-15 14:47:24,"@BenCuzzupe @C_Filippo23 'lawwwwwwwwwwwwwwwl' could be lawful, Lalo, Law, Layla, law, lowly, awl, label, lapel, Lil or bawl."
500292430604664833,2014-08-15 14:46:25,"@BenCuzzupe 'Fillipo' could be Fillip, Filippo, Filip, Fillips, Filippa, Flip, Fillip's, Filliped, Phillip or Filip's."
500286640279920640,2014-08-15 14:23:24,"@hausofJazzy 'Chrihanna' could be Cherianne, Cherilynn, Charin, Cherin, Cherishing, Choring, Cherilyn, Sheridan or Shrine."
500254934659383296,2014-08-15 12:17:25,"@LizLeGooner 'Chimamanda' could be Command, Chanda, Amanda, Commando, Chapman, Manda, Commander, Chapman's, Hammond or Miranda."
500247635895136258,2014-08-15 11:48:25,"@TrollhunterX @Ermintrude2 @cox_tom Congratulations, your spelling of 'ducal' is perfect!"
500245620695629827,2014-08-15 11:40:24,"@amorettaaa @killlaahh_k 'kahet' could be Kate, kart, Kat, Katey, Janet, cachet, cahoot, Kant, hate, Hart, hart, Katee or Capet."
500234296745938944,2014-08-15 10:55:24,"@cancerextermin 'Pharrell' could be Harrell, Farrell, Farrel, Darrell or Ferrell."
500173647814742016,2014-08-15 06:54:25,"@rob1nbowles @Roy_Noon @professoredith 'persuit' could be per suit, per-suit, pursuit, Perseid, persist, pest, pursuits or posit."
500152508866502656,2014-08-15 05:30:25,"@Kendralynnnnn @methmakos 'badsean' could be Baden, badman, badmen, batsman, Bardeen, Bataan, batsmen, bidden, badness or basin."
500137660887740417,2014-08-15 04:31:25,"@starlightashton 'ATHSMA' could be ASTHMA, ATHEISM, ASAMA, ASSAM, AUTISM, OATHS, ESMA, ATHEISM'S, EARTHS, OATH'S or THEISM."
500109223888302081,2014-08-15 02:38:25,@MaddiieWoods @sienna_hancock Gold star for you - 'Myles' is the correct spelling.
500108721490374656,2014-08-15 02:36:25,"@rar_g 'garen' could be gar en, gar-en, Caren, Goren, Karen, Gran, gran, Green, green, garden, grain, Carena, Gare or Karena."
500103687432204288,2014-08-15 02:16:25,@c_sirrah 'Darren' is spelt correctly! Who needs Google when you have me?
500090852513824768,2014-08-15 01:25:25,"@AZmucki @AYoung2002 'Vater' could be Vat er, Vat-er, Vader, Voter, Water, Vaster, VAT, Cater, Vat, Waiter, Watter or Vite."
500049327444611072,2014-08-14 22:40:24,@AlaskaSu24 Our team of dedicated staff working around the clock has determined that 'Huh' is spelt correctly.
499961250579640320,2014-08-14 16:50:25,"@MedelKotov 'Redditor' could be Radiator, Editor, Creditor, Reedit, Redactor, Redid, Retort, Repudiator, Mediator or Redder."
499921737761312768,2014-08-14 14:13:25,"@toddmal @chang_max 'soli' could be soil, solo, Sol, sol, Solis, solid, sole, sold, sols, Joli, Sol's or sol's."
499898837624840192,2014-08-14 12:42:25,"@thinner4me 'ugula' could be UCLA, ugly, uvula, Aguilar, Gila, Ula, jugular, usual, Ursula, equal, uvular, Aquila or Eula."
499896320853676032,2014-08-14 12:32:25,"@RealKentClontz 'dober' could be dob er, dob-er, DOB, Dover, dob, sober, Debee, Tiber, dabber, dauber, doer, dubber or Tobe."
499890281768951809,2014-08-14 12:08:25,"@GDGriffin 'Hendrickson' could be Hendrick son, Hendrick-son, Hendricks on, Hendricks-on, Hendricks, Hendrick's or Heindrick's."
499807238177824768,2014-08-14 06:38:26,"@AlaskaSu24 'Mishapocalypse' could be Apocalypse, Paperclips, Paperclip's, Shopkeepers or Shopkeeper's."
499768732747440128,2014-08-14 04:05:25,"@Stanislawam @richardroeper 'Loftus' could be Loft us, Loft-us, Lofts, Loft's, Lifts, Lift's, Lotus, Lefts, Louts or Lefty's."
499755143110213632,2014-08-14 03:11:25,"@BuujeBeauty @BennettOverHo @_LOVERenee 'frisby' could be Frisbee, frisky, Crosby, frosty, frisk, frizzy, Frisco or Fri's."
499739791261323266,2014-08-14 02:10:25,@donkeyboy_jack @mallelis You are correct spelling 'anything' that way. Good on you!
499724440234491904,2014-08-14 01:09:25,@melowinney @CBSBigBrother No need to ask. You spelt 'dingus' correctly. No need to thank me either.
499723684777439234,2014-08-14 01:06:25,"@QuietStormTMB 'jumuna' could be Junina, cumin, Julina, Juana, Junia, human, jejuna, Juan, Mina, myna, Julian, Jasmina or jumping."
499715380340748288,2014-08-14 00:33:25,@Breecklayer @KARMASBFF 'succubus' is the right spelling :)
499690968992325632,2014-08-13 22:56:25,"@lorenealicia @baccowinecheese @FFTTCider Congratulations, your spelling of 'Hayley' is perfect!"
499653724139032577,2014-08-13 20:28:25,"@Browney777 @Claire_Kearns 'Baratheon' could be Marathon, Parathion, Breathing, Barron, Barren, Breathe, Baryon or Breather."
499634348086132736,2014-08-13 19:11:26,@artsyhonker @WobblyGoose 'Alwyn' is right. Your sensational spelling is super solid. So is my alliteration.
499627551044534273,2014-08-13 18:44:25,"@BarnStudioSigns @Skylarkingmatt 'entendres' could be ententes, entente's, intendeds, intends, indentures, intents or indenture's."
499616226948030465,2014-08-13 17:59:25,"@Skalded 'Chamillionaire' could be Millionaire, Millionaires, Billionaire, Millionaire's, Millionairess or Commissionaire."
499609180064325632,2014-08-13 17:31:25,"@CarsmileSteve @ClaptonCraft 'Fieullion' could be Fellini, Felling, Filling, Fulling, Felon, Gillion, Fallon, Billion or Bullion."
499574702826721280,2014-08-13 15:14:25,"@impstudios 'Serano' could be Serrano, Saran, Serena, Cyrano, Serene, Sering, Drano, Sterno, Sean, Syrian, Eran or Searing."
499563881337847808,2014-08-13 14:31:25,@_migueldeguzman You are correct spelling 'Diet' that way. Good on you!
499563630870790144,2014-08-13 14:30:25,"@Juicytots 'camembert' could be Camembert, Camemberts or Camembert's."
499562124109037569,2014-08-13 14:24:26,"@soulrebelJ 'Zorastrians' could be Zoroastrians, Zoroastrian, Zoroastrianism or Restrains."
499515818460196864,2014-08-13 11:20:26,@C_Stratto27 @Amerz23 Booting up... Starting Word 2003... (just kidding) 'callused' is correctly spelt!
499508518089551872,2014-08-13 10:51:25,"@MissNamine @TinsM8 'nautical' is correct. Look out, here comes the next Einstein!"
499427737740664832,2014-08-13 05:30:26,"@MilaHugo 'Megaladon' could be Megaton, Melton, Gerladina, Melding, Magellan, Gelatin, Gladden, Magdalen, Gelding or McClain."
499424212163907584,2014-08-13 05:16:25,"@BigERwin @surfercon 'favoriting' could be favoring, favorite, favorites, fruiting, favorite's, forfeiting or ferreting."
499405840403537921,2014-08-13 04:03:25,"@uublog @FallonTonight 'improvisationally' could be improvisation ally, improvisation-ally, improvisational or improvisations."
499384453500641281,2014-08-13 02:38:26,"@chocolatedluxx 'Neek' could be Neel, Meek, Nee, Eek, Neck, Geek, Leek, Need, Peek, Reek, Seek, Week or Ne'er."
499381937639682048,2014-08-13 02:28:26,"@SylviaSnitt @FoodNetwork @ChopTedAllen 'Saquoia' could be Sequoia, Sequoias, Sequoya, Squaw, Sakai, Aqua, Suki or Sago."
499377656463237120,2014-08-13 02:11:25,"@74toros @MLS @Flight_19 'Anschultz' could be Insults, Unschooled, Unscaled, Insulates, Osculates, Anklets, Insects or Inoculates."
499373377547546624,2014-08-13 01:54:25,@hrldofgalactus @GregCapullo You spelt that correctly! I know this because I once had a pet called 'premise'... seriously.
499363816191184896,2014-08-13 01:16:26,"@AliasHere @UniteBlueCA @stopbeingfamous 'Golieth' could be Goliath, Goliaths, Goethe, Kieth, Girth, Goalie, Goldie or Cloth."
499356265441542144,2014-08-13 00:46:25,"@bft2112 @guarnaschelli @ChopTedAllen @amandafreitag @alexstupak @FoodNetwork Yes, 'Sequoia' was correctly spelt!"
499349722209865728,2014-08-13 00:20:25,"@Bxsrob 'Kaluaha' could be Kahlua, Kahlua's, Kala, Kalahari, Galahad, Kala's, Kalila, Kalina, Kilauea, Klara, Aloha or Callahan."
499313234071916545,2014-08-12 21:55:26,"@JoshHuntx @_rmurphz 'Cotterill' could be Cotter ill, Cotter-ill, Coterie, Terrill, Coteries, Coverall, Corilla, Catteries or Trill."
499312728721207296,2014-08-12 21:53:25,"@NotintheAsylum @Heallarious @TaoHinton 'coninsieur' could be connoisseur, conciser, condenser, connoisseurs, corniness or canines."
499310210775662592,2014-08-12 21:43:25,"@The_Leftie 'Janiqua' could be Jania, Janka, Janina, Jenica, Ranique, Kania, Janis, Janus, Jana, Janaya, Juanita or Janie."
499309204587302912,2014-08-12 21:39:25,"@thetobbierts 'Hart' is correct. Look out, here comes the next Einstein!"
499304926862790658,2014-08-12 21:22:25,@matt_lecornu 'Pogrebnyak' could be Kirinyaga or .
499303669154578432,2014-08-12 21:17:26,"@kdeuman @youngbymarriage 'piter' could be Pieter, pit er, pit-er, Peter, pater, peter, Poitier, Porter, Potter or porter."
499294105210351617,2014-08-12 20:39:25,"@liamdb1 Don't worry, you spelt 'minarets' correctly! It just looks wrong :)"
499265166001717249,2014-08-12 18:44:26,@_BREEyonce 'asphyxia' is spelt correctly! Who needs Google when you have me?
499259882017529857,2014-08-12 18:23:26,"@ASexton55 @BravesSwearJar 'Burhle' could be Burgle, Burble, Burlie, Byrle, Bugle, Burl, Bushel, Berle, Burly, Beryle or Bubble."
499255853438861313,2014-08-12 18:07:25,"@d20Blonde @jamaila 'lotromin' could be Latrina, Tremain, latrine, loitering, trimming, Truman, Tremaine, Trumaine or tramming."
499238239299829760,2014-08-12 16:57:26,"@CallMeLo 'horchata' could be orchard, hatchet, chitchat, Hort, chat, hitched, Hecate, hatchets, Herta, hooch, Richart or hotshot."
499229429877325824,2014-08-12 16:22:25,"@MagentaCaptain @ColinPayn 'Massamboola' could be Assembly, Assemble, Assumable, Symbol, Assembler, Mislabel or Reassemble."
499208291541479426,2014-08-12 14:58:26,"@GirlsLoveNerds 'Brandenberg' could be Branden berg, Branden-berg, Brandenburg or Brandenburg's."
499134051391787008,2014-08-12 10:03:25,"@lizgloyn @TheRangeUK 'Siane' could be Shane, Siana, Shaine, Shine, Diane, Shanie, Shayne, Sianna, Sane, Sine, Liane or Riane."
499103855066365952,2014-08-12 08:03:26,"@dugaldjellie @Sarah_C_Rae 'Mogdiliagni' could be Modigliani, Modeling, Gilligan, Magdalen, Middling, Mendelian or Codling."
499085231144448000,2014-08-12 06:49:26,"@camiejuan1 @iennetastic 'Aran' could be Ar an, Ar-an, Abran, Aryan, Arab, Arlan, Arman, Ara, Ran, Arin, Aron, Aryn or Eran."
499052265546604545,2014-08-12 04:38:26,@epise @AlyseWhitney 'Ladonna' is right... and to think that you doubted yourself!
499049244184297472,2014-08-12 04:26:26,"@x_emilyclaire @poopinchloe 'oragel' could be oracle, Oralle, Orel, oral, Rakel, Rigel, oriel, eagle, Oralee, Arabel or Arel."
499033140367597569,2014-08-12 03:22:26,"@SFlaVoice @aadelsonESPN 'Kayaa' could be Kaye, Kayo, Kayak, Kayla, Kanya, Katya, Kaaba, Kata, Jaye, Joya, Kay, Kauai or Kayos."
499016277303001088,2014-08-12 02:15:26,"@shaythevillain 'Apolonia' could be Appolonia, Apologia, Apollonian or Appolonia's."
499000171473014784,2014-08-12 01:11:26,"@anniegardens 'Arquette' could be Marquette, Arlette, Jacquette, Coquette, Etiquette, Equate, Acute, Parquet, Anette or Baguette."
498987336806305793,2014-08-12 00:20:26,@dvone @Shade45 @wakeupshow @fact135 @RealSway You are correct spelling 'fact135' that way. Good on you!
498981801121943552,2014-08-11 23:58:26,"@timeinch 'Boden' could be Bo den, Bo-den, Bod en, Bod-en, Borden, Baden, Bidden, Bordon, Bode, Boding, Burden, Bowen or Boded."
498981296329089025,2014-08-11 23:56:26,"@backerwex @ElvisDuranShow 'Megaldon' could be Megaton, Melton, Melding, Magdalen, Gelding, Markdown, Gelatin, Golden or Milton."
498978527723528192,2014-08-11 23:45:26,@TWERKIN4FUSCHOE @mickeeyx0 'ruins' is the correct spelling. You should have more faith in yourself :)
498972236099760128,2014-08-11 23:20:26,"@FoluShaw 'DoubtFire' could be Doubt Fire, Doubt-Fire, Doubtful, Doubter, Doubtfully, Doubters, Doubting, Doubted or Doubt."
498969217568227328,2014-08-11 23:08:26,"@tessgrosvenor27 'Brechner' could be Brenner, Bruckner, Breaching, Brecht, Breached, Breaches, Breeches, Brochure or Freshener."
498936252125548544,2014-08-11 20:57:26,"@deolaaa 'tuch' could be touch, tech, tush, Tuck, much, ouch, such or tuck."
498933987692511232,2014-08-11 20:48:27,"@Wulffricc @slysage 'Gourcoff' could be Gruff, Geoff, Kickoff, Griff, Guff, Cutoff, Goofy, Scoff, Gorgon, Garcon or Griffy."
498916871551201280,2014-08-11 19:40:26,"@andrewjamison @ChrisPirillo 'Philisophical' could be Philosophical, Philosophically or Philosophic."
498901771947741184,2014-08-11 18:40:26,"@FranBran_ 'Muslimahs' could be Muslims, Muslim's, Muslim, Muslin's, Moslem's, Slims, Mislays, Museums, Slimes or Museum's."
498897748406460416,2014-08-11 18:24:26,"@ELEYETH @stabini 'tegyu' could be Taegu, Tokyo, Tagus, Tye, deg, tag, tog, tug, TeX, Tex, Terrye, teacup, toge, Togo or teak."
498892462983639042,2014-08-11 18:03:26,"@peterghorrill 'drempt' could be tempt, preempt, trumpet, prompt, dreamed, crumpet, Trump, tramp, tramped, tromp or tromped."
