id,created_at,text
525445830149693440,2014-10-24 00:37:02,Norwegian Opposites Attract First Love Documentaries
525400531830059008,2014-10-23 21:37:02,Slapstick Musicals from the 1920s set in India
525375231402446848,2014-10-23 19:56:30,Blaxploitation Epic Movies Based on Children's Books
525355230389866496,2014-10-23 18:37:02,Bollywood Dark
525309933576019968,2014-10-23 15:37:02,Psychological Screwball Slasher Based on Contemporary Literature
525264634635628544,2014-10-23 12:37:02,Mistaken-Identity Critically Acclaimed Mysteries Based on a Book set in the Victorian Era about Marriage for Ages 5 to 7
525219335611371520,2014-10-23 09:37:02,Viral Plague Campy Sci-Fi Movies set in Africa about Reunited Lovers
525174036104740864,2014-10-23 06:37:02,Suburban-Dysfunction Reincarnation Sci-Fi Movies from the 1930s
525128740616286208,2014-10-23 03:37:02,Hit-Man Cult Mockumentaries Based on Contemporary Literature
525083442724499456,2014-10-23 00:37:02,Immigrant-Life Talking-Animal Scary Based on Contemporary Literature set in Latin America about Friendship Directed by Robin Williams
525038144094502912,2014-10-22 21:37:02,Treasure Hunt Dark Hidden Gem Based on Contemporary Literature set in the Victorian Era about Couples Starring Albert Brooks
524992844390731778,2014-10-22 18:37:02,Dysfunctional-Family Samurai &amp; Ninja
524947544338862082,2014-10-22 15:37:02,Police Wilderness-Survival Mockumentaries for Ages 8 to 12
524902249026551808,2014-10-22 12:37:03,Romantic Action Movies from the 1990s
524856950866313216,2014-10-22 09:37:03,Martial Arts Gay &amp; Lesbian Dramas about Friendship
524811651808514048,2014-10-22 06:37:02,Deep Sea Violent Satires from the 1970s
524766351916019712,2014-10-22 03:37:02,Race Against Time Psychological Ghost-Story Based on Contemporary Literature set in Prehistoric Times about Cats Directed by George Clooney
524749479267033089,2014-10-22 02:29:59,Serial Killer Biographical Period Pieces about Cats
524721052904333314,2014-10-22 00:37:02,Ominous Mysteries
524675754786029568,2014-10-21 21:37:02,Secret Society Whistleblower Musicals from the 1950s
524641287346343937,2014-10-21 19:20:04,Quirky Provocative Chilling Horror
524630456613236738,2014-10-21 18:37:02,Ominous Reincarnation Whistleblower
524585157500895232,2014-10-21 15:37:02,Witty Mind-Bending Police
524539860968013824,2014-10-21 12:37:02,Emotional Animation from the 1960s set in the Victorian Era
524494561075560448,2014-10-21 09:37:02,Ominous Gangster Horror for Ages 8 to 12
524449264601419777,2014-10-21 06:37:03,Immigrant-Life Cynical Horror from the 1930s
524403963509370880,2014-10-21 03:37:02,Absurd Animal Mysteries for Ages 5 to 7
524368619929882625,2014-10-21 01:16:35,Social Issue Goofy Satanic Action Movies
524358667110715394,2014-10-21 00:37:03,Tearjerker Immigrant-Life Fantasy Movies from the 1910s
524313368547426304,2014-10-20 21:37:02,Gritty Reincarnation Oscar-Winning Mysteries
524268070429528064,2014-10-20 18:37:03,Monster Sci-Fi Movies from the 1970s set in Ancient Times
524222768897089537,2014-10-20 15:37:02,War Classic Musicals from the 1910s
524201589327003649,2014-10-20 14:12:52,Spy Jewish Dramas set in Africa about Marriage
524177473521852418,2014-10-20 12:37:03,Sentimental Fairy Tale with a Strong Female Lead
524173760866570240,2014-10-20 12:22:17,Feel-Good Horror
524132171200868353,2014-10-20 09:37:02,Understated Chilling Musicals
524086873472647168,2014-10-20 06:37:02,Classic Horror from the 1940s Set in Prehistoric Times
524041577749291008,2014-10-20 03:37:03,Conspiracy Action Movies from the 1950s
524018025901854720,2014-10-20 02:03:27,BMX &amp; Extreme Biking Dramas Set in the Edwardian Era about Marriage
524013867345924096,2014-10-20 01:46:56,Controversial Horror
524012232875999232,2014-10-20 01:40:26,Blaxploitation Wilderness-Survival Fantasy Movies Based on a Book Set in Latin America about Reunited Lovers for Ages 2 to 4
524012024221954048,2014-10-20 01:39:36,Campy Nostalgic Dramas from the 1960s
524011577016848384,2014-10-20 01:37:50,Military First Love
524009278739591168,2014-10-20 01:28:42,Deep Sea Fantasy Movies for Hopeless Romantics
