id,created_at,text
511517924314447872,2014-09-15 14:12:31,おいらのパパはスコット・テナーマンのパパだった。その意味が分からないのか？
511502828842414080,2014-09-15 13:12:32,黙れミッチ・コナー。懐中電灯でも突っ込んでろ！
511487723773763586,2014-09-15 12:12:30,ママは両性具有で、実際にはママがパパなんだ
511472638263169025,2014-09-15 11:12:34,私はヘニファー・ホペス！生きるためにタコスがいるの！
511457551158763520,2014-09-15 10:12:37,考えてみろ。ムハンマドは世界で唯一侮辱されない。
511442433146507264,2014-09-15 09:12:32,カイル！これが世の中ってもんだ。良質な友達を見つけたきゃ全てのチンポをかき分けろ！
511434441877487616,2014-09-15 08:40:47,@i_da_ やることやりやがれチンポ顔！！
511427325867474944,2014-09-15 08:12:31,チンポ…チンポ…チンポチンポチンポ…
511412230739329024,2014-09-15 07:12:32,新しい友達を見つけるのはこれまでより簡単だ。Webカメラセットしたら同じチャットルーレットに居る５万人の中からランダムにつながる。
511397122218815488,2014-09-15 06:12:29,女友達は男より３倍価値があります
511382037417037825,2014-09-15 05:12:33,カイルを捨てて、可能ならクライド・ドノバンを友達に加えてください。なぜか？そう！クライドの誕生日はもうすぐ。彼の親が皆をカサボニータに連れていくからです。
511366926350565376,2014-09-15 04:12:30,負け犬キップ・ドローディを友達に加えてからカイル・ブロフロフスキーの友達人数は急落。2日前の55人から11人まで下落しました。ログインしてカイルを友達から削除してください。彼は毒です！
511351904899563521,2014-09-15 03:12:49,カイルより友達多い　カイルより友達多い♪
511336751948779520,2014-09-15 02:12:36,今肛門に指さえ入ってなきゃそっちに行っててめぇのタマ潰してやるところだぜ
511321647907733505,2014-09-15 01:12:35,こここっ、これでおしまーい！！
511306537520734208,2014-09-15 00:12:32,投げんじゃねえよ！テレビの幼児虐待特集見てねえのか？
511291446486265856,2014-09-14 23:12:34,とっとと帰りやがれザーメン吐きのカメ頭！
511155529079459840,2014-09-14 14:12:29,苦しんでやっと出した便秘糞が戻ってきた気持ちがわかるか？
511140443292049408,2014-09-14 13:12:32,彼は僕のお尻でオーラルセックスしたいと言いました
511125334775717889,2014-09-14 12:12:30,"Screw Amsterdam, I'm going home!"
511110246106796032,2014-09-14 11:12:33,おい！カーネル！おいらは２歳の時から最大の支援者だぞ。チキンとあんたを愛してるんだ。
511095132016222208,2014-09-14 10:12:29,おもしれぇ！あいつ窒息してる！
511080045100560384,2014-09-14 09:12:32,法王だってペドのための世界を作ってるだろ？
511064931647496193,2014-09-14 08:12:29,法王だってペド犯罪に手を貸すだろ？
511049845105106944,2014-09-14 07:12:32,ここなら…助かる…聞いた…お、おいら…１週間以上…ケンタ…きれてる…
511034737633161216,2014-09-14 06:12:30,おいらずっとケンタの肉を待っててキレやすくなってんだ
511019650541309952,2014-09-14 05:12:33,黙れずるユダヤ！ぶっ殺すぞ！
511004531673419776,2014-09-14 04:12:29,メトロは　オカマじゃない　でも似てるの　慣れてちょうだい♪
510989450831073282,2014-09-14 03:12:33,これでクレイグなんかに負けないわぁん♂
510974338292404224,2014-09-14 02:12:30,カイルを殺すしかないわ♂
510959248654598145,2014-09-14 01:12:32,じゃあ多分クォーターのバイかな。だっておじいちゃんがバイだからクォーターのバイでしょ！
510944142747127808,2014-09-14 00:12:31,こっちなんてハーフのバイセクシャルだし♂
510929051842662400,2014-09-13 23:12:33,そう！？こっちのが超ウルトラ夜用スーパーゲイっぽいけど♂
510793141683634176,2014-09-13 14:12:29,そりゃ言えてるね。だって女たちはゲイっぽい男が大好物なんだもん♂
510778057053835264,2014-09-13 13:12:33,センスが９１１前夜って感じぃ♂
510762945035243522,2014-09-13 12:12:30,お前らおいらのケツにキスするか？
510747859025547266,2014-09-13 11:12:33,鼻ほじってねえよ！歌いたくてむずむずしてんだよ！
510732735493599234,2014-09-13 10:12:27,やあごきげんよう！ちっぽけな夢に生きてるちっぽけな友人諸君！
510717659202088960,2014-09-13 09:12:33,おいらなら両手を後ろで縛られたままでも歌えるぜ
510702602326011904,2014-09-13 08:12:43,チージープーフを食べなきゃバカになる♪
510687459357638656,2014-09-13 07:12:33,プラネタリウムなんてだっせー
510672350371532800,2014-09-13 06:12:30,クリスマスなんて意味ねーよ
510657257487360000,2014-09-13 05:12:32,ママ！こいつボケてるよ。老人ホームにいれた方がいいって！
510642146450214912,2014-09-13 04:12:29,なんだっておばあちゃんはこんな遠くに住んでるんだよ。近所の老人ホームにでもぶちこんでおけばプレゼントもらうのに車で６時間もかかんねーだろ！
510629152622252033,2014-09-13 03:20:51,@yoru_oo ママー！ホームレスのよるLv.14 緑茶のおばけがいる。どっかに追い出して！
510627073468030976,2014-09-13 03:12:35,なんてこった、ケニーが殺されちゃった！
510611950980448256,2014-09-13 02:12:30,おい！おいらはもうガキじゃねえんだよ！もう８歳だぞ！？
510596855709712384,2014-09-13 01:12:31,ギャリソン先生。スタンの行動は私の教育を受ける権利を妨害しています。
510581753757462528,2014-09-13 00:12:30,おいらが現場監督だ！お前は見るな！家が貧乏な奴は肉体労働担当なんだよ！
510566662823632896,2014-09-12 23:12:32,おいらの防弾チョッキは特注で…つまり、その…あの…
510430752425529345,2014-09-12 14:12:29,ケニー？あれが殺されるのを手伝うだけでバターズに仕返しできるんだぞ
510415664343818240,2014-09-12 13:12:32,意味なんてねぇ！単にサラ・ジェシカ・パーカーが超ブサイクだからだ！
510400557870108672,2014-09-12 12:12:30,おいらがワイセツってもんを見せてやる
510385475287150592,2014-09-12 11:12:34,この本はヒッピーの王様を銃撃させるのか？今すぐみんなで読もう！！
510370354489872384,2014-09-12 10:12:29,ざけんな！誰がちっさい玉なんか殴りたがるんだよ
510355273395875840,2014-09-12 09:12:33,タマ蹴られたくなけりゃさっさと失せな
510340158600642561,2014-09-12 08:12:30,チューバッカ弁論って何だ？
510325072947474432,2014-09-12 07:12:33,セクシーセクシーパンツ♪
510310000787329024,2014-09-12 06:12:39,現実逃避のヒッピーどもにはもううんざりだ
510294876416520193,2014-09-12 05:12:34,水泳教室に行けばオリンピックに行けるって母ちゃん言ってたぜ
510279760245563393,2014-09-12 04:12:30,なあ皆、母ちゃんが水泳教室に申し込んだんだけど一緒に行かねーか？
510264676710490112,2014-09-12 03:12:33,おいらん家の猫に指一本でも触れてみろ！てめえらのタマ袋に爆竹ぶっこんでパンツをぐっちゃぐちゃにしてやるからな！
510249562724786177,2014-09-12 02:12:30,黙れピップ
510234476383707136,2014-09-12 01:12:33,中国は黒人だらけだって母ちゃん言ってたぞ
510219361601081345,2014-09-12 00:12:29,本当にお前はへたれヨーロッパの腐れヒッピー野郎だな
510204281555656704,2014-09-11 23:12:34,なあスタン、今まで保健の先生の顔見たやつは一人も生きて帰ってないって本当か？
510085567564877826,2014-09-11 15:20:50,@hajikeristmacha このまま朝まで目を開けちゃダメでちゅよん。開けたらタマキン蹴り飛ばしちゃうぅ。痛いでちゅよーん
510068364899676160,2014-09-11 14:12:29,はあ！？フランスにはドッヂボールねーのか？
510053281796608000,2014-09-11 13:12:33,カイルのおいなりさんに蹴りをいれてその反応を確かめてみよう
510038170235199488,2014-09-11 12:12:30,おいらも一つ学んだぜ。金儲けって最っ高！キャラクターグッズ万歳！なんてったって金さえありゃお前ら負け犬の貧乏人と無理してつるむ必要はねーからな。
510023080844873728,2014-09-11 11:12:32,おいらはアキンドじゃねえ！…アキンドってなんだ？
510007969530929154,2014-09-11 10:12:30,誰がトム・ハンクスなんか主演にしたんだよ。タマなし野郎の演技なんか見てらんねーよ！
509992887132516353,2014-09-11 09:12:34,ったく下らねー。おいら達はグーニーズかよ！
509977769812320256,2014-09-11 08:12:29,シェフの塩味チョコボール、気にいったぜ！
509962687120289792,2014-09-11 07:12:33,今週のでかっちりジョークはそこまでだ
509947570957721600,2014-09-11 06:12:29,Mr.ハンキーがやってくんのはクリスマスのときだけなんだろ？
509932492166418432,2014-09-11 05:12:34,尻に敷かれっぱなしだな。いや本当、ああはなりたくねえ
509917372967161856,2014-09-11 04:12:30,スタ～ン。みゃみゃみゃみゃみゃみゃみゃみゃみゃみゃみゃみゃみゃ、みゃみゃみゃみゃみゃ～？
509902290212249601,2014-09-11 03:12:34,あークソ。お前のガールフレンドのせいで校長室に呼び出されちまったじゃねーかよ
509887182576701440,2014-09-11 02:12:32,デブじゃねーぞ！背が伸びてもいいように肉をためてるんだよこの激安ビッチめ！！
509872089386336257,2014-09-11 01:12:33,じゃあゲイのカウボーイがプリンを食わない映画が一本でもあるなら見せてみろってんだよ
509856974159097856,2014-09-11 00:12:29,インデペンデントの映画っていうのは白黒のヒッピー映画で、ゲイのカウボーイがプリンを食うやつだよ
509841899432054784,2014-09-10 23:12:35,サノバビーッチ！！
509723181821595649,2014-09-10 15:20:51,@hajikeristmacha おい、こういうイタズラ知ってるか？誰かが寝たら、コップにぬるま湯を入れて…そいつの手を突っ込んで…それからおしっこをかける。
509705980943159296,2014-09-10 14:12:30,母ちゃんが父ちゃんなら、本当の母ちゃんは誰なんだ？
509690894602473472,2014-09-10 13:12:33,挨拶が長えんだよ！
509675782415732736,2014-09-10 12:12:30,このナレーターいい加減頭こねーか？
509660692190744576,2014-09-10 11:12:32,起きやがれこの糞ジジイ！
509645581057142785,2014-09-10 10:12:29,おいらの父ちゃんは誰なんだよ
509630505474486272,2014-09-10 09:12:35,お前ハンニバルって映画観たか？調教したデカい豚に人間を生きたまま食わせるだろ？
509615389748121600,2014-09-10 08:12:31,差別だー！！
509600319005655041,2014-09-10 07:12:38,Fuck! Shit! Cock! Ass! Titties! Boner! Bitch! Muff! Pussy! Cock! Butthole! Barbra Streisand!
509585222464049153,2014-09-10 06:12:39,来いよカイル。ベガスにはどんなタンポン売ってんのかチェックしようぜ
509570140472504321,2014-09-10 05:12:43,なあ、ベガスっておいらたち大人にはピッタリの場所だよなー。
509555016709844993,2014-09-10 04:12:37,初潮を迎えたティーンのためのミーティング第１回では、生理と男の子について話し合います。
509539954129526784,2014-09-10 03:12:46,ケニーもナプキン買っとけよ？でないとパンツが汚れちまうからな
509524830354300929,2014-09-10 02:12:40,なになに…「多い日でも安心の横漏れ防止ギャザー」…「吸収したらゼリー状にして閉じ込めます」……おい、これウイング付きだってよー！
509509739030401025,2014-09-10 01:12:42,どんな子どもでも、大人になっていく過程で思春期に突入すると毎月必ず何日間かケツから血を流すようになるんだよ
509494599539113984,2014-09-10 00:12:33,おいら男になったぜ。とうとう思春期に突入したんだ！実は昨日やっとおいらにも生理がきたんだ
509479504679403520,2014-09-09 23:12:34,シェフが「パンツにキュウリいれとくとお守りになる」って
509363315655450625,2014-09-09 15:30:52,@hajikeristmacha おやすみ、ポリー・プリシー・パンツ
509343592469381120,2014-09-09 14:12:30,カイル、お前は可愛い系だ
509328513921323009,2014-09-09 13:12:35,おいらはグループのマッチョ系だろ。どんなアイドルグループにも１人はいるだろ、マッチョな奴が
509313391249223680,2014-09-09 12:12:29,で、これはウェンディの垂れ乳隠し用
509298316325027840,2014-09-09 11:12:35,歌のうまいアイドルグループなんかいないだろ？
509283197692039169,2014-09-09 10:12:31,いや待てよ…これもしかして神のお告げ？ねえそうなの？おいらにアイドルグループを結成して一千万ドル稼げってこと？
509268108154916864,2014-09-09 09:12:33,みんながそこの黄金のケツメドを持ってるわけじゃねえ
509252999726637056,2014-09-09 08:12:31,そりゃいい、スタンは黄金の腸を授かったんだな。けどみんなにはチポトラウェイが必要だ
509237912727085057,2014-09-09 07:12:34,もう地球上で非少数民族はおいらだけかと思ったぜ。おいら達の人種は何人生き延びた？
509222795046166528,2014-09-09 06:12:29,おいらが少数民族に見えるか馬鹿！
509207717504753664,2014-09-09 05:12:35,おい！お前らおいらのスタンとカイル大嫌いの歌聴きてえのか！？
509192595709239297,2014-09-09 04:12:29,ケツに割れたガラス突っ込んでやる！
509177528351596544,2014-09-09 03:12:37,これは超愚かを超えてヘラ愚かだ
509162408305123328,2014-09-09 02:12:32,ペテロの弱虫！ペテロのアホ！でもおいらイエスだから許してやろうかな
509147307388837890,2014-09-09 01:12:32,ケニー、また彼女とデートの約束か？　ったくここんとこいっつもイチャつきやがって
509132229079867392,2014-09-09 00:12:37,おいらはホームレス・ジャンプの専門家だ。３、４０人は軽くいける
509117116239200256,2014-09-08 23:12:34,よっしゃ！やったぜ！ホームレス飛び越えた！よっしゃあ！！
508998393293582337,2014-09-08 15:20:48,@hajikeristmacha おやすみ、クライド・フロッグ
508981202082988032,2014-09-08 14:12:29,うわっ、こいつケニーん家のにおいだ。どきやがれ！
508966119600701440,2014-09-08 13:12:33,トークン逃亡！白人の勝ち！白人の勝ちだぞ！
508951008144130048,2014-09-08 12:12:30,カイル、バターズに居場所とられて嫉妬してんだろ？成長しろよ。人生に変化はつきものだ。
508935922730033152,2014-09-08 11:12:34,みなさんへお願い。これからは言葉に気をつけて生活しようね。
508920803006484480,2014-09-08 10:12:29,おいコラ口臭消しくらい使えよ。高くないから
508905716019503104,2014-09-08 09:12:32,おいらが説明してやるよ。このスタンってやつは涙もろい動物好きでさ
508890609218621441,2014-09-08 08:12:30,ふざけるなよおいらはカナダ人じゃねえ！
508875514119856128,2014-09-08 07:12:31,ジャワには心がねーんだよ
508860409076412416,2014-09-08 06:12:30,うっわーマジできたねー町！まるでイーストデンバーじゃねえかマジ最低ー！
508845320168427520,2014-09-08 05:12:32,おいら普通のミルク嫌いなんだって！
508830215582142464,2014-09-08 04:12:31,おいら達子どもはいつも被害者だ
508816714906099714,2014-09-08 03:18:52,ヘッ！湯上り頭タオル野郎のことなんか知るかよ！
508800793265205248,2014-09-08 02:15:36,そりゃおいらの先丸安全ハサミだ。そんなもんでどうやって人殺せるんだよ！
508785456889077761,2014-09-08 01:14:40,その掘られまくったケツをあげてさっさとリーダーに戻れよ！
508770180478935040,2014-09-08 00:13:58,おいらをケツメドって言うなよクソッタレが
508754779401486336,2014-09-07 23:12:46,うちに帰ってピストルチョコ食おうっと
508630976423944192,2014-09-07 15:00:49,@hajikeristmacha おやすみ、ポリー・プリシー・パンツ
508618814422921216,2014-09-07 14:12:29,ジミー、お前のスタンダップコメディーは最高だ。おいらに笑いを思い出させてくれ
508603721924612097,2014-09-07 13:12:31,なんか変だ…多分、あまりに面白すぎるものを見た衝撃で…おいらの面白ヒューズが飛んだんだ。つまり、おいらの面白回路がショートしちまったんだ。もう何見ても笑えないかも…。
508588612988841984,2014-09-07 12:12:29,コックもディックも同じじゃねーかよー
508573534105264128,2014-09-07 11:12:34,ごめん、ごめんなさいチョクソンコック先生！
508558410258726912,2014-09-07 10:12:28,ユダヤにはわかんねーんだな。最高なのによ
508543335611367424,2014-09-07 09:12:34,おめーらこれ面白いぞ！ケニーがさ、逆さまにパーカー着たんだよ。そしたら顔のとこにケツがハマって…ケニーこっち来いよ！
508528217393598464,2014-09-07 08:12:29,トークンがいい点とったのはあいつん家が金持ちだからだろ！？
508517720262836224,2014-09-07 07:30:46,@SS_0707sk くたばれヒッピー！
508513128724713472,2014-09-07 07:12:32,ざっけんな！なんでＣ－なんだよ！両親食わせてやる
508498016974553088,2014-09-07 06:12:29,おいらの発明は、鉛筆をペンに…テープで留めてみました。こうすることで、自然環境における筆記用具の二面性を実現した。
508482933552726016,2014-09-07 05:12:33,でもおいら収容所っていいところだって聞いてたし、集中力をつけるのにいいと思って。
508467817369202689,2014-09-07 04:12:29,カイル、カイル！今聞いたんだけど、第二次大戦中収容所に送られたユダヤ人がいるんだってな。おいらそんなこと知らなくてさ！さっき教室でおいらが言ったの人種差別ジョークだと思っただろうけど、そんなつもりじゃないんだぜ。
508452732831670272,2014-09-07 03:12:32,そんな奴は強制収容所に送っちまえ
508437620884398080,2014-09-07 02:12:29,よろしくなカイル。確かにお前はカイルの親せきって顔してるよな
508422527949885440,2014-09-07 01:12:31,ホント割礼は辛いよなー
508407424701591552,2014-09-07 00:12:30,あーあお前…そこからいくつもの嘘を重ねてくんだぜ
508392344693899264,2014-09-06 23:12:35,ショーやんないとてめえに自分の親を食わせちまうぞ
508286202525388800,2014-09-06 16:10:48,@Eleutheria_ おやすみ、ポリー・プリシー・パンツ
508256431686967296,2014-09-06 14:12:30,うわっ！ひっでーオイニーだぜ
508241337540308994,2014-09-06 13:12:32,ケニーはサセ子だぜ
508226237018292224,2014-09-06 12:12:31,貧乏白人！
508211147774767104,2014-09-06 11:12:34,うわあ、オタクがいるぜ
508196029309521920,2014-09-06 10:12:29,さっさとフィリップ出せよ。フィリップ！フィリップ！フィリップ！
508180945690562560,2014-09-06 09:12:33,子供はもう欲しくない　In the ghetto 　In the ghetto♪
508165836066922496,2014-09-06 08:12:31,プッシー妖精のくせにおいらにプッシーって言うなよな
508150747897139201,2014-09-06 07:12:33,おいらの母ちゃんも大企業だぜー
508135635291357184,2014-09-06 06:12:30,それなら国の補助を受ければいいだろ？ケニーん家を見ろよ！国の補助で幸せに暮らしてるじゃねーか。
508120550061776896,2014-09-06 05:12:34,てめーらヘラ野郎　てめーらヘラアホ　てめーらヘラ間抜け　ヘラヘラヘラ♪
508105437653127168,2014-09-06 04:12:31,そんなことよりよ、お前ら２人でカマを掘りあったらどうだ？
508090382643519488,2014-09-06 03:12:41,でもカイル。殺人は何の解決にもならないよ。
508075245824008192,2014-09-06 02:12:32,だめだキティ！おいらのパイだぞ！
508060146480590848,2014-09-06 01:12:32,みんな愛してるよー！
508045042494103552,2014-09-06 00:12:31,君たち面白いこと言うね。落ち込んでる時でも君たちにお目にかかると楽しくなるよ。
508029954978619392,2014-09-05 23:12:34,母ちゃんたちにヘルペスうつしてほしいんだ
507894048141479938,2014-09-05 14:12:31,あのアマー！今すぐキンタマに蹴りいれてやる！
507878971522838529,2014-09-05 13:12:37,お前ん家ネズミ飼う余裕はあんのかよ
507863857461592065,2014-09-05 12:12:33,貧乏人の冗談はきっついなー
507848771758092288,2014-09-05 11:12:37,この冷凍ワッフルにはどのようなおかずが付くのでしょうか？
507833645688578048,2014-09-05 10:12:30,In the ghetto　寒い朝また一人赤ん坊が産声をあげる　In the ghetto♪
507818619523178496,2014-09-05 09:12:48,泊まるなんてやなこった。ケニーん家貧乏だしスラム街にあるんだぜ
507803445978361856,2014-09-05 08:12:30,ケニー、チケットなくしたらキンタマ蹴り飛ばしてやるからな！
507788359813443584,2014-09-05 07:12:33,お前の天国観はファミレスでスープに髪の毛はいってるって嘘ついて５ドルまけてもらうぐらい間違ってる！
507780365600059393,2014-09-05 06:40:47,@someno0610 おいらはデブじゃなくてマッチョなの！
507773241226563584,2014-09-05 06:12:29,天国ってのは森の妖精みたいに信じてるやつにだけ見えるんだ。だから今天国を見つけられないのは…１人ユダヤがいるからだ
507758150980620288,2014-09-05 05:12:31,食べ放題ってのは人を狂わせるのさ
507743039633096704,2014-09-05 04:12:28,貧乏人は人をからかう以外に楽しみがねえんだ
507727962095894529,2014-09-05 03:12:33,おめーらおめーら！もう一度カイルの２０ドルを両替して全部２５セント玉にしてきた！そいつでこのプールをいっぱいにしてコインの海を泳ぐんだあ！
507712844574388224,2014-09-05 02:12:29,なんだこれ。チョコミルクの粉か？
507697751119785985,2014-09-05 01:12:31,カイル助けてくんない？困ってるんだ。おいらもう……お前の２０ドルで何を買ったらいいかわかんなーい！
507682646386683905,2014-09-05 00:12:29,おいケニー、黙れケニー…黙れでかっちり！
507667559999479808,2014-09-04 23:12:32,それじゃあべーべは今までどおりのダッサイ女なのか？
507546341673672704,2014-09-04 15:10:52,@hajikeristmacha おい、こういうイタズラ知ってるか？誰かが寝たら、コップにぬるま湯を入れて…そいつの手を突っ込んで…それからおしっこをかける。
507531648053673984,2014-09-04 14:12:29,野球見ながら紅茶飲むなよ腐れフレンチ野郎！
507516556142583808,2014-09-04 13:12:30,マウンテンスプラッシュで並んでた時にすんごい混んでたんだけどさ、ジミーのおかげですぐ先頭にいけて最高だったな
507501473769345025,2014-09-04 12:12:34,悪い冗談やめろよな。痩せちまうぜ
507486369283702785,2014-09-04 11:12:33,今まで話したことなかったかもしれないけど…おいらはお前のことを親友と思ってた…ていうか、なんかさ…。
507471248087982081,2014-09-04 10:12:28,今更だけどさ、スタンとカイルって特別な親友って感じがするだろ？
507456172308176896,2014-09-04 09:12:34,なんだ？PTAの集会か？
507441053708730368,2014-09-04 08:12:29,バターズ　てめえ骨の髄から嫌いだぜ
507425963123019778,2014-09-04 07:12:31,昨日の夜、バターズが寝た後ヒトラーにしてやった。知ってんだろ？人差し指をケツの穴に突っ込んで口の上で拭いてヒトラーの口ひげつけんの。
507410853746847744,2014-09-04 06:12:29,おい、こういうイタズラ知ってるか？誰かが寝たら、コップにぬるま湯を入れて…そいつの手を突っ込んで…それからおしっこをかける。
507395773302964224,2014-09-04 05:12:33,おいらも割礼してもらおうかなあ
507380653520715776,2014-09-04 04:12:29,消防士さんはとってもすごいんだぞ。ヘルメットをなでるとピュッピュッって唾を吐くんだ
507365583768137729,2014-09-04 03:12:36,ケニー！ペニスなんて言葉は絶対使うなってママ言ってたぞ。言うんなら消防士さんって言えよ。
507350461079236608,2014-09-04 02:12:30,麻薬を使っちゃいけねえのはヒッピーになっちまうからだ。やつらゴミだ
507335374461353984,2014-09-04 01:12:33,ケニーならいつも死んでんじゃねえか
