id,created_at,text
477226982703239168,2014-06-12 23:12:33,物買うのやめるって決めたらよ…その週はニンテンドーＤＳのＧＴＡ４の発売日だったんだぜ
477105764029304832,2014-06-12 15:10:53,@hajikeristmacha おい、こういうイタズラ知ってるか？誰かが寝たら、コップにぬるま湯を入れて…そいつの手を突っ込んで…それからおしっこをかける。
477091096426577922,2014-06-12 14:12:35,おいらレッド・ロシアン！　資本主義の親玉を潰しにロシアから来た！
477075983204249600,2014-06-12 13:12:32,ケニー？ケニー？プレイボーイ見たいか？シンナー嗅ぎたいか？ケニー？
477060867012321281,2014-06-12 12:12:28,みゃみゃあ～～～～～～～～～～～～～
477045788338446336,2014-06-12 11:12:33,精子のサンプルをとる必要があるな
477030672498843648,2014-06-12 10:12:29,クッキーとコーヒーもってこい！　気の利かねえ女だ
477015589026676736,2014-06-12 09:12:33,くそー、どうして誰も犯罪に遭わないんだよ
477000478786461700,2014-06-12 08:12:31,ああークッソ。葬式ってマジつまんねえな
476995017676832769,2014-06-12 07:50:49,@K_TKR 言っとくけどなトークン。今度デブって言ったらお前の頭に石めり込ませるぞ
476985391833038848,2014-06-12 07:12:34,そうか、じゃあ代わりにタマキン蹴りあげてやる！
476970274911305728,2014-06-12 06:12:29,どうにもならないほんとのビッチだ　一緒に叫ぼうBoys and Girls♪
476955189723680768,2014-06-12 05:12:33,トークン何度言ったら分かるんだよ。黒人だろ？　ベースは弾ける。
476940073288495104,2014-06-12 04:12:29,やっぱこの商売超おいしいぜ！ただ昔のヒット曲に「ジーザス」とかなんかくっつけて、キリスト教の歌にすりゃいい！
476924996573335552,2014-06-12 03:12:34,ああ、カイルが涙を流しておいらに１０ドル渡すのが見えた
476914499333537792,2014-06-12 02:30:51,@alunre くたばれヒッピー！
476909886509309953,2014-06-12 02:12:32,昔ヤリマン今サゲマン♪
476894794489135104,2014-06-12 01:12:33,"P-p-p-poker face, p-p-poker face♪"
476879681036099585,2014-06-12 00:12:30,あの、こないだ買ったチン毛を返品しにきたんですけど
476864601573715969,2014-06-11 23:12:35,なんでスコット・テナーマンはおいらに１０ドルでチン毛を売ったんだ？
476748392027013121,2014-06-11 15:30:48,@hajikeristmacha このまま朝まで目を開けちゃダメでちゅよん。開けたらタマキン蹴り飛ばしちゃうぅ。痛いでちゅよーん
476728686754811904,2014-06-11 14:12:30,例えば…タンポンを誰かの給食にいれちゃうってのはどうだ？
476715684148162561,2014-06-11 13:20:50,@toshirou0820 玉でもしゃぶりなアナル野郎！
476713595221606400,2014-06-11 13:12:32,ママの命にかけて誓う。バターズ、お前の口に汚いものはいれない。
476698482586030080,2014-06-11 12:12:29,1776年回想するのさ♪
476683407527661568,2014-06-11 11:12:35,バターズ？　まだ精子がとれねえのか？
476668284322856961,2014-06-11 10:12:29,体から精子を出してこのコップに入れろ！
476653238859481089,2014-06-11 09:12:42,"Make, make it right♪"
476638088618205186,2014-06-11 08:12:30,僕ら友達　どんな時も一緒さ　４人でともに遊べば自然に笑顔こぼれる　そうさそれが友達♪
476622999336935424,2014-06-11 07:12:32,ネットで調べたんだよ！バターズにくわえさせてもゲイは取り消せないってな！そしておいらがチンチン口にいれてもゲイじゃないってこともな！！
476607881085612033,2014-06-11 06:12:28,"Hand in hand, we can live together♪ Ginger or not, we're all the same♪"
476592804290756608,2014-06-11 05:12:33,入りたまえ農民カイル！イスラム君主のタマにひざまずけ！
476577679580225536,2014-06-11 04:12:27,キリスト教が金になるのは知ってるぜ
476562598406541312,2014-06-11 03:12:32,FUCK JESUS！！
476547484215308288,2014-06-11 02:12:28,ママはユダヤをわかってねえ！やつら常に嘘ついてるんだぞ！！
476532394728513536,2014-06-11 01:12:31,でも写真撮るとき、バターズが暑がってパジャマおろしたの。おいらつまずいて、チンチン口の中に入っちゃって、なんか面白くなって写るとき笑顔で親指立てたの！　でカイルが写真奪って、皆に見せて、おいらゲイだと思われるの～！
476517283901087744,2014-06-11 00:12:28,言っとくが、ここに来るまでに風呂入ってないから、おいらのタマは超すっぱいよ
476502202421239808,2014-06-10 23:12:32,けちけちすんな黒っちり！
476391034587320322,2014-06-10 15:50:48,@hajikeristmacha おやすみ、ポリー・プリシー・パンツ
476368394367692800,2014-06-10 14:20:50,@satoshi34wada おいらがワイセツってもんを見せてやる
476366294497779712,2014-06-10 14:12:29,あんまりですよ。僕は金だけを目当てに何かしたことなんてありません！
476351200778915840,2014-06-10 13:12:31,パフェに必要なものは、チョコソースと生クリームと……他に何がいるんだカイル？　あぁ！そうだ！おいらのタマだ！
476336115733909504,2014-06-10 12:12:34,カイル、お前がタマをしゃぶるとき考えるのはレプラコーンのことか？　それとも口の中のタマがどんだけしょっぱいかってことか？
476321009511829504,2014-06-10 11:12:32,さあドイツの踊り　楽しくtra-la-la♪
476305892665606145,2014-06-10 10:12:28,バターズ、あとでタマ切り落とすぞ
476290811051507713,2014-06-10 09:12:33,日曜日はスペシャルバージョンカメハメハ大王ビッチ♪
476275697342615552,2014-06-10 08:12:29,お前ん家は黒人なんだから探せばどっかにベースの１本くらいあるだろ！？
476260610271752192,2014-06-10 07:12:32,演奏なんて適当でいいんだ！　とにかくイエスが大好きって歌うたっとけば、キリスト教徒がＣＤ買いまくるだろ！
476252621783969792,2014-06-10 06:40:48,@torojum1 貧乏人はくせーなあ！
476245497481404418,2014-06-10 06:12:29,いつまでかかってもいいから精子を持ってこい！！
476232489724162048,2014-06-10 05:20:48,@alunre くたばれヒッピー！
476230411463294976,2014-06-10 05:12:32,便座に座ってウインナー引っ張ってると白いのが出てくるから、それをコップに入れろ
476215296944914432,2014-06-10 04:12:29,君が欲しいジーザス　君がいなくちゃジーザス　僕の中で感じたいよジーザス♪
476200210746449920,2014-06-10 03:12:32,計り知れない深～い悲しみの味がするよお
476185094353195010,2014-06-10 02:12:28,バカっぽい赤毛にきたねえそばかすだらけで…くそ！見てるだけでむかつく！
476170011778613248,2014-06-10 01:12:32,いや、人のチンコを食いちぎるように調教してんの！
476154898812125184,2014-06-10 00:12:29,君らが大人になり子どもを持ったときに、戦っとけばよかったと思っても既に遅いのだ。今日この日こそ未来に踏み出す時だ。言ってやるがいい。たとえプライドが踏みにじられようとも「お前においらの１６ドル１２セントは絶対に渡さない」と！！
476139815507722241,2014-06-09 23:12:32,我々はポニーを探し調教する。調教して、やつのチンコを食いちぎらせるんだよ
476031173613719553,2014-06-09 16:00:50,@O83oR うわー！くっせー！うんこの臭いがする！
476023623472254977,2014-06-09 15:30:50,@O83oR ♞taka@お爺ちゃん♘、ブラブラしてねーで仕事したらどうだ！？　何考えてんだ！
476023622205579268,2014-06-09 15:30:50,@hajikeristmacha このまま朝まで目を開けちゃダメでちゅよん。開けたらタマキン蹴り飛ばしちゃうぅ。痛いでちゅよーん
476018591825793025,2014-06-09 15:10:50,@O83oR 黙れこのスカトロレイプ魔！！
476013555624312832,2014-06-09 14:50:50,@O83oR おいらがワイセツってもんを見せてやる
476008522006556673,2014-06-09 14:30:50,@O83oR ♞taka@お爺ちゃん♘のおいなりさんに蹴りをいれてその反応を確かめてみよう
476006012965486592,2014-06-09 14:20:52,@O83oR うわあ、オタクがいるぜ
476003904216264705,2014-06-09 14:12:29,君たちがスコット・テナーマンを１日も早く社会から抹殺したいと願っていることは私もよーく分かっている！
476003482126647296,2014-06-09 14:10:48,@O83oR なあ…。今まで言ったかわかんねえけど、おめーら愛してるぜ。……♞taka@お爺ちゃん♘以外。
476000970657116161,2014-06-09 14:00:49,@O83oR ♞taka@お爺ちゃん♘っていつもうんこ食ってるから息がうんこ臭いんだって聞いたぜ。しかも好きで食ってるんだって。
475998446130696192,2014-06-09 13:50:47,@O83oR ママー！ホームレスの♞taka@お爺ちゃん♘がいる。どっかに追い出して！
475995931314094080,2014-06-09 13:40:48,@O83oR ヘラいけてるぜ
475988814708473856,2014-06-09 13:12:31,全てが楽しかった３年　毎日がきらめく宝石のようだった３年　優しい先生、素敵な授業、マシュマロの椅子、テディベアスマイル、溢れる笑顔……
475973702052376577,2014-06-09 12:12:28,The Body of Christ　日焼けして締まった体♪　The Body of Christ　そのボディを僕のものにしたい♪
475958620853501953,2014-06-09 11:12:32,あの、ちょっといいですか？　チン毛祭ってどこですか？　このチン毛を売りたいんだ！
475943501096419328,2014-06-09 10:12:27,カイルのおかんはマジでくさいオメコ♪
475928421051031552,2014-06-09 09:12:32,チン毛一本５ドルって……これ１００万ドルぐらい？
475913314141093888,2014-06-09 08:12:30,スコット大変だ！　コートニー・ラブがサウスパークに来て酔っぱらって股おっぴろげて誰かれ構わず見せまくってるよ！
475898223429578752,2014-06-09 07:12:32,いや…しゃぶってない！おいらが寝てるうちに誰かが口にチンチンいれて写真を撮ったんだよ！！　その写真には口にチンチンいれて笑顔で親指立ててるおいらが見えるが……確実に熟睡してるから！！
475895270622785536,2014-06-09 07:00:48,@torojum1 デブじゃねーよ！鍛えぬかれてんだよ！
475892750554890240,2014-06-09 06:50:48,@torojum1 クッキーとコーヒーもってこい！　気の利かねえ女だ
475890230478639104,2014-06-09 06:40:47,@torojum1 無～視無～視、おつかれさまでした～
475883105803202560,2014-06-09 06:12:28,スタンお前ユダヤ！ケニーお前ユダヤ！お前ら全員ユダヤだ！！
475868035157225472,2014-06-09 05:12:35,もういい！これから家に帰ってフォトショでチンチンくわえてるのをお前の顔に合成してやる！！
475857521773531136,2014-06-09 04:30:48,@cocu_n こきゅんのおいなりさんに蹴りをいれてその反応を確かめてみよう
475854995393224704,2014-06-09 04:20:46,@cocu_n 私はオスモ４０００　あなたのお世話をするために日本から来ました
475852907535798273,2014-06-09 04:12:28,例えば…犬のウンコをお前らの顔にのせるってはどうだ？
475837825351299072,2014-06-09 03:12:32,よしバターズ！口開けて目閉じてひざまずけ！！
475822711164260352,2014-06-09 02:12:29,でもおいらゲイじゃねーよ！！
475807618347192320,2014-06-09 01:12:30,お前ら！やったぞマジで！最高の写真が撮れた！あいつのチンチンを口に入れて撮ってやったぜ！！
475792509604339712,2014-06-09 00:12:28,月曜ビッチ　火曜もビッチ　水木金土ビチビッチ♪
475777434655023104,2014-06-08 23:12:34,タマしゃぶりたくてしょうがないんだなカイル。お前しゃぶりたガールか？シャブ中か？
475673813871374336,2014-06-08 16:20:49,@ChaHan81069 今度デブって言ったらチリソースにお前の両親いれて食わせるぞ
475658717371711489,2014-06-08 15:20:50,@hajikeristmacha おやすみ、ポリー・プリシー・パンツ
475641516656844800,2014-06-08 14:12:29,この写真見ろよ。題は「満ゲツが昇る」。おいらの尻を使ってみたぜ！
475626427337826305,2014-06-08 13:12:31,Californiania♪　Supercool to the homeless♪
475611317215039489,2014-06-08 12:12:29,この写真の題は「ピエール」。寝てる間に猫のウンコで口ひげ書いてやったぜ。ハハハハッ
475596232778211328,2014-06-08 11:12:32,いけよカイル。だが命をかけて誓うぜ。この日が終わるまでにお前はタマをしゃぶるんだ！絶対な！！
475585733474783233,2014-06-08 10:30:49,@Ekechiemmanuel 黙れこのスカトロレイプ魔！！
475581116754059264,2014-06-08 10:12:28,"Black or white, brown or red, we shouldn't kill each other, 'cause dying's lame♪"
475566025044271104,2014-06-08 09:12:30,おいらが興味あるのは、レプラコーンが実在しててお前がタマをしゃぶらなきゃいけないってことだけさ
475550921246527489,2014-06-08 08:12:29,誤解するなよカイル。お前はタマをしゃぶるんだ
475535839070408704,2014-06-08 07:12:33,今までに5000回は女とヤったぜ
475520720693256192,2014-06-08 06:12:29,カイルを連れてくな！だめだ！タマしゃぶらせるんだ！！
475505651116810240,2014-06-08 05:12:36,私のタマは乾いたままです、裁判長―――証拠を集め証人を集めたのに、まだタマが乾いているのです。
475490522312609792,2014-06-08 04:12:29,プラチナアルバム！　１００万枚！　カイルより先にとるんだ！！
475475434742632448,2014-06-08 03:12:32,お前は本当に精子の出し方を知らねえんだな？　じゃあ一緒にトイレ来い！
475460350884597761,2014-06-08 02:12:35,カイル・ブロフロフスキーは快く承知し契約書にサインしました。しかし未だに実行せず、タマをしゃぶる意志すら見せていません。
475445236349423617,2014-06-08 01:12:32,カイル……タマしゃぶれ
475430136431390721,2014-06-08 00:12:32,おいらはチン毛を手に入れた♪　お前らより先に♪　はははははーーは♪
475415045266890752,2014-06-07 23:12:34,黄金のありかを言うか？それともじっくり死ぬか？
475349175282827264,2014-06-07 18:50:49,@sabu0103 首にツバつけやがって！ママ―！バターズがキスマークつけた！
475279126601822208,2014-06-07 14:12:28,ビビってきたのかカイル？　レプラコーンが出たらタマしゃぶる約束だもんな
475264038683684864,2014-06-07 13:12:31,で、この写真はバターズが寝てる間に口の中にタンポン入れてやった。題は「多い日でも安心」
475248927319396352,2014-06-07 12:12:28,"この写真は低高度フィルターを使い絞り値を5,6にして写した。ちょっとおいらの口にチンチンが入っているが、柔らかな背景のまま奥行きを保ってる。"
475238444663205888,2014-06-07 11:30:49,@murakiti マァ～マ。いつものチョコレートバターサンドウィッチまたつくってぇ
475235930089877505,2014-06-07 11:20:49,@murakiti ママ！こいつボケてるよ。老人ホームにいれた方がいいって！
475233840894455808,2014-06-07 11:12:31,ママぁ～～明日学校行きたくないよ～～
475218729437896704,2014-06-07 10:12:28,ちょんまげって良いよな。気に入ったぜ
475203644564840449,2014-06-07 09:12:32,みんな聞こえたか？　どっかから下痢便みてーな音が聞こえたぜ
475188561382092801,2014-06-07 08:12:36,そういやお前が飼ってるモルモットの悪口も言ってたな。気にすんな、お前が毎晩ケツの穴に突っ込んでるって言っただけだ
475173451439685632,2014-06-07 07:12:33,おやおや～どなたかと思えば家庭科クラスのケニーちゃん
475158327316316160,2014-06-07 06:12:27,ちょっと待てよ。うちのクラスで一番の問題児はクレイグじゃねえか？
475143253235220480,2014-06-07 05:12:33,やつらがパンツにうんこ漏らすの待ち遠しいよな
475128136737112065,2014-06-07 04:12:29,おい……Queefってなんだ？
475113047845908480,2014-06-07 03:12:32,カイルなんかママ相手に必死で指使いの練習してましたー
475097938159341568,2014-06-07 02:12:30,なんで２２のジジイなんかと付き合ってたんだ？
475082842024587264,2014-06-07 01:12:30,おいら西部一のイケてるカウボーイ♪　wicky wicky scratch yo yo bang bang♪
475067734036709376,2014-06-07 00:12:28,文化の話なんかしてねーよ！　おいらはただうんこ臭いって言ってんだよ！
475052651717992448,2014-06-06 23:12:32,おい！あれ見てみろよ！コスタリカの立ちんぼだぜ！
474923886320943104,2014-06-06 14:40:52,@hareteharuharu 糞ジャップがあちこちいやがる
474921374201298944,2014-06-06 14:30:53,@hareteharuharu 体から精子を出してこのコップに入れろ！
474918844901773312,2014-06-06 14:20:50,@hareteharuharu デブじゃねーぞ！背が伸びてもいいように肉をためてるんだよこの激安ビッチめ！！
474916735456272386,2014-06-06 14:12:27,てめーらブラブラしてねーで仕事したらどうだ！？　何考えてんだ！　大学行けよ！！
474901651459805184,2014-06-06 13:12:31,カイルはユダヤだからリズム感がねーんだよ
474886539059531776,2014-06-06 12:12:28,チンポを膣に入れられるか聞いてもだめだ。イタ飯屋にデートで誘わなきゃ
474873538218696704,2014-06-06 11:20:48,@cocu_n クッキーとコーヒーもってこい！　気の利かねえ女だ
474871459869765632,2014-06-06 11:12:33,女の口が閉じたとき、何言ってようが関係なくこう続けろ。「すごい観察力だね」
474856338753732608,2014-06-06 10:12:28,チンチン見てたんじゃねーよ！どうやってコンドームつけるか見てたんだよ！
474841259014516736,2014-06-06 09:12:32,おいらは何よりユダヤをからかうのが好き♪
474826149634134016,2014-06-06 08:12:30,首にツバつけやがって！ママ―！バターズがキスマークつけた！
474811057760776192,2014-06-06 07:12:32,一皿ミークロブを食えって言うならチンポ１００本舐めた方がマシだね
474795943124942848,2014-06-06 06:12:28,事の重大さがわかってねーなあ。とうとう「チンポ」ってテレビで言うんだぜ？
474780856905515008,2014-06-06 05:12:31,なにイライラしてんだカイル？　膣の中に砂でも入ったのか？
474765744853368832,2014-06-06 04:12:28,胎児から取り出した幹細胞をシェーキーズの隣においたら、新しいシェーキーズができちまったんだよ！
474752753751711744,2014-06-06 03:20:51,@QinosieS Qinosie Sevoxuvaoのおかんは糞ビッチ！！
474752751898230784,2014-06-06 03:20:51,@MLehitui ヘラいけてるぜ
474750669249716224,2014-06-06 03:12:34,It was the heat of the moment telling me what your heart meant……
474735548087545856,2014-06-06 02:12:29,それじゃあもし幹細胞をシェーキーズの隣に置いたら、隣にもうひとつシェーキーズができる？　お金を払わなくていい自分だけのシェーキーズが？
474720456428109824,2014-06-06 01:12:31,心配すんなケニー。おいらが治療法を見つけてやる。だから心配すんなよ！
474705348649943041,2014-06-06 00:12:29,もうお前ら帰れ！こうなったらおいら１人で胎児をさばいてやる！
474690262887706625,2014-06-05 23:12:32,堕ろした胎児がなんと３３箱！
474569051914506240,2014-06-05 15:10:53,@hajikeristmacha このまま朝まで目を開けちゃダメでちゅよん。開けたらタマキン蹴り飛ばしちゃうぅ。痛いでちゅよーん
474554348383387648,2014-06-05 14:12:28,楽しさいっぱいカートマンランド♪　誰も入れない♪　特にスタンとカイルな！
474539260532367360,2014-06-05 13:12:30,おいらが何年おばあちゃんの相手したと思ってんだ？　ぺちゃぺちゃキスされてもずっと我慢してたんだぞ。アスペリンとおしっこくせえのにな！
474524152355766272,2014-06-05 12:12:28,宗教は山ほど金持ってんだろ！
474509069516931072,2014-06-05 11:12:32,おいら２歳のころから１００万ドルつかむのが人生の目標だったんだ
474493953749057536,2014-06-05 10:12:28,ミルクを絞ってんだよ。犬のミルクを
474478879499751424,2014-06-05 09:12:34,赤いロケット出せ！レッドロケット！レッドロケット！出せ！
474463759059017728,2014-06-05 08:12:29,ママ、エチオピア人を飼ってもいい？
474450763276509184,2014-06-05 07:20:51,@hareteharuharu ヒッピー…ヒッピー…そこらじゅうにいる…地球を救えとか言ってマリファナ吸ってやがる…くせー…
474448667902894081,2014-06-05 07:12:31,ユダヤ人にやるお菓子はねーよ
474433554777010176,2014-06-05 06:12:28,血まみれの冷凍タンポンアイスキャンディーーー！！
474418473150341120,2014-06-05 05:12:32,おい！デブって言うなこのおカマ掘り野郎！！
474403353800097792,2014-06-05 04:12:28,お母ちゃん…もしドイツの変なエロビデオに出るんやったら…言うてくれるやんなあ？
474388272521572354,2014-06-05 03:12:32,ママァ～～～～～～～～ン
474373163371876352,2014-06-05 02:12:30,森の中の道を抜けておばあちゃん家へ～♪
474362681353183232,2014-06-05 01:30:51,@cocu_n やることやりやがれチンポ顔！！
474360159183986688,2014-06-05 01:20:49,@cocu_n こきゅんのおかんは糞ビッチ！！
474358067841089536,2014-06-05 01:12:31,にゃにゃにゃにゃにゃーにゃ♪
474342960184565760,2014-06-05 00:12:29,おいらの爺さんはレズビアンだから  、おいらはクオーターレズビアンなんだぞ！
474327877538680832,2014-06-04 23:12:33,みゃみゃあ～～これ買ってぇ～～～～
474206662958403585,2014-06-04 15:10:53,@hajikeristmacha おい、こういうイタズラ知ってるか？誰かが寝たら、コップにぬるま湯を入れて…そいつの手を突っ込んで…それからおしっこをかける。
474191966926680067,2014-06-04 14:12:29,アイラブチージープーフ♪　ユーラブチージープーフ♪
474178972519911424,2014-06-04 13:20:51,@heychieri 玉でもしゃぶりなアナル野郎！
474176878324903937,2014-06-04 13:12:32,ママぁ～～～～
474161767338102784,2014-06-04 12:12:29,ケツを蹴りあげ　小娘レイプ　我らソマリア海賊団♪
474146684813840384,2014-06-04 11:12:33,海賊になりたい生徒は誰でもどうぞ！　ユダヤ、メキシコ人、ジンジャー以外でな！
474131568877772800,2014-06-04 10:12:29,ソマリアなら海賊生活がおくれる！カイルだって言ってた！
474116481613959168,2014-06-04 09:12:32,ハイル！メル・ギブソン！
474101374464962560,2014-06-04 08:12:30,メル・ギブソン様　真実をもたらす英知と勇気を持つ方よ　今日この日からあなたに人生を捧げます
474086281329135617,2014-06-04 07:12:32,一人でも遊べるもんね
474071169776115713,2014-06-04 06:12:29,「パッション」見たけどユダヤ人は悪魔だって言ってたぞ
474056091362263040,2014-06-04 05:12:34,私はオスモ４０００　あなたのお世話をするために日本から来ました
474040976843878400,2014-06-04 04:12:30,見てやがれクソユダヤ！最高裁判所まで行ってチューブを外させてやる！
474025890444087296,2014-06-04 03:12:33,思い出した！　前にケニーが言ってたぜ　栄養チューブで生かされたくないってな
474010784482091009,2014-06-04 02:12:32,ケニー見ろよ　1ドル欲しいか？
473995747822542848,2014-06-04 01:12:47,そんなのケニーじゃない！あいつはぺんき嗅いだりするやつなんだ！
473980578476216320,2014-06-04 00:12:30,知るか！ケニーは死んだ！いつPSPが手に入る？
473965511185690627,2014-06-03 23:12:38,"Would you like to touch my body?  Come on and touch my body!  Oooo, my hot body!"
473844274920824832,2014-06-03 15:10:53,@hajikeristmacha おい、こういうイタズラ知ってるか？誰かが寝たら、コップにぬるま湯を入れて…そいつの手を突っ込んで…それからおしっこをかける。
473829578914287616,2014-06-03 14:12:29,カイルの腐れデブユダヤママの顔に小便！
473814491776299008,2014-06-03 13:12:32,ったくなっげーフライトだったぜ！　もう二度とくっせースコットランドなんか行かねーからな！
473799374359646208,2014-06-03 12:12:28,今はチンポコモンの時代だぜ
473784315906519040,2014-06-03 11:12:38,ケニー、おいらのチューチューネスビーとお前のペンギン交換しようぜ
473769176192921600,2014-06-03 10:12:28,（この前いとことチンチン触りあったの！）
