id,created_at,text
495557763817164800,2014-08-02 13:12:32,男なら言ってやれよビシっと。おい、そこのアマ！ごちゃごちゃ余計な事言わずガキでも作ってやがれ！！
495549796514398208,2014-08-02 12:40:53,@SS_0707sk ✞うさみすずみ✞の涙はどんな味だ？
495547275414749184,2014-08-02 12:30:51,@SS_0707sk ヘラいけてるぜ
495544756424802304,2014-08-02 12:20:51,@SS_0707sk 相撲取りのアナルでも嗅ぎやがれってんだ！
495542646920585216,2014-08-02 12:12:28,ナメてる女にはこう言ってやんな～。おい！！ふざけやがってこのアマ！！黙って台所でパイでも焼いてきな～！！
495527568062173184,2014-08-02 11:12:33,ディベートに勝つにはスタンとカイルの人間性を攻撃した方が良い。基本だろ？
495512456190382080,2014-08-02 10:12:30,ぼいんぼいーん
495497366963625984,2014-08-02 09:12:32,ゲロゲ～ロ われこそは 南スリランカのメキシコにらみガエル。とても コワいぞ アブナいぞ～
495482252671733760,2014-08-02 08:12:29,ヘッ、若いうちから貯金なんてセコいことしてたら大成しないぞ
495467171057639424,2014-08-02 07:12:33,これ以上貧乏人が増えちゃ税金払ってるこっちはたまんねーぜ！
495452058128900096,2014-08-02 06:12:30,だから貧乏人はウゼーんだ！　保護うけて暮らしてんのに、もう一人作ろうなんて百万年早いんだよ！
495436970646974464,2014-08-02 05:12:33,干上がった子宮は戻らねぇけどな
495421861988007939,2014-08-02 04:12:31,相撲取りのアナルでも嗅ぎやがれってんだ！
495406767921037312,2014-08-02 03:12:32,玉しゃぶりやがれ！
495391659018817537,2014-08-02 02:12:30,生理になーった おまえらーはまーだ♪ 生理になーった おまえらーはまーだ♪
495376565509697537,2014-08-02 01:12:31,もし過去に戻ってヒトラーを殺せるチャンスがあったらどうする？ おいら個人は尊敬しているからやらんがお前は、殺すだろ？
495361464136241152,2014-08-02 00:12:31,タマ潰れちまうぜ
495346373550563328,2014-08-01 23:12:33,無～視無～視、おつかれさまでした～
495217608489058305,2014-08-01 14:40:53,@REP_narita 玉でもしゃぶりなアナル野郎！
495215119198982144,2014-08-01 14:30:59,@REP_narita 杉本(裕)っていつもうんこ食ってるから息がうんこ臭いんだって聞いたぜ。しかも好きで食ってるんだって。
495212603191218176,2014-08-01 14:20:59,@REP_narita やることやりやがれチンポ顔！！
495210476112842752,2014-08-01 14:12:32,おいらはデブじゃねぇんだよ！骨太なだけ！
495195373476904961,2014-08-01 13:12:31,うちのママは片方の靴だけで歩くほどの貧乏なんだあ！それで靴なくしたのかって聞くと「いいえ、片方見つけたの」って答えるんだあ！
495180260271345664,2014-08-01 12:12:28,"♪'Cause I'm not (He's not, he's not) the poor kid at school!"
495165175876448256,2014-08-01 11:12:32,「おいらはクズ白人！しょっぴかれます！」
495150070447104000,2014-08-01 10:12:30,♪Cause I'm not (I'm not) the poor kid at school!
495134981585244163,2014-08-01 09:12:33,いいか？おいらん家は貧乏だ！けどここに来る前はケニーのほうが貧乏だった。だから厳密に言えば学校一貧乏なのはケニーだ！
495119866458681344,2014-08-01 08:12:29,緊張するぜ…みんなタチ悪そうに見える。ケニー、お前先にこの学校に来てんだから友達紹介してくれるよな？おいらがイケてるってこと友達に証明してくれ。
495106880121757696,2014-08-01 07:20:53,@SS_0707sk うわー！くっせー！うんこの臭いがする！
495104780822269953,2014-08-01 07:12:33,うちのママはスパムが食えると思ってGmailのアドレス作るくらい貧乏なんだぜ
495089667054637056,2014-08-01 06:12:29,おいら里子に出るよ。第一希望はハワイね！
495074579358814208,2014-08-01 05:12:32,おいらのママはアイスを振ってこれが冷房よって言い張るほどの貧乏なんだあ！ケニーんちみたいにクールな里親にもらわれたらなあ…。
495059468980215809,2014-08-01 04:12:29,ママ。問題はな、ケニーがいなくなった今おいらが学校一の貧乏なんだよ。
495044385898131458,2014-08-01 03:12:33,お前ら！おいらん家がどんだけ貧乏かってジョーク、カイルから聞いたか！？あいつ面白いよな！貧乏すぎてカモがおいらのママにパン投げて与えてんだってよ！超おもしれえよな！
495029276270292992,2014-08-01 02:12:31,全生徒に聞いて回って確信したぜ。ケニーがいない今、この学校で一番貧乏なのはクレイグだ！
495016282589110272,2014-08-01 01:20:53,@SS_0707sk 貧乏人はくせーなあ！
495014182987644928,2014-08-01 01:12:32,いまケニーが里親に出されるところです。笑えます。
494999074689396736,2014-08-01 00:12:30,お前ら知ってるか？生理が来なくなることを更年期って言うんだぜ。神様が生理を取りやめて短気にするんだ。だから最近カイルの機嫌が悪いのは更年期だからかなって思って。
494983990034444290,2014-07-31 23:12:34,カイル、なんで機嫌悪いんだ？また女の子の日か？
494862780676063232,2014-07-31 15:10:55,@hajikeristmacha おやすみ、ポリー・プリシー・パンツ
494848073781104640,2014-07-31 14:12:29,くだんねえ本なんか読まなくてもヒストリーチャンネル観りゃいいんだよ
494837607168081920,2014-07-31 13:30:53,@takeshi0123 おい！デブって言うなこのおカマ掘り野郎！！
494832984030068737,2014-07-31 13:12:31,おいらの家全焼したんだぞ。みんなおいらに気使わなきゃいけないだろ
494817874020548608,2014-07-31 12:12:29,トークン、お前の助けが必要なんだ。今の時代黒人は何の悪さもできない無能だからさ。
494802787373314049,2014-07-31 11:12:32,「エリック…覚えておいて…いつまでも…素敵な君でいて…」
494787684695420928,2014-07-31 10:12:31,おいらが最高でイケてることはわかりきってますよ。けどそれは今あまり関係ありません。
494772592142585857,2014-07-31 09:12:33,"Fly, fly little dove, to the welcome arms of Christ above. Your tears are finally gone to…♪"
494757487413690368,2014-07-31 08:12:31,私は２歳の頃からクライド・フロッグを知っていました。彼は勇猛果敢で先見の明があり、完璧な友人でありました。彼は決して何も言わず己の欲求も持ち合わせていなかった…私が望んだことに同調してただ座っていた…。
494742409075363840,2014-07-31 07:12:36,クライド・フロッグがさらわれた！！
494727285551820800,2014-07-31 06:12:31,「えぇ、そうよエリック。大人になる必要なんてないわ。あなた最高にクールだもの」
494712200775229441,2014-07-31 05:12:34,「君のせいじゃないよエリック。どう見てもオバマのせいなのになぜ君に責任がある？くだらない体力測定をさせたのは君じゃない。オバマさ」
494701710988697600,2014-07-31 04:30:53,@Xx__RuRu__xX なんだよ、るる
494697093240348672,2014-07-31 04:12:32,でね…ウェンディが自分たちは９９％でおいらは１％だからイケてないって言ったのおぉ！
494682004449792000,2014-07-31 03:12:35,おいら知ってるぜ。お前ら９９％の人間が集団で１％を攻撃してんだ！
494666905697800193,2014-07-31 02:12:35,信じられねえ…貧乏ケニーとかユダヤカイルとか素敵な会話してたのによ…９１１並に突然デブジョークをぶち込んでくるなんてな
494651807340040192,2014-07-31 01:12:35,お前らケニー見ろよ！マジ貧乏すぎ！３ドル９９の体操服も買えないでやんの！
494636688484741120,2014-07-31 00:12:31,まあ愚痴んなよ。みんな前向きに行こうぜ。
494621610851045379,2014-07-30 23:12:36,あの…ただ…一緒にランチを食べられないかな。…おいら、ずっと君のこと……好きだった…。
494500386569330688,2014-07-30 15:10:54,@hajikeristmacha おい、こういうイタズラ知ってるか？誰かが寝たら、コップにぬるま湯を入れて…そいつの手を突っ込んで…それからおしっこをかける。
494485702206160896,2014-07-30 14:12:33,おいおい！あいつの死をおいらのせいにすんな。みんなの前でウンコ漏らしたのはおいらじゃねえ！あいつだ！
494470609066131457,2014-07-30 13:12:34,お前ら知らねえのか？サウスパーク小の裏サイトだぜ！
494455497714458626,2014-07-30 12:12:31,薄汚ねえメキシカン・ユダヤめ！！
494440411872505857,2014-07-30 11:12:35,おい！テキサス人だからっておいらはデブじゃねえ！
494425299946205185,2014-07-30 10:12:32,おいら去年予防接種を受けたんだ。明らかにアスバーガーだ！おいらの健康状態記録しとけよ！
494410207955390465,2014-07-30 09:12:33,Turn on your heart light♪ Let it shine wherever you go♪ Let it make a happy glow♪
494395100454072320,2014-07-30 08:12:32,お前らアスバーガーっていう病気知ってるか？
494389655995809792,2014-07-30 07:50:53,"@faieledwancar さっきトゥイークが北山しょんたん@みさきo,＋:｡のことうんこ食い野郎って言ってたの聞いたぞ"
494380013316104197,2014-07-30 07:12:34,あーっクソ！どうやって一週間もバターズを監禁するんだよ！
494364891143094272,2014-07-30 06:12:29,いいかバターズ。何があっても何が聞こえても絶対に出てくるな。もしおいらがもどってこなかったら…お前が地球の人間を増やすんだ。チンチンでさ。
494349810946695168,2014-07-30 05:12:34,ざっけんなジミー！くらえ！二度とカイルの悪口なんか言うんじゃねえ！カイルはおいらの友達だ！今度「あいつの母ちゃんとセックスしたい」なんて言ったらマジぶっ殺すかんな！
494334702640058369,2014-07-30 04:12:32,ジミー！お前のアドバイスが欲しいんだ。お前って誰からも好かれて人と付き合うのが上手だろ。だから教えてくんない？人に良くするフリってどうやんの？
494319620451356673,2014-07-30 03:12:36,カイルちょっと待てよ！カサボニータはおいらが世界一好きな場所なんだ！連れていってくれなきゃ死んじゃう！お願い！
494304509376475136,2014-07-30 02:12:33,いつおいらがユダヤの悪口言った？………まあ一度くらい言ったかもしんないけど
494289412688068608,2014-07-30 01:12:34,カサボニータ　カサボニータ　楽しいことがたっくさん♪
494274299503464448,2014-07-30 00:12:30,誰かさんは生理中みたいだな
494259211778289665,2014-07-29 23:12:33,信じらんねぇ…スラッシュが作り話なんて…
494138001090310147,2014-07-29 15:10:54,@hajikeristmacha おやすみ、ポリー・プリシー・パンツ
494125409978417154,2014-07-29 14:20:52,@windrnd スタンお前ユダヤ！ケニーお前ユダヤ！お前ら全員ユダヤだ！！
494123362914795520,2014-07-29 14:12:44,やっぱり会社にはユダヤが必要だな
494108242885111808,2014-07-29 13:12:39,この国はある理想の上に設立されている。一つの企業が奴隷を独占なんてできないのだ！
494097721251225600,2014-07-29 12:30:51,@0cilam デブじゃないぞ！おいらは陽気な骨太だ！
494093122578575360,2014-07-29 12:12:34,お前んとこの会社が大学だからってなんでもできると思ってんのか！？
494078038426931200,2014-07-29 11:12:38,マックのポテトにケンタのグレービーをつける。フランス人はこれをプーティンと呼ぶ。
494062912583897089,2014-07-29 10:12:32,スラッシュは見つけにくくねえ！金出せばどこにでも現れるだろ！おいらの８歳の誕生日会にも来たんだぞ！
494047819993329665,2014-07-29 09:12:33,クラックベイビー競技協会は名高い団体です。１２日前に設立され、選手への給与は不健全であると会社倫理規定に明記されているんです。あなたやお子さんにはお金は提供できませんが少しのクラックなら…
494032705734979585,2014-07-29 08:12:30,ではあなたは妊娠８ヶ月半のコカイン中毒者ってことで間違いないですね？　奥さん、朗報をお持ちしましたよ。お子さんにはぜひクラックベイビー競技協会で活躍してもらいたいんです。
494017624326418432,2014-07-29 07:12:34,誰かがあのベーコンを食べつくさなきゃならない。…それがおいら達だ。
494002501352321024,2014-07-29 06:12:29,おいら達毎晩このベーコン祭に来てるんだ。メニュー見ろよ！ベーコン詰めパンケーキ、ベーコンミートローフ、デザートにはベーコンパフェまであるんだぜ！
493987412708585472,2014-07-29 05:12:31,デニーズ行くか。ベーコン祭開催中だぜ！
493972322366136321,2014-07-29 04:12:33,ひどいってなんのことだ？ボールに麻薬詰めてクラックベイビーが争ってるところをネットに流すだけだぞ。誰が気にするんだ？
493957218652286976,2014-07-29 03:12:32,おいら達はかわいそうな麻薬中毒の赤ん坊に明るい未来を与える手伝いをしてるんだ
493942131120037888,2014-07-29 02:12:35,ファックユー！おいらはかんしゃく持ちじゃねえ！
493927017306279936,2014-07-29 01:12:32,チンコの大きさを大々的に知らしめていたいけな少年たちを馬鹿にしやがって！！
493911905115729920,2014-07-29 00:12:29,なんだレッド！おいらのチンチンがみんなより小さいからって驚いてんのか？おいらそんなの全然気にしてねーよ！！
493896823711350786,2014-07-28 23:12:33,これで分かったか？おいらのチンチンは３cmじゃなくて３．５cmなんだよ！
493775617322528768,2014-07-28 15:10:55,@hajikeristmacha おやすみ、ポリー・プリシー・パンツ
493760913216790528,2014-07-28 14:12:30,どうする気だ？お前らがおいらのチンポ測るのか？ホモか！？
493745844785401857,2014-07-28 13:12:37,よし、バターズ…えっと…６…おぉ！６cmだ！マジ良かったなバターズ！
493731019476856835,2014-07-28 12:13:42,おいらのチンチンだって３cmじゃねえ！！本当だ！！これは学校による陰謀だ！！
493716098810802177,2014-07-28 11:14:25,エリック・カートマン、３cm……なんでみんなに発表するんだ！？チンチン計りたいだけならいい！けど馬鹿にすんな！！
493700560885776384,2014-07-28 10:12:40,また大げさに騒いでると思ってんな？今回は違うぞ！先週の身体測定覚えてるか？学校がおいら達全員のチンコのサイズを表にして廊下に張り出しやがった！！
493686597745774592,2014-07-28 09:17:11,バターズ！手を貸さなかったら一生お前に付きまとってやるからな！
493670742102245376,2014-07-28 08:14:11,しっかりしろ！おいらは死んだんだ！何かの理由で魂がここに…天国に行けないんだ…
493655261379166209,2014-07-28 07:12:40,バターズ！おいらは空想じゃねえ！なぜかお前だけが死んだおいらを見れるんだよ！
493640140254744576,2014-07-28 06:12:35,びしょびしょだぜ！おいらずぶ濡れだ！最高ー！！
493625689128439808,2014-07-28 05:15:10,我が同胞たちよ！最後の審判がやってきた！いざ始めよう！世界中のジンジャーでない子ども全ての血が流されるまで！
493610310960291840,2014-07-28 04:14:03,行け！ジンジャーでない子どもを捕まえてくるのだ！檻に閉じ込め溶岩の穴にぶち込んでやつらを絶滅させるのだ！
493595184181948416,2014-07-28 03:13:57,我が同胞たちよ。私は憎しみのない世界を想像する！みんながジンジャーの世界を！だからジンジャーでない全ての人間を集め絶滅させるのだ！
493579718084411392,2014-07-28 02:12:29,ジンジャーは選ばれた人間！選ばれた種族だ！軽蔑すべきは我々以外の人間！色のある奴らだ！
493564621383413763,2014-07-28 01:12:30,いいか、おいらはジンジャーかもしれないけど他のジンジャーとは違う！中身はおいらのままだ！
493549513169063937,2014-07-28 00:12:28,ジンジャーは誰？ユダヤだ！ユダヤは何をした？キリストを殺した！
493534433027174400,2014-07-27 23:12:32,お前ら忘れるなよ。カイルはデイ・ウォーカーだ。デイ・ウォーカーは半分ジンジャーだぜ。
493415729467625472,2014-07-27 15:20:51,@hajikeristmacha おい、こういうイタズラ知ってるか？誰かが寝たら、コップにぬるま湯を入れて…そいつの手を突っ込んで…それからおしっこをかける。
493398509890973697,2014-07-27 14:12:26,吸血鬼と同じようにジンジャーの遺伝子は呪いです。地球上からその呪いを取り除くまで世界は永遠に暗黒に包まれたままでしょう。我々自身が認めるべき時なのです――ジンジャーは下劣で汚らしいと！
493383413995282432,2014-07-27 13:12:27,赤毛の中には肌が白いわけでもそばかすがあるわけでもない者がいます。そう、デイ・ウォーカーです。
493368307739672576,2014-07-27 12:12:25,バターズ、女子がお泊り会で何をするかは分からない。でもレズプレイを始めたら…お前もやれ。
493353221272784897,2014-07-27 11:12:28,女子どもはおいら達に内緒で隠してんだ…とてつもない物を。もし仮にやつらが…未来が見れる…装置を持ってるって言ったら…どうする？
493338109413560321,2014-07-27 10:12:25,"「お前らには俺みたいなやつが要るんだ！俺みたいなのがいるから""あいつは悪人だ""と指さして言えるんだ！」"
493323018890792962,2014-07-27 09:12:27,もしもし？聞いてます？カードゲームならウォルマートのほうが３ドルも安いのになんでジムのスーパーに行くんですか？
493307917840285698,2014-07-27 08:12:27,お前ら知ってるか？　死ぬ時ってウンコ漏らすんだぜ！
493292829167218690,2014-07-27 07:12:30,ドイツ人をキレさせた奴らがどうなったか知らないのか！？言ってやれカイル！
493284860438388736,2014-07-27 06:40:50,@REP_narita ママ！こいつボケてるよ。老人ホームにいれた方がいいって！
493282356547960832,2014-07-27 06:30:53,@REP_narita ママー！ホームレスの杉本(裕)がいる。どっかに追い出して！
493279821779070977,2014-07-27 06:20:48,@REP_narita うわー！くっせー！うんこの臭いがする！
493277714481049602,2014-07-27 06:12:26,味付きローションがいいか？次においらをハメる時はもっと優しくナメやがれ！！
493262626625814530,2014-07-27 05:12:29,おいらメチャメチャハメられたぜ！フィリピン人の売春婦並にな！
493247513529311235,2014-07-27 04:12:25,マァマ…お願い…戻って東芝ハンディブック買ってぇ
493232428014518272,2014-07-27 03:12:29,おいらをハメたいならそう言えよ！ほら！ママやれよ！ハメろよ！ほら！ベストバイでハメろ！息子をハメたいんだろ！やれよ！ハメろ！ハメろ！！
493217343254691840,2014-07-27 02:12:32,もっといい考えがあるぜ。向こうの店でコンドームを買うんだ。おいらをハメる気なら安全な方がいいだろ！
493202222331592704,2014-07-27 01:12:27,東芝ハンディブック？そんなの学校に持っていったらド貧乏のウンコたれだと思われるだろ！
493187117200068608,2014-07-27 00:12:26,ママ！Apple以外は全部クズだってみんな知ってんだぞ！
493172029164498944,2014-07-26 23:12:29,ママ、口紅貸してくれる？次にてめぇにハメられる時は少しでも綺麗に見せたいからな！
493058410124808192,2014-07-26 15:41:00,@yukahsm1 相撲取りのアナルでも嗅ぎやがれってんだ！
493055861967695872,2014-07-26 15:30:52,@yukahsm1 糞ジャップがあちこちいやがる
493036127381508099,2014-07-26 14:12:27,ハ～ハ！てめぇらiPad持ってないからそんな事して遊んでんのか！
493021026859503616,2014-07-26 13:12:27,おいトークン、おいらのiPad見たか？あれ？持ってないのかよ？お前ん家金持ちだと思ってたのに
493005923544076289,2014-07-26 12:12:26,お前にわかるか？みんながおいらにこう言うんだ。「カートマン、お前ファミリー・ガイ好きだろ？」「笑いのセンスがファミリー・ガイみたいだ」
492990843532222465,2014-07-26 11:12:31,おいらとファミリー・ガイを比べるな！もう一度比べてみろ。ぶっ殺してやるからな！！
492975741282160640,2014-07-26 10:12:30,単純なテレビ経済学さ。番組を終わらせたきゃまず一つの回を止めさせる。もしイスラム教徒の要求で止められたならカトリック教徒でもできるってことだ。そうすりゃ障害者だってやめさせられる。そうしていきゃファミリー・ガイはおしまいだ！
492960637568290816,2014-07-26 09:12:29,こんなのイケてねえよ。こいつら宗教をからかったんだぞ。問題がないとでも？そいつらの感情は気にしないのか？おいらはただの少年だがあれはアニメだ。何百万人も観るんだぞ！カイル、もしテレビでユダヤをからかうアニメが流れたらどんな気分だ！？
492945530125697025,2014-07-26 08:12:27,みんなで「親に淫らなことされた」って言おうぜ！
492930439506452481,2014-07-26 07:12:29,母ちゃんの彼氏が居着いたときによ、「淫らなことされた」って警察に言ったらその後３か月見なくなったぜ！
492915326745468928,2014-07-26 06:12:26,もうママは信じらんない。もう二度と人なんて信じらんないよ！結局信じられるのは自分だけってことか…。自分とウィルキンスベアーちゃんだけ…。
492900239800426496,2014-07-26 05:12:29,おいら見たんだって！皮の手袋をした手で思いっきりタマキンを握りつぶして最後はブドウみてえに弾けちまうんだよ！
492885129258221570,2014-07-26 04:12:26,おい！小便用の便器にクソしたのはカイルだかんな！
492870038714466304,2014-07-26 03:12:28,もし良かったら…時々でいいんだけどさ、シェリーをお姉ちゃんって呼んでいいかな？そんで一緒に遊んでほしいんだ。例えば一緒に流れ星を見たりとかさ。そしたら弟気分を味わえるじゃん
492854934107201536,2014-07-26 02:12:27,ほら、おいらって兄弟いねえだろ。兄弟いる奴ってみんなそのありがたさを分かってねえんだよな。喧嘩もするだろうけど、いつもそばに誰かいるっていいことだよね。
492839838735818752,2014-07-26 01:12:28,ここサウスパークでは季節は２つだけ。冬と７月です。
492824736326377474,2014-07-26 00:12:28,マ～マぁ～、昔日本のトクガワソルジャーが使ってた名刀スマトミっての買ってい～い？
492809649511346176,2014-07-25 23:12:31,おめーら羨ましいだろ！ジョン・エルウェイが父ちゃんだぜ！エルウェイがパパ♪エルウェイがパパ♪
492673736730894336,2014-07-25 14:12:26,お前のその髪誰が切ったんだ？スティービー・ワンダーか？
492658639547543553,2014-07-25 13:12:27,そのとき母ちゃんは若くてお金が必要で…仕方なかったんだよ！
492643533866536960,2014-07-25 12:12:26,もうこいつとは遊ばない！リアクション無しじゃつまんねーよ
492628448154644481,2014-07-25 11:12:29,ケニーん家あまりにも貧乏だからよ、やっとの思いで手に入れたダンボールハウスまで昨日質に入れちまったんだってよー。
492613339701202945,2014-07-25 10:12:27,おい！おめーらみたいな虚弱体質野郎にそんなこと言われる筋合いねーよ！
492600373249441792,2014-07-25 09:20:55,@Tomato_Gundam Takácsのおかんは糞ビッチ！！
492598248213737472,2014-07-25 09:12:29,やっぱりカイルにエイズじゃなぁい？これしかないだろ。
492583145053515777,2014-07-25 08:12:28,カイルにエイズっての……だめ？
492568048709009408,2014-07-25 07:12:28,おい待てよ！いいこと考えたぞ。まずカイルをエイズに感染させて、チャリティー団体を作ってそこで寄付金を集めるんだ！
492552939269922817,2014-07-25 06:12:26,おいらのは小さくねえ！ドイツ系を舐めんな！
492537850093518848,2014-07-25 05:12:29,もう心配ない。何時間かしたらカイルはあの世だ
