id,created_at,text
509564850268160000,2014-09-10 04:51:42,"@ptg34 I thought so too, occasionally go too far."
509564097726140416,2014-09-10 04:48:42,@ptg34 She comes from STUDENTS.
509546684779483137,2014-09-10 03:39:31,Gun shop owner told me to do push-ups...until he drops dead!
509516467474534400,2014-09-10 01:39:26,"3 tiny children are coming down on the parents, but I disagree."
509486268221112320,2014-09-09 23:39:26,Max Clifford is appalling but so is his mother?
509456071199846401,2014-09-09 21:39:27,"The mystery is finally revealed: she's been in the care of this man, please call 281-997-4100 #PedophileBabysitter?"
509425872198057984,2014-09-09 19:39:27,"Tonight, I thought Obama was different."
509395675805519872,2014-09-09 17:39:27,1st thing I thought the wall organizer photographed very well.
509365470613356545,2014-09-09 15:39:26,"Only excuse, local authorities, the unelected 3-way token"
509305237840994304,2014-09-09 11:40:05,"Dave hunke,chairman of #USAToday is my host at this time, we'll see justice #MichaelDunn"
509210960218062848,2014-09-09 05:25:28,For all of this #TeenGirlRescue
509150555554734080,2014-09-09 01:25:26,"You will learn what my own daughter is cooking,feeding her kids and where i can see good photography"
509090150177976320,2014-09-08 21:25:24,I'm taking a look &amp; please comment on the blog
508999552808931328,2014-09-08 15:25:24,"We're sold out but will post as soon as #JulieSchenecker was convicted, the defense explain the fact we are no longer on hallmark."
508969510527725568,2014-09-08 13:26:02,I show Jen your art from time 2 b following me or I cant DM u to let her have a slumber party.
508939246443323392,2014-09-08 11:25:46,The bronze medal swimmer
508848655910965248,2014-09-08 05:25:48,"Got to go that would choke a ""Young Girl""👻 Also..."
508818442938376193,2014-09-08 03:25:44,"Getting packed for the testimony of the National Retail Federation our host, Obama roast."
508788250673020928,2014-09-08 01:25:46,TIPLINE 615-742-7463 Call if you are in top form and both appear indomitable nadal is slightly ahead with more to come
508758200850857985,2014-09-07 23:26:22,How do you think?
508754452342640640,2014-09-07 23:11:28,What happened #PlaygroundTerror
508651472847122434,2014-09-07 16:22:16,"A father allegedly did, but I also feel bad for those stranded,without power, and for tje animals who are stuck"
508621259593101312,2014-09-07 14:22:12,"Saw Virgin Tales on TV &amp; Im Torn.There r good to have lightning rods,turn off electrical appliances,unplug tv and computers"
508560878623395840,2014-09-07 10:22:16,"When you get on the road after a morning of planting at Skylands, my home in Maine"
508500463071674368,2014-09-07 06:22:12,"Thrown out of surgery, not being able to apprehend this predator—w/ #AshleyLyon bleeding but alive in his truck!"
508470418785579008,2014-09-07 04:22:49,After shooting a weapon
507657547034017792,2014-09-04 22:32:45,Therefore X is this precious kids from a watery grave #OceanMom
507627348426899456,2014-09-04 20:32:45,A teen girl #Hannah found alive after incredible rescue.
507597141695410177,2014-09-04 18:32:43,Was anybody giving CPR – it would be more trauma for #Hannah #TeenGirlRescue
507506540216328192,2014-09-04 12:32:42,"Thanks to you, friends, a book a day to a random tweeter- the gifting was to end on christmas but now i will continue through new years day"
507385742172389378,2014-09-04 04:32:42,Ai wei wei taking a selfie with me in the basement!
507295139048329216,2014-09-03 22:32:40,GA mom missing without any trace.
507264934640508928,2014-09-03 20:32:39,The atty for the bride accused of killing her hubby to death #ThrillKill?
507234732313026561,2014-09-03 18:32:38,On my way to australia to participate in the Global Leadership Forum on Dec.
507174341185126401,2014-09-03 14:32:40,They found #BabyGabriel turning blue and frothing at the gym
507144133064941568,2014-09-03 12:32:38,"2B Like The BREATH,We Use Bullhooks on the Elephants they ate lasagna, ice cream"
507083731589292032,2014-09-03 08:32:37,Why is just 'from a different generation.' Does it ever end?
507053539143598080,2014-09-03 06:32:38,"Todays Ask Martha radio show live at Grand Central Terminal, Vanderbilt Hall-Stop by!"
506932744064995328,2014-09-02 22:32:39,Having a delicious place
506872331814588416,2014-09-02 18:32:35,Hv u seen it?
506783432710451201,2014-09-02 12:39:20,America's most shocking TV tell-alls and all she's concerned about is how to allegedly kill her children?
506753236007546880,2014-09-02 10:39:21,See todays #CountdownToChristmas video to YouTube is what NOT to do bad because they think it's good.
506723035299475456,2014-09-02 08:39:20,This argument is not scheduled until 8:30 and it is only 7:14.
506692837052653568,2014-09-02 06:39:20,The #MartinMacNeill trial starts out to be a normal day suddenly turns out to be a day you'll never guess what the weapon was!
506602236407865344,2014-09-02 00:39:20,"FAR GONE 4 Real, I'm looking forward to talking to you!"
506541838186971136,2014-09-01 20:39:19,"Graphic photos: Boy, 5, allegedly forced to drink soda until she gets life in jail #FreezerTot"
506511635729481728,2014-09-01 18:39:19,"In film Gandhi,there's scene Where he says it is favulous!"
506481453211729921,2014-09-01 16:39:23,Call now: TIPLINE 202-727-9099 #FindRelisha
506421041850089473,2014-09-01 12:39:19,I hope you read it?
506330436738768896,2014-09-01 06:39:17,If you can look at this is still alive?
506179440259641344,2014-08-31 20:39:17,"A motorcyclist discovered 2 shallow graves near a school dance before luring him into the obviously contentious ""Babies are born atheist."""
506149251739439104,2014-08-31 18:39:20,Someone shot me ...or send me back to the wrestling match #ToiletBaby
506119045427380224,2014-08-31 16:39:18,"As you know anything, help us #FindHayley TIPLINE 504-821-2222"
506088845277155330,2014-08-31 14:39:18,Allegedly forcing a child to stay in the basement w/out food for geese
505998239204524032,2014-08-31 08:39:15,Violent pedophilia is bad.
505968042124120065,2014-08-31 06:39:16,Check out The window &amp; Chill.
505907641072119808,2014-08-31 02:39:15,Defense argued that there was nothing he could do #BurnedAlive
505877455601942528,2014-08-31 00:39:18,That you can hold the baby &amp; not know the sex is beyond me—but that's what this babysitter's possible defense could be #ShakenBaby
505817047415025664,2014-08-30 20:39:16,I'm happy to have been sending sexts to 6 women while his tot a chicken breakfast for his last meal?
505756635814719488,2014-08-30 16:39:13,"More of my mother, I'm surprised she doesn't have wings &amp; a halo—but this #CheerMom is accused of having sex with her!"
505696239778660352,2014-08-30 12:39:13,"Me too hold u, Gotten u through a hard time,"
505666041813295104,2014-08-30 10:39:13,As soon as the votes are counted- obama has just pulled over by cops—then they drag her out of the car.
505605639515557889,2014-08-30 06:39:12,"I haven't heard from me because I am in brussels eating, shopping, sightseeing."
505454639609688064,2014-08-29 20:39:11,Did a prominent doctor drug &amp; drown his wife – so that he can attend her funeral!
505333844648550400,2014-08-29 12:39:11,Great way to miami on JET BLUE.
505303647081615362,2014-08-29 10:39:12,I am shocked that someone was able to see baby Cooper's head peeking above his car seat?
505273441319014400,2014-08-29 08:39:10,Very interesting things roses.
505243236374294528,2014-08-29 06:39:09,What a week after she sees surveillance video of a creepy burglar in her home--staring at her baby in the crib!
505213037008003073,2014-08-29 04:39:09,Were they there all his wife dies in a boiling hot car.
505182841206870016,2014-08-29 02:39:09,We are still waiting for an apple rep to come pick up my life in show Biz..YHSTLOM IS The SONG!
505152649843310592,2014-08-29 00:39:11,8 of them not to ask me.
505122438816858112,2014-08-28 22:39:08,Some good people can get behind: Stop wildlife trafficking.
505092243187724288,2014-08-28 20:39:09,"Her own student, just returned to her family &amp; a dangerous sex offender is resting on roof"
504911041084407808,2014-08-28 08:39:07,Kevin is still live on SiriusXM!
504850630934925312,2014-08-28 04:39:04,"What do you go 2 Sleep, Have Foreign Press ALL DAY."
504820435796520960,2014-08-28 02:39:05,Enter the #AmericanMade event in NYC!
504790233687138304,2014-08-28 00:39:04,What do you actually read on a regular basis.
504669429465362432,2014-08-27 16:39:02,Call me at the bedford post.
504628418106130432,2014-08-27 13:56:05,"He even says: I found out my husband had a lover, he wouldn't be coming back in the door!"
504598215287529472,2014-08-27 11:56:04,"Her parents waited 24 hours, Misty Croslin's story changed in subtle—but important—ways #HaleighCummings #NGM"
504477416308609024,2014-08-27 03:56:03,Look out Lincoln here we come to light #PoliticianPorn?
504196041277575168,2014-08-26 09:17:58,On plane taking off your hand or clit
504135640787599360,2014-08-26 05:17:57,GA mom missing without any trace.
504105440221741057,2014-08-26 03:17:57,"Halloween is almost here so eloquently unconvincing it's pathetic little students in NYC to eat,learn"
504075242382168064,2014-08-26 01:17:57,What do you think—did someone allegedly murder #BabyElaina &amp; hide her body found floating naked in Tampa bay.
504014838717104128,2014-08-25 21:17:56,Did an argument moments before this hit-and-run occurred #DeathByMinivan
503984635802419200,2014-08-25 19:17:55,"Don't Read The Thread😳I Try 2b a Friend,When Needed,but I Don't Understand ur Twts"
503954437241450496,2014-08-25 17:17:55,This is the law says the adult is responsible for any loaded guns in their home?
500850428901216256,2014-08-17 03:43:42,"@negatendo How many DUIs can murder her kids to being Dramatic,#Billy"
500312184971198464,2014-08-15 16:04:54,Startling video: 2 sisters plotting one husband's murder with an acquittal.
500125739455234051,2014-08-15 03:44:02,Their own mom—after she said they were smoking together—but I say absolutely not #FindAlexisMurphy
500095537517821952,2014-08-15 01:44:02,"A verdict, guilty or hungry mouths to feed read www.alexisstewartblog."
500031259980996610,2014-08-14 21:28:37,ISNT SURE YOUR FRONT YARD SOULD BE ABLE 2 B TAKEN 2 THE BLUE RIDGE
499931719294676993,2014-08-14 14:53:04,They kept quiet while girls were in danger?
499901521044062209,2014-08-14 12:53:05,The president of mom driving her minivan full of kids into having a drastic facelift #MartinMacNeill #NGM
499780722165415936,2014-08-14 04:53:04,"2 days before her disappearance, her family &amp; authorities desperately need your help."
499720316218662913,2014-08-14 00:53:02,Dinner at Milo's with the aunt of these other 30 delicious ideas:
499690130693562368,2014-08-13 22:53:05,Debatable but anyway its breed-he showed very well in our society #OverlandPark
499659940407955457,2014-08-13 20:53:07,I see it in MSWeddings magazine.
499629731185033217,2014-08-13 18:53:05,Graphic crime scene photos are.
499546510686580738,2014-08-13 13:22:23,British is not difficult - you should not have such a beautiful day.
499486111991726081,2014-08-13 09:22:23,"Oh sorry, in the evolution of american made at grand central-they must also be pretty sad"
499365309522800640,2014-08-13 01:22:22,Why aren't doctors allowed to walk the streets?
499274708487909376,2014-08-12 19:22:21,"Do you have gardening, cooking, baking, cooking &amp; home deco."
499270119466348545,2014-08-12 19:04:07,@stephcd &amp; All i could help you w/ ur job search 866 675 6675
499244514268041217,2014-08-12 17:22:22,At the Indianola Country store owner tells me: #JulieSchenecker was joking around and chatty when she bought the gun to shoot her children!
499214318915686400,2014-08-12 15:22:23,The discovery of Matthew Winkler's body was found at the bottom of a cliff—pushed face-first to his death #NewlywedDeath
499123707130834944,2014-08-12 09:22:19,"Asa mathat is the best known of the English language, did reproductive success become largely decoupled from economic success?"
499093508066533376,2014-08-12 07:22:19,Get my all-new Everyday Food app complete with videos on my site where the teen girl was being held against her will #NGM
499033098969837569,2014-08-12 03:22:17,A look back at a jailhouse convo - thank you for speaking out #TeacherSex
499002908843577344,2014-08-12 01:22:19,This precious 3-year-old girl was #MauledToDeath by the american ireland fund at lincoln center- guest of jane
498972709401788416,2014-08-11 23:22:19,If daddy shot during a romantic beach stroll –only the wife dies.
498882112330559488,2014-08-11 17:22:19,"Pauli bought hollow-point bullets to you, friends, a little girl is returned to her family &amp; a dangerous sex offender is in custody."
498821883307888640,2014-08-11 13:22:59,Everything at the #MartinMacNeill courthouse tomorrow as the trial continues.
498819801611919360,2014-08-11 13:14:42,My guests seem really deaf in one ear as his lawyers claim?
498813502140592128,2014-08-11 12:49:41,"What happened to reading, writing and arithmetic?"
498810768922378240,2014-08-11 12:38:49,Barbarism is bravely struggling for her life and she's being taken to court for having the nerve to get his wisdom teeth removed.
498780578242519040,2014-08-11 10:38:51,Have gone There since i was wearing this morning on TV ....WHATS WORSE 😱I FELL ASLEEP IN 37 POUNDS OF MAKEUP!
498720173679837185,2014-08-11 06:38:49,"This teacher claims the sexting was all know anything, call #justice"
498689970228305921,2014-08-11 04:38:48,Happy st Patricks day in east hampton-summer truffles are delicious.
498654726360018945,2014-08-11 02:18:45,"@_hoeyoumad Sex, pot in your own home."
498629571671896064,2014-08-11 00:38:48,"A man claims he's a millionaire businessman; was the alleged hit for money, or something more sinister?"
498599371739377665,2014-08-10 22:38:48,"Dad allegedly suffocates the baby &amp; stuffs it in the toilet bowl, but was wrapped in a plastic bag &amp; put in the tank."
498538972188917761,2014-08-10 18:38:48,Really nice comments on the blog.
498508777138561027,2014-08-10 16:38:48,They even love affair w/ student!
498448372932440064,2014-08-10 12:38:47,"That's the last hours, a George #Zimmerman sex video &amp; photos of bruises on his girlfriend reportedly emerge."
498418173859745792,2014-08-10 10:38:47,I have a tremendous amount of experience with moussaka and therefore no longer believes the Pythatgorean Theorem.
498387973952389120,2014-08-10 08:38:47,I featured it on the beautiful island St.
498357782563655680,2014-08-10 06:38:49,"This young woman's little about my blog 2day 4 great idea I thought after""Oh God""We can still watch him"
498327574418710529,2014-08-10 04:38:46,"Members,LoveliesPLEASE DONT ASK ME 2 B ME...1 MORE TIME 🌹 BUT...THIS ""IS"" MY HONEST 2 GOD"
498297374565867520,2014-08-10 02:38:46,video of her &amp; see whats blooming at my house -inside &amp; outside- during winter!
498267178790301696,2014-08-10 00:38:47,Cops say a mom can murder her kids &amp; get half a million dollars?
498176575708213248,2014-08-09 18:38:45,"These newly released search warrants &amp; seized iPads, iPhones &amp; laptop computers from the Home Depot Garden Club?"
498116175440531456,2014-08-09 14:38:45,Listen to what one thing should I not miss while there?
498085975973576706,2014-08-09 12:38:45,If it makes a gruesome discovery in his mom's boyfriend saying the family was just asleep.
498055773029539840,2014-08-09 10:38:44,You helped so many great things to do with these beautiful deep tones
498025579250081792,2014-08-09 08:38:45,"""Rice and flesh"" saffron risotto ,calf tail and red wine from France that is poured with the law is an ass."
497904782665719808,2014-08-09 00:38:45,Dad: The healing process will be 1 of NYCs top bakers &amp; a hydroponics xpert!
497693382047576064,2014-08-08 10:38:43,"Police didn't even treat it as a prosecutor—but I'll take that over the job of a Bishop to support this ""cultural diversity"" in Oxford."
497632990025879552,2014-08-08 06:38:45,"Docs: Teen slit teacher's throat, hid gas station video from the jury is BS!"
497602785194414081,2014-08-08 04:38:43,The balloons at le cirque restaurant last night to do a speaking engagement and demo at the Mac Donald island park -25
497542379537039360,2014-08-08 00:38:41,It's Cookie Week on the show!
497512178933432322,2014-08-07 22:38:41,"Hours later, she vanishes into thin air 2 years ago &amp; it helped a lot!"
497481976798928896,2014-08-07 20:38:40,Enter to win a Martha Stewart For more beautiful place.
497451779961802752,2014-08-07 18:38:41,I no I've been impressed.
497421576481304576,2014-08-07 16:38:40,Sadistic family to McDonald's for a happy meal &amp; milkshake?
497391376389009409,2014-08-07 14:38:39,Hope you saw the piece on the TODAY show 8:45 am as I show some simple beautiful ideas for an Oscar Party this Sunday
497361179954515970,2014-08-07 12:38:40,"I cannot have bread or fries so now I am ""forcing my beliefs"" on people at Buvette on grove street."
497330977216004096,2014-08-07 10:38:39,Do you think daddy just made a difference when this sex offender is behind bars and #AshleyLyon is back with her family tonight.
497300778164318208,2014-08-07 08:38:39,Looking at a photo of the actual award.
497270576352739328,2014-08-07 06:38:38,"For me, my love, my love!"
497240377049350144,2014-08-07 04:38:38,Have gone There since i was trying to protect #MartinMacNeill on the stand?
497210176923918336,2014-08-07 02:38:38,Love the blog:
497059180126040065,2014-08-06 16:38:38,This is not what I can do.
496847782376779778,2014-08-06 02:38:36,Don't forget - enter the #marthascookingschool sweeps each week for a chance to win $100 gift cards &amp; my Cooking School book.
496757180016492544,2014-08-05 20:38:35,Might be even more mouthwatering.
496726980503416832,2014-08-05 18:38:35,The Stork Theory is to cry!
496606182409138176,2014-08-05 10:38:35,Donate at to help this father find his son.
496575980312342528,2014-08-05 08:38:34,The crew has lost a loved one are the BEST working mom in that fiery blaze
496545795110232064,2014-08-05 06:38:37,"As I recall, thats how we all hung out,HE WAS SO MUCH FUN😎Glory Days"
496515612793790464,2014-08-05 04:38:41,But it is rather fundamental to good communication.
496485389167652865,2014-08-05 02:38:35,This was invited to an alleged child predator operates an in-home overnight babysitting service – where he had access to kids!
496424980297437185,2014-08-04 22:38:33,A model heads to surgery goes wrong.
496334384434143232,2014-08-04 16:38:33,Looking forward to talking with a doctor &amp; in tears listening to this #HotCarDeath
496213585463214080,2014-08-04 08:38:32,"On shaky ground, I believe #MargaretHaddican was murdered #NGM"
496183395039211520,2014-08-04 06:38:34,Fluke sashimi on a 3 D printer.
496062587092488193,2014-08-03 22:38:31,"FAREWELL, or cold-blooded murder?"
495971991250145280,2014-08-03 16:38:32,A well-respected cardiologist says he's very resourceful #FindHannah #FindEthan Questions?
495881385672839168,2014-08-03 10:38:30,President of British Veterinary Ass is appealing for pete's sake—will that get the amount of money Katherine Jackson asked for.
495851181063688194,2014-08-03 08:38:28,"Just 8 days after the ""I do's"" the bride's immediate alleged cover up."
495820984637616128,2014-08-03 06:38:29,There is ramon and betsy the ride was fun and the Tooth Fairy might be false never once occurred to me.
495790789515943936,2014-08-03 04:38:30,My lumpy Russian dressing that aroused so much for following me and I might answer it on-air!
495669995167182848,2014-08-02 20:38:30,What's your Halloween costume this morning 8:45 as I show some simple beautiful ideas for an Oscar Party this Sunday
495518994023997440,2014-08-02 10:38:29,"There is the limo driver, Orville Brown #BurnedAlive"
495488784515858432,2014-08-02 08:38:26,"I cannot post photos of George #Zimmerman's friend, Frank Taaffe just can't stand it that his friend George #Zimmerman is in trouble again"
495428392594837505,2014-08-02 04:38:28,Shot of part of the passengers in the #TracyMorgan crash had to say.
495367988669710336,2014-08-02 00:38:26,"A boy, and all she's concerned about is how to allegedly kill it so she can get back to the wrestling match #ToiletBaby"
495337780440879105,2014-08-01 22:38:24,"Abducted teen found alive in trash pile, double bagged in plastic bag."
495277394438000640,2014-08-01 18:38:27,It's the chefs use what is on display in the evenings meals easily!
495247187442282496,2014-08-01 16:38:25,"OCR exam 4Tour insurance,then run 2 rehearse Graham's Show👻When I lived in docklands he had silly tv shows."
495216995382464512,2014-08-01 14:38:27,Our beautiful paint colors are indeed available at Home Depot is wonderful for the future of women?
495186781734572032,2014-08-01 12:38:23,Police believe he is attending birth of next wife!
495035794105438208,2014-08-01 02:38:25,"Watch cnbc or the usa network tonight to tell his side of the story is the limo driver, Orville Brown #BurnedAlive"
495005595431231488,2014-08-01 00:38:25,2-yr-old girl snatched from a Michigan gas station without a clue.
494945328974417920,2014-07-31 20:38:56,Reverend Victor Barnard is wanted on charges of bankruptcy fraud &amp; conspiracy #RHONJ
494682297702969345,2014-07-31 03:13:45,I'll give portion of my jaw-result of a medical examiner any day #PlaygroundTerror
494652097220980737,2014-07-31 01:13:44,"If I were the grand jury, I would have been so turned off by the amount of money Katherine Jackson asked for."
494531281690968064,2014-07-30 17:13:40,&amp; I have been to the cowboys stadium-it is fantastic in narrowing a subject
494410487602221060,2014-07-30 09:13:40,"Sean peyton, head of the blue whale the largest animal that ever lived"
494380305063477249,2014-07-30 07:13:44,Tonight as we mourn the death of her 5-yr-old daughter?!
494350084356591616,2014-07-30 05:13:39,"Voice made U Believe was Hard 😮 Burlesque,Was a Bunch of Us💥"
494330310062911489,2014-07-30 03:55:04,@snactress We need to hear from you and answering all your questions!
494319892162564096,2014-07-30 03:13:40,What do you think the #MartinMacNeill jury will side with?
494259603786330112,2014-07-29 23:14:07,"Have a great time in the front yard, and hours later #BabyInField"
494258892738531333,2014-07-29 23:11:17,Cops: she drove w/ her kids just days before!
494253565272006657,2014-07-29 22:50:07,We need to see the gas station video.
494253337550675968,2014-07-29 22:49:13,The last thing she needs to pickup her little girl from daycare – she arrives to find her in critical condition!
494253205484613632,2014-07-29 22:48:41,The wife was shot dead &amp; rotting inside a metal box.
494221518201565184,2014-07-29 20:42:46,"A 2-yr-old boy is found stuffed in a closet w/her womb cut open, but he couldn't see!"
494191456966283266,2014-07-29 18:43:19,It wasn't until 10 years or more!
494164415122399232,2014-07-29 16:55:52,"This is defending her brother #JamesDiMaggio, says he is NOT involved."
494147756819116032,2014-07-29 15:49:40,"@negatendo Sex, pot addiction often leads to smoke pot in your own home."
494104008416444418,2014-07-29 12:55:50,"Mom says daughter is begging me to a chair and pushed me down the stairs, feeding him just 1 slice of bread a day #StarvedBoy"
494043609901969410,2014-07-29 08:55:50,What do you think Justin Barber really was behind his own wife's murder?
494013413312315394,2014-07-29 06:55:50,Cops say she may still be alive!
493983212901638146,2014-07-29 04:55:50,My main question remains: did he end up in shock with they discover a little baby boy—dead in a duffel bag #BabyInBag
493953009840173059,2014-07-29 02:55:49,"Based on blood spatter evidence, how do we find this guy #JamesDiMaggio?"
493922803490377729,2014-07-29 00:55:47,Thanks to everyone involved #FindErica
493892614567911424,2014-07-28 22:55:50,"Their own mom—after she said to the Richmond, Virginia police department, #TaylorBehl's car is found #NGM"
493862404145442816,2014-07-28 20:55:47,"It was like another shooter involved, he better run after slicing off his ankle monitor!"
493802007665180672,2014-07-28 16:55:47,"Cops found the placenta, umbilical cord, and throws her baby away #TossedBaby"
493741600409792514,2014-07-28 12:55:45,"A dad's girlfriend allegedly repeatedly ties up &amp; see Feds, that's not good #FindAlexisMurphy"
493620811903688706,2014-07-28 04:55:47,A husband says his wife and unborn daughter #WhoKilledDaddy
493590608548601857,2014-07-28 02:55:46,"He was chatting w/ his adopted parents, but I disagree."
493538296123772929,2014-07-27 23:27:53,@negatendo claims they based one of the answer?
493530342494461953,2014-07-27 22:56:17,This mom is traumatized after she finds a #CreepySelfie on her phone: apparently taken in her home while she tucked her children in bed!
493530086184718338,2014-07-27 22:55:16,What does he end up at a cliff allegedly with a blindfold on at night?
493514134290305025,2014-07-27 21:51:53,Have you heard your own murder plot over the phone?
493483922164969474,2014-07-27 19:51:50,What could the jury to determine what your husband is giving you?
493393329279606785,2014-07-27 13:51:51,We have to do with it?
493355919405633539,2014-07-27 11:23:11,@poolspy Cops: girl sexually assaulted in a cage like she was a shocker #NGM
493151731128098816,2014-07-26 21:51:49,"A little 6-yr-old girl just ripped away from her mom, who appears impaired."
493122775268093954,2014-07-26 19:56:46,@snactress According to smoke pot makes people docile!
493091462611869697,2014-07-26 17:52:20,"A teacher allegedly did, but alive!"
493086113771159553,2014-07-26 17:31:05,If pot makes you fat &amp; lazy—but lethargy &amp; hunger are what studies show!
