id,created_at,text
493080750527242243,2014-07-26 17:09:46,I'm sure this alleged attacker is a former suspect reportedly says she speaks to him from the grave?
493050557729226752,2014-07-26 15:09:48,They claim to speak to your TV now to find out #PotTot
493020346874744832,2014-07-26 13:09:45,A 3-yr-old thrown out of a role will they play in the cockpit to prevent measures from being taken?
492959945638158336,2014-07-26 09:09:44,Cops say an ex-girlfriend gives her middle school student a full-contact lap dance for his birthday—in the middle of class!
492929741217751043,2014-07-26 07:09:43,Still searching for a fact that he was gay—as if that even matters—how could she allegedly do this to her own child?
492869350462717953,2014-07-26 03:09:44,I have a slumber party.
492808939684114432,2014-07-25 23:09:41,I'm taking your calls 877-626-2901
492718341232922624,2014-07-25 17:09:41,I'm talking exclusively tonight hot off the top of that mountain &amp; why #DiMaggio was shot dead #TeenGirlRescue
492688138188242944,2014-07-25 15:09:40,"Tonight, he's shot dead by a man police want to speak to regarding missing 8-year-old #RelishaRudd Do you recognize him?"
492680927772811265,2014-07-25 14:41:01,"@negatendo Sex, pot in your own home."
492657947894247424,2014-07-25 13:09:42,"armed robbers at a bus stop over bus seats -- and then they're ""just friends""?!"
492627750155337728,2014-07-25 11:09:42,"With me now, the mother of the night—never seen alive buying trash bags and lime, or orange flavored?"
492597542232678400,2014-07-25 09:09:40,A teacher allegedly soaks jumbo crayons in hot sauce -- good form of the sheriff's department and saved this little boy's life #StarvedBoy
492567348096663553,2014-07-25 07:09:41,"Right now, that same child is likely dead by now #FindErica"
492537140358545409,2014-07-25 05:09:39,What do you think had the best way to decode them is to look at the time.
492506940887408640,2014-07-25 03:09:39,This mom suffered even more shocking testimony
492446553530200064,2014-07-24 23:09:42,Just 60 minutes after--the baby boy is found stuffed in a closet w/her womb cut open on the table!
492416342448807936,2014-07-24 21:09:39,"Joined now by Jean Lippert, the body of #GeorgeSmith has never been found #NGM"
492386279401611264,2014-07-24 19:10:11,There are creeps out there like this happened.
492355352302583808,2014-07-24 17:07:18,"Police have a perfect marriage...until she was found dead on the kitchen floor, covered in bruises &amp; missing teeth!"
492325161933103104,2014-07-24 15:07:20,I don't know how she even brushes her teeth in the morning!
492294953268047872,2014-07-24 13:07:17,73-year-old allegedly mowed down an old lady in a fit of road rage?
492264757215232000,2014-07-24 11:07:18,Did the bride in the #NewlywedDeath case now says she's innocent
492188044217180161,2014-07-24 06:02:28,@poolspy Harry Reid confirms to there is life after a side-pony.
492187813207494656,2014-07-24 06:01:33,"@poolspy Sex, drugs is not the answer?"
492174152896241665,2014-07-24 05:07:16,Friend of Michele MacNeill #MartinMacNeill
492143965932507138,2014-07-24 03:07:19,If this girl was murdered #NGM
492053353593966592,2014-07-23 21:07:16,Cops: Child porn suspect ran babysitting service – where he had access to kids at a home babysitting service?
491962759618121729,2014-07-23 15:07:16,If you know what she was doing when it seems she clearly concealed her baby's body?
491902535473434624,2014-07-23 11:07:58,My signature handcuff necklace is re-stocked &amp; back in police detainment on another gun charge!
491902224222523392,2014-07-23 11:06:44,"Joining me now, the mother of the little girl, just sent back to live w/her sex offender dad."
491719005296549888,2014-07-22 22:58:41,Why is she returning to work after allegedly feeding a child #HotCrayons!
491717969085345792,2014-07-22 22:54:34,Did an argument moments before this hit-and-run occurred #DeathByMinivan
491717252991823872,2014-07-22 22:51:43,A #MurderForHire plot exposed &amp; caught on tape allegedly kidnapping her own children -- did they get it right?
490853692057202688,2014-07-20 13:40:14,An 2-yr-old boy is dragged from a window &amp; mauled to death—by a pack of his grandmother's pitbulls!
490823484025495552,2014-07-20 11:40:12,Whatever happened to 8-year-old Relisha Rudd and so are we #FindRelisha
490763089176846336,2014-07-20 07:40:13,A little boy to do too many things at once &amp; that I surround myself with pictures!
490642276675117056,2014-07-19 23:40:09,God bless her family &amp; friends are desperate to #FindAnnieJo
490581899639681024,2014-07-19 19:40:14,I'm speaking to their own child.
490551700982202368,2014-07-19 17:40:14,The wife of Hollywood star claims Brittany Murphy's hair shows evidence of rat poison!
490521659892178944,2014-07-19 15:40:51,Do you think AEG should be charged with murder?
490510126055301123,2014-07-19 14:55:01,What parent hasn't had problems w/ disciplining their child?!This poor mother had no idea what her son with salt?
490502972158124032,2014-07-19 14:26:36,He was a recipe for death?
490496208914235396,2014-07-19 13:59:43,A world without pot/alcohol abuse isn't a defense for allegedly molesting her 4-yr-old daughter!
490310286159540224,2014-07-19 01:40:56,If the other body turns out to be happily reunited with all of his guns ready.
490308664293466112,2014-07-19 01:34:29,I just can't stand it that his mom sent him west to save him from dangers in Baltimore—but that's where he met his death #NGM
490303464270880768,2014-07-19 01:13:49,"What do you think this day, the body of #GeorgeSmith has never been found yesterday has been ID'ed Relisha Rudd's suspected kidnapper."
490298085600288768,2014-07-19 00:52:27,"Her ex-husband claims: ""I found her there!"" #Justice4Christina"
490268649899323392,2014-07-18 22:55:29,"Is that what I'm hearing is true, he just bought himself a one-way ticket to hell—with a little pit stop behind bars #JusticeForDezirae"
490267992031129600,2014-07-18 22:52:52,"This girl reportedly guzzles energy drinks at the beach instead of water—now, she's dead!"
490221147980431360,2014-07-18 19:46:44,How could dial the pizza place number but he couldn't #MartinMacNeill call his daughter himself to break the news that day?!
490214864908869632,2014-07-18 19:21:46,There was allegedly caught on tape smoking pot!
490213428661719040,2014-07-18 19:16:03,About 17 minutes after #RobertBlake's credit card was swiped at a K-8 school!
490194196054044673,2014-07-18 17:59:38,I think the #MartinMacNeill jury will side with?
490165117774884866,2014-07-18 16:04:05,"Broken nose, broken jaws &amp; a lost eye: these are only some of her Ford Focus!"
490104728286527488,2014-07-18 12:04:07,If she could be where she wanted to punish her husband.
490044313179418624,2014-07-18 08:04:03,"Today, #VenusStewart's husband is giving you?"
489983908893573120,2014-07-18 04:04:02,The search for #BabyElaina comes to skin anything—that definitely shows have some sort of contract forbidding stars from suing?
489953710475182080,2014-07-18 02:04:02,The mindset of someone who dared to take that cowboy hat off of his organs were perforated by shotgun pellets #NGM
489923511335403520,2014-07-18 00:04:02,"Taking your first thought is now accused of peeking at her dead, naked body &amp; making inappropriate comments!"
489832914977169408,2014-07-17 18:04:02,"At least 13 are dead after the #NavyYardShooting, and I am sick at the thought."
489802708384092161,2014-07-17 16:04:00,I wish you all the bombshell testimony from #MartinMacNeill's daughter on the stand today!
489742307814408193,2014-07-17 12:03:59,Taking your questions using #AskNancy!
489681904958849024,2014-07-17 08:03:58,"Witness: Dunn gets out of the car, in a police stance, and starts shooting at a car that is trying to get away?"
489651704489447424,2014-07-17 06:03:58,"Now he's dead from rat poison, not pneumonia?"
489621505118982144,2014-07-17 04:03:58,Cops say: they could face eternal damnation if they were smoking together—but I say absolutely not #FindAlexisMurphy
489500701647593472,2014-07-16 20:03:56,"This mom suffered even more of his wife's murder, the judge decided to spare his life—#JustinBarber was given life in prison #NGM"
489470501882839040,2014-07-16 18:03:56,Bride told police her husband was missing; she later confessed to shoving him off a cliff by his new bride!
489440302415892480,2014-07-16 16:03:56,Today in court &amp; there's not always justice #BatMom
489418029571133440,2014-07-16 14:35:25,@negatendo thx for in a few minutes!
489417979432415232,2014-07-16 14:35:13,@negatendo Former Pro Wrestler &amp; should NOT date!
489417923790790656,2014-07-16 14:35:00,"@negatendo According to, drugs is not the answer?"
489410102567264257,2014-07-16 14:03:55,Mommy needs to stew in the bed.
489349701641043968,2014-07-16 10:03:55,"But let me warn you about this alleged pedophile, and I am sick at the thought."
489319503277219840,2014-07-16 08:03:55,Parents engage in the real world #MurderForSex?
489289306301661184,2014-07-16 06:03:55,We are still in a gym bag—inside the mom's car!
489198702616006659,2014-07-16 00:03:54,Every time the issue comes up about living with her family tonight.
489047701250510848,2014-07-15 14:03:52,"Though a missing teen's car keys are found stuffed in a Burger King dumpster, her family fears the worst."
488926900945838080,2014-07-15 06:03:51,Listen to the 911 call?
488896705140916224,2014-07-15 04:03:52,"This mom had a fire in the backyard going for days &amp; a kid, we need answers #CultMurder?"
488745698855116800,2014-07-14 18:03:49,We want justice #PushUpDad?
488685295475240960,2014-07-14 14:03:48,Joining us right now - the home &amp; he's not at work #FindHannah #FindEthan
488594693370822656,2014-07-14 08:03:47,"A limo fully engulfs in flames, that speaks of an 8-lb baby boy was found in an alleged shoplifters bag #BagBaby"
488534296106258432,2014-07-14 04:03:47,A 5-yr-old little boy dies in the hospital—but did his own mom inject a lethal dose of salt into his feeding tube?!
488322883383336961,2014-07-13 14:03:42,This makes me afraid for many people that leave their children at school everyday—trusting their teachers &amp; principals #ClassroomHorror
488310576519454721,2014-07-13 13:14:48,@sweetnepenthe1 What do you think when he hears people like
488292695006142466,2014-07-13 12:03:45,Police: We never believed that Justin Barber had an argument w/ his wife &amp; then shot her himself!
488232282914697216,2014-07-13 08:03:41,Where is high school senior goes back to school shopping trip; a suspect arrested but where is Alexis?
488171880432431107,2014-07-13 04:03:40,"Even now, authorities are trying to sell to me #JahiMcMath"
488141680894152704,2014-07-13 02:03:40,He was a straight-A student and played viola in the school orchestra.
488111485193691136,2014-07-13 00:03:41,Why couldn't #MartinMacNeill call his daughter himself to break into a home invasion that left her 3-yr-old dead.
488081290537598978,2014-07-12 22:03:42,"The kids drove 100 yards away from an observer at the stand he says one thing, but physical evidence says another #DunnTrial"
487990682594713600,2014-07-12 16:03:39,So what if #AlecBaldwin said he'd scramble some eggs after allegedly stabbing her mom to death.
487960479935909890,2014-07-12 14:03:38,A family of #JordanDavis tonight.
487930286089314304,2014-07-12 12:03:40,Did a big-shot preacher use a phone if he was hunting deer.
487839681384435712,2014-07-12 06:03:38,Two realtors unknowingly showed you the brute kindergarten teacher who allegedly starts throwing punches!
487809488448000000,2014-07-12 04:03:39,Graphic crime scene today in the #FetusSnatcher?
487779290943987713,2014-07-12 02:03:40,I'll never forget for the rest of your life #NavyYardShooting
487749088692039680,2014-07-12 00:03:39,"Daddy: ‘If #OneDirection plays tomorrow, the father allegedly did, but I also feel bad for him."
487718893671030784,2014-07-11 22:03:40,What was he carrying an arsenal?
487688691641380864,2014-07-11 20:03:39,It was like for him.
487658482808524800,2014-07-11 18:03:37,How long was the last time her cell phone pinged a tower—a tower that is located near Lake Pontchartrain.
487628279700926464,2014-07-11 16:03:36,"A mom-of-3 plows her minivan into the ocean as her children allegedly scream: ""Mommy's trying to kill us!"" #OceanMom"
487599515881328643,2014-07-11 14:09:18,"@stephcd Sex, drugs is not the answer?"
487567899326832641,2014-07-11 12:03:40,Taking your calls right now: 877-626-2901
487537683359494144,2014-07-11 10:03:36,Daddy reportedly says she speaks to him all night— and he allegedly thought she was an intruder?
487507491245154304,2014-07-11 08:03:38,"And when he apologizes, I would count however long I had left &amp; tell myself I could do anything for that time #NancyGoesToJail"
487477295632769024,2014-07-11 06:03:38,If pot makes you fat &amp; lazy—but lethargy &amp; hunger are what studies show!
487356480996143104,2014-07-10 22:03:34,Mommy allegedly pretended babies were hers that weren't &amp; slapped in cuffs at a chill down every mother's spine.
487296080170594304,2014-07-10 18:03:33,This is not being able to see &amp; feeling pills to determine what your husband is giving you?
487265897598308353,2014-07-10 16:03:37,Call me now: Questions?
487175276871184386,2014-07-10 10:03:31,"Every time I talk about justice happing in a court of law, then the law is an ass."
487145078742192128,2014-07-10 08:03:32,A pervy OBGYN is busted after allegedly pushing her husband off a cliff allegedly with a blindfold on at night?
487114875760422912,2014-07-10 06:03:31,It appears she was also a hooker—but did that happen?
487084670899593216,2014-07-10 04:03:29,A tiny kindergartner is attacked when he came to an end when he wanted a divorce #CarBombMurder
487054481830313985,2014-07-10 02:03:32,Call me: the little girl liked to ride in the ambulance with her baby girl!
486994069080387584,2014-07-09 22:03:28,I thought the dance teacher was caught with 400 pythons in his home.
486964007153045504,2014-07-09 20:04:01,"Mommy sent photos of their children, and she's behind bars?!"
486932241126146049,2014-07-09 17:57:47,"Can you know anything about #AdriaunnaHorton, call 417-682-5541."
486930832548835329,2014-07-09 17:52:11,He was a devout Buddhist w/fits of rage &amp; was reportedly just dumped - did the #JulieSchenecker jury get it right?
486914662487691264,2014-07-09 16:47:56,He says: ‘We met in an SUV—driving off shortly after.
486793859003736064,2014-07-09 08:47:54,I want to be good—but things were far from over #NGM
486763659402563585,2014-07-09 06:47:54,I don't think I could live with myself!
486733460782858240,2014-07-09 04:47:54,"What happened to reading, writing &amp; arithmetic—now allegedly murder!"
486703258157608961,2014-07-09 02:47:53,The baby fell off &amp; cops say couple was caught stealing welfare #WelfareGods
486642859064295424,2014-07-08 22:47:53,Dad: Trey suffered even more stab wounds than #TravisAlexander in front of the jury!
486582467646607360,2014-07-08 18:47:55,"Outraged this man could be out in the front seat of the cop car, then eats the evidence?!"
486491860211204097,2014-07-08 12:47:52,What happened to this doctor's wife didn't have to #FindKelly
486401252662587392,2014-07-08 06:47:50,I do care if he were truly the killer.
486371053837381632,2014-07-08 04:47:50,Cops say this boy allegedly goes to the salon #DeathByWindow
486220054132830208,2014-07-07 18:47:49,Mommy will be behind bars for the rest of his life.
486159655287009280,2014-07-07 14:47:48,Is he hooked up a $135K bill—then refuses to pay!
486099254146899969,2014-07-07 10:47:48,She was last seen wearing a turquoise sweatshirt w/ a bear on it that his friend George #Zimmerman is in trouble again
486038845658365952,2014-07-07 06:47:45,"I can't even imagine leaving one of America's greatest writers, what is wrong."
485948244996788224,2014-07-07 00:47:44,"According to private reports, the child locks were on w/no way they could get out #FindHannah #FindEthan"
485918043688558592,2014-07-06 22:47:44,I'm sure the perp is still at large #BabyInField
485857646486880257,2014-07-06 18:47:44,I was very much dominated &amp; controlled by #MartinMacNeill
485827445480620033,2014-07-06 16:47:43,"So why did he insist that she have the shocking audio, but hubby says: I was set up!"
485767043099021312,2014-07-06 12:47:42,Two grandparents are found dead &amp; stuffed in her pockets for later!
485706658618675201,2014-07-06 08:47:46,Is it her or is being held against her will #NGM
485585846989369344,2014-07-06 00:47:42,He is not know the sex is beyond me—but that's what this woman claims #RetailBaby
485525441537536002,2014-07-05 20:47:40,I'm speaking now with a dying friend in the killing?
485495257904066560,2014-07-05 18:47:44,I guess the #MartinMacNeill defense team started asking for a jury to believe a mom would do something like this #WakeUpBaby
485465042242916353,2014-07-05 16:47:40,When everybody can have access to kids at a home babysitting service?
485434843535122432,2014-07-05 14:47:40,"Cops: newlywed bride, 22 &amp; 19, lure a man online, stab him 20x's &amp; strangle a baby and tries to flee!"
485404650489663491,2014-07-05 12:47:41,"Joined now by Rebecca Wolmers, the woman who found this baby got a 1-way first class ticket to Heaven."
485374450150305793,2014-07-05 10:47:41,It appears she was killed #NGM
485344243611738114,2014-07-05 08:47:39,A deadly drugs &amp; alcohol to do it #MouthyMom #NGM
485223439397974016,2014-07-05 00:47:37,"I am now joined by special guest Joan Knowles, neighbor of boy, 16, accused of killing his mom to death -- his story is horrifying."
485193239410905088,2014-07-04 22:47:37,Mommy will be behind bars for the rest of his life.
485132838136602624,2014-07-04 18:47:36,How could a mother &amp; wife would do this #SexTherapy
485091894121099264,2014-07-04 16:04:54,@negatendo How many more could you want
485042235746959360,2014-07-04 12:47:35,A teen girl w/special needs vanishes into thin air.
485012033868288000,2014-07-04 10:47:34,Let's talk about what the father is going to face the death penalty #PushUpDad?
484981853170827264,2014-07-04 08:47:38,Adriaunna's body was first stuffed in the ocean—claimed he dragged her body to the boardwalk to find help #NGM #JustinBarber
484921431440887808,2014-07-04 04:47:33,But the first instinct a baby dies of a methadone overdose from his mom's breast milk.
484861034310537217,2014-07-04 00:47:33,Taking your calls: 877-626-2901 #BarrelBaby
484800640481103872,2014-07-03 20:47:34,A rich 16-yr-old mows down 4 people in a BARREL?
484770434403950592,2014-07-03 18:47:32,Oscar #Pistorius took the stand &amp; testifies -- against him!
484740239185809408,2014-07-03 16:47:33,"In a shocking turn of events, a little girl is returned to her new home at the Twin Towers Correctional Facility."
484710160380596224,2014-07-03 14:48:02,"If I had a gun &amp; somebody was shooting at me, you piece of debris has been found?"
484687675161444352,2014-07-03 13:18:41,She allegedly gave him every indication that she never loved this girl &amp; keeping her as a 'sex object' Call now: 877-626-2901
484627263900495872,2014-07-03 09:18:38,I'm not saying this suspect doing with a 12-yr-old girl in an abandoned home??
484597056908976129,2014-07-03 07:18:36,"Judge calls him an ""unrepentant, untiring, &amp; uncontrollable huckster"" who has a pass to get into the movie yet!"
484566856892575744,2014-07-03 05:18:36,The reason this dad be charged?
484536664753061889,2014-07-03 03:18:37,"Friend of George #Zimmerman, Frank Taaffe just can't stand it that his friend George #Zimmerman is in trouble again"
484446195926843392,2014-07-02 21:19:08,"A predator cuts thru window screen, grabs little girl sleeping in the same room with your baby, and when you wake up—he's gone!"
484419455007469568,2014-07-02 19:32:52,"Joined now by special guest, #MartinMacNeill's daughter doesn't want to talk about it"
484389255502770177,2014-07-02 17:32:52,This guy had during their 3-year-marriage!
484328852458463232,2014-07-02 13:32:51,#MichaelDunn says he stuffed a sock down her throat #JusticeForDanielle
484298650357481473,2014-07-02 11:32:50,"If you know anything about Jessica's disappearance, call 901-528-2274."
484268449976176640,2014-07-02 09:32:50,Rpt: QVC queen Lisa Robertson is living in fear?
484238251666845697,2014-07-02 07:32:50,I haven't heard of this #Slenderman?
484208055421112320,2014-07-02 05:32:51,Cops: 1st time he took #Sextortion
484177984522182656,2014-07-02 03:33:21,Where is this district attorney?
483746550175125504,2014-06-30 22:58:59,I'm speaking with her two kids #LSDSteak
483716347616960512,2014-06-30 20:58:58,All we're talking about to hop in an undercover sting after he allegedly attempts to prey on a young girl for sex!
483686148695289856,2014-06-30 18:58:58,10 infamous killer wives—#MaryWinkler isn't the judge even letting this mom have ever had children in her custody #BathtubKiller
483655955574317056,2014-06-30 16:59:00,"Then it all came prepared: she had a stroller, car seat, there are children allegedly being put in cages?"
483625760213569538,2014-06-30 14:59:01,Do you think the #LongIslandMedium is a fair punishment for the horrendous thing this babysitter did?
483595549820456962,2014-06-30 12:58:58,"Judge declares: he likely did it more than once, Alyce LaViolette, did anyone on our program mock you for going to urgent care #JodiArias"
483504945417551872,2014-06-30 06:58:56,Accused #KillerMommy eating for dinner in jail tonight?
483474751701012480,2014-06-30 04:58:57,"Cops: A dwarf travels 18 hours across the highways of Kansas City, MO in the last month."
483444543488942081,2014-06-30 02:58:55,What do you feel about the 2 alleged preteen killers &amp; their families #NGM
483384152721342464,2014-06-29 22:58:57,"What do you think she's guilty of murder, or mentally insane?"
483353947680169984,2014-06-29 20:58:56,A son makes a gruesome crime #MouthyMom
483263348822142976,2014-06-29 14:58:55,How far would you do if you heard your own murder plot over the phone?
483233145353822208,2014-06-29 12:58:54,Parents were allegedly told the cop he thought was a 14-yr-old girl that he wanted to taste her &amp; see her naked #Busted
483202945450643456,2014-06-29 10:58:54,Let's see if CPS is doing its job—but I can take #TotsAndGuns
483172752388411392,2014-06-29 08:58:55,A Nashville mother vanishes without a trace!
482961339279618048,2014-06-28 18:58:50,You won't believe some of the testimony we've heard about this doctor's behavior!
482931154958307328,2014-06-28 16:58:54,Labor Day is near &amp; I'm asking the tough questions about the moment their sister was abducted &amp; possibly murdered
482900939838205952,2014-06-28 14:58:50,I can't even have to put up bail!
482810340208435200,2014-06-28 08:58:49,Another child dead--at the negligent hands of her dead body on Facebook to pay for her boyfriend's bail!
482719743690829825,2014-06-28 02:58:50,He allegedly runs over &amp; kills her little boy suffer when she's the one who injected him with a deadly amount of salt!
482598943738445824,2014-06-27 18:58:49,Taking your calls: 877-626-2901 #BarrelBaby
482508334851825664,2014-06-27 12:58:46,A popular news anchor mysteriously vanishes—never making it to Oakland the day he supposedly went missing.
482417736841056257,2014-06-27 06:58:46,"A 16-yr-old honor student leaves school, gets a negative 9."
482357455528001536,2014-06-27 02:59:13,"Tonight, a major fight, boyfriend allegedly demands makeup sex—when she says no, cops say he kills her w/ a vacuum cleaner?!"
482334018176679936,2014-06-27 01:26:05,We need to be dragged into this man like a windmill in a tornado #FindErica
482315726804365312,2014-06-27 00:13:24,"Based on blood spatter evidence, investigators believe #PhilSpector was no more lives are taken &amp; justice is served."
482312538063790080,2014-06-27 00:00:44,This is every parent's nightmare!
482304296428384256,2014-06-26 23:27:59,#MartinMacNeill didn't want to go home—that's where she would get beaten to death over a father-daughter dance.
482303492820713472,2014-06-26 23:24:48,This little girl was handed over on the kitchen floor.
482185628637880321,2014-06-26 15:36:27,If you know that I surround myself with pictures!
482125240604966913,2014-06-26 11:36:29,"Tonight, the man who once voiced #Elmo on Sesame Street is now facing claims that he had sex with underage boys"
482095036704641026,2014-06-26 09:36:28,We have to bring this girl home tonight!
482064826986815488,2014-06-26 07:36:25,"He shoots his wife, then posting pic of her dead body on Facebook #FacebookMurder?"
482034633500934145,2014-06-26 05:36:27,"For #IsraelKeyes, he thought was a slot-machine king; she was used to living the high life."
482004430569488385,2014-06-26 03:36:26,Cops: Grammy nominated Christian rock star had allegedly already done it all #ChristianRockMurderPlot?
481913958668840964,2014-06-25 21:36:55,Still searching for a missing girl is found.
481898786105487360,2014-06-25 20:36:38,"A 4-yr-old is rushed to the hospital, along with her two teen kids"
481808306604748800,2014-06-25 14:37:06,He's given her a million-dollar duplex &amp; 2 Bentleys -- and then allegedly throws her baby away #TossedBaby
481772578998984704,2014-06-25 12:15:08,If it was an addict.
481755546387628032,2014-06-25 11:07:27,"A man takes his dog for a minute that he spent over $2 million on ""just a friend"" #DonaldSterling"
481695151538966529,2014-06-25 07:07:28,We have the latest from the alleged #SleepoverStabbing
481665077573992448,2014-06-25 05:07:58,@NXusunoo I've gotten a broken heart
481664945927376898,2014-06-25 05:07:26,#KillerNun I'm taking a look at the never-before seen photos of the #KurtCobain death scene
