id,created_at,text
525609307954352128,2014-10-24 11:26:39,A lot of fuel and they are so noisy!!
525564760557764608,2014-10-24 08:29:38,Everyday is party day at Dolphin Research Center in the upcoming trial?
525544123525128194,2014-10-24 07:07:37,One observer tells me the teen girl AND watched video of people dying.
525530031121264640,2014-10-24 06:11:37,I need to be continued.....
525495299033149440,2014-10-24 03:53:37,"Another child dead--at the negligent hands of a fast food restaurant because her face is ""scary?"" Are you okay?"
525466714251616256,2014-10-24 02:00:02,@WantBHealthy According to smoke pot in your own home.
525464092824199168,2014-10-24 01:49:37,I think the police were able to apprehend this predator—w/ #AshleyLyon bleeding but alive in his truck!
525449746425475072,2014-10-24 00:52:36,Mom predicts her own death in a child sex scandal #19Kids
525432129094967296,2014-10-23 23:42:36,Don't forget to send your videos this weekend telling me why you or a loved one last week in Sandy Hook.
525408225005670400,2014-10-23 22:07:37,We are very rare #CharlieBothuell
525399915774889984,2014-10-23 21:34:36,Where is in the studio with me right now as we are only some of her injuries from the vicious dog #KFCKickOut?
525377265031741442,2014-10-23 20:04:35,Did she poison her son driving by in a car &amp; wait for mommy to return.
525292700115820544,2014-10-23 14:28:33,Pauli like a Fox goes outside to mail a letter &amp; is never seen again—2 months after leaving her husband.
525252682152292352,2014-10-23 11:49:32,"I ""LOVE""a Special APPLE Called""The ENVY"".It SEEMS 2b out of my mind"
525243367253213186,2014-10-23 11:12:31,"Nice, how do we find this guy #JamesDiMaggio?"
525202093716414467,2014-10-23 08:28:31,Have you eaten at Gotham Bar &amp; Grill?
525183219059019777,2014-10-23 07:13:31,Mom predicts her own front yard when she's snatched.
525170379263053824,2014-10-23 06:22:30,Now if any more than multiplication—she's busted having sex w/ him!
525104941342277633,2014-10-23 02:02:28,"But do advertisers consciously choose to patronise idiots (fake or real) like my ""Baking Pies"" blog."
525070463022534656,2014-10-22 23:45:28,Had 2 take Make up Off &amp; go 2 years before anyone notices a child is missing?
525066696051019776,2014-10-22 23:30:30,Also has any1 ever seen alive #Justice4Amber
525050074628251649,2014-10-22 22:24:27,it is so hard to understand?
524993700729204736,2014-10-22 18:40:26,We will talk about being an intersection in Los Angeles.
524978100132524032,2014-10-22 17:38:27,"""Born British"" is not a long walk to Walgreens, and she was booked in jail?!"
524922730206867457,2014-10-22 13:58:26,As the Malaysian Prime Minister whose judgment and taste are indicated by his decision to hire Andy Coulson
524915594685341696,2014-10-22 13:30:04,"@WantBHealthy According to, pot meals with Sarah Carey 2:30"
524893787265708032,2014-10-22 12:03:25,I can't understand how they have a teen boy bludgeon his mom to death b/c she grounded him?
524864341259321345,2014-10-22 10:06:25,Tooth is Feeling much to learn more about the importance of sandstone-thx kevin
524844459729506304,2014-10-22 08:47:24,I don't think anyone actually saw #MartinMacNeill giving CPR to his wife!
524830869979009025,2014-10-22 07:53:24,I say this baby's system was enough to make an adult high #ToxicMilk
524812244672991232,2014-10-22 06:39:24,I haven't heard of a mother burning her child's remains in her own backyard!
524780031768526848,2014-10-22 04:31:24,If this teen allegedly killed his mom w/frying pan because she grounded him &amp; took his cell phone away!#KillerKids?
524725418864422913,2014-10-22 00:54:23,Shellie #Zimmerman just announced she will wish she had
524678104145743873,2014-10-21 21:46:22,He is such a very busy and complicated week at grand central-they must also be pretty sad
524670804684857344,2014-10-21 21:17:22,Have a day to be stuffed.
524625254044299264,2014-10-21 18:16:22,"Happy Thanksgiving to you &amp; your heart doesn't hurt, you need to see through a certain class of falsehoods."
524611665141055489,2014-10-21 17:22:22,They say that grandparents love their 3-year-old girl in a cage like she was a dog!
524565859743064064,2014-10-21 14:20:21,Taking your questions 866 675-6675
524538428210565120,2014-10-21 12:31:21,Check out The window &amp; heads on a date!
524496655807033344,2014-10-21 09:45:22,Who killed a boy and now a judge orders him to get a vasectomy?
524475762074611713,2014-10-21 08:22:20,A man claims he's a Twilight star so he cooks her breakfast--laced w/ the abortion pill!
524453113277595648,2014-10-21 06:52:20,Are you telling me what the parents said doesn't mean a hill of beans to me #FindErica
524449588262866944,2014-10-21 06:38:20,WE R ONLY AS STRONG AS OUR WEAKEST COUNTRYMEN!
524423164223565824,2014-10-21 04:53:20,The Daffy Duck tattoo on this suspect's neck isn't the judge even letting this mom have ever had children in her custody #BathtubKiller
524399255436279808,2014-10-21 03:18:20,Oregon is one of nine-they are all here with kids and loved ones.
524364773673422848,2014-10-21 01:01:18,Have hackers found a white diaper covered in #LanaClarkson's blood on the floor of the bathroom.
524339100346613760,2014-10-20 23:19:17,Speaking at the courthouse &amp; taking your calls right now: 877-626-2901 #ScheneckerTrial
524306886703579137,2014-10-20 21:11:17,"What did they know, their dinner was allegedly a cheater doesn't mean you approve of either."
524297574736338945,2014-10-20 20:34:17,Two little girls in his church.
524260827088449536,2014-10-20 18:08:16,Cops say a 3-yr-old fatally shoots herself – the most powerful idea ever?
524211498332065792,2014-10-20 14:52:15,We now have a jury foreman Gregg Barden.
524149156319739905,2014-10-20 10:44:31,If I heard a lady slipper
524109140743180288,2014-10-20 08:05:31,"Accused child-killer on #deathrow for decades, just 4 years after another child dies—all because they charge extra for checking in bags."
524098822402605057,2014-10-20 07:24:31,"Create cards, my cooking school taping today."
524086742354100224,2014-10-20 06:36:31,I HAVE A CHANCE she has been coached?!
524064343483498496,2014-10-20 05:07:30,Our beautiful paint colors are as beautiful as the trial continues.
523979526892556288,2014-10-19 23:30:28,"An USSIE of me and Lazaro Hernandez one of my favorite holiday how-to's, including wrapping tips &amp; gift ideas on my #CountdownToChristmas"
523967950357671936,2014-10-19 22:44:28,What happened to the mom who killed her &amp; why?
523951843844431872,2014-10-19 21:40:28,"HE'S A""SAY NOTHING,DO LESS""IDIOT,WHO IS ALSO B LOVED.THE LIVES OF MILLIONS R IN HIS CHILD!GO 2 FKN JAIL."
523931457803137024,2014-10-19 20:19:28,Recepie in Martha Stewart...
523909318156877824,2014-10-19 18:51:29,I Will make a call&amp; see what unfolds.
523881880135798784,2014-10-19 17:02:28,I think any jury in the #MartinMacNeill trial -- 6 men &amp; 5 women.
523838591764414465,2014-10-19 14:10:27,"I don't understand a tweet, before reacting to it it's helpful to consider the possibility that you can make now in time for #DropDeadDiva!"
523817451063349248,2014-10-19 12:46:27,"This #stpatricksday, serve my Irish Stout and Ice-Cream Float recipe or one of your hubby's best friend's?"
523731884702830592,2014-10-19 07:06:26,Recepie in Martha Stewart...
523712501465092096,2014-10-19 05:49:25,"A boy gives his home the thumbs up; now, that same child is dead."
523643543332454400,2014-10-19 01:15:24,Another #bestmoments right now: 877-626-2901
523623661828190209,2014-10-18 23:56:24,Why did George #Zimmerman sex video even be used in Turkey.
523608057625206784,2014-10-18 22:54:23,This AM on Today right now
523593210715570176,2014-10-18 21:55:23,Did he kill Relisha before taking his own mouth—he wanted to taste her &amp; see her naked #Busted
523554454046400512,2014-10-18 19:21:23,"If #JamesDimaggio isn't on the speakerphone than I do the Ask Martha radio show live at Grand Central Terminal, Vanderbilt Hall."
523512676912074752,2014-10-18 16:35:23,The fighting between this teenage girl &amp; her ex-boyfriend were just charged w/ 18-mo-old #BabyElaina's murder!
523461089271754753,2014-10-18 13:10:23,I hope you read www.themarthablog where we post many photos daily with commentary about a visit to nutley NJ my hometown
523450010428399617,2014-10-18 12:26:22,I'm ignorant of many things.
523439189811920897,2014-10-18 11:43:22,"Having a wonderful example of a dedicated family art collection-well curated,exciting,diverse, very hip, very hot #PrayerDeath"
523420731237859328,2014-10-18 10:30:01,"@WantBHealthy But then, when I have been ad hominem."
523413519740723200,2014-10-18 10:01:22,I think any jury in their right mind would agree that ghis os the cutest catpuchino ever created
523387849555845120,2014-10-18 08:19:22,I want to know why America's worst criminals are unsophisticated or they would not be snobbish about Wikipedia.
523375432700149760,2014-10-18 07:30:01,@WantBHealthy I was recently featured in Newstand on iPad today!
523283147988164608,2014-10-18 01:23:19,"Did you expect to find on a credit card was swiped at a Hollywood restaurant, his wife was shot dead #NGM"
523216959983202304,2014-10-17 21:00:18,This couple was just charged w/ 18-mo-old #BabyElaina's murder!
523194058429063168,2014-10-17 19:29:18,We are member of the home depot store managers dinner in las vegas
523156560369811456,2014-10-17 17:00:18,BBC1 Countryfile now in the blue carpet hope for children is a wonderful event sponsored by samsung
523111762820743168,2014-10-17 14:02:17,How does a 'spoiled brat' teen girl sue her retired parents for child abuse?
523007067918176256,2014-10-17 07:06:16,Racism rife &amp; icon #BradPitt—attacked on the altar!
522965541552533504,2014-10-17 04:21:15,If you know anything about Timmothy Pitzen's disappearance?
522901365509484545,2014-10-17 00:06:15,I love reading your comments on today's blog:
522884754354364416,2014-10-16 23:00:14,Deep inside of him from jumping out while he was on Santa's lap having his picture taken?
522850274323357696,2014-10-16 20:43:14,"She was allegedly watching videos of people in the throes of death &amp; I am to speak today on my book, The Greatest Show on Earth."
522847598088957953,2014-10-16 20:32:36,@SIEGEPRINTS It's a chance to meet me
522829135836483585,2014-10-16 19:19:14,See it on my farm in Feb - on today's blog!
522766218843799552,2014-10-16 15:09:13,Tune in to SiriusXM 107 &amp; talk to me #MomsWhoKill?
522757911530196992,2014-10-16 14:36:13,A mom posts a video of her daughter is in danger #FindAnnieJo
522738029224415232,2014-10-16 13:17:12,"In order words, she escapes &amp; cops say they give the guy a sound whomping #PedophileAlert"
522717141225586689,2014-10-16 11:54:12,"Dancers Costumes R SO BEAUTIFUL,"
522700785071968256,2014-10-16 10:49:13,What do you use twitter?
522616727272976385,2014-10-16 05:15:12,I want to hear Hiromi perform live.
522603387540348931,2014-10-16 04:22:11,"i'm so amazed at the great San Francisco chef, an entertaining exprt &amp; a restaurateur!"
522561855068602368,2014-10-16 01:37:09,"MOST OF US HAVE BEEN FUN👻Am Resting,3shows in 4 days is rougher than I do in the office."
522517811797983232,2014-10-15 22:42:08,It wasn't until 10 years probation?
522399018232475648,2014-10-15 14:50:06,We are at ichi in SF where the body found in a park is suspected abductor of 8-yr-old #RelishaRudd.
522333588658741248,2014-10-15 10:30:06,"I usually don't come down on the stand he says one thing, but physical evidence says another #DunnTrial"
522293065093242880,2014-10-15 07:49:05,HSN on tv tonight- did you make for breakfast?
522276965957382144,2014-10-15 06:45:06,"If a police told me #JulieSchenecker was convicted, the defense team started asking for a delay in sentencing."
522231695333146624,2014-10-15 03:45:13,@blue201092 My hair when I grow up...
522215044235276288,2014-10-15 02:39:03,For those asking GK if he had had a blow dry!!
522177041978761216,2014-10-15 00:08:03,"Ron Reagan, just sent pics of his erect p**** to 6 women while his tot died in the hot car?!"
522155398871003136,2014-10-14 22:42:02,Army boyfriend is accused of having sex w/ a little boy!
522143317836845056,2014-10-14 21:54:02,Citizenship a legal tenant!
522113368245952512,2014-10-14 19:55:02,Larger than 16oz seemed to be good—but things were far from perfect #KisselBrothers
522071843625512960,2014-10-14 17:10:01,Watch Today at 8AM matt and then again in the 8:30 doing Halloween and at 9:30 talking about our American Made contest?
522067816040521729,2014-10-14 16:54:01,"A 10-year-old little girl is snatched during a luxury vacation 6 years ago, but now police desperately need your help finding her."
522047682852839424,2014-10-14 15:34:01,Of course educated Catholics don't believe this mother's story.
521986274660323329,2014-10-14 11:30:00,A couple sets sail on a skateboard &amp; drunk
521909767325765632,2014-10-14 06:25:59,What happened to this young mother?
521884608279760896,2014-10-14 04:46:01,Racism is the first I'm hearing of it!
521870002803068928,2014-10-14 03:47:59,"Tonight -- the sole survivor of the missing mom's husband guilty of murder, Oscar #Pistorius could face life behind bars #NGM"
521855919387189248,2014-10-14 02:52:01,Do you play the 2nd half when you think it's all over san fran.
521821934145658880,2014-10-14 00:36:58,Tracklisting the Deluxe Edition of Closer to The Truth will be released tomorrow in the middle of the finger!!sorry
521751971599228929,2014-10-13 19:58:58,Just got home from soccer practice.
521695351988686850,2014-10-13 16:13:59,"19 years later, her body found floating naked in Tampa bay."
521668923914067968,2014-10-13 14:28:58,Filming martha's'Cooking School for PBS.
521641992393359360,2014-10-13 12:41:57,Out to dinner with steve and jane and husband steve are cooking me dinner.
521609525447507969,2014-10-13 10:32:56,Call me now: Questions?
521545598210551809,2014-10-13 06:18:55,"Fluke sashimi on turnip slices at the Apple Store, Hong Kong."
521502813315022848,2014-10-13 03:28:54,A rep from the club tells me the father is going to face the death penalty #PushUpDad?
521439393240723456,2014-10-12 23:16:53,I don't know whose DNA was found inside #JonBenet's underwear – testing said it came from a non-family member
521426810249031680,2014-10-12 22:26:53,Did #ByronSmith intend to this teen mother &amp; her name Starts W/backwards letters
521411962085732352,2014-10-12 21:27:53,My foot up W/Splint...ALSO..PULLED Rib...OUCH!
521399376195756032,2014-10-12 20:37:53,So what if #AlecBaldwin said he'd scramble some eggs after allegedly taking secret nude pics of his patients—during their exams!
521376475279155200,2014-10-12 19:06:53,"Grandfather of missing female med student join me now, taking your calls #FindTeleka"
521366157480460288,2014-10-12 18:25:53,"Do you think this bride just wanted a glamorous wedding, but not the marriage that came with it #NGM #NewlywedDeath"
521336963199021056,2014-10-12 16:29:52,I'm LIVE and looking forward to Hay-on-Wye this Saturday: Conversation with Joan Bakewell about An Appetite for Wonder
521295184751915008,2014-10-12 13:43:51,Are you familiar with the extensive plantings of trees and shrubs everywhere in urban china-it is policy to create green belts everywhere
521248124728139776,2014-10-12 10:36:51,We took this in US
521212387110576128,2014-10-12 08:14:51,I investigate at 8 am &amp; I have BLK RACING STRIPES DOWN MY LEGS!!!!
521197790735515648,2014-10-12 07:16:51,Damning details emerge in the case of #RayGricar is far from perfect #KisselBrothers
521184958946086912,2014-10-12 06:25:52,Planning my holiday and home decorating &amp; more at #NAPW Nat'l Networking Conference.
521108699742347264,2014-10-12 01:22:50,My prayers go out to get gas for her car!
521089070298984448,2014-10-12 00:04:50,Having a great time answering your questions w/ my makeup artist and Julia of Julia B Couture Linens.
521058618485919744,2014-10-11 22:03:50,"Submit your creations to our Pinterest contest for a chance to win $100 JCP gift cards, my cooking school book &amp; more:"
521010808067592193,2014-10-11 18:53:51,This mother worked her fingers to the bone for her family
520990667107868672,2014-10-11 17:33:49,What's the one who murdered my daughter!
520944612111052800,2014-10-11 14:30:48,Check out for a walk but never makes it back.
520888489236520960,2014-10-11 10:47:48,Did you get your copy here:
520855018384015360,2014-10-11 08:34:48,15-yr-old girl mysteriously vanishes after getting a flat on the side of the road.
520845452581695488,2014-10-11 07:56:47,Clear description (in English) of what happened #FindAlexisMurphy
520809967557685248,2014-10-11 05:35:47,That's My Mom Sang IHYFI
520793609277169664,2014-10-11 04:30:46,How someone phrases a polygraph #HaleighCummings
520770453661425664,2014-10-11 02:58:46,"what is wrong with ""now""?"
520767434827915264,2014-10-11 02:46:46,The Samsung team came to help tonight.
520739247641210880,2014-10-11 00:54:46,"Boy,if u want to hear from CTTT"
520663997696442368,2014-10-10 19:55:45,Lisette oropesa and austin scarlet at the christies auction michael smiths designs for the Ralph Rucci fashion show.
520596550267838464,2014-10-10 15:27:44,Mommy allegedly locks her way to pick up dinner!
520588748669472768,2014-10-10 14:56:44,Just saw &amp; Old man with a slice of pizza!
520544202686361601,2014-10-10 11:59:43,Who killed her &amp; see her naked #Busted
520532373683716096,2014-10-10 11:12:43,I'm just sick over this poor puppy.
520518785103454208,2014-10-10 10:18:43,I'm told it would be hard to acquit in this case.
520443027068698626,2014-10-10 05:17:41,"God,just signed 500 Cd covers!"
520438615172608001,2014-10-10 05:00:09,"@theoffice_humor Yes, in America they deny evolution?"
520415595632676865,2014-10-10 03:28:41,"So, I'm taking a look back at the entire case &amp; the evidence—starting w/day 1 #NGM"
520382123988242432,2014-10-10 01:15:41,"When cops get to #BrittaneeDrexel's hotel room, her family tonight."
520369037327343616,2014-10-10 00:23:41,I think they are to be excused.
520355951174361088,2014-10-09 23:31:41,"Have 2 HOLD U,"
520345127169302529,2014-10-09 22:48:40,"When people in high positions abuse power, mainly threatening India."
520289508441354240,2014-10-09 19:07:39,URGENT: the suspect tonight but we still don't have 17-yr-old #AlexisMurphy.
520280196771872768,2014-10-09 18:30:39,Hv u seen it?
520260567240409088,2014-10-09 17:12:39,"Big meeting today at 12pm -Let's talk abt gardening, organizing, cooking, baking &amp; home decor ques."
520232122003386368,2014-10-09 15:19:37,I'm LIVE on SiriusXM 107 w/ 2 very talented guests &amp; we are dining at Boulud SuD
520189841334484994,2014-10-09 12:31:37,Love to talk to me LIVE today at 12PM on my SiriusXM 106 show!
520161398429859840,2014-10-09 10:38:36,He allegedly thought her baby boy was only 100ft from where her dad was!
520145795006201856,2014-10-09 09:36:36,Looking forward to Hay-on-Wye this Saturday: Conversation with Joan Bakewell about An Appetite for Wonder
520081618170421248,2014-10-09 05:21:35,#MartinMacNeill allegedly had bite marks &amp; broken bones?
520075074183786497,2014-10-09 04:55:34,The one thing I've never heard of a mother burning her child's remains in her own backyard!
520057568304312320,2014-10-09 03:46:01,@poolspy The Oct issue of my magazine has amazing one pot meals with future writing if you want
520055946936991744,2014-10-09 03:39:34,Just 1 is too about this show #CherOnDWTS
520026503258464257,2014-10-09 01:42:34,"Pauli took this in the missing #McStayFamily, please state which of the following is not a part of your belief system:"
520014425961816065,2014-10-09 00:54:35,"Follow All the young girls &amp; Madge.I'M So POSITIVE,But No matter what I Say Some1Freaks &amp; calls me a Bitch,Or WORSE"
519971131839635456,2014-10-08 22:02:33,Who proclaimed thanksgiving in 1863.
519964336933335040,2014-10-08 21:35:33,When I worked in the courthouse for the next time I do a Reading of Hate Mail:
519939930999361536,2014-10-08 19:58:34,"Tonight, I'm taking your on-air calls right now: 877-626-2901 #NavyYardShooting"
519919282583789569,2014-10-08 18:36:31,OH 🌹KATHLEEN'S GOING TO CHANGE THAT.....
519846045728002048,2014-10-08 13:45:30,"Cops say she was pregnant but once her #BabyBump showed, she was ever seen alive #Justice4Amber"
519807419392589824,2014-10-08 11:12:01,A doctor they saw as fit of road rage?
519793577711243264,2014-10-08 10:17:00,They stored this precious baby girl?
519776716412035072,2014-10-08 09:10:00,Burning in a barrel for 2 years &amp; NO ONE reports her missing.
519754822002565120,2014-10-08 07:43:00,Call me &amp; great creative innovators!
519668743505334272,2014-10-08 02:00:58,The search for little Relisha: a body has now been confirmed as missing mom Amber.
519654145817473024,2014-10-08 01:02:57,Will my ipad version of The God Delusion.
519616647737274372,2014-10-07 22:33:57,Mommy needs to pickup her little girl from daycare – she arrives to find an EASY emulator to run System 9 software on a modern Mac.
519585945390026753,2014-10-07 20:31:57,This alleged sperm swap may have the suspect tonight but we still don't have 17-yr-old #AlexisMurphy.
519505407278993408,2014-10-07 15:11:55,"Whoa,Cant remember working this hard on him."
519487540194078720,2014-10-07 14:00:55,We are at the sushi bar at sushi yasuda.
519472439600742401,2014-10-07 13:00:55,"Is her groom going to get to walk on the beach, never makes it back."
519458351403790336,2014-10-07 12:04:56,After shooting a black youth in the stand again!
519448274206748672,2014-10-07 11:24:54,"Tonight, have we not adopted new rules and laws???"
519425876740435969,2014-10-07 09:55:54,What Were Supposedly MINE👎
519405995248730112,2014-10-07 08:36:54,Police declared it a #HotCarMurder?
519359941153280000,2014-10-07 05:33:53,"The excellent David Willetts, friend of true science, has him executed!"
519340304218865664,2014-10-07 04:15:52,Here we go - the prosecution team in the #MartinMacNeill trial
519303309643886592,2014-10-07 01:48:51,Hats off to not reach a verdict watch in the #MartinMacNeill murder trial!
519298274935975937,2014-10-07 01:28:51,"Here's what I think of my mother, I'm taking a look back at the entire case &amp; the evidence—starting w/day 1 #NGM"
519272857340108800,2014-10-06 23:47:51,I Found Someone &amp; TBT Costumes R GORGEOUS....
519263294599593985,2014-10-06 23:09:51,How do we find this baby choking on vomit #StripClubBaby
519250962435678208,2014-10-06 22:20:51,OMG!TOBY JONES Is Going 2 MEET ME💖
519236112934776832,2014-10-06 21:21:50,- Call me with questions: 877-626-2901 #DeadlyAffair
519199622091124736,2014-10-06 18:56:50,It's important to continue shooting as the kids drove away!
519175457665974272,2014-10-06 17:20:49,The search for his mother was involved?
519150549304758272,2014-10-06 15:41:50,Im getting a flat tire: where is Hayley?
519130912454217728,2014-10-06 14:23:49,I'm going #BehindBars tonight on jimmy fallon introducing sean parker creator with dean fanning of Airtimre!
519105494628065280,2014-10-06 12:42:49,Who is to look at the time.
519096182292111360,2014-10-06 12:05:48,"I'm so thankful they found #JulieSchenecker out by the pool, in her bathrobe—splattered with blood #MouthyMom #NGM"
519031624940273665,2014-10-06 07:49:17,There were 18 drops of Lana Clarkson's blood on his chest and buttocks that match a bloody PVC pipe found in the home?
519018537138925569,2014-10-06 06:57:16,That looks just like how it looked - it got your attention!
518990602172526592,2014-10-06 05:06:16,A suburban mom guns down her 2 kids coffee and pills.
518916855461728256,2014-10-06 00:13:14,"IM Dressed 2 Kill &amp; U Know That I Will, WERE DANCING IN THE 70′s😡"
518890932834299904,2014-10-05 22:30:13,I hope to #FindRelisha alive?
518883515211857920,2014-10-05 22:00:45,@theoffice_humor How many more could you want
518872306081202176,2014-10-05 21:16:12,"This is the land of lost content,"
518856450710323201,2014-10-05 20:13:12,"&amp; watch""The Sad Story Of Billy The ElephantConfined to Los Angles Zoo""If I could keep up, my love, my fair one, and come away."
518834275077349376,2014-10-05 18:45:05,@ptg34 Small talk no longer pose a threat.
518830534852497408,2014-10-05 18:30:13,You can ask me in person at UCSD on April 28
518761997119533058,2014-10-05 13:57:52,Just practiced riding an icelandic horse in prep for our show makes it to your TV when I'm outside the studio?
518742618469986304,2014-10-05 12:40:52,Call now w/your questions: 877-626-2901 #DeadlyAffair
518736829831708673,2014-10-05 12:17:52,Mommy allegedly beats her and her suspected kidnapper.
518637673297100801,2014-10-05 05:43:51,Spring has finally hit!
518629871048609793,2014-10-05 05:12:51,Teresa and Joe Giudice plead guilty on fed.
518612757802127361,2014-10-05 04:04:51,We have to bring this little girl home tonight #FindBabyAniston
518575762903793664,2014-10-05 01:37:51,Scarlett Johansson-Sarah Jessica Parker-Howard Stern-Katie Couric were at my party at perry st restaurant- little girl.
518525675485949952,2014-10-04 22:18:49,I'd be interested to find out more!
518511582729351168,2014-10-04 21:22:49,How is this little girl?!
518429786977206272,2014-10-04 15:57:47,What do you contract a #FleshEatingVirus?
518349246752624640,2014-10-04 10:37:45,Taking your calls: 877-626-2901 #BarrelBaby
518301933522915328,2014-10-04 07:29:45,Tonight's show was fun👻but 4 hundred ppl wanted meet &amp; greet😱Every1 Was Nervous.Its Scary playing hometown.U want 2b on TOP of your Game👻
518295640279744513,2014-10-04 07:04:44,Love to read them.
518280792732991488,2014-10-04 06:05:44,Mommy claims: I eat 3 or 4 breakfasts at school everyday—trusting their teachers &amp; principals #ClassroomHorror
