id,created_at,text
451165316492443648,2014-04-02 01:12:48,なんてこった!　いったいどっちから来て、どこを曲がったのか。もうぜんぜん分かんなくなってる。
451135142329737216,2014-04-01 23:12:54,わ、わかったわよ。やりゃあいいんでしょ、やりゃあ!
450984121439764482,2014-04-01 13:12:48,やだ!　やなもんはぜーったい、やだ!!
450962066925318144,2014-04-01 11:45:09,今日も野宿かぁ。お風呂に入りたいなあ。
450953934983536640,2014-04-01 11:12:51,そうね。でも、お弁当、もったいないし。昼食代も、もっともったいないし。
450923718009556992,2014-04-01 09:12:46,わたしだって、さっきからさんざん励ましてるんですけどねーっだ。
450901667144151040,2014-04-01 07:45:09,今日の晩御飯はモカ肉のショウガ焼きにしようかな……。
450893531784032256,2014-04-01 07:12:49,クレイがまたこいつ、寝ぼけるんだよなぁ。
450863334565228545,2014-04-01 05:12:50,あーあ、リタよ、おまえもか……。
450833153200885760,2014-04-01 03:12:54,まず、こっちを右のはずで……行き止まりになってるところにドアがあるはずで……。
450811069401817088,2014-04-01 01:45:09,今日のお昼はパステル風アラスカパンね。
450802936944144384,2014-04-01 01:12:50,いきなりトラップって冴えてるじゃない。まるで盗賊みたいだ。
450772747790999552,2014-03-31 23:12:52,これ以上頭悪くなったら困るでしょって。
450650012666441728,2014-03-31 15:05:10,実は私、結婚することになったの!　　　なーんてね。まだそんな相手いないよ。
450621734329122818,2014-03-31 13:12:48,あはは。そんな。お嬢さんなんていう柄じゃないよ。
450599681282682880,2014-03-31 11:45:10,今晩はちゃんとした宿だから、ノルも部屋で寝られるよ!
450591543078834176,2014-03-31 11:12:50,ううう、わたしってあんな声出さないと思うけど……。
450561344098406401,2014-03-31 09:12:50,でも、でも!　えーん、やっぱし「お願い」のこと、知ってたらなあ……!!
450539280327139328,2014-03-31 07:45:09,今日の晩御飯は根野菜とミケドリアのマトマベースシチューにしようかな……。
450531136079294464,2014-03-31 07:12:47,わたしは食事に関してはオーソドックスなのが一番だと思うんだけどな。
450500940609495040,2014-03-31 05:12:48,トラップ、またギャンブル?
450470744917417985,2014-03-31 03:12:49,あーあ、リタよ、おまえもか……。
450448685969592320,2014-03-31 01:45:10,今日のお昼はお好みサンドね。
450440537053470720,2014-03-31 01:12:47,そりゃ、わたしたちみたいなレベルじゃ、クラーケンなんて十年早いけどさぁ。
450410353046728704,2014-03-30 23:12:51,え?　地図?　ち、ちゃんと書いてるよ?
450259337127026689,2014-03-30 13:12:46,そうね。でも、お弁当、もったいないし。昼食代も、もっともったいないし。
450237290204246017,2014-03-30 11:45:09,ダンジョンの中で野宿って、いまだに慣れないなあ。
450229147600564225,2014-03-30 11:12:48,よけたのはてめぇだろうー?　トラップ。
450198944664936448,2014-03-30 09:12:47,トイレとかさ、あとお風呂とか、こういうのって女性の冒険者にとっては大問題なわけで。
450176888632123393,2014-03-30 07:45:08,今日の晩御飯はブラックサバスの塩焼きにしようかな……。
450168749279019008,2014-03-30 07:12:48,コイツもこわいけどトラップもこわい。
450138546309853184,2014-03-30 05:12:47,一食を笑う者は、一食に泣くことになるんだ。
450108371945795585,2014-03-30 03:12:53,ううう、そこは（あ、クレイ、冴えてるかも!）って思ったのに。そこから続かないところがやっぱりクレイらしい。
450086292085153792,2014-03-30 01:45:08,今日のお昼はカンピラのマヨネーズピリピリ和えね。
450078184680091648,2014-03-30 01:12:55,わたしたちって、ほんと移動ばっかしてると思わない?
450047987998154752,2014-03-29 23:12:56,わたしっていったい何の役に立ってるんだろ。マッパーとかいって方向音痴だしな。こんな普通の町中で迷っちゃうんだもの。
449896950628765696,2014-03-29 13:12:46,でも、でも!　えーん、やっぱし「お願い」のこと、知ってたらなあ……!!
449874898882535424,2014-03-29 11:45:08,今日も野宿かぁ。お風呂に入りたいなあ。
449866754265587712,2014-03-29 11:12:46,ちがう。無一文じゃなくて、マイナス。
449856362885808128,2014-03-29 10:31:29,@8836Aphdqrkrn そ、そうかな。ちょっと嬉しいかも。
449836561580830720,2014-03-29 09:12:48,ねぇ、トラップ。あなたも何か言ってよ。ほら、金銭交渉なら、任せとけっていつも言ってるじゃない!
449814504616902656,2014-03-29 07:45:09,今日の晩御飯は川魚のムニエルにしようかな……。
449806363309273088,2014-03-29 07:12:48,トイレとかさ、あとお風呂とか、こういうのって女性の冒険者にとっては大問題なわけで。
449776159643824128,2014-03-29 05:12:47,どうして、この人はいちいちカチンとくる言い方をするのかね。
449745955621851136,2014-03-29 03:12:46,う、ううう……これで頑張ってみないなんて、それじゃ冒険者やってきた意味がないってもんじゃないの。
449723913405071360,2014-03-29 01:45:11,今日のお昼はマトマカニのピリ辛サンドね。
449715764782567424,2014-03-29 01:12:48,うわぁー!!　ル、ルーミィ、シロちゃん!　あんたたち、クッキー全部食べちゃったのぉー??
449685576422154240,2014-03-28 23:12:50,トラップ……それ、もしかして……一番上に「ギ」って文字がついたりしない?
449534558740836353,2014-03-28 13:12:45,リタと話すと元気になるよね。
449512515374817280,2014-03-28 11:45:09,今晩はちゃんとした宿だから、ノルも部屋で寝られるよ!
449504376122376193,2014-03-28 11:12:49,手に手をとっておまえ百までわしゃ九十九まで……って、そりゃあ仲のいい両まぶたひっぺがして、機嫌だって少なからず悪いわよ。
449474171160915969,2014-03-28 09:12:47,あの、ジュン・ケイはいないかしらん。
449452116612878336,2014-03-28 07:45:09,今日の晩御飯は川魚のムニエルにしようかな……。
449443972327280641,2014-03-28 07:12:47,なんてこった!　いったいどっちから来て、どこを曲がったのか。もうぜんぜん分かんなくなってる。
449413775678902272,2014-03-28 05:12:48,あっはっはっは。わたしがそんなこと言ったら、はり倒すくらいですむかなあ。
449383583489077249,2014-03-28 03:12:50,んもう!　ルーミィ。わたしの真似するのやめなさいってば。
449361528207060992,2014-03-28 01:45:11,今日のお昼は手長エピとグリーンアスッパラのピラフね。
449353381526519808,2014-03-28 01:12:49,つくづくマリーナってチャーミングだよなぁ。
449323192532754432,2014-03-27 23:12:51,ジャイアントビーだ!　早く地面に伏せなきゃ!
449172181293887489,2014-03-27 13:12:47,あ、クレイ!　聞いて聞いて。トラップったらねえ、ワナだとも知らずに何回も宝箱を……。
449150132823416833,2014-03-27 11:45:11,今日はこの洞穴で寝るしかないね。モンスターとか来ませんように……。
449141992006508544,2014-03-27 11:12:50,クレイ!　その「パステルと駆け落ちなんか」っていうのはどういう意味?
449111827532640256,2014-03-27 09:12:58,んあぁー、ここにキットンがいてくれれば!!　いや、せめて彼のモンスターポケットミニ図鑑がここにあれば!!
449089724045467648,2014-03-27 07:45:08,今日の晩御飯はミケドリアの蒸し焼きにしようかな……。
449081595752747009,2014-03-27 07:12:50,ね、ねえ!　そんなことでケンカしないでよぉ。わたしが悪いんだから……。
449051386823446528,2014-03-27 05:12:48,クレイのバカカバオタンチン!
449021189378166784,2014-03-27 03:12:48,そんなの、改めて言われなくたってわかってらい!
448999136285569024,2014-03-27 01:45:10,今日のお昼はクレープね。
448990993086287872,2014-03-27 01:12:49,わたしは食事に関してはオーソドックスなのが一番だと思うんだけどな。
448960800930004993,2014-03-26 23:12:50,家計を預かる身とはいえ、まだ十七なんだぞ。なんかだんだん所帯じみてきてないか?
448811920967999488,2014-03-26 13:21:15,@orange_candy572 あの、一緒に食べよ?
448809809479884801,2014-03-26 13:12:51,うわぁー!!　ル、ルーミィ、シロちゃん!　あんたたち、クッキー全部食べちゃったのぉー??
448787736464355328,2014-03-26 11:45:09,ダンジョンの中で野宿って、いまだに慣れないなあ。
448779608867889152,2014-03-26 11:12:51,そうポカポカ叩くとねー、悪い頭がもっと悪くなるでしょ?
448751521606287360,2014-03-26 09:21:14,@mishiofukazawa そりゃあ私もほしいよ。
448749426278805504,2014-03-26 09:12:55,冒険者担ぎ出すにゃあみこしはいらぬ、助けて欲しいの一言でいい、ってね。
448727341343047680,2014-03-26 07:45:09,今日の晩御飯はドルチェのフライにしようかな……。
448719197036498944,2014-03-26 07:12:48,クレイ!　その「パステルと駆け落ちなんか」っていうのはどういう意味?
448689021141516288,2014-03-26 05:12:53,ったく、トラップったら、誰のせいでこうなったと思ってるのよ。
448658815022428161,2014-03-26 03:12:51,記憶がなくなるって、どういう事だと思う?
448636744175345664,2014-03-26 01:45:09,今日のお昼はマトマカニのピリ辛サンドね。
448628608232214528,2014-03-26 01:12:49,ルーミィにおやつあげなきゃ。
448598410757537792,2014-03-25 23:12:50,う、ううう……これで頑張ってみないなんて、それじゃ冒険者やってきた意味がないってもんじゃないの。
448447401632612352,2014-03-25 13:12:46,トイレとかさ、あとお風呂とか、こういうのって女性の冒険者にとっては大問題なわけで。
448425347663400961,2014-03-25 11:45:08,今晩はちゃんとした宿だから、ノルも部屋で寝られるよ!
448417209807675392,2014-03-25 11:12:48,あ、クレイ!　聞いて聞いて。トラップったらねえ、ワナだとも知らずに何回も宝箱を……。
448387003847962624,2014-03-25 09:12:47,やっぱりノルって、すごいなぁ。わたしには絶対に真似できない。
448364948331057152,2014-03-25 07:45:08,今日の晩御飯はタホタ貝のバター焼きにしようかな……。
448356796978061312,2014-03-25 07:12:45,クレイって、神経質なところがあるかと思ったら、ここぞという時にいきなりのんきになっちゃうんだもんなあ。
448326614409936896,2014-03-25 05:12:49,ふんだ!　もう知らんもんね。
448296419548340224,2014-03-25 03:12:50,ちがう。無一文じゃなくて、マイナス。
448274357677064192,2014-03-25 01:45:10,今日のお昼は焼きハマリタね。
448266215429914624,2014-03-25 01:12:48,あーら、トラップ。そう言いますけどね。わたしたちって今、すっごい借金抱えてるのよ。
448236033142841344,2014-03-24 23:12:52,ジャイアントビーだ!　早く地面に伏せなきゃ!
448085013855096832,2014-03-24 13:12:46,偉そうに毒づいてたのは、どこのどなたさまでしたっけねぇ。
448062960376614912,2014-03-24 11:45:09,今日はいつものみすず旅館。安いから助かるわ。
448054812685266944,2014-03-24 11:12:46,ったく、トラップったら、誰のせいでこうなったと思ってるのよ。
448024620029845505,2014-03-24 09:12:47,毛糸のパンツはいてて、よかったぁ。
448002562059280384,2014-03-24 07:45:08,今日の晩御飯はミケドリアの木の実詰めにしようかな……。
447994418461560832,2014-03-24 07:12:47,わたしは時々無性にクレイのことが不憫でしかたなくなるんだ。
447964213923676161,2014-03-24 05:12:46,えーんもう、そんなこったろうと思ったんだ。
447934026473431040,2014-03-24 03:12:48,クレイって、鈍感だなーと思うこと、よくあるけど。なぜかいつもわたしのこと口に出さなくってもわかってくれてるんだ。
447911963369013248,2014-03-24 01:45:08,今日のお昼は食パンケーキね。
447903811336536064,2014-03-24 01:12:44,なんてこった!　いったいどっちから来て、どこを曲がったのか。もうぜんぜん分かんなくなってる。
447873628881711104,2014-03-23 23:12:48,シロちゃんって、ひなたぼっこのいい匂いがするよね。
447722618993377280,2014-03-23 13:12:45,あーあ、リタよ、おまえもか……。
447700569755381760,2014-03-23 11:45:08,今晩はちゃんとした宿だから、ノルも部屋で寝られるよ!
447692449331175424,2014-03-23 11:12:52,でも、ほんとのとこ、トラップがわたしたちのことを結構真剣に気にしてくれてるの、わかってるからね。
447662221812707329,2014-03-23 09:12:45,あの、ジュン・ケイはいないかしらん。
447640176571863040,2014-03-23 07:45:09,今日の晩御飯はミケドリアの蒸し焼きにしようかな……。
447632034765086720,2014-03-23 07:12:48,えぇーい、もっとビシッと言ったらんかい!
447601826301349888,2014-03-23 05:12:46,あ、でもギアは「サイコロ……なんとかウォーマンモス」って、すぐに言ったじゃない?
447571648586076160,2014-03-23 03:12:51,記憶がなくなるって、どういう事だと思う?
447549578472996864,2014-03-23 01:45:09,今日のお昼はグフグフのナッツソテーね。
447541430488035328,2014-03-23 01:12:46,怖いよぉ。何が怖いって、キットンの顔が。
447511268648165376,2014-03-22 23:12:55,あーら、トラップ。そう言いますけどね。わたしたちって今、すっごい借金抱えてるのよ。
447360262647971840,2014-03-22 13:12:52,ううう、わたしってあんな声出さないと思うけど……。
447338193340203009,2014-03-22 11:45:11,今晩はちゃんとした宿だから、ノルも部屋で寝られるよ!
447330050971406336,2014-03-22 11:12:49,きゃあ、ゴースト!?　キットン、ホーリースプレー持ってないの?
447299850770456576,2014-03-22 09:12:49,クレイって、鈍感だなーと思うこと、よくあるけど。なぜかいつもわたしのこと口に出さなくってもわかってくれてるんだ。
447277786269380608,2014-03-22 07:45:08,今日の晩御飯はミケドリアとクスパラの串焼きにしようかな……。
447239440339980289,2014-03-22 05:12:46,こうなりゃ意地でも、とことんやるだけやったろうじゃん!
447209249546850304,2014-03-22 03:12:48,お・ね・が・い・だ・か・ら、わたしが書きものしてるときは邪魔しないでくれる?
447187192285102080,2014-03-22 01:45:09,今日のお昼は巻貝の酒蒸しね。
447179040487530497,2014-03-22 01:12:46,ノルってすごいもん持ってんのねー!
447148866756829184,2014-03-21 23:12:52,ふんだ!　もう知らんもんね。
446997847276138496,2014-03-21 13:12:46,クレイ!　その「パステルと駆け落ちなんか」っていうのはどういう意味?
446982353143857152,2014-03-21 12:11:12,@mayumayunet3 ギアって大人だよね。あんまりギアの話するとなぜかトラップが機嫌悪いんだけど……。
446977331265957890,2014-03-21 11:51:14,@mishiofukazawa ごめん、ちょっと分からないよ……。
446975799237672960,2014-03-21 11:45:09,ダンジョンの中で野宿って、いまだに慣れないなあ。
446967664108240897,2014-03-21 11:12:50,ジャイアントビーだ!　早く地面に伏せなきゃ!
446937442923192320,2014-03-21 09:12:44,あ、ヌルヌラが追っかけてくる!　トラップ、早く宝石とか返してきなさいよ!
446915401545297920,2014-03-21 07:45:09,今日の晩御飯はチャーベの串焼きにしようかな……。
446907254017507328,2014-03-21 07:12:47,財務担当としてはですねぇ、キットンとトラップのコンビになんか、こともあろうにパーティの全財産をほいほい預けたりは断固できない!
446877057708871680,2014-03-21 05:12:47,でも、でも!　えーん、やっぱし「お願い」のこと、知ってたらなあ……!!
446846862369095680,2014-03-21 03:12:48,冒険者担ぎ出すにゃあみこしはいらぬ、助けて欲しいの一言でいい、ってね。
446824806801870848,2014-03-21 01:45:10,今日のお昼は海産物のカナッペね。
446816658884030464,2014-03-21 01:12:47,じゃ、やっぱりこのままにしておくわけにはいかないよ!　でしょ?　トラップ!　寝てんじゃないの。聞いてよ!
446786471987396609,2014-03-20 23:12:50,わざわざよりによって、んな気持ち悪いもんに会いに行くことはないじゃない!
446635458647191552,2014-03-20 13:12:46,まず、こっちを右のはずで……行き止まりになってるところにドアがあるはずで……。
446613414782046208,2014-03-20 11:45:10,今日はいつものみすず旅館。安いから助かるわ。
446605270307700736,2014-03-20 11:12:48,これがあれば当分……いや、一生遊んで暮らせる。もうお財布の心配しなくていい……。はっっ、私は何を!?
446575056030674944,2014-03-20 09:12:44,ね、ねえ!　そんなことでケンカしないでよぉ。わたしが悪いんだから……。
446553019362983936,2014-03-20 07:45:11,今日の晩御飯はタホタ貝のバター焼きにしようかな……。
446544867775115265,2014-03-20 07:12:47,一応タイツを履いてたのが唯一の救いかな。あれで生足だったりした日にゃ……。
446514679754399744,2014-03-20 05:12:50,クレイのバカカバオタンチン!
446462424766742529,2014-03-20 01:45:11,今日のお昼はホットドッグね。
446454289138212864,2014-03-20 01:12:51,ぬ、ぬわにが「うっかりさん」よお!!
446424095266050048,2014-03-19 23:12:53,ううう、そこは（あ、クレイ、冴えてるかも!）って思ったのに。そこから続かないところがやっぱりクレイらしい。
446273070760595456,2014-03-19 13:12:46,クレイもトラップもノルもキットンも、みんないい奴なんだけどそれぞれいろんなとこ、抜けてたりするでしょ。だいたい、全員お人好し過ぎるし金銭感覚全くないし。
446251022537613312,2014-03-19 11:45:09,今日は宿に泊まれるよ!　でもノルは馬小屋なの。ごめんね。
446242893552812032,2014-03-19 11:12:51,あれってサラスだよね?　弱点は……え?　鳥の羽根!?
446212671432429568,2014-03-19 09:12:45,誰かに頼りにされてるって、いいもんだね。
446190625801510912,2014-03-19 07:45:09,今日の晩御飯はログロフのマトマ煮にしようかな……。
446182482950381570,2014-03-19 07:12:48,あ、でもギアは「サイコロ……なんとかウォーマンモス」って、すぐに言ったじゃない?
446152285668651008,2014-03-19 05:12:48,そういう言い方ってないと思うわ!　ごじゅうし。
446122072582782977,2014-03-19 03:12:45,時にはちょっと無理するぐらいじゃないと人間、進歩しないんじゃない?
446100029791408128,2014-03-19 01:45:09,今日のお昼はクレープね。
446091881290534913,2014-03-19 01:12:47,こ、こ、こんな奴!　心配しただけ損した。
446061702463766528,2014-03-18 23:12:51,ぬ、ぬわにが「うっかりさん」よお!!
445910709394608130,2014-03-18 13:12:52,ついに底をつきやぶってたんだわ!
445888635670257665,2014-03-18 11:45:09,今日はこの洞穴で寝るしかないね。モンスターとか来ませんように……。
445880499374804992,2014-03-18 11:12:49,わたしだって、さっきからさんざん励ましてるんですけどねーっだ。
445850286821625856,2014-03-18 09:12:46,あーら、トラップ。そう言いますけどね。わたしたちって今、すっごい借金抱えてるのよ。
445828243862478848,2014-03-18 07:45:11,今日の晩御飯はミミウサギの串焼きにしようかな……。
445820083206488065,2014-03-18 07:12:45,出るとこ引っ込んで引っ込むこと出てって……。失礼ね!
445789899082321921,2014-03-18 05:12:48,ちょ、ちょっと休まない?
445759694821269505,2014-03-18 03:12:47,そんなの、改めて言われなくたってわかってらい!
445737641225355266,2014-03-18 01:45:09,今日のお昼は蟹とハイサクのとろみ和えね。
445729499359891456,2014-03-18 01:12:48,ねぇ、お願い。背中の上のとこ、かいてくれない!?
445699341928243201,2014-03-17 23:12:58,なんてこった!　いったいどっちから来て、どこを曲がったのか。もうぜんぜん分かんなくなってる。
445548282777829376,2014-03-17 13:12:43,ジャイアントビーだ!　早く地面に伏せなきゃ!
445526241559339008,2014-03-17 11:45:08,ダンジョンの中で野宿って、いまだに慣れないなあ。
445487881180561409,2014-03-17 09:12:42,ノルってすごいもん持ってんのねー!
445465846710681600,2014-03-17 07:45:08,今日の晩御飯はモカ肉のショウガ焼きにしようかな……。
445457689028489216,2014-03-17 07:12:43,のん気というか、おおらかというか、マヌ……まあ、いっか。それがクレイだもんな。
445427506615566336,2014-03-17 05:12:47,クレイがまたこいつ、寝ぼけるんだよなぁ。
445397303537324032,2014-03-17 03:12:46,ね、ねえ!　そんなことでケンカしないでよぉ。わたしが悪いんだから……。
445375252025974784,2014-03-17 01:45:09,今日のお昼はコーボーとレンホーソーのサラダね。
445367090216595456,2014-03-17 01:12:43,どっちかといったら、メナースには悪いけどウギルギさまの方がありがたみあるわけで。
445336914011226112,2014-03-16 23:12:48,わたしたちみたいな貧乏パーティ、誰かが財務担当してなきゃ、すぐ行き倒れになっちゃうのよ。
445185894501199872,2014-03-16 13:12:43,ルーミィ、シロちゃんがほら、苦しがってるよ。
445163859922255872,2014-03-16 11:45:09,今日も野宿かぁ。お風呂に入りたいなあ。
445155706572783617,2014-03-16 11:12:45,わたしも行くわ!　ルーミィをおぶってでもついていくかんね。
445125495835729921,2014-03-16 09:12:42,きゃあ、スネークフライ。ルーミィ、ファイアーの呪文覚えてる?
445103456827629569,2014-03-16 07:45:08,今日の晩御飯はタホタ貝のバター焼きにしようかな……。
445095303440396290,2014-03-16 07:12:44,リタと話すと元気になるよね。
445065117856563201,2014-03-16 05:12:47,うわっ、モウンだ。耳も口もふさいどかなきゃ!
445034915197767680,2014-03-16 03:12:46,あら、失礼な。ちゃんと外して射るわよぉ。
445012861996109824,2014-03-16 01:45:08,今日のお昼は巻貝の酒蒸しね。
445004707027623936,2014-03-16 01:12:44,今月も赤字かぁ。
444974517589262336,2014-03-15 23:12:46,ナイフが右、フォークが左……。
444823515716284416,2014-03-15 13:12:45,ううん、あったかくて柔らかいベッド以上の宝物ってある!?
444801475437293568,2014-03-15 11:45:10,今晩はちゃんとした宿だから、ノルも部屋で寝られるよ!
444793324331757568,2014-03-15 11:12:47,このままほっといて自分たちだけ先に進むっていうの?　わたしはできないわ。だって、あんなに助けてもらっておきながら……。
444763117235351552,2014-03-15 09:12:45,きゃあ、スネークフライ。ルーミィ、ファイアーの呪文覚えてる?
444741073772892161,2014-03-15 07:45:09,今日の晩御飯はログロフのマトマ煮にしようかな……。
444732941352968192,2014-03-15 07:12:50,ルーミィにおやつあげなきゃ。
444702728405544960,2014-03-15 05:12:47,ほーんと、口は災いの元!って、この人の手の甲にでっかく書いておきたい。
444672525151117312,2014-03-15 03:12:46,うちって本当に何もないよ。小さい町だし。エベリンとかとはぜんぜん違う、ただの田舎町だもん。
444650476538052608,2014-03-15 01:45:09,今日のお昼は食パンケーキね。
444642331346472960,2014-03-15 01:12:47,だってだって、宝の地図なんだよ?
444612134844891136,2014-03-14 23:12:48,あっはっはっは。わたしがそんなこと言ったら、はり倒すくらいですむかなあ。
444474316386611200,2014-03-14 14:05:09,ホワイトデーのお返し、みんなからもらっちゃった!
444461120590344193,2014-03-14 13:12:43,う、ストーンゴーレム。逃げるしかないよね。
444439082345562112,2014-03-14 11:45:09,ダンジョンの中で野宿って、いまだに慣れないなあ。
444430927662309376,2014-03-14 11:12:44,あら、失礼な。ちゃんと外して射るわよぉ。
