id,created_at,text
471618188669497345,2014-05-28 11:45:13,今日は宿に泊まれるよ!　でもノルは馬小屋なの。ごめんね。
471610013895520256,2014-05-28 11:12:44,ゾンビが顔を輝かせると、かえって怖いって知ってた?
471579819365257216,2014-05-28 09:12:45,あ、マイマイスライム。さすがに楽勝……だよね?
471557777182035968,2014-05-28 07:45:09,今日の晩御飯はミケドリアの唐揚げにしようかな……。
471549607944540161,2014-05-28 07:12:42,最近、わたしも時々、自分っていったいなんだろう?　なんて思うことがある。たぶん、存在証明みたいな……そんなこと。
471519403951927296,2014-05-28 05:12:40,毛糸のパンツはいてて、よかったぁ。
471489213473361921,2014-05-28 03:12:43,あ、ヌルヌラが追っかけてくる!　トラップ、早く宝石とか返してきなさいよ!
471467176080076801,2014-05-28 01:45:08,今日のお昼は冷やしヌグね。
471459011745677312,2014-05-28 01:12:42,それにしても、欲のない奴!
471428823213285376,2014-05-27 23:12:44,ねぇ、トラップ。あなたも何か言ってよ。ほら、金銭交渉なら、任せとけっていつも言ってるじゃない!
471277813966704640,2014-05-27 13:12:41,ここは冷静にマッピング……。なんてしてらんないよ、やっぱりぃぃ。
471255780990013440,2014-05-27 11:45:08,今日は安宿だけど、屋根があるだけましだよね。
471247625031667712,2014-05-27 11:12:43,シビレクラゲだ!　こいつに刺されると痛いんだよね。
471217417473912832,2014-05-27 09:12:41,まさかレッドブーツ!?　大声出さないと姿が見えないよ!
471195390822211584,2014-05-27 07:45:10,今日の晩御飯はミミウサギの串焼きにしようかな……。
471187228027133954,2014-05-27 07:12:44,ん……?　何か秘密の話?　ちょっとやめてよね、この忙しい時に告白とかするの。
471157020918157312,2014-05-27 05:12:42,クレイって、鈍感だなーと思うこと、よくあるけど。なぜかいつもわたしのこと口に出さなくってもわかってくれてるんだ。
471126827256119297,2014-05-27 03:12:43,ううう、そこは（あ、クレイ、冴えてるかも!）って思ったのに。そこから続かないところがやっぱりクレイらしい。
471104795596443648,2014-05-27 01:45:10,今日のお昼はブロッコリーとマトマガニのサンドイッチね。
471096617865461760,2014-05-27 01:12:40,おい!　それ、誰だよ!!　と、とにかく人違いだから。
471066435913928706,2014-05-26 23:12:44,う、ストーンゴーレム。逃げるしかないよね。
470915424809271296,2014-05-26 13:12:41,上から落ちたら痛いとか、死ぬとか、そういう常識にとらわれてるから、わたしたちは今恐いんだと思う。
470893399990484992,2014-05-26 11:45:09,今日も野宿かぁ。お風呂に入りたいなあ。
470885249526665218,2014-05-26 11:12:46,早く帰って熱ぅーいお風呂に入って、ぬっくぬくのお布団の中でぐっすり寝たい。
470855032347193344,2014-05-26 09:12:42,ほんと何するか分かんないよなあ、あのばあちゃんは!
470833021944610816,2014-05-26 07:45:14,今日の晩御飯はドルチェのフライにしようかな……。
470824839230394368,2014-05-26 07:12:43,この「ウォーマンモス・クロスボウ」で見事にしてめてみせるわ。
470794641797677056,2014-05-26 05:12:44,きゃあ、ジャイアントスパイダーゴン!　飛び道具部隊の出番ね!
470764446554394624,2014-05-26 03:12:45,すっごーい!　さすがは+1の修正がついた竹アーマーだね。そんじょそこらの竹アーマーとものが違う!
470742408745865216,2014-05-26 01:45:10,今日のお昼はマトマの煮込みスパゲッティね。
470734232063467520,2014-05-26 01:12:41,なんだ。トラップなの??　どうしたのよ、びっくりするじゃない。いつ帰ってきたの??
470704058508922880,2014-05-25 23:12:47,こ、こ、こんな奴!　心配しただけ損した。
470553030853541889,2014-05-25 13:12:39,どんだけ疑り深いのよ!
470531011265064960,2014-05-25 11:45:09,今晩はちゃんとした宿だから、ノルも部屋で寝られるよ!
470522849828929536,2014-05-25 11:12:43,ん……?　何か秘密の話?　ちょっとやめてよね、この忙しい時に告白とかするの。
470492641956618240,2014-05-25 09:12:41,わざわざよりによって、んな気持ち悪いもんに会いに行くことはないじゃない!
470470613081939969,2014-05-25 07:45:09,今日の晩御飯はミミウサギの串焼きにしようかな……。
470462438710587392,2014-05-25 07:12:40,あ、でもギアは「サイコロ……なんとかウォーマンモス」って、すぐに言ったじゃない?
470432255190392832,2014-05-25 05:12:44,ついに底をつきやぶってたんだわ!
470402061511569409,2014-05-25 03:12:45,このままほっといて自分たちだけ先に進むっていうの?　わたしはできないわ。だって、あんなに助けてもらっておきながら……。
470380014152609792,2014-05-25 01:45:09,今日のお昼は海産物のカナッペね。
470371864645087232,2014-05-25 01:12:46,わたしも行くわ!　ルーミィをおぶってでもついていくかんね。
470341719641169920,2014-05-24 23:12:59,げげ、わたしがメイドの格好するの?
470190639775088641,2014-05-24 13:12:38,せめてクレイくらい気付いてくれたってよかろーに。
470168621595901952,2014-05-24 11:45:09,今日はシルバーリーブの家で寝るんだ。自分たちの家って、やっぱりいいよね!
470160458087804928,2014-05-24 11:12:43,きゃあ、ゴースト!?　キットン、ホーリースプレー持ってないの?
470130253105352704,2014-05-24 09:12:41,これ以上頭悪くなったら困るでしょって。
470108224830468096,2014-05-24 07:45:09,今日の晩御飯はチャーベの串焼きにしようかな……。
470100049926426624,2014-05-24 07:12:40,わたしは時々無性にクレイのことが不憫でしかたなくなるんだ。
470069860752293888,2014-05-24 05:12:42,きゃあ、スネークフライ。ルーミィ、ファイアーの呪文覚えてる?
470039671607549952,2014-05-24 03:12:45,あれってサラスだよね?　弱点は……え?　鳥の羽根!?
470017627402678274,2014-05-24 01:45:09,今日のお昼はホットドッグね。
470009442377822208,2014-05-24 01:12:38,こ、こ、こんな奴!　心配しただけ損した。
469979268827475968,2014-05-23 23:12:44,ううう、そこは（あ、クレイ、冴えてるかも!）って思ったのに。そこから続かないところがやっぱりクレイらしい。
469828249703313409,2014-05-23 13:12:38,財務担当としてはですねぇ、キットンとトラップのコンビになんか、こともあろうにパーティの全財産をほいほい預けたりは断固できない!
469806237106704384,2014-05-23 11:45:10,今日も野宿かぁ。お風呂に入りたいなあ。
469798075209228288,2014-05-23 11:12:44,方向音痴なわたしだもの。注意しなきゃ迷ってしまいそうだ。
469767869517950977,2014-05-23 09:12:42,キットンったら、いつからお風呂に入ってないんだろうか。
469745845252792320,2014-05-23 07:45:11,今日の晩御飯はニグルのレモン漬けにしようかな……。
469737664451588097,2014-05-23 07:12:41,がぜんファイトがわいてきちゃったじゃん。
469707475063537664,2014-05-23 05:12:43,ぬ、ぬわにが「うっかりさん」よお!!
469677267824566272,2014-05-23 03:12:41,なんだ。トラップなの??　どうしたのよ、びっくりするじゃない。いつ帰ってきたの??
469655236512997377,2014-05-23 01:45:08,今日のお昼は食パンケーキね。
469647062665949186,2014-05-23 01:12:40,無理よ!　どう考えたって、絶対に無理よ!
469616874909491200,2014-05-22 23:12:42,どうして、この人はいちいちカチンとくる言い方をするのかね。
469465860524896256,2014-05-22 13:12:38,もう、寝ぼけるのもいい加減にしてよね!　誰そのエマって!!
469443846309298176,2014-05-22 11:45:09,今日も野宿かぁ。お風呂に入りたいなあ。
469435703273598977,2014-05-22 11:12:48,マイナスに考えてても、何も始まらない。お母さん、そうだよね!?
469405489139163137,2014-05-22 09:12:44,きっと、あの分厚くふくらんだ財布の中には、手が切れそうなピン札がばっちり入ってるんだぞ。
469383444238057472,2014-05-22 07:45:08,今日の晩御飯はミケドリアの唐揚げにしようかな……。
469375279010283520,2014-05-22 07:12:41,あら、失礼な。ちゃんと外して射るわよぉ。
469345084668792832,2014-05-22 05:12:42,何それ。旦那様には、ちゃーんと優しくするんだもん。
469314890478284801,2014-05-22 03:12:44,で、出たぁ、ガラビアスライム!　ルーミィ、コールドの魔法!
469292849096179712,2014-05-22 01:45:08,今日のお昼はジャガイモのチーズ焼きね。
469284678499717121,2014-05-22 01:12:40,すっごーい!　さすがは+1の修正がついた竹アーマーだね。そんじょそこらの竹アーマーとものが違う!
469254504190201857,2014-05-21 23:12:46,マッパーとしても、冒険者としても、全然初心者だし進歩もあんまりしてない。でも、せめて勇気を持とう!　現実と向き合う勇気を。
469103481144369152,2014-05-21 13:12:40,トラップ、あんたもねぼけてる。
469081461048754176,2014-05-21 11:45:10,今日も野宿かぁ。お風呂に入りたいなあ。
469073312698478593,2014-05-21 11:12:47,あぁーああ。アクスもかわいそう。キットンに「変わった人」とか言われたくないよねぇ?
469043100791238656,2014-05-21 09:12:44,一応タイツを履いてたのが唯一の救いかな。あれで生足だったりした日にゃ……。
469021064278720513,2014-05-21 07:45:10,今日の晩御飯はミケドリアの蒸し焼きにしようかな……。
469012907867385856,2014-05-21 07:12:45,誰かに頼りにされてるって、いいもんだね。
468982747391074305,2014-05-21 05:12:54,わたしだって冒険者のはしくれなんだ。よ、よおーし、こうなったら自分でなんとかするしかない!
468952561371066368,2014-05-21 03:12:58,毛糸のパンツはいてて、よかったぁ。
468930459578413056,2014-05-21 01:45:08,今日のお昼はコンダイとマトマのサラダね。
468922362982064128,2014-05-21 01:12:58,これ……もしかして、ビーンズラ?　キットン、そこだなスプレー持ってないの?
468892166019088386,2014-05-20 23:12:58,まず、こっちを右のはずで……行き止まりになってるところにドアがあるはずで……。
468741094113427457,2014-05-20 13:12:40,ううう、わたしってあんな声出さないと思うけど……。
468719072104812544,2014-05-20 11:45:09,ダンジョンの中で野宿って、いまだに慣れないなあ。
468710913466331136,2014-05-20 11:12:44,んもう!　ルーミィ。わたしの真似するのやめなさいってば。
468680707590471680,2014-05-20 09:12:43,あ、でもギアは「サイコロ……なんとかウォーマンモス」って、すぐに言ったじゃない?
468658674169171968,2014-05-20 07:45:09,今日の晩御飯は新ジャガと鶏肉のヨーグルト煮にしようかな……。
468650502922596352,2014-05-20 07:12:41,早い話が、好奇心が勝ったってことね。まあ、対好奇心じゃ連戦連敗なんだけどさ。
468620315845607424,2014-05-20 05:12:44,マッパーとしても、冒険者としても、全然初心者だし進歩もあんまりしてない。でも、せめて勇気を持とう!　現実と向き合う勇気を。
468590138897862656,2014-05-20 03:12:49,二頭を追う者は一頭も得ずと言うじゃない?　あら知らない?　欲張って牛二頭を追いかけてたら、一頭も捕まえられなかったっていうことわざよ。
468568074744918016,2014-05-20 01:45:09,今日のお昼はホイル焼きね。
468559943612641280,2014-05-20 01:12:50,そりゃ、わたしたちみたいなレベルじゃ、クラーケンなんて十年早いけどさぁ。
468529733106278400,2014-05-19 23:12:47,おいおいリーダーだろお?　もちっと持ち歩かんかい!
468380137717653504,2014-05-19 13:18:21,なんてこった!　いったいどっちから来て、どこを曲がったのか。もうぜんぜん分かんなくなってる。
468356690245476352,2014-05-19 11:45:11,今晩はちゃんとした宿だから、ノルも部屋で寝られるよ!
468348582735527937,2014-05-19 11:12:58,げげ、ドッペルゲンネルが混じってる!?　だ、大丈夫、シロちゃんの目を見れば本物かどうか分かるわ!
468318348191621120,2014-05-19 09:12:49,う、バクムレイダーとバクマンだ……。気付かれませんように……。
468296287238901760,2014-05-19 07:45:10,今日の晩御飯はミケドリアの照り焼きにしようかな……。
468288207063220224,2014-05-19 07:13:03,シラタマだ!　踏まないように気を付けて!
468258003041267713,2014-05-19 05:13:02,ええっ、ウッドゴーレム?　勝てそうにないよぉ……。
468227742446538752,2014-05-19 03:12:47,わたしは時々無性にクレイのことが不憫でしかたなくなるんだ。
468205684836671488,2014-05-19 01:45:08,今日のお昼はコーボーとレンホーソーのサラダね。
468197613963980800,2014-05-19 01:13:04,失礼な!　せっかく助けようっていうのに。
468167412190179329,2014-05-18 23:13:03,クレイって、神経質なところがあるかと思ったら、ここぞという時にいきなりのんきになっちゃうんだもんなあ。
468016326582091778,2014-05-18 13:12:42,失礼な!　せっかく助けようっていうのに。
467994294083534848,2014-05-18 11:45:09,今日はいつものみすず旅館。安いから助かるわ。
467986135788974080,2014-05-18 11:12:44,やっぱりノルって、すごいなぁ。わたしには絶対に真似できない。
467955922472419328,2014-05-18 09:12:40,コイツもこわいけどトラップもこわい。
467933900430254080,2014-05-18 07:45:10,今日の晩御飯はサイバラ肉のクリーム煮にしようかな……。
467925730962051072,2014-05-18 07:12:42,クレイのバカカバオタンチン!
467895528731049985,2014-05-18 05:12:41,ぬ、ぬわにが「うっかりさん」よお!!
467865340093792257,2014-05-18 03:12:44,じゃあ、やっぱりここは……あの世?　死後の世界?　冥土?　わたし、死んじゃったの?
467843295188484096,2014-05-18 01:45:08,今日のお昼は手長エピとグリーンアスッパラのピラフね。
467835138684882945,2014-05-18 01:12:43,もう!　やめてよ。金目の物って言ったらわたしたちの武器くらいしかないんだからね。
467804978325618688,2014-05-17 23:12:52,ここは冷静にマッピング……。なんてしてらんないよ、やっぱりぃぃ。
467653932756373506,2014-05-17 13:12:40,シビレクラゲだ!　こいつに刺されると痛いんだよね。
467631911783763968,2014-05-17 11:45:10,今日も野宿かぁ。お風呂に入りたいなあ。
467623743905202176,2014-05-17 11:12:43,早い話が、好奇心が勝ったってことね。まあ、対好奇心じゃ連戦連敗なんだけどさ。
467593544262090752,2014-05-17 09:12:43,トラップ、性懲りもないわね。またギャンブルで……なんて思ってるでしょ。ダメだからね、ダメダメ!!
467571520617734144,2014-05-17 07:45:12,今日の晩御飯はエニガニのマトマ煮にしようかな……。
467563353104076800,2014-05-17 07:12:44,はは、マダムキラー、健在なり。
467533151292497921,2014-05-17 05:12:44,恨むんなら、自分のこれまでの数々の悪行を恨みなさい。
467502952064618496,2014-05-17 03:12:44,ここは冷静にマッピング……。なんてしてらんないよ、やっぱりぃぃ。
467480916390969345,2014-05-17 01:45:10,今日のお昼は緑黄色野菜の煮込みね。
467472802296000512,2014-05-17 01:12:55,でも、なによ。その特大級のってのは!
467442552577085440,2014-05-16 23:12:43,まさかレッドブーツ!?　大声出さないと姿が見えないよ!
467291547889700864,2014-05-16 13:12:41,わたし、早くお風呂に入ってさっぱりしたい!　シャンプーしたい!　着替えしたい!
467269522555027456,2014-05-16 11:45:10,今日も野宿かぁ。お風呂に入りたいなあ。
467261355280461824,2014-05-16 11:12:43,お、お母さん……そ、それって、あの先祖代々由緒正しい緑色のタイツなのでは?
467231158158114816,2014-05-16 09:12:43,ぬ、ぬわにが「うっかりさん」よお!!
467209131426709504,2014-05-16 07:45:11,今日の晩御飯はミケドリアの照り焼きにしようかな……。
467200960184320000,2014-05-16 07:12:43,あーたねえ!　しらばっくれるの、いいかげんにしたら?
467170759517810688,2014-05-16 05:12:43,うん、ほんとにね。まるでクレイの不幸が伝染っちゃったみたいだわ。
467140561468522496,2014-05-16 03:12:43,一応タイツを履いてたのが唯一の救いかな。あれで生足だったりした日にゃ……。
467118531327176704,2014-05-16 01:45:11,今日のお昼はパステル風アラスカパンね。
467110361053659136,2014-05-16 01:12:43,使命感と冒険心に胸を高鳴らせているクレイに勝てるわけがない。
467080175553761280,2014-05-15 23:12:46,恨むんなら、自分のこれまでの数々の悪行を恨みなさい。
466929158027616258,2014-05-15 13:12:41,こ、こ、こんな奴!　心配しただけ損した。
466907139911344129,2014-05-15 11:45:11,今日は宿に泊まれるよ!　でもノルは馬小屋なの。ごめんね。
466898976134795264,2014-05-15 11:12:45,そうポカポカ叩くとねー、悪い頭がもっと悪くなるでしょ?
466868766928687106,2014-05-15 09:12:42,見損なって……って。アンジェリカ……。
466846743271727105,2014-05-15 07:45:11,今日の晩御飯はレンホーソーのカレーにしようかな……。
466838578840891392,2014-05-15 07:12:45,冒険者になった時、危険は覚悟の上だったけど。まさかまさかこんな風に最後が訪れるだなんて。
466808373703213057,2014-05-15 05:12:43,そりゃ、わたしたちみたいなレベルじゃ、クラーケンなんて十年早いけどさぁ。
466778178992631808,2014-05-15 03:12:44,ナイフが右、フォークが左……。
466756146879938560,2014-05-15 01:45:11,今日のお昼はグフグフのナッツソテーね。
466747978489671680,2014-05-15 01:12:44,よけたのはてめぇだろうー?　トラップ。
466717825856315392,2014-05-14 23:12:55,一食を笑う者は、一食に泣くことになるんだ。
466566989381902337,2014-05-14 13:13:33,お喋りのゾンビだなんて、知り合いじゃなかったら、すっごく嫌だ。
466544753681502208,2014-05-14 11:45:11,今日も野宿かぁ。お風呂に入りたいなあ。
466536646184550400,2014-05-14 11:12:58,ダーンジョンは暗い。暗い暗いくらーい!　ダーンジョンは深い。深い深いふかーい!
466506427352510464,2014-05-14 09:12:54,やだぁ、ウージョが現れたよ。あいつらって、歌が弱点だっけ?
466484376445136896,2014-05-14 07:45:16,今日の晩御飯はタホタ貝のバター焼きにしようかな……。
466476347775533056,2014-05-14 07:13:22,んもう!　ルーミィ。わたしの真似するのやめなさいってば。
466446051751510016,2014-05-14 05:12:59,トイレとかさ、あとお風呂とか、こういうのって女性の冒険者にとっては大問題なわけで。
466415923193446403,2014-05-14 03:13:16,無理よ!　どう考えたって、絶対に無理よ!
466393765843050496,2014-05-14 01:45:13,今日のお昼はミズキノコのマリネね。
466385689610035201,2014-05-14 01:13:08,うわわわあ、ああぁぁー!　こ、怖い。助けてぇー!　ごめんなさい、わたしが悪かったぁー。わたしが悪かったってばぁー!!
466355450410455041,2014-05-13 23:12:58,うん、ほんとにね。まるでクレイの不幸が伝染っちゃったみたいだわ。
466204378064371712,2014-05-13 13:12:40,やっぱりノルって、すごいなぁ。わたしには絶対に真似できない。
466182361512550400,2014-05-13 11:45:10,ダンジョンの中で野宿って、いまだに慣れないなあ。
466174194070196224,2014-05-13 11:12:43,所詮、人生とはそういうもんだ。
466143992225091584,2014-05-13 09:12:42,で、出たぁ、ガラビアスライム!　ルーミィ、コールドの魔法!
466121961194541056,2014-05-13 07:45:10,今日の晩御飯はモカ肉のショウガ焼きにしようかな……。
466113799863279616,2014-05-13 07:12:44,うん、ほんとにね。まるでクレイの不幸が伝染っちゃったみたいだわ。
466083611817431041,2014-05-13 05:12:47,ちょ、ちょっと休まない?
466053400723857408,2014-05-13 03:12:44,そういや、ルーミィはかなりめんどくさがりだったな。
466031362781085696,2014-05-13 01:45:09,今日のお昼はコーボーとレンホーソーのサラダね。
466023182634209280,2014-05-13 01:12:39,じゃ、やっぱりこのままにしておくわけにはいかないよ!　でしょ?　トラップ!　寝てんじゃないの。聞いてよ!
465993010971299840,2014-05-12 23:12:46,きっと、あの分厚くふくらんだ財布の中には、手が切れそうなピン札がばっちり入ってるんだぞ。
465841987472465920,2014-05-12 13:12:39,で、出たぁ、マイマイスライム!
465819965463879680,2014-05-12 11:45:08,今日はこの洞穴で寝るしかないね。モンスターとか来ませんように……。
465811804153597952,2014-05-12 11:12:43,なんだ。トラップなの??　どうしたのよ、びっくりするじゃない。いつ帰ってきたの??
465781597132709888,2014-05-12 09:12:41,ああぁぁぁもう!　だーから、呪文くらい暗記しなさいってあれほど……。
465759569247891456,2014-05-12 07:45:09,今日の晩御飯はミケドリアのパイ包み揚げにしようかな……。
465751399729352704,2014-05-12 07:12:41,お喋りのゾンビだなんて、知り合いじゃなかったら、すっごく嫌だ。
465721199230595072,2014-05-12 05:12:41,トイレとかさ、あとお風呂とか、こういうのって女性の冒険者にとっては大問題なわけで。
465691018835132416,2014-05-12 03:12:45,クレイって、鈍感だなーと思うこと、よくあるけど。なぜかいつもわたしのこと口に出さなくってもわかってくれてるんだ。
465668977994117121,2014-05-12 01:45:10,今日のお昼は一口サイズの肉団子ね。
465660796035284993,2014-05-12 01:12:39,あ、あはは。そ、そうだよね?　いやあ、宿代が浮くかと思ってつい。
465630617846026240,2014-05-11 23:12:44,きゃあ、ゴースト!?　キットン、ホーリースプレー持ってないの?
465479603310444544,2014-05-11 13:12:40,ほんとクレイって根気あるなぁ。
465457580597202944,2014-05-11 11:45:09,ダンジョンの中で野宿って、いまだに慣れないなあ。
465449420025126912,2014-05-11 11:12:44,いくらお風呂に入らなくって臭くっても、いきなり大声出して笑い出したって、何考えてるのかわかんないとこあったって、肝心な時に肝心なものをすぐ見つけられなくたって、キットンがいないパーティなんて考えられないんだもん。
465419211506860032,2014-05-11 09:12:41,あぁトラップ……お・ね・が・い!　だからもうちょっと言葉を選んでほしい。
465397181684277248,2014-05-11 07:45:09,今日の晩御飯は川魚のムニエルにしようかな……。
465389019136655360,2014-05-11 07:12:43,せめてクレイくらい気付いてくれたってよかろーに。
465358818189115392,2014-05-11 05:12:42,やだ、リタったら。いくらなんでも、『不幸といえばクレイ』だなんて、ひどいよぉ。
465328638880014336,2014-05-11 03:12:47,でも、なによ。その特大級のってのは!
465306584386523136,2014-05-11 01:45:09,今日のお昼は冷やしヌグね。
465298431880085504,2014-05-11 01:12:45,家計を預かる身とはいえ、まだ十七なんだぞ。なんかだんだん所帯じみてきてないか?
465268248292777985,2014-05-10 23:12:49,ううう、いつかはちゃんとしたアーマー買おうね。今度の報酬は……生活費にあてるから使えないけどさ。
465117230552727552,2014-05-10 13:12:43,だって、ほら、宝物に名前でも書いてあれば返してやるっていってたじゃない?
465095197932523522,2014-05-10 11:45:10,今日はこの洞穴で寝るしかないね。モンスターとか来ませんように……。
465087050505392128,2014-05-10 11:12:48,あはは。そんな。お嬢さんなんていう柄じゃないよ。
465056991593762819,2014-05-10 09:13:21,ま、ま、まっずぅい!　マッピング、すっかり忘れてたよ。
465034800143683584,2014-05-10 07:45:10,今日の晩御飯はタホタ貝のソテーにしようかな……。
