id,created_at,text
525786995537113088,2014-10-24 23:12:43,あ、あれ?　今転んだのって、カピオカのせい?
525635979126636545,2014-10-24 13:12:37,わっ、金棘コカトリス。石にされちゃうよ!
525613959873695745,2014-10-24 11:45:08,今日はシルバーリーブの家で寝るんだ。自分たちの家って、やっぱりいいよね!
525605802715779072,2014-10-24 11:12:43,うわあ、グスフング!　は、早く逃げなきゃ!
525575590649159681,2014-10-24 09:12:40,んもう、うそ!　で、なんなのよ。何の用?　せっかくこれからミケドリアの串……。
525553562890170368,2014-10-24 07:45:08,今日の晩御飯は川魚のムニエルにしようかな……。
525545399268814848,2014-10-24 07:12:42,手に手をとっておまえ百までわしゃ九十九まで……って、そりゃあ仲のいい両まぶたひっぺがして、機嫌だって少なからず悪いわよ。
525515198216421376,2014-10-24 05:12:41,これがあれば当分……いや、一生遊んで暮らせる。もうお財布の心配しなくていい……。はっっ、私は何を!?
525485002637590528,2014-10-24 03:12:42,ううう、でもさ。いつもお金には困ってるんだもん、勘弁してほしい。
525462967316250624,2014-10-24 01:45:08,今日のお昼はホイル焼きね。
525454822984536064,2014-10-24 01:12:46,んもう、ウジャジャだかガジャジャだか知らないけど、あんなにたくさん倒せないよ!
525424653981196289,2014-10-23 23:12:54,あいつ、ブルーノっていうんだっけ。襲っては来なさそうだね。
525273597627990017,2014-10-23 13:12:39,ねぇ、お願い。背中の上のとこ、かいてくれない!?
525251577485869058,2014-10-23 11:45:09,今日はお屋敷に泊めてもらえるんだよね。ふふっ。
525243409494077440,2014-10-23 11:12:42,わざわざよりによって、んな気持ち悪いもんに会いに行くことはないじゃない!
525213216826081281,2014-10-23 09:12:43,つくづくマリーナってチャーミングだよなぁ。
525191174638678016,2014-10-23 07:45:08,今日の晩御飯はダグ肉の丸焼きにしようかな……。
525183014444085249,2014-10-23 07:12:42,うまくできるかどうか自信はないけど、一応、お裁縫は習ってたもんね。
525152855955480576,2014-10-23 05:12:52,よけたのはてめぇだろうー?　トラップ。
525122673743908864,2014-10-23 03:12:56,わたしを見なさい、いつだって迷ってばっかり……。
525100580574740480,2014-10-23 01:45:08,今日のお昼はお好みサンドね。
525092412763287552,2014-10-23 01:12:41,んもう!　ルーミィ。わたしの真似するのやめなさいってば。
525062229675081728,2014-10-22 23:12:45,わたしたちって、ほんと移動ばっかしてると思わない?
524911217014353920,2014-10-22 13:12:41,まったくぅー。人間、素直なのが一番だよ!
524889188810768385,2014-10-22 11:45:09,今晩はちゃんとした宿だから、ノルも部屋で寝られるよ!
524881036526628864,2014-10-22 11:12:45,わたしっていったい何の役に立ってるんだろ。マッパーとかいって方向音痴だしな。こんな普通の町中で迷っちゃうんだもの。
524850828851417088,2014-10-22 09:12:43,初心者なのは認めるけど、ディビーちゃんと同じだって言われるのにはカチンとくるなあ。
524828790938017792,2014-10-22 07:45:09,今日の晩御飯はミケドリアの蒸し焼きにしようかな……。
524820636607062016,2014-10-22 07:12:45,あ、ヌルヌラが追っかけてくる!　トラップ、早く宝石とか返してきなさいよ!
524790425865826304,2014-10-22 05:12:42,トラップ、性懲りもないわね。またギャンブルで……なんて思ってるでしょ。ダメだからね、ダメダメ!!
524760256484622337,2014-10-22 03:12:49,すっごーい!　さすがは+1の修正がついた竹アーマーだね。そんじょそこらの竹アーマーとものが違う!
524738192558157824,2014-10-22 01:45:08,今日のお昼はポテト＆キウリの冷たいスープね。
524730006493093888,2014-10-22 01:12:37,わっ、グリーンスライム。確か火が弱点よね?
524699846297403392,2014-10-21 23:12:46,最近、わたしも時々、自分っていったいなんだろう?　なんて思うことがある。たぶん、存在証明みたいな……そんなこと。
524548869456011264,2014-10-21 13:12:50,せめてクレイくらい気付いてくれたってよかろーに。
524526803398832128,2014-10-21 11:45:09,今日はこの洞穴で寝るしかないね。モンスターとか来ませんように……。
524518639681028096,2014-10-21 11:12:43,記憶がなくなるって、どういう事だと思う?
524488449294729216,2014-10-21 09:12:45,あはは。そんな。お嬢さんなんていう柄じゃないよ。
524466401478598656,2014-10-21 07:45:08,今日の晩御飯はミケドリアの木の実詰めにしようかな……。
524458241669881857,2014-10-21 07:12:43,うん、ほんとにね。まるでクレイの不幸が伝染っちゃったみたいだわ。
524428036280578048,2014-10-21 05:12:41,家計を預かる身とはいえ、まだ十七なんだぞ。なんかだんだん所帯じみてきてないか?
524397854337400832,2014-10-21 03:12:45,幸せだなぁと思えば思うほど、本当の幸せも近くなるんだって。
524375803929190400,2014-10-21 01:45:08,今日のお昼はお好みサンドね。
524367632326086656,2014-10-21 01:12:40,いいよね。お財布が充実してるって。
524337442300502016,2014-10-20 23:12:42,じゃあ、やっぱりここは……あの世?　死後の世界?　冥土?　わたし、死んじゃったの?
524201541050191873,2014-10-20 14:12:41,クレイって、神経質なところがあるかと思ったら、ここぞという時にいきなりのんきになっちゃうんだもんなあ。
524171365683716096,2014-10-20 12:12:46,つくづくマリーナってチャーミングだよなぁ。
524164412072947713,2014-10-20 11:45:09,今晩はちゃんとした宿だから、ノルも部屋で寝られるよ!
524141143668166656,2014-10-20 10:12:41,だってだって、宝の地図なんだよ?
524110956662513664,2014-10-20 08:12:44,うわ、デビルフィッシュヘッド!　クレイー、何とかしてー!
524104012950298624,2014-10-20 07:45:08,今日の晩御飯はログロフのマトマ煮にしようかな……。
524080776971702272,2014-10-20 06:12:48,わたしも、おなか、ぺっこぺこだおう!
524050556789067777,2014-10-20 04:12:43,う、ストーンゴーレム。逃げるしかないよね。
524020364817362945,2014-10-20 02:12:45,んもう、ウジャジャだかガジャジャだか知らないけど、あんなにたくさん倒せないよ!
524013415421861888,2014-10-20 01:45:08,今日のお昼は冷やしヌグね。
523990191900356609,2014-10-20 00:12:51,うちって本当に何もないよ。小さい町だし。エベリンとかとはぜんぜん違う、ただの田舎町だもん。
523824045003780097,2014-10-19 13:12:39,わたしたちって、ほんと移動ばっかしてると思わない?
523802022596706305,2014-10-19 11:45:08,今日も野宿かぁ。お風呂に入りたいなあ。
523793856228110336,2014-10-19 11:12:41,そういう言い方ってないと思うわ!　ごじゅうし。
523763656022974464,2014-10-19 09:12:41,ナイフが右、フォークが左……。
523741626879864833,2014-10-19 07:45:09,今日の晩御飯は川魚の蒸し焼きにしようかな……。
523733452651126784,2014-10-19 07:12:40,ねぇ、お願い。背中の上のとこ、かいてくれない!?
523703275225219073,2014-10-19 05:12:45,大変、キケロ鳥よ!
523673089142317057,2014-10-19 03:12:48,やだ!　やなもんはぜーったい、やだ!!
523651028265078784,2014-10-19 01:45:08,今日のお昼はマトマカニのピリ辛サンドね。
523642843139555328,2014-10-19 01:12:37,ええっ、ウッドゴーレム?　勝てそうにないよぉ……。
523612659912957952,2014-10-18 23:12:41,だあぁからぁ!　いいんだってば!　んなことは。結局、なにが弱点なの、なにが!
523461666118193153,2014-10-18 13:12:41,おいおいリーダーだろお?　もちっと持ち歩かんかい!
523439633636392960,2014-10-18 11:45:08,今日は安宿だけど、屋根があるだけましだよね。
523431476382031872,2014-10-18 11:12:43,あ、マイマイスライム。さすがに楽勝……だよね?
523401286914277376,2014-10-18 09:12:45,うわっ、モウンだ。耳も口もふさいどかなきゃ!
523379235654610947,2014-10-18 07:45:08,今日の晩御飯はミケドリアの唐揚げにしようかな……。
523371094271475712,2014-10-18 07:12:47,あのメナースとだったら、一緒にショッピングしたりお茶したりしても楽しそうだけど。
523340963142303744,2014-10-18 05:13:03,トラップ、あんたもねぼけてる。
523310710462246912,2014-10-18 03:12:50,あ、ムウオムよ。シロちゃん、食べる?
523288639908765696,2014-10-18 01:45:08,今日のお昼はホロホロ肉のポローネ風味パスタ付きね。
523280482616606722,2014-10-18 01:12:43,所詮、人生とはそういうもんだ。
523250279878111232,2014-10-17 23:12:42,って、あ!　思い出した。わたしにプロポーズしてくれた半魚人のことを。
523099279783522304,2014-10-17 13:12:41,キットンったら、いつからお風呂に入ってないんだろうか。
523077247742132224,2014-10-17 11:45:08,今日は安宿だけど、屋根があるだけましだよね。
523069088864546816,2014-10-17 11:12:43,げげ、わたしがメイドの格好するの?
523038887023616000,2014-10-17 09:12:42,困ったなぁ。方向感覚がないのは自信あるんだけど……。
523016850368495617,2014-10-17 07:45:08,今日の晩御飯はミケドリアの木の実詰めにしようかな……。
523008687288229888,2014-10-17 07:12:42,わっ、金棘コカトリス。石にされちゃうよ!
522978488622403584,2014-10-17 05:12:42,あれはドーラ!?　よーし、短剣で応戦するわ!
522948363763716096,2014-10-17 03:13:00,うわ、エルトンだ。見つかりませんように……。
522926250684198913,2014-10-17 01:45:08,今日のお昼はサーザンのつぼ焼きね。
522918084571451392,2014-10-17 01:12:41,って、あ!　思い出した。わたしにプロポーズしてくれた半魚人のことを。
522887901902680064,2014-10-16 23:12:45,扉に耳あり窓に目ありって言うでしょ?
522736892588986368,2014-10-16 13:12:41,ほんとクレイって根気あるなぁ。
522714860878958594,2014-10-16 11:45:09,今日はシルバーリーブの家で寝るんだ。自分たちの家って、やっぱりいいよね!
522706703997865985,2014-10-16 11:12:44,失礼な!　せっかく助けようっていうのに。
522676499086721024,2014-10-16 09:12:42,なんてこった!　いったいどっちから来て、どこを曲がったのか。もうぜんぜん分かんなくなってる。
522654462016376834,2014-10-16 07:45:08,今日の晩御飯はミケドリアの蒸し焼きにしようかな……。
522646298420203520,2014-10-16 07:12:42,そりゃ、わたしたちみたいなレベルじゃ、クラーケンなんて十年早いけどさぁ。
522617712179040257,2014-10-16 05:19:07,お喋りのゾンビだなんて、知り合いじゃなかったら、すっごく嫌だ。
522585947586568192,2014-10-16 03:12:53,うう、ブラックリザードマンもレッドリザードマンもいる……。気付かれないうちに逃げよう?
522563866740289537,2014-10-16 01:45:09,今日のお昼はマトマカニのピリ辛サンドね。
522555699394400256,2014-10-16 01:12:42,惜しい!　逆光で顔がよくわかんない。
522525508257337344,2014-10-15 23:12:43,出た、マグマン!　は、早く逃げよう!
522374497169444867,2014-10-15 13:12:40,で、出たぁ、ガラビアスライム!　ルーミィ、コールドの魔法!
522352474133262336,2014-10-15 11:45:09,今晩はちゃんとした宿だから、ノルも部屋で寝られるよ!
522344315394080768,2014-10-15 11:12:44,うわ、ストライスネークだ。早くどっか行ってくれないかな……。
522314109564358656,2014-10-15 09:12:42,これが本当のひっくりカエル、なんちゃって。……うー、くだらない。
522292071906828288,2014-10-15 07:45:08,今日の晩御飯はタホタ貝のバター焼きにしようかな……。
522283911766749184,2014-10-15 07:12:42,ええっ、レイス!?　トマスもいないのにどうすれば……。
522253712475971584,2014-10-15 05:12:42,ううう、わたしってあんな声出さないと思うけど……。
522223581208387584,2014-10-15 03:12:58,くっそお、最後まであきらめないもんね!
522201475997396992,2014-10-15 01:45:08,今日のお昼はお好みサンドね。
522193308534059008,2014-10-15 01:12:41,わたしが経験値稼げるなんて、そんなチャンスめったにないんだぞ。
522163113731190785,2014-10-14 23:12:42,見損なって……って。アンジェリカ……。
522012116748734464,2014-10-14 13:12:41,こりゃそうとうセンチになってるぞ。
521990085663662082,2014-10-14 11:45:09,今日はシルバーリーブの家で寝るんだ。自分たちの家って、やっぱりいいよね!
521981922528866305,2014-10-14 11:12:42,クレイ!　その「パステルと駆け落ちなんか」っていうのはどういう意味?
521951721656827907,2014-10-14 09:12:42,顔見て、いきなり大爆笑って……そりゃないだろ。
521929687765766144,2014-10-14 07:45:09,今日の晩御飯はモカ肉のショウガ焼きにしようかな……。
521921540216983555,2014-10-14 07:12:46,うわ、エルトンだ。見つかりませんように……。
521891326573289472,2014-10-14 05:12:43,そうポカポカ叩くとねー、悪い頭がもっと悪くなるでしょ?
521861137118162945,2014-10-14 03:12:45,あ、あれ?　今転んだのって、カピオカのせい?
521839087846563840,2014-10-14 01:45:08,今日のお昼はお好みサンドね。
521830926456598528,2014-10-14 01:12:42,あーあ、きょうはお風呂に入れると思ったのになぁ。
521800723512586241,2014-10-13 23:12:41,そんなの、改めて言われなくたってわかってらい!
521649715868213248,2014-10-13 13:12:38,おい!　それ、誰だよ!!　と、とにかく人違いだから。
521627696757895170,2014-10-13 11:45:08,今日はお屋敷に泊めてもらえるんだよね。ふふっ。
521619549720813569,2014-10-13 11:12:46,このガキ……いや失礼、このお嬢様、けっこうやるじゃん。
521567300038574080,2014-10-13 07:45:09,今日の晩御飯はニグルのムニエルにしようかな……。
521559133351186432,2014-10-13 07:12:42,誰かに頼りにされてるって、いいもんだね。
521528923658534912,2014-10-13 05:12:39,いきなりトラップって冴えてるじゃない。まるで盗賊みたいだ。
521498743971917824,2014-10-13 03:12:44,わたしがレイスになったときの、最初の犠牲者は決まりだな。
521476700471705600,2014-10-13 01:45:08,今日のお昼は巻貝の酒蒸しね。
521468523013365760,2014-10-13 01:12:38,わたしたちって、ほんと移動ばっかしてると思わない?
521438344056545282,2014-10-12 23:12:43,ふんだ!　もう知らんもんね。
521287329533534209,2014-10-12 13:12:39,あっはっはっは。わたしがそんなこと言ったら、はり倒すくらいですむかなあ。
521265311987679233,2014-10-12 11:45:09,今日はお屋敷に泊めてもらえるんだよね。ふふっ。
521257139214368768,2014-10-12 11:12:41,っていうことは、知ってて、クレイに迷惑かけてるってこと?　つまり確信犯?　最低じゃん。
521226936735920129,2014-10-12 09:12:40,でも、ほんとのとこ、トラップがわたしたちのことを結構真剣に気にしてくれてるの、わかってるからね。
521204911816466432,2014-10-12 07:45:09,今日の晩御飯はファタテの網焼きにしようかな……。
521196751152095232,2014-10-12 07:12:43,だあぁからぁ!　いいんだってば!　んなことは。結局、なにが弱点なの、なにが!
521166560426094592,2014-10-12 05:12:45,こ、こ、こんな奴!　心配しただけ損した。
521136398942760960,2014-10-12 03:12:54,早く帰って熱ぅーいお風呂に入って、ぬっくぬくのお布団の中でぐっすり寝たい。
521114313700827136,2014-10-12 01:45:08,今日のお昼はパステル風アラスカパンね。
521106139908292609,2014-10-12 01:12:40,シラタマだ!　踏まないように気を付けて!
521075955687645184,2014-10-11 23:12:43,扉に耳あり窓に目ありって言うでしょ?
520924950991892480,2014-10-11 13:12:41,あんなに骨折り損のくたびれもうけしたのに、トラップったら、忘れちゃったの?
520902921127358464,2014-10-11 11:45:08,今日はお屋敷に泊めてもらえるんだよね。ふふっ。
520894758655234048,2014-10-11 11:12:42,わたし、早くお風呂に入ってさっぱりしたい!　シャンプーしたい!　着替えしたい!
520864556952719360,2014-10-11 09:12:42,わ、わかったわよ。やりゃあいいんでしょ、やりゃあ!
520842525490167809,2014-10-11 07:45:09,今日の晩御飯はサイバラ肉のクリーム煮にしようかな……。
520834355615121408,2014-10-11 07:12:41,いくらキットンでも、さすがにあのダークネス・クィーンをしとめるほどの強烈な臭いってわけではないしな。
520804158383722496,2014-10-11 05:12:42,うわ、バジリスクだ……。気付かれないうちに逃げよう……。
520773955490029568,2014-10-11 03:12:41,ジャイアントビーだ!　早く地面に伏せなきゃ!
520751925902323712,2014-10-11 01:45:08,今日のお昼は緑黄色野菜の煮込みね。
520743749735813122,2014-10-11 01:12:39,最近、わたしも時々、自分っていったいなんだろう?　なんて思うことがある。たぶん、存在証明みたいな……そんなこと。
520713566773473281,2014-10-10 23:12:43,ゾンビが顔を輝かせると、かえって怖いって知ってた?
520562552967675904,2014-10-10 13:12:38,シロちゃん、犬のふりしてなきゃ。人間の言葉、喋っちゃダメじゃない!!
520540533005901824,2014-10-10 11:45:08,今日はここで野宿だね。ふかふかのベッドで寝たいなあ。
520532366494674946,2014-10-10 11:12:41,冒険者になった時、危険は覚悟の上だったけど。まさかまさかこんな風に最後が訪れるだなんて。
520502165945585664,2014-10-10 09:12:41,おい!　それ、誰だよ!!　と、とにかく人違いだから。
520480132008402944,2014-10-10 07:45:08,今日の晩御飯はブラックサバスの塩焼きにしようかな……。
520471966491238400,2014-10-10 07:12:41,やっぱりノルって、すごいなぁ。わたしには絶対に真似できない。
520441763136151553,2014-10-10 05:12:40,それより、誰が道に落ちてるお金を探して歩いてるのよ!!
520411580391907328,2014-10-10 03:12:44,偉そうに毒づいてたのは、どこのどなたさまでしたっけねぇ。
520389544852480000,2014-10-10 01:45:10,今日のお昼はホイル焼きね。
520381359672422400,2014-10-10 01:12:39,ええっ、ウッドゴーレム?　勝てそうにないよぉ……。
520351170766716928,2014-10-09 23:12:41,どっちかといったら、メナースには悪いけどウギルギさまの方がありがたみあるわけで。
520200168117780481,2014-10-09 13:12:39,あーら、トラップ。そう言いますけどね。わたしたちって今、すっごい借金抱えてるのよ。
520178142950854656,2014-10-09 11:45:08,今日はいつものみすず旅館。安いから助かるわ。
520169975055532032,2014-10-09 11:12:41,やつは、ああ見えてけっこうもてるのだ。ちぇ、実態知らないからなぁー、みんな。
520139797612867584,2014-10-09 09:12:46,ま、ま、まっずぅい!　マッピング、すっかり忘れてたよ。
520117744641925120,2014-10-09 07:45:08,今日の晩御飯はキノコと木の実のソテーにしようかな……。
520109574829772801,2014-10-09 07:12:40,冒険者になった時、危険は覚悟の上だったけど。まさかまさかこんな風に最後が訪れるだなんて。
520079376541446146,2014-10-09 05:12:40,困ったなぁ。方向感覚がないのは自信あるんだけど……。
520049182455779328,2014-10-09 03:12:41,このままほっといて自分たちだけ先に進むっていうの?　わたしはできないわ。だって、あんなに助けてもらっておきながら……。
520027150997389312,2014-10-09 01:45:09,今日のお昼はコーボーとレンホーソーのサラダね。
520018986956623872,2014-10-09 01:12:42,ということは、きょうも、どこかで水を借りて体拭くしかないのかなぁ。
519988794674536448,2014-10-08 23:12:44,ううう、でもさ。いつもお金には困ってるんだもん、勘弁してほしい。
519837813538172928,2014-10-08 13:12:47,げげ、わたしがメイドの格好するの?
519815754128965633,2014-10-08 11:45:08,今日はいつものみすず旅館。安いから助かるわ。
519807587659706370,2014-10-08 11:12:41,キットンったら、いつからお風呂に入ってないんだろうか。
519777390227361792,2014-10-08 09:12:41,ねぇ、トラップ。あなたも何か言ってよ。ほら、金銭交渉なら、任せとけっていつも言ってるじゃない!
519755357082509312,2014-10-08 07:45:08,今日の晩御飯は川魚の蒸し焼きにしようかな……。
519747196984389635,2014-10-08 07:12:42,誰もそんなこと言ってないじゃないの!　強いていえば……怪しいのはトラップ、あんただけってこと。
519717000856092672,2014-10-08 05:12:43,じゃあ、やっぱりここは……あの世?　死後の世界?　冥土?　わたし、死んじゃったの?
519686819172990976,2014-10-08 03:12:47,ふん、落ち込んでたって事態は解決しないの。だったら、明るくしてたほうがいいじゃない?　あれ?　それって、誰かさんの口癖だったんじゃなかったっけ?
519664764348162050,2014-10-08 01:45:09,今日のお昼はジャガイモのチーズ焼きね。
519656583731490816,2014-10-08 01:12:38,げげ、ドッペルゲンネルが混じってる!?　だ、大丈夫、シロちゃんの目を見れば本物かどうか分かるわ!
519626451788652545,2014-10-07 23:12:55,お、お母さん……そ、それって、あの先祖代々由緒正しい緑色のタイツなのでは?
519475388863352832,2014-10-07 13:12:38,なんだかワクワクしてくるじゃあありませんか!!
519453368771559425,2014-10-07 11:45:08,今日は安宿だけど、屋根があるだけましだよね。
519445204651098112,2014-10-07 11:12:42,あーら、トラップ。そう言いますけどね。わたしたちって今、すっごい借金抱えてるのよ。
519414992601223168,2014-10-07 09:12:39,怖いよぉ。何が怖いって、キットンの顔が。
519392968369655809,2014-10-07 07:45:08,今日の晩御飯は川魚の蒸し焼きにしようかな……。
519384795088822272,2014-10-07 07:12:39,やだぁ、ウージョが現れたよ。あいつらって、歌が弱点だっけ?
519354593231138817,2014-10-07 05:12:38,誰もそんなこと言ってないじゃないの!　強いていえば……怪しいのはトラップ、あんただけってこと。
519324410893701120,2014-10-07 03:12:42,う、ストーンゴーレム。逃げるしかないよね。
519302373458460673,2014-10-07 01:45:08,今日のお昼は一口サイズの肉団子ね。
519294189658316801,2014-10-07 01:12:37,うわぁー!!　ル、ルーミィ、シロちゃん!　あんたたち、クッキー全部食べちゃったのぉー??
519264018167382017,2014-10-06 23:12:44,時にはちょっと無理するぐらいじゃないと人間、進歩しないんじゃない?
519113010724360194,2014-10-06 13:12:41,トラップ……それ、もしかして……一番上に「ギ」って文字がついたりしない?
519090981090500609,2014-10-06 11:45:08,今日はこの洞穴で寝るしかないね。モンスターとか来ませんように……。
519082828743454721,2014-10-06 11:12:45,ジャイアントビーだ!　早く地面に伏せなきゃ!
519052627959504896,2014-10-06 09:12:44,クレイって、神経質なところがあるかと思ったら、ここぞという時にいきなりのんきになっちゃうんだもんなあ。
519030581804298240,2014-10-06 07:45:08,今日の晩御飯はログロフのマトマ煮にしようかな……。
519022417595727872,2014-10-06 07:12:41,くっそお、最後まであきらめないもんね!
518992215364755456,2014-10-06 05:12:41,このままほっといて自分たちだけ先に進むっていうの?　わたしはできないわ。だって、あんなに助けてもらっておきながら……。
518962049712275456,2014-10-06 03:12:49,わたしだって冒険者のはしくれなんだ。よ、よおーし、こうなったら自分でなんとかするしかない!
518939984540086272,2014-10-06 01:45:08,今日のお昼は巻貝の酒蒸しね。
