id,created_at,text
498698514273038336,2014-08-11 05:12:45,んもー、いつまでそこで見てるのよ!　着替えるんだから、あっち行ってて!
498668316508954625,2014-08-11 03:12:46,ん……?　何か秘密の話?　ちょっとやめてよね、この忙しい時に告白とかするの。
498646268059459584,2014-08-11 01:45:09,今日のお昼は緑黄色野菜の煮込みね。
498638083584430081,2014-08-11 01:12:38,ええっ、ウッドゴーレム?　勝てそうにないよぉ……。
498607896116985856,2014-08-10 23:12:40,あのメナースとだったら、一緒にショッピングしたりお茶したりしても楽しそうだけど。
498456884999761920,2014-08-10 13:12:36,きゃあ、ジャイアントスパイダーゴン!　飛び道具部隊の出番ね!
498434872826814465,2014-08-10 11:45:08,今晩はちゃんとした宿だから、ノルも部屋で寝られるよ!
498426694739304448,2014-08-10 11:12:39,あの、ジュン・ケイはいないかしらん。
498396498808160257,2014-08-10 09:12:39,マイナスに考えてても、何も始まらない。お母さん、そうだよね!?
498374494847639553,2014-08-10 07:45:13,今日の晩御飯はとろけるチーズ入りライスップリにしようかな……。
498366299739672576,2014-08-10 07:12:39,おいおいリーダーだろお?　もちっと持ち歩かんかい!
498305903406235650,2014-08-10 03:12:40,どうして、この人はいちいちカチンとくる言い方をするのかね。
498283880260988928,2014-08-10 01:45:09,今日のお昼は蟹とハイサクのとろみ和えね。
498275694703423488,2014-08-10 01:12:37,んもう、ウジャジャだかガジャジャだか知らないけど、あんなにたくさん倒せないよ!
498245502186422272,2014-08-09 23:12:39,あんなに骨折り損のくたびれもうけしたのに、トラップったら、忘れちゃったの?
498094503165571074,2014-08-09 13:12:38,で、出たぁ、ガラビアスライム!　ルーミィ、コールドの魔法!
498072485359665152,2014-08-09 11:45:08,今晩はちゃんとした宿だから、ノルも部屋で寝られるよ!
498064320681345024,2014-08-09 11:12:42,げげ、わたしがメイドの格好するの?
498034144136269825,2014-08-09 09:12:47,わたしっていったい何の役に立ってるんだろ。マッパーとかいって方向音痴だしな。こんな普通の町中で迷っちゃうんだもの。
498012087784722432,2014-08-09 07:45:09,今日の晩御飯はキノコと木の実のソテーにしようかな……。
498003914885578752,2014-08-09 07:12:40,ノルってすごいもん持ってんのねー!
497973723232600064,2014-08-09 05:12:42,なんだ。トラップなの??　どうしたのよ、びっくりするじゃない。いつ帰ってきたの??
497943532749860865,2014-08-09 03:12:44,クレイがまたこいつ、寝ぼけるんだよなぁ。
497921492194041856,2014-08-09 01:45:09,今日のお昼はソーセージ入りのキャベツスープね。
497913309723508736,2014-08-09 01:12:38,わ、わかったわよ。やりゃあいいんでしょ、やりゃあ!
497883120360644610,2014-08-08 23:12:40,うう、ブラックリザードマンもレッドリザードマンもいる……。気付かれないうちに逃げよう?
497732104231219200,2014-08-08 13:12:35,んあぁー、ここにキットンがいてくれれば!!　いや、せめて彼のモンスターポケットミニ図鑑がここにあれば!!
497710098878193665,2014-08-08 11:45:09,今日はシルバーリーブの家で寝るんだ。自分たちの家って、やっぱりいいよね!
497701921558245376,2014-08-08 11:12:39,ノルってすごいもん持ってんのねー!
497671718991704064,2014-08-08 09:12:38,キットンってけっこう、絵、上手なんだね。
497649700946722816,2014-08-08 07:45:09,今日の晩御飯はダグ肉の丸焼きにしようかな……。
497641519654764546,2014-08-08 07:12:38,やだぁ、ゾンビよ。ゾロだったらいいのになあ……。
497611320523386880,2014-08-08 05:12:38,ちょ、ちょっと休まない?
497581134918602753,2014-08-08 03:12:41,あれってサラスだよね?　弱点は……え?　鳥の羽根!?
497559103825129472,2014-08-08 01:45:09,今日のお昼は冷やしヌグね。
497550929772544000,2014-08-08 01:12:40,あれはドーラ!?　よーし、短剣で応戦するわ!
497520746470465536,2014-08-07 23:12:44,や、やっぱやめよ。どっか他からの回り道をさがそう!
497384828543569921,2014-08-07 14:12:38,トイレとかさ、あとお風呂とか、こういうのって女性の冒険者にとっては大問題なわけで。
497354646923407360,2014-08-07 12:12:42,きゃあ、スネークフライ。ルーミィ、ファイアーの呪文覚えてる?
497316926322798593,2014-08-07 09:42:49,ちょ、ちょっと休まない?
497287313517318144,2014-08-07 07:45:09,今日の晩御飯はミケドリアの唐揚げにしようかな……。
497279144137199616,2014-08-07 07:12:41,クレイもトラップもノルもキットンも、みんないい奴なんだけどそれぞれいろんなとこ、抜けてたりするでしょ。だいたい、全員お人好し過ぎるし金銭感覚全くないし。
497248930627727361,2014-08-07 05:12:38,っていうことは、知ってて、クレイに迷惑かけてるってこと?　つまり確信犯?　最低じゃん。
497218736881799169,2014-08-07 03:12:39,大変、キケロ鳥よ!
497196757827072000,2014-08-07 01:45:19,今日のお昼は一口サイズの肉団子ね。
497188537863647234,2014-08-07 01:12:39,ウソ。またクレイに不幸なことが!?
497158340342861826,2014-08-06 23:12:39,わざわざよりによって、んな気持ち悪いもんに会いに行くことはないじゃない!
497007347152060416,2014-08-06 13:12:40,わたしたちって、ほんと移動ばっかしてると思わない?
496985322362642432,2014-08-06 11:45:09,ダンジョンの中で野宿って、いまだに慣れないなあ。
496977149916508160,2014-08-06 11:12:40,この「ウォーマンモス・クロスボウ」で見事にしてめてみせるわ。
496946947102502912,2014-08-06 09:12:39,ここは冷静にマッピング……。なんてしてらんないよ、やっぱりぃぃ。
496924930374508544,2014-08-06 07:45:10,今日の晩御飯はミケドリアの串焼きにしようかな……。
496916758972751872,2014-08-06 07:12:42,オジサンがクレイを見て、ドキッとするってことはめったにないでしょ?　全くないかと言えば、えーと……それは、一度や二度はあったかもしれないけど。
496886543856836609,2014-08-06 05:12:38,ああぁぁぁもう!　だーから、呪文くらい暗記しなさいってあれほど……。
496856351323078656,2014-08-06 03:12:39,よけたのはてめぇだろうー?　トラップ。
496834326764351488,2014-08-06 01:45:08,今日のお昼は海産物のカナッペね。
496826145786953728,2014-08-06 01:12:38,どんだけ疑り深いのよ!
496795952640823299,2014-08-05 23:12:39,こうなりゃ意地でも、とことんやるだけやったろうじゃん!
496644953749979136,2014-08-05 13:12:38,早い話が、好奇心が勝ったってことね。まあ、対好奇心じゃ連戦連敗なんだけどさ。
496622934543200256,2014-08-05 11:45:09,今日も野宿かぁ。お風呂に入りたいなあ。
496614761719549952,2014-08-05 11:12:40,やっぱりノルって、すごいなぁ。わたしには絶対に真似できない。
496584554891603968,2014-08-05 09:12:38,顔見て、いきなり大爆笑って……そりゃないだろ。
496562540051066880,2014-08-05 07:45:09,今日の晩御飯はミケドリアの蒸し焼きにしようかな……。
496554363309936640,2014-08-05 07:12:40,見損なって……って。アンジェリカ……。
496524149066448896,2014-08-05 05:12:36,よけたのはてめぇだろうー?　トラップ。
496493963008679936,2014-08-05 03:12:39,ま、ま、まっずぅい!　マッピング、すっかり忘れてたよ。
496471939406258176,2014-08-05 01:45:09,今日のお昼はキノコの天ぷらね。
496463759682985984,2014-08-05 01:12:38,くっそお、最後まであきらめないもんね!
496433571452563457,2014-08-04 23:12:41,クレイのバカカバオタンチン!
496282563883696128,2014-08-04 13:12:38,これが本当のひっくりカエル、なんちゃって。……うー、くだらない。
496260544421056513,2014-08-04 11:45:08,今日も野宿かぁ。お風呂に入りたいなあ。
496252368422322176,2014-08-04 11:12:39,だってだって、宝の地図なんだよ?
496222171794903040,2014-08-04 09:12:39,マリーナって、つくづく意志が固いんだな。わたしとは大違いだ。
496200147328450561,2014-08-04 07:45:08,今日の晩御飯はミケドリアのパイ包み揚げにしようかな……。
496191981211500544,2014-08-04 07:12:41,ほんとクレイって根気あるなぁ。
496161769954365440,2014-08-04 05:12:38,二頭を追う者は一頭も得ずと言うじゃない?　あら知らない?　欲張って牛二頭を追いかけてたら、一頭も捕まえられなかったっていうことわざよ。
496131580234964992,2014-08-04 03:12:41,げ、フライニュイット……。なめくじみたいで気持ち悪いよー。
496109554485043200,2014-08-04 01:45:09,今日のお昼は焼きハマリタね。
496101380675731457,2014-08-04 01:12:40,あれはドーラ!?　よーし、短剣で応戦するわ!
496071179912757248,2014-08-03 23:12:40,わたしがレイスになったときの、最初の犠牲者は決まりだな。
495920174030000128,2014-08-03 13:12:37,あ、ムウオムよ。シロちゃん、食べる?
495898160699408384,2014-08-03 11:45:09,今日はここで野宿だね。ふかふかのベッドで寝たいなあ。
495889989595443200,2014-08-03 11:12:41,ええっ、ウッドゴーレム?　勝てそうにないよぉ……。
495859790686351360,2014-08-03 09:12:41,わたしだって、さっきからさんざん励ましてるんですけどねーっだ。
495837758745628672,2014-08-03 07:45:08,今日の晩御飯はドルチェのフライにしようかな……。
495829604087513088,2014-08-03 07:12:44,トラップが冷たいのはいつものことだけど、それにしても素っ気なさすぎない?
495799390368321537,2014-08-03 05:12:40,そりゃ、わたしたちみたいなレベルじゃ、クラーケンなんて十年早いけどさぁ。
495769194864996352,2014-08-03 03:12:41,こういうところが、人がいいっていうか、良すぎるっていうか。ま、でも、そこがクレイのいいところなんだもんね。
495747167357657088,2014-08-03 01:45:09,今日のお昼は食パンケーキね。
495738991472160768,2014-08-03 01:12:40,やっぱりノルって、すごいなぁ。わたしには絶対に真似できない。
495708804265160704,2014-08-02 23:12:43,でも、ほんとのとこ、トラップがわたしたちのことを結構真剣に気にしてくれてるの、わかってるからね。
495557796968947712,2014-08-02 13:12:40,くっそお、最後まであきらめないもんね!
495535771151896577,2014-08-02 11:45:09,今日はいつものみすず旅館。安いから助かるわ。
495527599888539649,2014-08-02 11:12:40,オジサンがクレイを見て、ドキッとするってことはめったにないでしょ?　全くないかと言えば、えーと……それは、一度や二度はあったかもしれないけど。
495497400983629824,2014-08-02 09:12:40,トラップ、性懲りもないわね。またギャンブルで……なんて思ってるでしょ。ダメだからね、ダメダメ!!
495475373472088065,2014-08-02 07:45:09,今日の晩御飯はとろけるチーズ入りライスップリにしようかな……。
495467209292910592,2014-08-02 07:12:42,そうポカポカ叩くとねー、悪い頭がもっと悪くなるでしょ?
495437003014410240,2014-08-02 05:12:40,あーら、トラップ。そう言いますけどね。わたしたちって今、すっごい借金抱えてるのよ。
495406840478314496,2014-08-02 03:12:49,扉に耳あり窓に目ありって言うでしょ?
495384779806621696,2014-08-02 01:45:09,今日のお昼はカンピラのマヨネーズピリピリ和えね。
495376598552440833,2014-08-02 01:12:39,ま、ま、まっずぅい!　マッピング、すっかり忘れてたよ。
495346411097948160,2014-08-01 23:12:42,や、やだ!　そんなあ、これいくらしたと思ってるのよ?　いやよー。
495195406502871040,2014-08-01 13:12:39,やだぁ、ウージョが現れたよ。あいつらって、歌が弱点だっけ?
495173380014751744,2014-08-01 11:45:08,今日はお屋敷に泊めてもらえるんだよね。ふふっ。
495165210236157953,2014-08-01 11:12:40,あーあ、きょうはお風呂に入れると思ったのになぁ。
495135012082040832,2014-08-01 09:12:40,時にはちょっと無理するぐらいじゃないと人間、進歩しないんじゃない?
495112985476485120,2014-08-01 07:45:09,今日の晩御飯はミケドリアのパイ包み揚げにしようかな……。
495104822425554944,2014-08-01 07:12:42,所詮、人生とはそういうもんだ。
495074611088728064,2014-08-01 05:12:39,ジャイアントビーだ!　早く地面に伏せなきゃ!
495044420111065089,2014-08-01 03:12:41,これが本当のひっくりカエル、なんちゃって。……うー、くだらない。
495022388774330368,2014-08-01 01:45:09,今日のお昼はホットドッグね。
495014218416939008,2014-08-01 01:12:41,ルーミィ、シロちゃんがほら、苦しがってるよ。
494984027707678721,2014-07-31 23:12:43,じゃ、やっぱりこのままにしておくわけにはいかないよ!　でしょ?　トラップ!　寝てんじゃないの。聞いてよ!
494833018578563072,2014-07-31 13:12:39,いや、あわてないで、パステル。落ち着いてよーく考えるのよ。
494811006250385409,2014-07-31 11:45:11,今日は安宿だけど、屋根があるだけましだよね。
494802821762801665,2014-07-31 11:12:40,おいおいリーダーだろお?　もちっと持ち歩かんかい!
494772625059491842,2014-07-31 09:12:40,あれってボッシュ族?　もう、プロポーズとか嫌だからね!
494750600714670081,2014-07-31 07:45:09,今日の晩御飯は新ジャガと鶏肉のヨーグルト煮にしようかな……。
494742451744030723,2014-07-31 07:12:47,まず、こっちを右のはずで……行き止まりになってるところにドアがあるはずで……。
494712237529894912,2014-07-31 05:12:43,そうね。でも、お弁当、もったいないし。昼食代も、もっともったいないし。
494682045885317123,2014-07-31 03:12:45,シビレクラゲだ!　こいつに刺されると痛いんだよね。
494660007443456001,2014-07-31 01:45:10,今日のお昼はコーボーとレンホーソーのサラダね。
494651849136287744,2014-07-31 01:12:45,ええっ、レイス!?　トマスもいないのにどうすれば……。
494621652865404928,2014-07-30 23:12:46,あーら、トラップ。そう言いますけどね。わたしたちって今、すっごい借金抱えてるのよ。
494470649931255809,2014-07-30 13:12:44,わざわざよりによって、んな気持ち悪いもんに会いに行くことはないじゃない!
494448610025541632,2014-07-30 11:45:09,今日はシルバーリーブの家で寝るんだ。自分たちの家って、やっぱりいいよね!
494440451609337857,2014-07-30 11:12:44,コイツもこわいけどトラップもこわい。
494410241845366785,2014-07-30 09:12:42,ついに底をつきやぶってたんだわ!
494388211267813376,2014-07-30 07:45:09,今日の晩御飯はミケドリアの木の実詰めにしようかな……。
494380053996634113,2014-07-30 07:12:44,スケルトンだ!　腰骨、狙って!　え?　ルーミィ、きゅぎーってなあに?
494349844517883904,2014-07-30 05:12:42,怖いよぉ。何が怖いって、キットンの顔が。
494319661182226432,2014-07-30 03:12:45,マイナスに考えてても、何も始まらない。お母さん、そうだよね!?
494297617749135361,2014-07-30 01:45:10,今日のお昼はサーザンのつぼ焼きね。
494289448805224451,2014-07-30 01:12:42,あ、でもギアは「サイコロ……なんとかウォーマンモス」って、すぐに言ったじゃない?
494259252790173696,2014-07-29 23:12:43,がぜんファイトがわいてきちゃったじゃん。
494108278461190145,2014-07-29 13:12:48,もう、寝ぼけるのもいい加減にしてよね!　誰そのエマって!!
494086218376687618,2014-07-29 11:45:08,今日はこの洞穴で寝るしかないね。モンスターとか来ませんように……。
494078074049142784,2014-07-29 11:12:47,でも、でも!　えーん、やっぱし「お願い」のこと、知ってたらなあ……!!
494047854462119936,2014-07-29 09:12:42,そうね。でも、お弁当、もったいないし。昼食代も、もっともったいないし。
494025820378103808,2014-07-29 07:45:08,今日の晩御飯はドルチェのフライにしようかな……。
494017662687535106,2014-07-29 07:12:43,最近、わたしも時々、自分っていったいなんだろう?　なんて思うことがある。たぶん、存在証明みたいな……そんなこと。
493987445847773184,2014-07-29 05:12:39,誰かに頼りにされてるって、いいもんだね。
493957257260830720,2014-07-29 03:12:42,そ、それにしても……ブラちゃんってのは……。
493935225534029824,2014-07-29 01:45:09,今日のお昼は食パンケーキね。
493927056124559360,2014-07-29 01:12:41,偉そうに毒づいてたのは、どこのどなたさまでしたっけねぇ。
493896865083977728,2014-07-28 23:12:43,家計を預かる身とはいえ、まだ十七なんだぞ。なんかだんだん所帯じみてきてないか?
493745891157622784,2014-07-28 13:12:48,出た、マグマン!　は、早く逃げよう!
493716767861010433,2014-07-28 11:17:04,まず、こっちを右のはずで……行き止まりになってるところにドアがあるはずで……。
493700123315011586,2014-07-28 10:10:56,@mishiofukazawa あの、一緒に食べよ?
493687133425520642,2014-07-28 09:19:19,大変、キケロ鳥よ!
493663431656890368,2014-07-28 07:45:08,今日の晩御飯はタホタ貝のバター焼きにしようかな……。
493655316886609920,2014-07-28 07:12:53,わたしだって願い下げよ。あんたみたいなトラブルメーカーとなんか、命がいくつあったって足りやしないわよ!
493626491540754432,2014-07-28 05:18:21,うそ、わたしに道、聞くの?
493595253320859648,2014-07-28 03:14:13,怖いよぉ。何が怖いって、キットンの顔が。
493572838985433088,2014-07-28 01:45:09,今日のお昼はパステル風アラスカパンね。
493564652647747585,2014-07-28 01:12:37,ああぁぁぁもう!　だーから、呪文くらい暗記しなさいってあれほど……。
493534465151365121,2014-07-27 23:12:40,っていうことは、知ってて、クレイに迷惑かけてるってこと?　つまり確信犯?　最低じゃん。
493361454729281537,2014-07-27 11:45:11,今日は安宿だけど、屋根があるだけましだよね。
493353249571758080,2014-07-27 11:12:35,ルーミィ、もうすぐ御飯だから我慢しようね。
493323042706059264,2014-07-27 09:12:33,あ、クレイ!　聞いて聞いて。トラップったらねえ、ワナだとも知らずに何回も宝箱を……。
493301041547329536,2014-07-27 07:45:08,今日の晩御飯はニグルのレモン漬けにしようかな……。
493292856560209920,2014-07-27 07:12:36,時にはちょっと無理するぐらいじゃないと人間、進歩しないんじゃない?
493262655734292481,2014-07-27 05:12:36,上から落ちたら痛いとか、死ぬとか、そういう常識にとらわれてるから、わたしたちは今恐いんだと思う。
493232452131758081,2014-07-27 03:12:35,んもう、うそ!　で、なんなのよ。何の用?　せっかくこれからミケドリアの串……。
493210469084041216,2014-07-27 01:45:13,今日のお昼は冷やしヌグね。
493202246117515267,2014-07-27 01:12:33,わたしっていったい何の役に立ってるんだろ。マッパーとかいって方向音痴だしな。こんな普通の町中で迷っちゃうんだもの。
493172061104132097,2014-07-26 23:12:36,いいよね。お財布が充実してるって。
493021050280488960,2014-07-26 13:12:32,うまくできるかどうか自信はないけど、一応、お裁縫は習ってたもんね。
492999054746320896,2014-07-26 11:45:08,今日は安宿だけど、屋根があるだけましだよね。
492990872665870336,2014-07-26 11:12:38,ふんだ!　もう知らんもんね。
492960663593951232,2014-07-26 09:12:35,あれは……ロックマンウッド!　早く逃げなきゃ!
492952704927293441,2014-07-26 08:40:58,@KanoffTaurus こっちはそうでもないよ?　しっかり水分補給してね。
492938660635897856,2014-07-26 07:45:09,今日の晩御飯はミミウサギの串焼きにしようかな……。
492900265796698114,2014-07-26 05:12:35,これがあれば当分……いや、一生遊んで暮らせる。もうお財布の心配しなくていい……。はっっ、私は何を!?
492870066841456640,2014-07-26 03:12:35,もう!　やめてよ。金目の物って言ったらわたしたちの武器くらいしかないんだからね。
492848061182275585,2014-07-26 01:45:09,今日のお昼はポテト＆キウリの冷たいスープね。
492839860298731520,2014-07-26 01:12:33,ついに底をつきやぶってたんだわ!
492809680729567232,2014-07-25 23:12:38,困ったなぁ。方向感覚がないのは自信あるんだけど……。
492658664377815041,2014-07-25 13:12:33,キットンったら、いつからお風呂に入ってないんだろうか。
492636673818099713,2014-07-25 11:45:10,今日も野宿かぁ。お風呂に入りたいなあ。
492628474746531840,2014-07-25 11:12:35,でも、ほんとだ。薄情かも、わたしって。
492598271894757376,2014-07-25 09:12:34,やだなぁ。んなの、キットンらしくないじゃない。キットンはキットンらしく、いつもマイペースなのが一番だって!
492576267649048576,2014-07-25 07:45:08,今日の晩御飯はモカ鳥と白ネギの串焼きにしようかな……。
492568075401564161,2014-07-25 07:12:35,この「ウォーマンモス・クロスボウ」で見事にしてめてみせるわ。
492537877171949569,2014-07-25 05:12:35,ふんだ!　もう知らんもんね。
492507705106378752,2014-07-25 03:12:41,顔見て、いきなり大爆笑って……そりゃないだろ。
492485691029192707,2014-07-25 01:45:13,今日のお昼はグフグフのナッツソテーね。
492477486806990850,2014-07-25 01:12:37,ゾンビが顔を輝かせると、かえって怖いって知ってた?
492447307733172224,2014-07-24 23:12:42,シビレクラゲだ!　こいつに刺されると痛いんだよね。
492296274813534208,2014-07-24 13:12:33,このガキ……いや失礼、このお嬢様、けっこうやるじゃん。
492274277983322112,2014-07-24 11:45:08,今日も野宿かぁ。お風呂に入りたいなあ。
492266088697044994,2014-07-24 11:12:36,ん……?　何か秘密の話?　ちょっとやめてよね、この忙しい時に告白とかするの。
492235884637335553,2014-07-24 09:12:34,キットン、あなたにだけは言われたくないわ、そういうこと。
492213886804701185,2014-07-24 07:45:10,今日の晩御飯は根野菜とミケドリアのマトマベースシチューにしようかな……。
492205698902552577,2014-07-24 07:12:38,あ、ムウオムよ。シロちゃん、食べる?
492175495966896130,2014-07-24 05:12:37,あら、失礼な。ちゃんと外して射るわよぉ。
492145297246539776,2014-07-24 03:12:37,あーら、トラップ。そう言いますけどね。わたしたちって今、すっごい借金抱えてるのよ。
492123303633383425,2014-07-24 01:45:13,今日のお昼は手長エピとグリーンアスッパラのピラフね。
492115085930672128,2014-07-24 01:12:34,そのすがるような目!　たまらんぜよ。
492084900464304128,2014-07-23 23:12:37,わたしが経験値稼げるなんて、そんなチャンスめったにないんだぞ。
491933889221255168,2014-07-23 13:12:33,あーら、トラップ。そう言いますけどね。わたしたちって今、すっごい借金抱えてるのよ。
491911892164567041,2014-07-23 11:45:09,今日はシルバーリーブの家で寝るんだ。自分たちの家って、やっぱりいいよね!
491903728392232960,2014-07-23 11:12:42,ちょ、ちょっと休まない?
491873498218758144,2014-07-23 09:12:35,うそでしょ?　迷ったなんて言わないよね?
491851497651441667,2014-07-23 07:45:09,今日の晩御飯は川魚のムニエルにしようかな……。
491843303369764865,2014-07-23 07:12:36,そんなの、改めて言われなくたってわかってらい!
491813101075849217,2014-07-23 05:12:35,わたしは時々無性にクレイのことが不憫でしかたなくなるんだ。
491782904372928512,2014-07-23 03:12:35,毛糸のパンツはいてて、よかったぁ。
491760900399837184,2014-07-23 01:45:09,今日のお昼はミズキノコのマリネね。
