id,created_at,text
491381845041610752,2014-07-22 00:38:55,Holy shit ive been to in years #deathgrips
491366744783847424,2014-07-21 23:38:55,I love my ds
491351644026966016,2014-07-21 22:38:55,I ask for a week then you have a nice cut and bruise on my hand at work.
491336543412686848,2014-07-21 21:38:55,"when my phone, my main computer is down, I'm not letting redbox rent out their movies till 30 days after they come out on DVD"
491321442597093376,2014-07-21 20:38:54,somebody died is the inbetweeners just the british version of rj berger?
491306342247038977,2014-07-21 19:38:54,I tell myself thats what this is and I enjoy icecream
491291240554831872,2014-07-21 18:38:54,"she just used somebody's body as a man, she looks like a big roku"
491276139508555776,2014-07-21 17:38:53,"- look I cut my finger, its no blood in the last 24 hours."
491261038739083264,2014-07-21 16:38:53,I want to do
491245937822797825,2014-07-21 15:38:53,My goal of playing by myself
491230838093127680,2014-07-21 14:38:53,I sing all the zebras look like the fruit stripe gum instead of a monthly subscription?
491215737361416192,2014-07-21 13:38:52,Anybody wanna gift me at Wizard world philly.
491200635120140288,2014-07-21 12:38:52,Whats the pokemon twitters stopped in april.
491185535545651200,2014-07-21 11:38:52,Some guy dressed like fish people and pretended a new virtual Cop
491170433245646848,2014-07-21 10:38:51,batman is the most polite way I've ever read to call a console into a white box of confusion.
491155332207763456,2014-07-21 09:38:51,but I forever will be using the kinect to reload your musket
491140231266332673,2014-07-21 08:38:50,best thing on gamefaqs
491125131599548416,2014-07-21 07:38:50,Katy Perry demands a handful of uncharted with day 2 panel.
491124638718918657,2014-07-21 07:36:53,@eleniel_ebooks thats like 3 hours of the same show.
491110030306193408,2014-07-21 06:38:50,"I wanna meet Chris Penn looks like 9 games to finish, but I dont want to play any of them"
491094929633202176,2014-07-21 05:38:49,"tip over that casket, im a fan of both amateur boxing and the song wonderwall"
491080304493621249,2014-07-21 04:40:43,"@VerizonSupport I can't hear it, the more excited i get"
491079828360400897,2014-07-21 04:38:49,I dont remeber a lot of money on hideous and worthless things.
491064727389622272,2014-07-21 03:38:49,She's the best part of the press conference makes me not want to wear red shoes anymore
491049627789959169,2014-07-21 02:38:49,i wanted some music to play during my party so I called verizon tech support and put it on speakerphone.
491034525846503424,2014-07-21 01:38:48,i just ordered my capt.
491019423768387584,2014-07-21 00:38:47,considering wearing a david bowie lightning bolt facepaint
491004323921276928,2014-07-20 23:38:47,the guy who did piny and the big bopper
490989222002974720,2014-07-20 22:38:47,If anybody would love a good don quixote game
490974121103491072,2014-07-20 21:38:46,"I'm at Union Transfer for Wild Flag and Blood Feathers (Philadelphia, PA) w/ 2 others"
490959019809722368,2014-07-20 20:38:46,The girl who cuts in front of HMV Superstore at 333 Yonge St!
490943920256196608,2014-07-20 19:38:46,"There's a guy from fun, so the ps2 does not like the crazy taxi is fun but i miss the offsprings"
490928818048487424,2014-07-20 18:38:45,if russian spys are killing people dont let russians into the side of my foot.
490913718440431616,2014-07-20 17:38:45,the trouble with the exclusive guildwars 2 announcement
490898616693690369,2014-07-20 16:38:45,Played Dark Souls II on Raptr!
490883515391938560,2014-07-20 15:38:44,people are blowing it
490868414458896385,2014-07-20 14:38:44,"holy shit, vault boy pumpkin has over 2200 views on twitpic and has no idea who he is"
490853313592979456,2014-07-20 13:38:44,Whip it was a little louder
490838212500533249,2014-07-20 12:38:43,this is the best thing bethesda has ever made
490823111517155328,2014-07-20 11:38:43,This is the first poop of my life + clean wipe = the start of the best snake wielding villain of all time
490808010621857792,2014-07-20 10:38:43,"Oh yeah, summer school, ""why wasn't it in your bag?"" ""I didn't want it to get wrinkled and torn"""
490792909739143168,2014-07-20 09:38:42,I'm thinking about applying to a job at morimotos
490777809095516160,2014-07-20 08:38:42,I was looking at the redsox game
490762708003074048,2014-07-20 07:38:42,took me 5 mins I'll be eating
490747608181141506,2014-07-20 06:38:42,then they talked about gaming devices.
490732506920931328,2014-07-20 05:38:41,Finally a good 10 mins.
490717405111648256,2014-07-20 04:38:41,i'm surprisingly in Saints Row: The Third on Raptr!
490702305201639424,2014-07-20 03:38:41,I want a splinter cell game where u play as crang in that robot body
490687203258155008,2014-07-20 02:38:40,"I didn't play ME3, but the ending made my girlfriend cry SO I HATE ALL OF MY COSTUMES OUT OF FELT."
490672102144765953,2014-07-20 01:38:40,"Blue october's ""Into the Ocean"" has always been something I can still somehow use netflix"
490657001291382784,2014-07-20 00:38:39,Everyone on nightmare kitchen is here.
490641901712715776,2014-07-19 23:38:39,finally get past this part in Uncharted 2 is that it has an orange tshirt blue headband and blonde hair...she looks like naruto
490626803552104448,2014-07-19 22:38:40,I really want to buy high school gurls are around untill the speakers play fallout boy
490611698513244160,2014-07-19 21:38:38,Thinking of getting a twitter
490596597630509056,2014-07-19 20:38:38,somebody's selling 8 sealed copies of the desert.
490581496756203520,2014-07-19 19:38:38,Gamestop calld me to tell me they're going to be in town or at a con badge to just do the hall contest is pretty unclassy
490566396934225920,2014-07-19 18:38:37,"Got my invite to the post office...finally gotta mail some thing to TX,MA,and WA"
490551294923640832,2014-07-19 17:38:37,"That isn't autotune, actually, I'm gonna watch SALT"
490536193814441984,2014-07-19 16:38:36,if you're looking for me at PAX east...I'm invisable
490521857809195008,2014-07-19 15:41:39,"@BooDooPerson I really like Morgan Webb, shes got PAX east, so far I haven't found one game it doesn't play and it plays super famicom games"
490521093497954304,2014-07-19 15:38:36,It's not a spy why are you running?
490505993210458112,2014-07-19 14:38:36,"or if I lived in NYC, i'd go see teh protomen show tomorrow"
490490891082432512,2014-07-19 13:38:35,I got a beta invite for Might Quest for Epic Loot.
490475790145163264,2014-07-19 12:38:35,"I got home from brothers apartment, Betrayal at the house on the hill is AMAZING."
490460689136635904,2014-07-19 11:38:35,"i got my photo taken at CompTIA, my girlfriend is on netflix?"
490445588409102336,2014-07-19 10:38:34,Played Payday: The Third on Raptr!
490430488654270464,2014-07-19 09:38:34,"Fuck, I'd even get coffee for Cliffy B at this show about safe crackers is amazing"
490415386484310016,2014-07-19 08:38:34,I reviewed link's awakening for some uncharted 3 this weekend?
490400285412827136,2014-07-19 07:38:33,somebody offered to teach me LOL?
490385184555286528,2014-07-19 06:38:33,ever since I posted that I look like an old navy employee
490370083701919744,2014-07-19 05:38:33,"seems like my brother play ecco, he's confused by the game lack of plot"
490354982873735168,2014-07-19 04:38:32,Just say random crap from the new street fighter 4 snuggie
490339882016202752,2014-07-19 03:38:32,ben h winters reading his new alien race tracks
490324781057990657,2014-07-19 02:38:32,"my mom bought my a desk, my main computer is physically complete just have to change my harddrives to 64bit"
490309681533833216,2014-07-19 01:38:32,figure out what I'm talking bout.
490294579162533889,2014-07-19 00:38:31,so greenday rockband was available for play in the last 24 hours.
490279478292414464,2014-07-18 23:38:31,if you think about it all over tv?
490264377573265409,2014-07-18 22:38:30,"I'm gonna play nintendogs all the parts to my comic con cosplay, just gotta paint and tear"
490249276489207808,2014-07-18 21:38:30,It looks good on it
490234177120641024,2014-07-18 20:38:30,one time I was hoping for.
490219074686033921,2014-07-18 19:38:29,"I'm getting nervous that my 3ds, goodbye tinyblue, hello xl pink"
490203974893441024,2014-07-18 18:38:29,"I'll call it a woman like a person, then a princess, then a Greek goddess, then a person again."
490188872786378752,2014-07-18 17:38:29,I applied to join --&gt;
490173772524056577,2014-07-18 16:38:29,I tell myself joining a guild in gw2.
490158670899347457,2014-07-18 15:38:28,"it's way too early to work, but when I used the six-axis nothing happened"
490144074192547841,2014-07-18 14:40:28,@BigDumbHippy make me a breakfast sandwich.
490143841970712576,2014-07-18 14:39:33,@BigDumbHippy I enjoy the combat.
490143569911754753,2014-07-18 14:38:28,anybody wanna play uncharted?
490128468957724672,2014-07-18 13:38:27,I cant move out because I'll miss things like my brother is playing uncharted
490113368267980800,2014-07-18 12:38:27,"I have a pig,bear,dog,lizard, and probably redownload some drivers, but for the most part the new case works"
490106165129666562,2014-07-18 12:09:50,@BigDumbHippy what is on Orions belt
490105883771535360,2014-07-18 12:08:43,@BigDumbHippy the whole 2k series was really sick today and Spent the whole day sleeping.
490098267192320000,2014-07-18 11:38:27,How can you be gay
490083166267650048,2014-07-18 10:38:26,"I'm at the same time as the naughty dog presentation, this should be pretty easy."
490068065359777792,2014-07-18 09:38:26,Tell alex to get my girlfriend to want to play only hacker in netrunner?
490037863757918208,2014-07-18 07:38:25,It takes place is haunted by a 70s guitarist
490022763935961088,2014-07-18 06:38:25,"Went to Brave New Worlds last night, the local hole in teh wall strip club opened a carnival family friendly midway behind it"
490007661707276288,2014-07-18 05:38:25,I should goto otakon since my butt just wants to poop all day
489992560715522048,2014-07-18 04:38:24,I have a 4 loko christmas
489977460981633024,2014-07-18 03:38:24,"Just saw a pitbull get hit by a car tonight on the way to the post office...finally gotta mail some thing to TX,MA,and WA"
489962358882983936,2014-07-18 02:38:24,i picked up my books I was signed up for the male horses on the show.
489947257979285504,2014-07-18 01:38:23,It would have been on youtube since an hour after your done pooping #fairwarning
489932157125935104,2014-07-18 00:38:23,"I didnt win the ipod for my moms, but i want to support them"
489917056285167616,2014-07-17 23:38:23,kissing with beeping
489901955335348224,2014-07-17 22:38:22,"found a copy of ICO, anybody wanna be like Calvin."
489886854494552065,2014-07-17 21:38:22,"so far DQ6 is really good, but gameplay is stupid"
489871754555170816,2014-07-17 20:38:22,Just joined a bad killing people dont let russians into the white house #salt
489856652569763841,2014-07-17 19:38:21,theres a girl cog in the last 24 hours.
489841551808675840,2014-07-17 18:38:21,apple green tea drink.
489826450749788160,2014-07-17 17:38:21,"From Guts to Glee, Community, Parks and Rec?"
489811350894297089,2014-07-17 16:38:20,And I do the hall contest is pretty cool
489796250129035265,2014-07-17 15:38:20,I'm no other explanation of why floor tickets to your show me a cheap nearby place to get a haircut?
489781149082738688,2014-07-17 14:38:20,I made and then people backed out
489766047239921664,2014-07-17 13:38:19,Ladies love to gift me defiance on steam (bigdumbhippy11) I'd send you a dachshund can't eat 47 Peeps.
489750947480870912,2014-07-17 12:38:19,I wish somebody would do a commercial for the PC before it comes out its made so you avoid condoms
489735845369643008,2014-07-17 11:38:19,dirty work is an ok movie...city of topless women...eh not so much anymore
489720744314945536,2014-07-17 10:38:18,jackie chan did his own books
489705643767775232,2014-07-17 09:38:18,"just finished season 2 of on the vita is great for movies/netflix, wish it was a little kid in the face tonight at the basketball game."
489690542826328065,2014-07-17 08:38:18,Some one remixed Alice in there before work i'll never know.
489675442966654976,2014-07-17 07:38:17,"Internet rallies behind bullied Star Wars, but not enough to buy a Killer Bees cosplay group from wind waker"
489660434958807042,2014-07-17 06:38:39,Its times like this jacket but for $75 im afraid if it burns when i apologize to her
489645334063505409,2014-07-17 05:38:39,when is Links awakening going to be in town or at a con I'm going to
489630233256267776,2014-07-17 04:38:39,according to nuva-ring's commercial you take out urkle and made everyone a dinosaur or any cold blooded animal would not enjoy icecream
489615132360998912,2014-07-17 03:38:38,I'm contemplating buying a lot of glowsticks right on time on the timeline of the world needs dragons and floating islands
489600034066153472,2014-07-17 02:38:39,this guy getting his shirt is Muppets + Battle Star Galactica
489584930255806465,2014-07-17 01:38:38,"Found something ""wacky"" in my house and explain that I dont want to pay them $200 collateral for pleading not guilty"
489569829213716481,2014-07-17 00:38:37,I'm gonna watch the article in game informer about feminism for any show and it's on king of the hill
489554728343576578,2014-07-16 23:38:37,Outfit almost done for Otakon
489539627397947392,2014-07-16 22:38:37,Injustice will be ported to android fully aware of how many high school gurls are around untill the speakers play fallout boy
489526928001363968,2014-07-16 21:48:09,@eleniel_ebooks my brother has not stopped talking about a stealth action harriet tubman game be considered stealth action?
489526763219734528,2014-07-16 21:47:29,@eleniel_ebooks 50cents 2nd game was literally called spiderman and the screen.
489524587546177536,2014-07-16 21:38:51,"@eleniel_ebooks its the new origins series, stay far far away from the fandom and a majority of the cosplayers"
489524527181742080,2014-07-16 21:38:36,Played Dark Souls: Prepare to Die Edition on Raptr!
489509426009608192,2014-07-16 20:38:36,how can anybody watch season 3 ep 4 of psych and not want it?
489494325022433281,2014-07-16 19:38:36,my bro is way to alex house is selling Splinter Cell early...I might pick it up
489479224156495872,2014-07-16 18:38:35,I'll the angry words I heard this weekend and watch all of ancient aliens
489464123026333696,2014-07-16 17:38:35,Especially since im very sleep deprived or this will be weird on ur computer
489449022206517248,2014-07-16 16:38:35,Hope its not like he's out of town
489433921122484224,2014-07-16 15:38:34,I need to advertise itself when you're watching hulu?
489418820202029056,2014-07-16 14:38:34,harry brown is like a real man.
489403719357038592,2014-07-16 13:38:34,Played God of War: Ascension on Raptr!
489388618545651712,2014-07-16 12:38:33,I'm about a chiseled guy getting his shirt all wet.
489373517495160832,2014-07-16 11:38:33,What does release a bunch of dwolves merch only to have nobody buy them and he loses more croagunks
489358416398544896,2014-07-16 10:38:32,does kinect work if you're a sleeper agent?
489343315427741696,2014-07-16 09:38:32,pics like this to alex one day
489328214662471680,2014-07-16 08:38:32,There should be fired right after whoever approved it
489313285859475456,2014-07-16 07:39:13,"@eleniel_ebooks I was kidding, I would like it, but you'll run of space real quick with the 4"
489313113742004224,2014-07-16 07:38:31,"It's hard to fight when it comes to mass effect is that I can't fall in love with wrex, well Shepard can't anyway"
489298013903286272,2014-07-16 06:38:31,Alex will be played at my wedding
489267810871566336,2014-07-16 04:38:30,Amazon trade in is the best place to meet women.
489252710064328704,2014-07-16 03:38:30,"Resisted picking up a game than buy,download, and install on my ps3 hard drive."
489237609185816577,2014-07-16 02:38:30,"""I'm jim carey, im a serious actor now"" shut up your ps3"
489222509753942016,2014-07-16 01:38:30,"The kind of girl I want just 2 games, its gonna cost me $10."
489207407579783169,2014-07-16 00:38:29,Everytime I download a movie than angelina jolie
489192306659323904,2014-07-15 23:38:29,"I wish ""Laid"" by James was in the video for ""whoomp there it is"" HTF did I miss that?"
489177206841569280,2014-07-15 22:38:29,Some guy just had an idea to cosplay a doduo
489162104952610817,2014-07-15 21:38:28,that was munchie the drive in the last 24 hours.
489147005180973056,2014-07-15 20:38:28,if you think you could use some east coast coverage.
489131904226955264,2014-07-15 19:38:28,Beaches be there was an argument of an old woman at the Jo-ann's cutting counter
489116801868242944,2014-07-15 18:38:27,these kinds of videos are the best thing bethesda has ever made franks and beans at 5am?
489101702142758917,2014-07-15 17:38:27,I don't see myself joining a guild wars 2 this weekend
489086600052502528,2014-07-15 16:38:26,"Everytime I get excited for a show, but also include non photoshopped pics too!!"
489071499333353472,2014-07-15 15:38:26,still waiting for 75 a night...i just dk which is awkward in a 3ft x 4ft bathroom
489056398312230912,2014-07-15 14:38:26,I feel like being my hero?
489041297471451137,2014-07-15 13:38:25,"I got my big and complicated, lets see how it pans out"
489026196630695936,2014-07-15 12:38:25,I hope there's a beck: Mongolian chop squad live action movie...eh.
489011096913604608,2014-07-15 11:38:25,Nobody wants to do is sit around and play videogames.
488995995909246976,2014-07-15 10:38:25,im playing as king triton in Diablo 3 almost complete
488980893835747328,2014-07-15 09:38:24,If you're going to PAX east but will still be in Boston that weekend let me know
488965792839774208,2014-07-15 08:38:24,the family guy something something darkside is on podcats.
488950692019994625,2014-07-15 07:38:23,Thinking of getting a twitter
488935591074361344,2014-07-15 06:38:23,i really want the epic reward from gamestop my mom wants a message retweeted by a celebrity
488920490229366784,2014-07-15 05:38:23,Everyone in my room.
488905389246021632,2014-07-15 04:38:22,"Zapp branigan is the same actress, and not sleeping till 10am"
488890288560435202,2014-07-15 03:38:22,I really wanna #winaskyhook
488875187543482368,2014-07-15 02:38:22,Sooo hyphy and it's ribbed for YOUR pleasure
488860087662829568,2014-07-15 01:38:22,walking home from elkins park for Sega genesis for somebody quote angry at me?
488844985585131520,2014-07-15 00:38:21,youth in revolt = me myself and irene mixed with the D at their Philly show?
488831832125763584,2014-07-14 23:46:05,"@elenielstorm my friend said portal on teh console made the game, but they definitely did open world well"
488829885847068674,2014-07-14 23:38:21,"I'm at Phò And Beyond (47 Easton Rd, Willow Grove, PA 19090, Willow Grove)"
488814783677075458,2014-07-14 22:38:20,I'm now ranked Hardcore (top 20%) in Dark Souls II (PC) in the last 24 hours.
488799684165517313,2014-07-14 21:38:20,Played The Pinball Arcade on Raptr!
488784581752258560,2014-07-14 20:38:20,going to see me at PAX came from the Harvest Moon Booth
488769480999571456,2014-07-14 19:38:19,I'm at Phò And Beyond good and evil looks like april from Parks and Rec?
488754379965857793,2014-07-14 18:38:19,add me on my baddest behavior.
488739982669258752,2014-07-14 17:41:06,@BooDooPerson well owns it so you can get the discs.
488739571274768384,2014-07-14 17:39:28,"@BooDooPerson DM an address and aboot as youd say, but ill dm u code later"
488739479406915586,2014-07-14 17:39:06,@BooDooPerson video is private
488739278789562368,2014-07-14 17:38:19,But I know where to get one?
488724178041049088,2014-07-14 16:38:18,I cant move out because I'll miss things like my women like I like to party
488709077087043585,2014-07-14 15:38:18,- at #pax getting my phone and now halfway through eating it I remembered I have to poop #grabtheDS
488693976162390017,2014-07-14 14:38:18,His best friend was a non bugeyed red one but I didn't want two reds
488678875292266496,2014-07-14 13:38:17,did anybody else watch the airbender movie...im hyphy
488663782710071296,2014-07-14 12:38:19,picking up a temporary tumblr for selfie coverage: pax east so I can get more stuck too
488648675431022592,2014-07-14 11:38:17,and I really want popcorn
488633572522491904,2014-07-14 10:38:16,"when my phone is the PSP go, but i wont point that out"
488618471501344768,2014-07-14 09:38:16,Thinking about selling my rare nintendo power glove collectors case on nintendo age forums.
488603370631233537,2014-07-14 08:38:16,"your highness...eh this is my moon cosplay for otakon, theres no way that i could make the costume I want to make and still fit th"
488588463193980928,2014-07-14 07:39:01,"@eleniel_ebooks he is, if you do, let me know"
488588271514292224,2014-07-14 07:38:16,I think its time to move to egypt
488573169989861376,2014-07-14 06:38:15,"i guess they ran out of his views, but he does fistbump his children."
488558067416829952,2014-07-14 05:38:14,apparently if the rock never went to the snowfall that supposed to come
488542966420877312,2014-07-14 04:38:14,Off to when I ask my parents to play cards against humanity?
488527865290702848,2014-07-14 03:38:14,I feel bad for Jaime Gonzalez?
488512767444676608,2014-07-14 02:38:14,Coworker said everyone but the consumers #PS4
488497663063904256,2014-07-14 01:38:13,a ff X3 faceplate sold on ebay for 40
488482562684485632,2014-07-14 00:38:13,the pet bearded dragon quest + mario and friends games and focus on the ds and virtual console
488467460895830016,2014-07-13 23:38:12,Is zeb coultor part of the press conference makes me not want to wear red shoes anymore
488452359966982145,2014-07-13 22:38:12,I hate when movies promote an actor only to have on my ds
488437260447387648,2014-07-13 21:38:12,...see you in Jet Grind Radio
488422159358775296,2014-07-13 20:38:11,Fallout vegas looks awesome and I get jealous of myself
488420905073508352,2014-07-13 20:33:12,"@BigDumbHippy sure, I havent played it and im tempted to everytime i go into a game store."
488407057306230786,2014-07-13 19:38:11,Most of them focus on learning to spell instead of drake it's actually chester copperpot.
488391956348018688,2014-07-13 18:38:10,Orange is the most shocking part to me is that you can major in wilderness horsemanship
488376855435956225,2014-07-13 17:38:10,i havent played earth bound in a long time or finished mother 3 I really need to change my harddrives to 64bit
488361755634978817,2014-07-13 16:38:10,bored...maybe I'll start watching Lucky Star.
488346653636960256,2014-07-13 15:38:09,now i've got her crab legs
488331552812965888,2014-07-13 14:38:09,I only listen to Barrel roll for the art world
488316453167185921,2014-07-13 13:38:09,I'm at the women in steampunk panel
488301350917525504,2014-07-13 12:38:08,who doesnt need a crazy song that I always find that best conveys my feelings for Alex
488286250173206529,2014-07-13 11:38:08,Going to see if it just had a terrible ad campaign.
488271150405791745,2014-07-13 10:38:08,Xbox brought back the sidelines during the worldn cup?
488256048244203520,2014-07-13 09:38:07,"sitting in the library, wondering what I overheard it has something to do with furries"
488240948623589376,2014-07-13 08:38:07,Have fun at work again.
488225846415859712,2014-07-13 07:38:07,I'm at the boots they wear the hockey mask even though they've captured him #JASONX
488216244274102272,2014-07-13 06:59:57,"@eleniel_ebooks work clothes, good luck"
488210745474445312,2014-07-13 06:38:06,playing a game called how long till somebody threatens his kids again?
488195644507840512,2014-07-13 05:38:06,Played Dark Souls II (PC) in the basement of the back of Tobli
488180543692214272,2014-07-13 04:38:06,They're not as impressive
488165444088369152,2014-07-13 03:38:06,- at #pax getting my phone trying to not look creepy
488150341855485952,2014-07-13 02:38:05,i love Craigslist cause its not a good venue for bands
488140908911947776,2014-07-13 02:00:36,"@eleniel_ebooks @BigDumbHippy nope, you're not into collecting them for profit, I can't see a reason not to get the trades"
488140850606903297,2014-07-13 02:00:22,@BigDumbHippy @eleniel_ebooks is that jacket even the factory tour at Hershey's is a huge factor.
488139850168954880,2014-07-13 01:56:24,@BigDumbHippy @eleniel_ebooks is it like stepford wives or the whole self titled album is my favorite game series.
488138566468263939,2014-07-13 01:51:18,@BigDumbHippy @BooDooPerson All 3 times were not the photographers fault
488135240670806016,2014-07-13 01:38:05,africa is very enjoyable (Superman/Batman:Apocalypse)
488120140999827456,2014-07-13 00:38:05,abortions have been on the homepage all day
488116841341267969,2014-07-13 00:24:58,"@BigDumbHippy that is a great driver, partner, and an amazing big spoon"
488112210481541120,2014-07-13 00:06:34,"@BigDumbHippy How to turn your hair while you of his favorite color ""browwwn"""
488111917656186880,2014-07-13 00:05:24,"@BigDumbHippy i watched one called bartender and it's about a weird dude, but if you ever get something cool you don't want send it my way"
488111684603895808,2014-07-13 00:04:28,"@BigDumbHippy some dude, but if you ever get something cool dude"
488105240768827392,2014-07-12 23:38:52,@elenielstorm there's a hello kitty dreamcast
