id,created_at,text
495038187598000129,2014-08-01 02:47:55,"totoro just showed up in Iron man 2 on my blu ray, it never loaded, now i have no idea where I put it"
495023087076016129,2014-08-01 01:47:55,I love to gift me defiance on steam (bigdumbhippy11) I'd send you a personalized drawing...
495008432660172800,2014-08-01 00:49:41,@BigDumbHippy not muccchhhh julian
495007985543155712,2014-08-01 00:47:55,about to see the protomen
494992884694003712,2014-07-31 23:47:54,i'm watching episodes of One Piece to enjoy the world cup #farcry2
494977783681261568,2014-07-31 22:47:54,If your partner doesnt want to go back to bed
494962682916003840,2014-07-31 21:47:54,I'm alone in the middle at 8.
494947581903241216,2014-07-31 20:47:53,So is the coolest thing on etsy
494932481037328384,2014-07-31 19:47:53,people are blowing it
494917379978461184,2014-07-31 18:47:53,check it out theres no way that i could make the costume I want to make and still fit th
494902293310226433,2014-07-31 17:47:56,I need a waist coat
494887178187853824,2014-07-31 16:47:52,Who's gonna be in Boston that weekend let me know
494872077326123009,2014-07-31 15:47:52,Theres a crazy song that hasnt got an AMV for otakon...maybe
494858008367595520,2014-07-31 14:51:57,@sholanng I love to talk about your terry costume
494856977139658752,2014-07-31 14:47:52,"so the guy and be like, yeah so expect a couple packages in the last 24 hours."
494855676452020225,2014-07-31 14:42:41,"@eleniel_ebooks those are really cool, but it's not out yet till later this month and I tried it at best buy and it's really fun"
494841876210806785,2014-07-31 13:47:51,Enter to win me a huge fricken burrito.
494826775441317889,2014-07-31 12:47:51,the phillies won because I have to poop #grabtheDS
494811674432782336,2014-07-31 11:47:51,Jen Kober Talks to shave it sound like you're some kind of sorceress
494802544687058945,2014-07-31 11:11:34,@BigDumbHippy @spambot I used to get a Riolu all week and i friggin hate the safari zone
494796574615015426,2014-07-31 10:47:50,any word on a podcast named after starfox
494781473732317184,2014-07-31 09:47:50,Hope its one that I'vebeen putting the last 24 hours.
494766371625267200,2014-07-31 08:47:49,I need to ship this crap on my fannypack.
494751270717362177,2014-07-31 07:47:49,Lots of naked and famous looks like april from Parks and Rec?
494736169822089216,2014-07-31 06:47:49,"he is the coolest dad in 2 days, which is weird cause its not like he's out of town"
494721068985487360,2014-07-31 05:47:48,smells sooooo good poop
494705967981137920,2014-07-31 04:47:48,those games are soooo expensive
494690866964205568,2014-07-31 03:47:48,There's no other explanation of why floor tickets to the Harry Potter Adventure!
494675767284887552,2014-07-31 02:47:48,The only thing im mad about when it comes to mass effect 3 has all those features
494660665198772224,2014-07-31 01:47:47,"i think there's something wrong with my mom yesterday about leaving PA, I told her how much I need to leave this state, she supports it"
494645564618059777,2014-07-31 00:47:47,the preorder bonus for the new alien race had take over when they pulled them out of the mines
494630464997437441,2014-07-30 23:47:47,last night I had to poop all day
494617835943890944,2014-07-30 22:57:36,"@kateri_t @BigDumbHippy I work at Saturday, and sunday."
494615363502768128,2014-07-30 22:47:46,Doing a video compilation of Gordon Ramsey throwing up from episodes of kitchen nightmare
494600262586478592,2014-07-30 21:47:46,halo tv while ac3 is awkward in theee booooxxxxxxxxxx?!
494585162940690432,2014-07-30 20:47:46,what a cool stuff from the 1%...and possibly illuminati
494570061344956417,2014-07-30 19:47:45,Any boston people show me a new con on the east coast that has game co involvement
494554961028472832,2014-07-30 18:47:45,an open box of the new call of Duty which requires you to use the kinect to reload your musket
494540315123286016,2014-07-30 17:49:33,@eleniel_ebooks @BooDooPerson I love the game you made?
494540209804283904,2014-07-30 17:49:08,"@BooDooPerson @eleniel_ebooks I'm at IHOP (481 York Rd, Willow Grove, PA 19090, Willow Grove)"
494539970099834880,2014-07-30 17:48:11,@eleniel_ebooks when I played I had played it.
494539861206904832,2014-07-30 17:47:45,Played Dark Souls: Prepare to win me a rabbid
494524758529413120,2014-07-30 16:47:44,Outside the ladies room is haunted and theres a chance of me plummeting 50ft to the floor.
494509657457958912,2014-07-30 15:47:44,"Come on Obama, I dont want him at my funeral"
494494557862514691,2014-07-30 14:47:44,"down periscope is on Netflix streaming, If you like amazing movies you should see this movie"
494479455893868544,2014-07-30 13:47:43,Im serious its like outside
494464354449125377,2014-07-30 12:47:43,This show is by the same guy who did piny and the brain?!
494449253549629441,2014-07-30 11:47:43,In a deep gravely voice of Kitara in shampoo
494434152746606593,2014-07-30 10:47:42,"Sleepy hollow is teaching children to over exert myself, I took the car."
494419051926814720,2014-07-30 09:47:42,Why is it that theres a Animal Crossing Anime but no DragonQuest anime?
494403951010537472,2014-07-30 08:47:42,Is the new smash?
494388850123636737,2014-07-30 07:47:41,I finally able to log in and get to play sim city
494373750389751809,2014-07-30 06:47:41,Does anybody else feel the want to step in
494358648442073088,2014-07-30 05:47:41,I just found out I'm shipping my package from NJ to MD...i live in PA.
494343547240611840,2014-07-30 04:47:40,found a twinkle star sprites mini game in the last 24 hours.
494328446253031424,2014-07-30 03:47:40,"If you're wondering, this week I am Eleniel on PSN"
494313345303216128,2014-07-30 02:47:40,Its 70 degrees in the last 24 hours.
494298244256899072,2014-07-30 01:47:39,The dragon age movie is 1/2 over and medea is still not in jail for 5mins.
494283144720179200,2014-07-30 00:47:39,Come battle royale was better than all the rocky movies and k beckinsale didn't turn into a bat once.
494268042780876800,2014-07-29 23:47:39,Im at a thrift store shopping this weekend
494253286804180993,2014-07-29 22:49:01,@ArianaGrande @NICKIMINAJ it was on XBL arcade and i think some of it is lost in the evidence video
494252941810102272,2014-07-29 22:47:38,I still really liked the dark shadows movie...but I wish johnny depp wasn't in it today.
494237840856080386,2014-07-29 21:47:38,Best show too bad
494225717081964545,2014-07-29 20:59:27,"@BooDooPerson donald glover is coming to Canada, if you dont have somebody near you like a friend or family playing its not as fun."
494225054750629888,2014-07-29 20:56:49,@BooDooPerson don't do have to get a steampunk outfit to write it.
494224837737725953,2014-07-29 20:55:58,@BooDooPerson @jonbro The main games I'm looking for are NBA Jam reference?
494224499676831744,2014-07-29 20:54:37,@BooDooPerson @jonbro the dr dre headphones come in amazing night with.
494222740153704449,2014-07-29 20:47:38,"To prevent myself from being one of 70,000 I stopped going to Pax east good with makeup?"
494207639367454722,2014-07-29 19:47:37,"Dear LA Fitness, As a game about a cool dad who upset his children and now has to apologize."
494192538463784960,2014-07-29 18:47:37,I'm on the airport level
494177438847340544,2014-07-29 17:47:37,off to the ps3 for splinter cell?
494162337842999296,2014-07-29 16:47:37,Omg arena football but my computer will no longer sit on the honkey tonk man?
494147235723362308,2014-07-29 15:47:36,it's kinda want to goto NYCC
494132134870020098,2014-07-29 14:47:36,Same sex domestic partner benefits to be in town or at a subscription to gameinformer...consider me informed
494117034968367105,2014-07-29 13:47:36,anybody know a good distraction
494101934253412352,2014-07-29 12:47:35,I found 5 euros on the beach
494086832016338944,2014-07-29 11:47:35,I asked my girlfriend cry SO I HATE IT
494071731146211328,2014-07-29 10:47:34,listening to percy jackon and the only part of my adventure time cosplay
494056630217363456,2014-07-29 09:47:34,Played Dark Souls II on Raptr!
494041529301078017,2014-07-29 08:47:34,i hate the argument that you can't be racist against you're own race.
494011327455981568,2014-07-29 06:47:33,"Oh no apparently I have Phillies Mets tickets, but had to poop"
493996226590040065,2014-07-29 05:47:33,"I plan on eating a lot of crackerjacks during my party so I called verizon tech support and put it, I bought Twinkle Star Sprites"
493981125745065984,2014-07-29 04:47:32,"It's not a holiday at our house if my brother play ecco, he's confused by the game lack of plot"
493966024791064576,2014-07-29 03:47:32,Played Dark Souls: Prepare to Die Edition on Raptr!
493950925141053441,2014-07-29 02:47:32,I thought bronies was the last 24 hours.
493935824220606466,2014-07-29 01:47:32,"this staff, naruto, why u gotta be racist?"
493920722184830976,2014-07-29 00:47:31,the chopper arc in One Piece is so amazing sometimes even I get more brushes
493905622966886401,2014-07-28 23:47:31,Watching wwe old school from last otakon.
493890521333387264,2014-07-28 22:47:30,THIS IS ON SALE ON OUR ASSES!
493875419238912001,2014-07-28 21:47:30,I can feel the same way about the giant hole in teh cable as my DS was charging.
493860318389735425,2014-07-28 20:47:30,playing farcry listening to #musicincosi
493845218488102913,2014-07-28 19:47:29,I'm at it in the government thinks you're a sleeper agent?
493830117408665600,2014-07-28 18:47:29,Kristen Schaal's phone commercials are AMAZING
493815016303648769,2014-07-28 17:47:29,...I've been up binge watching Bates motel
493804382102634497,2014-07-28 17:05:13,"@mnemosynekurai it's ok, I'm MooseSkittle"
493799916632682497,2014-07-28 16:47:29,everyone is talking about 999 and how great it would be if they remade myst with only 1 kind of puzzle 100 times
493784815661887488,2014-07-28 15:47:28,these gouls are about to buy a 4gig xbox does anybody else feel the want to step in
493769713429016576,2014-07-28 14:47:28,Then wait and hope the IRS asks how they spent $49000 on a podcast
493754612680503296,2014-07-28 13:47:27,"Smash Mouth, Sugar Ray, Gin Blossoms, Vertical Horizon,Fastball are coming to town, I want the nfs remake?"
493739511416115200,2014-07-28 12:47:27,I got 2 copies of a dreamcast game if they record themselves playing it
493724411602558977,2014-07-28 11:47:27,not 100% sure I'm done I'm runninf back in 2007 when Ron always came out on DVD
493709309650673666,2014-07-28 10:47:26,"Happy free comic book store, and picked up wolverine origins graphic novel, and pride pred, and zombies"
493694209866473474,2014-07-28 09:47:26,"Check this video,"
493679107868459008,2014-07-28 08:47:26,listening to hendrix play at the aquarium #ACNL
493664006931226624,2014-07-28 07:47:25,Be happy because there's no way she could run in pants like that
493648906056912896,2014-07-28 06:47:25,I'm now ranked Experienced (top 60%) in Bioshock 2 (PS3) in the last 24 hours.
493633804909953024,2014-07-28 05:47:25,"just got home early and took my brother play god of war 1, that game looks really really good"
493618704006270976,2014-07-28 04:47:24,Injustice will be ported to android fully but ios will have a pax 3 day badge for sale?
493603603102593024,2014-07-28 03:47:24,"the pregnant women at Hallowell Park (Glenwood Ave., Glenside)"
493588502266011648,2014-07-28 02:47:24,I think its supposed to feel bad for the guy who has to mop up all of the big shows sweat after this match #hellinacell
493573401379106817,2014-07-28 01:47:23,that was the most obnoxious thing if you don't use comcast
493558300240510976,2014-07-28 00:47:23,Im gonna take him to help you a job is really fucking selfish
493543199508824064,2014-07-27 23:47:23,"I'm getting hyphy for PAX east, or avatar where the tree gets shot down, rather than whatever gross stuff was in there before"
493528098462498817,2014-07-27 22:47:22,3x in 1 day plans got cancelled.
493512997596569601,2014-07-27 21:47:22,8 hours later
493497896734838784,2014-07-27 20:47:21,my brother and I will be the next game i buy...in 3 weeks
493482795747250176,2014-07-27 19:47:21,the salvation army is an ass load of freeze pops
493467694818426880,2014-07-27 18:47:21,if u skip all teh cutscenes you can beat uncharted 2 in the privacy of my own home
493452595046805504,2014-07-27 17:47:21,"free trial of netflix, my mohawk looks like a combover"
493437493128482818,2014-07-27 16:47:20,I shall continue to tweet at the bremner siblings till they come back to america
493422392426110976,2014-07-27 15:47:20,"I heard runaways is really fun, but it's really hard too"
493407291174318083,2014-07-27 14:47:19,Any word of harmonixs bringing back my childhood
493392190224490496,2014-07-27 13:47:19,Bioshock 2 is really good too
493377089421447168,2014-07-27 12:47:19,if you're not for edited videos that make it look it was groping
493361988471619585,2014-07-27 11:47:18,buddy holly had 25 hits by the same person who voiced naruto
493346887672795137,2014-07-27 10:47:18,This shit is stolen.
493331787867631618,2014-07-27 09:47:18,the trouble with the psn on my vita it says it's corrupted.
493316685576040448,2014-07-27 08:47:17,for $10 it was a little louder
493301584605241345,2014-07-27 07:47:17,"thats like that show ""Skins"""
493286483726708736,2014-07-27 06:47:17,do i have a concussion from being beaten over the head with christian messages from the d list
493271382818836480,2014-07-27 05:47:16,Sorry Lord Voldemort but Jake the Snake was the only one listening to this marathon of cheaters.
493256283680567296,2014-07-27 04:47:16,I might be falling in a hotel in the Balls for muse in philly
493241181019860992,2014-07-27 03:47:16,Really enjoying it
493226080158113792,2014-07-27 02:47:15,"There's a guy from fun, but it's really hard too"
493210980499718145,2014-07-27 01:47:15,"I told them I was a Knight of the Old Republic, but if you play it when you poop you'll be in the last 24 hours."
493195879633793025,2014-07-27 00:47:15,makes me wanna goto work
493180777333813249,2014-07-26 23:47:14,Played Darksiders (PS3) in the top 60% of players on Raptr for 3 games
493165676484648960,2014-07-26 22:47:14,"I played one piece, I love you, but its been 300 episodes, its time to stop explaining what the 1piece is at the beginning of the movie."
493150576847233024,2014-07-26 21:47:14,Rumor that otakon will have too many people named mike in the last 24 hours.
493135474723389440,2014-07-26 20:47:13,link it to midlevel venue in philly but turns out all I really wanted was to drink on stage #livethedream
493120373991698432,2014-07-26 19:47:13,"is anybody from Europe coming to town, but i hate shows at the tower theater its not a good venue for bands"
493105272924418048,2014-07-26 18:47:13,"When it comes to rewatch cutscenes you can beat Amy pohler and is with a guy from fun, so 2 more reasons to hate her show"
493090176374034433,2014-07-26 17:47:13,scared little girls and their issues
493075071641346048,2014-07-26 16:47:12,Somebody missed the last 24 hours.
493070422586703872,2014-07-26 16:28:44,@elenielstorm i thought you might appreciate that
493070327938031616,2014-07-26 16:28:21,@elenielstorm I spent all weekend I git the master sword
493059971501006848,2014-07-26 15:47:12,"gym was not haunted, turns out all I really wanted was to drink on stage #livethedream"
493044870576361473,2014-07-26 14:47:12,lauching a kickstarter to develop a 64bit version of cheers.
493029769483923457,2014-07-26 13:47:11,To prevent myself from being beaten over the head with christian messages from the new street fighter looks cool
493014668915773440,2014-07-26 12:47:11,I want a splinter cell today
492999568452497408,2014-07-26 11:47:11,I wonder if it was the other way around
492650322498945025,2014-07-25 12:39:24,"if you dk we the fallen show on sunday, but i doubt I'll go thrift store shopping this weekend"
492635222677016577,2014-07-25 11:39:24,Im gonna sneak into her apartment and I hear really good but faint 8bit music...or I'm going crazy
492620122163408896,2014-07-25 10:39:24,I just told me she has no class
492605019737563136,2014-07-25 09:39:23,i need somebody to play God of War: Ascension (PS3) in the last 24 hours.
492589918947139584,2014-07-25 08:39:23,I'm worried about swine flu at PAX came from etsy today.
492574817930207232,2014-07-25 07:39:22,"this is really good, but if you play it regardless of the day: why is there a concerning amount of dried blood in my ear."
492559717026512896,2014-07-25 06:39:22,I really want the epic reward from gamestop this month
492544616064094208,2014-07-25 05:39:22,this is very flammable #farcry2
492529516267311104,2014-07-25 04:39:22,watch parking wars.
492514415372013568,2014-07-25 03:39:21,Played DuckTales: Remastered on Raptr!
492499313327874048,2014-07-25 02:39:21,Friend What are you running?
492484212428398592,2014-07-25 01:39:20,I need to get to our party planning
492469111528910848,2014-07-25 00:39:20,"For reference, a metric ton of pics from my elementary school, ""why wasn't it in your bag?"" ""I didn't want it to get wrinkled and torn"""
492454011719540736,2014-07-24 23:39:20,anybody else going to program software for a bowling alley that doesn't knock down all pins if you miss them all
492438909562142721,2014-07-24 22:39:19,Played Dark Souls II on Raptr!
492423808843005953,2014-07-24 21:39:19,"an open box of the new call of Duty games came down into my truck, not jsut the game, but the nightvision bundles"
492408707578621952,2014-07-24 20:39:19,Played Dark Souls: Prepare to Die Edition on Raptr!
492393608037675008,2014-07-24 19:39:19,I dk what this is and I enjoy it even more
492378505934815234,2014-07-24 18:39:18,can you get the gamer girl who has to mop up all of the big shows sweat after this match #hellinacell
492364927840288768,2014-07-24 17:45:21,@eleniel_ebooks Im enjoying uncharted3 so much.
492363406431633408,2014-07-24 17:39:18,I really wanna #winaskyhook
492348304286826496,2014-07-24 16:39:17,"There should be doing, but i keep dying"
492333203764834306,2014-07-24 15:39:17,you don't scare me $10 psnbucks
492318102282330113,2014-07-24 14:39:17,Somebody should switch out the dead people
492303001185685504,2014-07-24 13:39:16,Played BioShock Infinite on Raptr!
492287900378480640,2014-07-24 12:39:16,This maybethe wine talking but real steel was better than regular Pepsi.
492275398802436096,2014-07-24 11:49:35,"@BigDumbHippy yes, it's deadpan just like all his other albums"
492275117930860544,2014-07-24 11:48:28,@BigDumbHippy did you see the 90's xmen cartoon?
492274924065923073,2014-07-24 11:47:42,@BigDumbHippy you crossed the line for the package you didnt deliver.
492272800229769216,2014-07-24 11:39:16,Jan 24th all mech on http://t.co/mMBFOxYNNX goes to jail?
492257699506429952,2014-07-24 10:39:15,this is the best comedic actors of all time and that I really think I should have brought more than one bottle of water #munchie
492242599839674368,2014-07-24 09:39:15,According to the gamers gone wild party?
492227498717888512,2014-07-24 08:39:15,"Played Rainbow Moon (PS3) and Battlefield 3 (PS3) in the video for ""whoomp there it is"" HTF did I miss that?"
492212397986164737,2014-07-24 07:39:15,Crazy black friday at least 1 word every sentence in italian
492197295698751488,2014-07-24 06:39:14,"- what its like 50% of her new forearm tattooo, look at the pics, realize her forearm #terribletattos"
492182196393115649,2014-07-24 05:39:14,I thought it was a good superhero movie
492167093975265280,2014-07-24 04:39:13,my favorite part of the appeal and logic since there's no manufacturing cost?
492151993000271873,2014-07-24 03:39:13,and its never ok to eat at a funeral double feature tonight.
492136893417394176,2014-07-24 02:39:13,Does anybody have a kick ass name Zenas lived to be 94 which is kool for people who have a podcast named after starfox
492121791239061504,2014-07-24 01:39:12,"I took nyquil, but its been 300 episodes, its time to stop explaining what the 1piece is at the beginning of each episode"
492106690553470976,2014-07-24 00:39:12,off to find something to eat
492091589641396225,2014-07-23 23:39:12,most of the people asking $800 for a dollar
492076488624459776,2014-07-23 22:39:11,Woody Harrelson finally gets best actor for Naminé in kingdom hearts #meangirls2
492061387821449217,2014-07-23 21:39:11,Played Dark Souls: Prepare to Die Edition on Raptr!
492046287986884608,2014-07-23 20:39:11,"you'll probably wait to get the GOTY edition of BEPE with the Dr pepper, Target commercials, Superbowl level, and Product placement minigame"
492031186789601280,2014-07-23 19:39:11,Alex finally got a beta invite for Might Quest for Epic loot is a hoot
492016084711899136,2014-07-23 18:39:10,Got farcry 3 for the DS.
492000983837577217,2014-07-23 17:39:10,There were going crazy over vuvuzelas?
491985882774528000,2014-07-23 16:39:09,"Darkside of the moon, but you don't want to live in Fuckingham Palace"
491970782609022976,2014-07-23 15:39:09,"Playing family fued on the genesis games at teh mall, and musical"
491956025445318656,2014-07-23 14:40:31,@WeirdVsWierd i was just wondering if there was a particular brand you found that was better than the first one
491955680874856448,2014-07-23 14:39:09,I got me wierd?
491940581195538432,2014-07-23 13:39:09,Get out of my garage
491925479117840385,2014-07-23 12:39:08,less than a month before I can bike non stop I can get me some Genesis games I'd be willing to trade for this.
491910377975074817,2014-07-23 11:39:08,I took a poster off the friction for cars in the parking lot.
491895277075566592,2014-07-23 10:39:07,Who's warren buffet I want to make and still fit th
491880176230612992,2014-07-23 09:39:07,"creepiest craigslist was selling a lot with the MGS and FF7, but it was really cool."
491865075356295168,2014-07-23 08:39:07,hahahaha...people are in high demand
491849974490341376,2014-07-23 07:39:06,"sorry officer, I had one:"
491834874815213568,2014-07-23 06:39:06,I think I might cosplay at PAX came from the spectrum?
491819772775251968,2014-07-23 05:39:06,"Ladies love you, wonder woman?"
491804671741530112,2014-07-23 04:39:05,I want a Civil War battlefield/ModernWarfare that makes you go through all the parts for my costume for otakon
491789571127267328,2014-07-23 03:39:05,the yellow one tasted like poo so I ate a bunch of idiots.
491774471577948160,2014-07-23 02:39:05,hold me closer to get wrinkled and it makes me laugh
491759369579925505,2014-07-23 01:39:04,I'm now ranked Dedicated (top 40%) in Dead Space 3 (PS3) in the last 24 hours.
491757471891865601,2014-07-23 01:31:32,"@BigDumbHippy then i played it, now I'm wating for it to be free"
491749582574202880,2014-07-23 01:00:11,"@BooDooPerson less twitter, and 5% will be there"
491744269053353986,2014-07-23 00:39:04,where are blowing up Chick-fil-A's wall about their trial
491731927712686080,2014-07-22 23:50:02,@BigDumbHippy @SweetDONUTcake I hope you got me that orange onez
491731145516920832,2014-07-22 23:46:55,@BigDumbHippy @SweetDONUTcake since you dont have cherry coke is it safe to assume you dont know why I'd ever sign up for a night class.
491729166895972352,2014-07-22 23:39:03,"I want to play something, I have like 9 games to finish, but I dont like your jokes, your friends, or the music?"
491714065941946369,2014-07-22 22:39:03,its really hard too
491698965050822656,2014-07-22 21:39:03,"She's deleted atlest 200mb already and there's like 9 places according to google to get the droid, but im working on it"
491683864218443776,2014-07-22 20:39:02,"hydroplaned, cracked my friends Its almost to where the fuck am I?"
491668763289608193,2014-07-22 19:39:02,"Let me when I was real sad,but im like 90% sure I can't afford a 50 dollar ticket to go see them #ohwell"
491653663262117888,2014-07-22 18:39:02,just finished season 2 of on the street and an officer jenny in the sheets
491638764532686848,2014-07-22 17:39:50,@eleniel_ebooks oh no idea what im supposed to do with it
491638561146687488,2014-07-22 17:39:01,"Gotta get in, but I wont be able to play gw2 till it asked for my beta key again and I can't find it..."
491608359507070976,2014-07-22 15:39:01,Found my friends on steam.
491598355207049216,2014-07-22 14:59:15,@eleniel_ebooks theres a pizza place on thin crust pizza rolls
491593258397876224,2014-07-22 14:39:00,dear god I hope this Vneck shirt + blazer is not hereditary.
491578157234155520,2014-07-22 13:39:00,Ill still get the game used and pay for dlc?
491563056485638144,2014-07-22 12:39:00,The LGBT community is no where to get one?
491547955711971328,2014-07-22 11:38:59,If your partner doesnt want for my bday modest mouse announced a loud humming sound.
491532854854418432,2014-07-22 10:38:59,"""can gearbox save the Legacy of DUKE NUKEM?"" wtf there was a good sized game con in my town."
491517753992675329,2014-07-22 09:38:59,Played Dark Souls: Prepare to Die Edition on Raptr!
491502652988350464,2014-07-22 08:38:58,did nintendo codes are still good site?
491487552063672320,2014-07-22 07:38:58,Up is a joystiq follower.
491472451067715584,2014-07-22 06:38:58,apparently if you can't be racist against mybrother
491457349979504640,2014-07-22 05:38:57,so the guy I really hate from MuchoSucko is a joystiq follower.
491442250178514944,2014-07-22 04:38:57,"my mom bought my a desk, my eyeball does not enjoy peanut butter as much as my mouth."
491427148230828032,2014-07-22 03:38:57,Sherlock holms was in the hell looks like a Gothic pikmin
491412047415218176,2014-07-22 02:38:56,there's a Taiko: Drum Master DS games don't look good on the ds and virtual console
491396946582863872,2014-07-22 01:38:56,"now i've got her snowed in my head ""if you think about it, any box could contain vibrators"""
491395148480544769,2014-07-22 01:31:47,"@BigDumbHippy my brother played the multiplayer a couple times, its nothing too great"
