id,created_at,text
443768513862193153,2014-03-12 15:20:33,"Sometimes the questions are complicated, but the answers are simple."
443748752327577601,2014-03-12 14:02:01,The scariest part about losing faith in someone is losing faith in yourself.
443729109357576192,2014-03-12 12:43:58,"I don't want to just be someone you'll always remember, I want to be someone you can't possibly forget."
443709483559038976,2014-03-12 11:25:59,''LSHIFOMUALIAPOG! xD'' ''What?!'' ''Laughing So Hard I Fall Off My Unicorn And Land In A Pile Of Glitter... Duhh.''
443689761161482241,2014-03-12 10:07:37,DON'T PRETEND TO BE MY FRIEND IF YOU DON'T LIKE ME!!
443669118516879360,2014-03-12 08:45:35,There's a reason behind everything in your life. You just have to find out what that reason is.
443648637331976192,2014-03-12 07:24:12,Stay strong. Even when it feels like everything is falling apart.
443628463845416960,2014-03-12 06:04:02,"Whatever makes you feel bad, leave it. Whatever makes you feel good, keep it."
443608843319128064,2014-03-12 04:46:04,Can we go back to the way we used to be?
443589085748150272,2014-03-12 03:27:34,"Those relationships where you can mess around, play fight &amp; tease each other."
443569223382470656,2014-03-12 02:08:38,The scariest part about losing faith in someone is losing faith in yourself.
443549501714747392,2014-03-12 00:50:16,Plot twist: He likes you back.
443529618285293568,2014-03-11 23:31:16,I can complain about all of the things that I don't have but when I look at you I realize I have everything.
443509772512280576,2014-03-11 22:12:24,You really have no idea how hard it is to force myself to stop thinking about you.
443489955801620480,2014-03-11 20:53:39,Do what you feel in your heart to be right – for you’ll be criticized anyway. You’ll be damned if you do &amp; damned if you don’t.
443470271433822209,2014-03-11 19:35:26,"Maybe I'm over you. Maybe I've moved on. Maybe I like someone else, but maybe, I'm just a really good liar."
443445082608242689,2014-03-11 17:55:21,Spend less time chasing what ran away and more time chasing what makes you happy.
443424996384194560,2014-03-11 16:35:32,I love people who text back instantly.
443405117144850432,2014-03-11 15:16:32,Not being able to get enough sleep because of that ONE person on your mind.
443385394084601856,2014-03-11 13:58:10,A kiss is just a kiss until you find the one you love. Love was just a word until I heard it from you.
443365716478025728,2014-03-11 12:39:58,"Life doesn't have subtitles, You either understand it or not."
443345946575794176,2014-03-11 11:21:25,I'm a girl. I cry for stupid boys. My room is a mess. Sometimes music is my only friend. I'm not perfect. But I'm me.
443325979436396545,2014-03-11 10:02:04,I want to feel wanted and needed and just cared for.
443306265947541505,2014-03-11 08:43:44,F.R.I.E.N.D.S : Fight for you. Respect you. Include you. Encourage you. Need you. Deserve you. Stand by you.
443286509483851778,2014-03-11 07:25:14,Don’t lower your standards for anyone or anything. Self respect is everything.
443266822058438658,2014-03-11 06:07:00,Holding her hand in public is just another way of saying you are proud to have her. ❤
443247209316765697,2014-03-11 04:49:04,"When I listen to old songs, the memories hit me."
443227211701579776,2014-03-11 03:29:36,"I thought I was over him, done with him.. But then there he was, and I couldn't breathe."
443207362728296448,2014-03-11 02:10:44,Music sounds better when the song describes how you feel.
443187363452174336,2014-03-11 00:51:16,"No matter how angry you get, you always end up forgiving the people you love."
443167224342138880,2014-03-10 23:31:14,I want to feel wanted and needed and just cared for.
443147323187556353,2014-03-10 22:12:09,Remember me? You made me feel like I was your everything but then you left me easily like I was nothing.
443127524797595648,2014-03-10 20:53:29,"Never make someone your everything, because once they're gone you have nothing."
443107691561353216,2014-03-10 19:34:40,"Sometimes, the best way to stay close to someone you love is by being just a friend."
443087938054651904,2014-03-10 18:16:11,I was born without you. So guess what? I can live without you.
443067963931762689,2014-03-10 16:56:49,"I like conversations where I don't have to think about what to say, it just comes naturally."
443047927389233152,2014-03-10 15:37:11,"Love your parents. We're so busy growing up, we often forget they're growing old."
443028115539767296,2014-03-10 14:18:28,Relationship are always stronger when you are best friends first and a couple second.
442865188509728768,2014-03-10 03:31:03,Silence is the best way to let someone know they did something wrong.
442843477689118720,2014-03-10 02:04:47,I love you. *erases* I miss you. *erases* Can we talk? *erases* Hi. *sends*
442822708061941760,2014-03-10 00:42:15,"Getting a lot of girls isn't something to be proud of, keeping one is."
442802018126528512,2014-03-09 23:20:02,My weakness is that I care too much.
442780875940315136,2014-03-09 21:56:01,"Use your ""real-eyes,"" to ""realize"" the ""real-lies."""
442759776632446976,2014-03-09 20:32:11,HUMAN BRAIN: It's amazing. It functions 24/7 from the time we were born &amp; only stops when we take exams.
442738880769314816,2014-03-09 19:09:09,"When I was young I always wanted to grow up, but now I just wish I was a kid again."
442718041512484865,2014-03-09 17:46:21,You'll never know how it feels to have the one person who means everything to you; make you feel like you're nothing.
442697213202808832,2014-03-09 16:23:35,I'm tired of getting my hopes up for things that I know will never happen.
442674771851894784,2014-03-09 14:54:24,True love is always in your heart; when you meet that person it will come out.
442653852962009089,2014-03-09 13:31:17,"I like conversations where I don't have to think about what to say, it just comes naturally."
442633201362538497,2014-03-09 12:09:13,"The first time you fall in love, it changes your life forever. No matter how hard you try, the feeling never goes away."
442612351653519360,2014-03-09 10:46:22,"#IJustWantYouToKnow that I'm truly, madly, deeply in love with you! ♥"
442591250621800449,2014-03-09 09:22:31,You'll never understand how much I cared.
442570225762836480,2014-03-09 07:58:59,"All my time is spent thinking about you. I hope you think of me too, even after you tell me you love me."
441441833462149120,2014-03-06 05:15:09,I'm sick of bitches bitching about other bitches being bitches.
441419341246918656,2014-03-06 03:45:46,"If you can’t accept someone’s past, then you can’t accept them. Because their past is what makes them into the person they are now."
441336354882846720,2014-03-05 22:16:01,Giving someone all your love is never been an assurance that they will love you back.
441316504768753664,2014-03-05 20:57:08,How much pain do you have to go through until giving up is okay?
441296968375992320,2014-03-05 19:39:30,"If we aren't texting each other, maybe we should just call and simply say ""I love you""."
441277518419464192,2014-03-05 18:22:13,Everyone is driven by a reason.
440684297763041280,2014-03-04 03:04:58,Everyone has problems. Some people are just better at hiding them than others.
440545867649388545,2014-03-03 17:54:54,"When a girl is silent, she’s either over-thinking, tired of waiting, falling apart, crying inside, or all of the above."
440526713374523392,2014-03-03 16:38:47,"When I was 5, sticking my tongue out was like giving someone the middle finger."
440507845436403712,2014-03-03 15:23:49,"Don't blame me for leaving, blame yourself for not doing the right things to keep me."
440487269929975808,2014-03-03 14:02:03,"Sitting next to you doing absolutely nothing, means absolutely everything to me."
440467847316115457,2014-03-03 12:44:52,Love someone not because they give you what you need. Love them because they give you things you thought you never needed
440307752452124672,2014-03-03 02:08:43,You know you really love someone when you don't hate them for breaking your heart.
440288125282033664,2014-03-03 00:50:43,One second it feels like we're strangers. Next second it felt like we had something going on.
440269268655939584,2014-03-02 23:35:48,"Worrying is a waste of time, it never changes anything. It only messes with your mind &amp; steals your happiness."
440250267120840704,2014-03-02 22:20:17,"If it’s meant to be, it will be."
440092527404666880,2014-03-02 11:53:29,Don't confuse my personality with my attitude. My personality is who I am. My attitude depends on who you are.
440073148700958723,2014-03-02 10:36:29,"If I could choose to be anywhere right now, it would be with you."
440053593995874305,2014-03-02 09:18:47,"Don't blame me for leaving, blame yourself for not doing the right things to keep me."
438806471573110784,2014-02-26 22:43:10,"A real boyfriend knows his girl like the back of his hand. He knows when she's mad, sad, aggravated, happy, hurt, because that's his girl."
438778522719354881,2014-02-26 20:52:06,Hugs are to let people know you love them without saying anything.
438753806629629952,2014-02-26 19:13:53,I could be a morning person...if morning happened around noon.
438733787384397824,2014-02-26 17:54:20,"B*tch I didn't text you to exercise my fingers, I want a damn reply."
438583185396346880,2014-02-26 07:55:54,I'd cuddle the fuck out of you.
438557233593339904,2014-02-26 06:12:47,"I don't care if you're black, white, mexican, asian, indian, ect.. If you treat me with respect, you will get nothing but respect in return."
438534605788823553,2014-02-26 04:42:52,"Facebook Should get a ""I Don't Even Know you"" button, for the Dumbasses who like to try to add people they don't know!"
438512347846414336,2014-02-26 03:14:25,Immature: A word boring people use to describe fun people.
438492309676490754,2014-02-26 01:54:48,*Alarm set for 6:00 a.m* *Wakes up at 5:59* Who else lies back down to cherish that last minute of sleep?
438469639010402304,2014-02-26 00:24:42,"You hate me? Well ok, grab a chair and wait for me to care."
438443902161285120,2014-02-25 22:42:26,I'm ̶s̶e̶x̶y̶ unattractive and I know it.
437834002196492288,2014-02-24 06:18:55,"Sorry is nothing, the real apology comes when you can look in their eyes and see they hurt themselves just as much."
437808695573876737,2014-02-24 04:38:21,"When boys smile and ask ""Can I get a hug?""."
437789149098020864,2014-02-24 03:20:41,When boys text you first. ❤
435934702579363840,2014-02-19 00:31:47,"I forgive easy... But honestly, I never forget."
435908268460756992,2014-02-18 22:46:44,"That awkward eye contact, with somebody who used to mean the world to you."
435886770341699585,2014-02-18 21:21:19,"Google: ""I have everything!"" Facebook: ""I know everybody!"" Internet: ""Without me, you're all nothing."" Electricity: ""Keep talking, bitches."""
435866463178457088,2014-02-18 20:00:37,"""Why are you talking during my lesson?"" ""Why are you teaching during my conversation?"""
435845704754274304,2014-02-18 18:38:08,"5 boys, only 1D. Something's wrong here."
435825091511738368,2014-02-18 17:16:13,"#In2013YouBetterNot put a password on your WiFi. Remember, sharing is caring."
435804130334871554,2014-02-18 15:52:56,"Age 4: ""I love Mommy."" Age 16: ""I HATE HER."" Age 20: ""Mom was right"" Age 57: ""I wish my Mom was still here."" RT if you love your Mom. &lt;3"
435782752810438656,2014-02-18 14:27:59,A picture speaks a thousand words. But with photoshop it tells a thousand lies.
435624502743932928,2014-02-18 03:59:09,"Google: ""I have everything!"" Facebook: ""I know everybody!"" Internet: ""Without me, you're all nothing."" Electricity: ""Keep talking, bitches."""
435602856595300352,2014-02-18 02:33:08,When someone touches your phone and you automatically turn into a ninja.
435581741508468737,2014-02-18 01:09:14,"2013, please be a good year."
435560676870746112,2014-02-17 23:45:32,"Age 4: ""I love Mommy."" Age 16: ""I HATE HER."" Age 20: ""Mom was right"" Age 57: ""I wish my Mom was still here."" RT if you love your Mom. &lt;3"
435539454376173568,2014-02-17 22:21:12,"How I finish my presentations: ""So, um... Yeah..."""
435517816372875264,2014-02-17 20:55:13,Retweet if you find '♠' in less than 10 seconds: ♣♣♣♣♣♣♣♣♣♣♣♣♣♣♣♣♣♣♣♣♣♣♣♣♣♣♣♣♣♣♣♣♣♠♣♣♣♣♣♣♣♣♣♣♣♣♣♣♣♣♣♣♣♣♣♣♣♣♣♣♣♣♣♣♣♣♣♣
435496784240971777,2014-02-17 19:31:39,"Suicide Hotline: 1-800-273-8255. Just by retweeting this, you could save someone's life. Please retweet ❤"
435476056917549056,2014-02-17 18:09:17,I'm so ready for school... to end.
435456019645222913,2014-02-17 16:49:40,*Phone vibrates at home* Barely hear it. *Phone vibrates at school* Fucking earthquake!
435434260472664064,2014-02-17 15:23:12,Pretending to think hard when your teacher is looking at you.
435413354480295936,2014-02-17 14:00:07,"That was actually really funny, but I don't like you. Therefore I won't laugh."
435393037946998786,2014-02-17 12:39:24,"When my name's in a math problem: Whole class: *Stares at me* Me: ""That's right bitches, I bought 60 watermelons!"""
435372568392896512,2014-02-17 11:18:03,"That sad moment when you see an awesome shirt, look at the price tag then sadly walk away."
435352218233892864,2014-02-17 09:57:11,"""Hey, can I borrow a pencil?"" ""Yeah, sure."" = Forever gone."
435332405746884608,2014-02-17 08:38:28,"If school has taught us anything, it's texting without looking."
435312334307737601,2014-02-17 07:18:42,"2,800 teenage girls get pregnant everyday. Retweet if you like pancakes."
435292484139106305,2014-02-17 05:59:50,"So they pay $1 million for commercials of starving kids, but they can't feed them?"
435272579650043904,2014-02-17 04:40:44,"Teacher: ""Why are you late?"" Me: ""Why does it matter? You still get paid, right?"""
435252686959558656,2014-02-17 03:21:41,"Cool story bro, wanna hear mine? Once upon a time I didn’t give a fuck. The end!"
435232871821737985,2014-02-17 02:02:57,2 + 2 = Fish. 3 + 3 = Eight. 7 + 7 = Triangle. RT if you get it!
435212910843797504,2014-02-17 00:43:38,"""You're just like a coin."" ""Awww, very valuable?"" ""No, two faced."""
435192840017022976,2014-02-16 23:23:53,Your birth certificate is an apology letter from the condom factory.
435172834361372672,2014-02-16 22:04:23,That awkward moment when you try to high five someone and you both miss.
435153127642124288,2014-02-16 20:46:05,I wish Google sat next to me during exams.
435133216752562176,2014-02-16 19:26:57,#NobodyLikes Facebook anymore.
435113391426789377,2014-02-16 18:08:11,Students are not cheaters. We just really enjoy having the same answers.
435093558316392448,2014-02-16 16:49:22,"Dear weekend, I love you so fucking much."
435072946336305152,2014-02-16 15:27:28,Sone people can't sleep because they have insomnia. I can't sleep because I have Internet.
434965380163833856,2014-02-16 08:20:02,"Even if i had 1000 reasons to leave, i'll still be looking for 1 to stay and if i can't find 1, i promise i'll make up something to stay."
434935959214231552,2014-02-16 06:23:08,"If your relationship has more issues than your magazine, you need to cancel your subscription."
434904360825286656,2014-02-16 04:17:34,Take a shower. Your attitude stinks.
434884984780750848,2014-02-16 03:00:34,"Sometimes you miss the memories, not the person."
434588510025039873,2014-02-15 07:22:29,I love people I can be weird with.
434567738934063104,2014-02-15 05:59:57,Never give permanent feelings to a temporary person.
433359861284216832,2014-02-11 22:00:17,"You know it’s love when those tiny details about another person, seem incredible and magnificent to you."
433339896074227713,2014-02-11 20:40:56,Never let someone define who you are or what you're worth.
433320256929411072,2014-02-11 19:22:54,I just can't walk away; I can't forget what we had. It's not that easy for me to let go of something that was once my life.
433300438922711040,2014-02-11 18:04:09,"For once in my life, I don't have to try to be happy. When I'm with you, it just happens"
433280704663674882,2014-02-11 16:45:44,We’re all supposed to die next month and I can't fucking wait.
433261011487821824,2014-02-11 15:27:29,It’s not that I’m mad at you. I had just wished and hoped so hard that you could be the one thing I could finally count on.
433241579138981889,2014-02-11 14:10:16,I hope I cross your mind every once in awhile just so that I won't feel pathetic for thinking of you all the time.
433221367635263488,2014-02-11 12:49:57,"The reason why I don't talk to you anymore is because I keep telling myself that if you wanted to speak to me, you would."
433201317029240833,2014-02-11 11:30:17,"I try to stop thinking about you, but it just makes me want you even more."
433181150643642368,2014-02-11 10:10:09,I'm scared to tell you how I feel because I know that you're too good for me and the possibility that you like me too seems so impossible.
433160237244104704,2014-02-11 08:47:02,"Out of all the people in the world, I still want you."
433015386305331200,2014-02-10 23:11:27,Mr. right is coming. But his plane crashed in Africa and he's walking.
432992392925286402,2014-02-10 21:40:05,You know the feeling you got when you first rode on a roller-coaster? Flew you high. That's how I feel when you're around.
432969752386875393,2014-02-10 20:10:07,Don't let go too soon. But don't hold on too long.
432949474957070336,2014-02-10 18:49:33,We lose people we love because they are meant to love someone else. We lose them because we are destined to find somebody else.
432929952057405440,2014-02-10 17:31:58,Just the thought of being with you tomorrow gives me the strength to go on today.
432910124223430656,2014-02-10 16:13:11,"I just wonder how many people never get the ones they want, but end up with the one they're supposed to have."
432889925420081152,2014-02-10 14:52:55,"It's in your hands. If you want to be with me, I'm right here."
432869586325610496,2014-02-10 13:32:06,Trust is like a piece of paper. Once it’s crumbled it can’t be perfect.
432848807798112256,2014-02-10 12:09:32,"It's not very hard to sacrifice everything for someone, but it's hard to find that someone who deserves your sacrifice."
432829286769115136,2014-02-10 10:51:58,"Girls, just because you’re not perfect, that doesn’t mean that you don’t deserve to be loved."
432809291221708800,2014-02-10 09:32:30,"To be honest, ""I'm sorry"" doesn't mean shit to me. Don't keep saying you're sorry if you're going to keep doing the same shit."
432789693424353282,2014-02-10 08:14:38,I could love you for my whole life. I just don’t want to anymore.
432770392529199104,2014-02-10 06:57:56,Sometimes people play hard to get to make sure that the other person's feelings are real.
432751119865872384,2014-02-10 05:41:21,"You can't describe the feeling to anyone, because the rush that you get around him is more than anyone could ever explain."
432731919990525952,2014-02-10 04:25:04,"The reason why I don't talk to you anymore is because I keep telling myself that if you wanted to speak to me, you would."
432712595569512448,2014-02-10 03:08:16,"I don't know what it is about you. Maybe it's the way nothing matters when we’re talking, or how you make me smile more than"
432570109333229569,2014-02-09 17:42:05,"It's a complicated world. People have a hard time finding each other and even when they do, they're scared to take the risk."
432550127039823872,2014-02-09 16:22:41,"Sometimes you’ve got to stop and remember that you're not gonna live forever. Be young, think smart, stay true and just follow your heart."
432530617993920512,2014-02-09 15:05:10,Don’t let a few rips in your heart keep you from loving at all.
432510919029952512,2014-02-09 13:46:53,"When you're around, my whole body knows it. I’ll keep talking and stuff, but my mind will have no idea what I’m saying."
432491285572640768,2014-02-09 12:28:52,"Somewhere between laughing for no reason, innocent smiles, long talks and making fun of each other, I fell in love."
432471736500502528,2014-02-09 11:11:11,"It's in your hands. If you want to be with me, I'm right here."
432452264054120448,2014-02-09 09:53:48,"Words can be just words. But when that someone means a lot to you, words can never be just words."
432432820577783808,2014-02-09 08:36:33,She's got a lot of patience to still be waiting for him.
432413488267272192,2014-02-09 07:19:44,Sometimes the hardest part of the journey is believing you’re worthy of the trip.
432393735406485505,2014-02-09 06:01:14,"I’m making some changes in my life right now. If you don’t hear from me, you’re probably one of them."
432374252256231424,2014-02-09 04:43:49,"Don't be afraid to walk by yourself. Just because no one is with you, doesn't mean you’re alone."
432354617779707904,2014-02-09 03:25:48,"Love without trust is like a car without an engine. You can try to push, but it won't get you far."
432334938663161857,2014-02-09 02:07:36,"It's funny how once you find a song that explains exactly how you feel, you listen to the song over and over again."
432315249782304769,2014-02-09 00:49:22,One day your life will flash before your eyes. Make sure it's worth watching.
432295780611653632,2014-02-08 23:32:00,"Your character is based upon what you stand for, your reputation is based upon what you fall for."
432276240926375937,2014-02-08 22:14:21,It all comes down to what you deserve and you probably deserve a lot more than what you're getting.
432256895508684800,2014-02-08 20:57:29,"If you cry over a guy, then you're friends can't date him. It can't even be considered. -Taylor Swift"
432237362748211200,2014-02-08 19:39:52,"Even though ‘I’ve stopped liking you’, everytime someone mentions your name, my head turns right towards them."
432217873843376128,2014-02-08 18:22:26,"Life's too short to play games. If you love somebody, and you want to be with them. Go get them."
432198301018906624,2014-02-08 17:04:39,"You’re so cute, it’s unbearable."
432178836898193409,2014-02-08 15:47:18,When someone can make you see this broken world as beautiful. They're worth keeping around.
432158845331193856,2014-02-08 14:27:52,"Here, let me tie your shoelaces so you won't fall for anyone else."
432139336700551168,2014-02-08 13:10:21,You can't just keep playing with someone's feelings because you are unsure about your own.
432119836743720960,2014-02-08 11:52:52,I realized that that I was holding on to something that didn't exist anymore.
432100505385308161,2014-02-08 10:36:03,"Always remember, when the pain of holding on is greater than the pain of letting go, it's time to let go."
432081021601714176,2014-02-08 09:18:37,"Sometimes it is not only the bad memories that's making you sad, but also the best ones which you know will not happen for the second time."
432061390728081408,2014-02-08 08:00:37,"Even though you're gone, I will always cherish the moments we shared together."
432041797703831552,2014-02-08 06:42:46,"Sometimes people have to cry out all their tears, to make room for a heart full of smiles."
432022212401328129,2014-02-08 05:24:56,"Sometimes you don't need to ask yourself who you really love most, but ask yourself who really makes you happy and who makes you feel loved."
432002628529037312,2014-02-08 04:07:07,"I don’t regret a second spent on you, but it’s time to wave goodbye to the memories I’m leaving behind."
431982955284537344,2014-02-08 02:48:57,"A person who truly loves you, will not let you go. No matter how hard the situation is."
431963331692208129,2014-02-08 01:30:58,"If you're going to trust someone with your heart, make sure they have a heart of their own so they know how it feels when its broken."
431943796809416704,2014-02-08 00:13:20,"There's no need to reminisce about the past, because obviously the past didn't last."
431924340062306304,2014-02-07 22:56:02,Love is an understatement. They haven't made a word for what I feel for you.
431904816311181313,2014-02-07 21:38:27,"You can't describe the feeling to anyone, because the rush that you get around him is more than anyone could ever explain."
431885325200130048,2014-02-07 20:21:00,It’s not that I’m mad at you. I had just wished and hoped so hard that you could be the one thing I could finally count on.
431865471126605824,2014-02-07 19:02:06,You stood there in front of me just close enough to touch close enough to hope you couldn't see what I was thinking of.
431845316975812609,2014-02-07 17:42:01,Falling in love with you was the second best thing in the world. Finding you was the first.
431825730716987393,2014-02-07 16:24:11,The hardest part about what you feel for someone is that you can't admit that you're jealous when somebody else catches their attention.
431806203782393856,2014-02-07 15:06:36,"I really can’t explain it, but I like you without trying. I love the things you say, and how you never fail to make me smile."
431786819017928705,2014-02-07 13:49:34,I’ve never needed someone to be able to breathe. Not until now.
431767360756654080,2014-02-07 12:32:15,"Because even if it breaks your heart to just be friends, if you really care about someone, you'll take the hit."
431747484981817344,2014-02-07 11:13:16,"When you're around, my whole body knows it. I’ll keep talking and stuff, but my mind will have no idea what I’m saying."
431727887217983489,2014-02-07 09:55:24,"One day, someone will walk into your life and make you realize why it never worked out with anyone else."
431708192444121088,2014-02-07 08:37:08,"Even though I promised myself I wouldn't risk the chance of getting hurt again, for some reason, when I’m with you, it all seems worth it."
