id,created_at,text
431688398462414848,2014-02-07 07:18:29,The first time you fall in love it changes your life and no matter how hard you try ... the feeling never goes away.
431668699095777282,2014-02-07 06:00:12,"Follow your heart, but be quiet for a while first. Ask questions, then feel the answer. Learn to trust your heart."
431649056973025280,2014-02-07 04:42:09,"Love is something you don't own,and you want to give to somebody who doesn't necessarily want it."
431628978722316288,2014-02-07 03:22:22,"Now, it's back to the way we started. Strangers."
431609431508262913,2014-02-07 02:04:42,"Sometimes no matter how much you like someone, they're just not good for you."
431589991966208000,2014-02-07 00:47:27,Suddenly I'm hating myself for everything I ever felt for you.
431570528051027968,2014-02-06 23:30:06,"Right now, all I want to do is be anywhere on earth that you are."
431550927682560000,2014-02-06 22:12:13,You can't go through life thinking everyone you meet will one day let you down.
431531474634825728,2014-02-06 20:54:55,"A girl doesn’t need to tell you straight up how she feels, it’s written all over her eyes."
431512024455983105,2014-02-06 19:37:38,I'm getting really tired of waiting. So it's time you decide what you really want from me.
431492230671380480,2014-02-06 18:18:59,She talks about you like you put the stars in the sky.
431472517622923265,2014-02-06 17:00:39,"If you look at the people's eyes the first seconds they look at you, the truth of their feelings will shine through for just an instant."
431453022133035011,2014-02-06 15:43:11,"I don't know what it is about you. Maybe it's the way nothing matters when we’re talking, or how you make me smile more than"
431433581714362369,2014-02-06 14:25:56,The time I receive your messages are my favorite parts of the day.
431413354406498306,2014-02-06 13:05:33,"I'd give him another chance, since I never really gave up. It seemed like I moved on but all I did was pick myself up and tried being happy."
431393799667867649,2014-02-06 11:47:51,"The longest distance on Earth: is not from North to South; it's when I stand in front of you and yet, you still ignore me."
431374288247996416,2014-02-06 10:30:19,There is nothing worse in the world than thinking you have a chance when you really don’t.
431354969178914817,2014-02-06 09:13:33,They say love has no age limit and that might be true. But don't date someone who could go to jail for being with you. Love will wait.
431335461823315968,2014-02-06 07:56:02,"Truth is, if I could be with anyone, it would still be you. Every time."
431316147632222209,2014-02-06 06:39:17,"I knew from the day we met, you'd be kind of hard to forget."
431296563411820545,2014-02-06 05:21:28,You know how I know I’m not over you? I still wonder what it would be like if you came back.
431276306739654656,2014-02-06 04:00:58,"It's alright to lose your pride over something you love, but never lose something you love over your pride."
431253937283297280,2014-02-06 02:32:05,I can't even pretend to concentrate on anything else when you smile at me.
431231017873981440,2014-02-06 01:01:01,"Even though you're gone, I will always cherish the moments we shared together."
431211040093642752,2014-02-05 23:41:38,"I'd like to say that I don't care, almost. But the thing is I do, I probably care more than anyone that you will ever know."
431191673696051200,2014-02-05 22:24:40,"Your character is based upon what you stand for, your reputation is based upon what you fall for."
431172313250144258,2014-02-05 21:07:44,Stay close enough to have fun but far away enough so that you don't get hurt.
431152833585377280,2014-02-05 19:50:20,"It’s not easy, is it? Fighting for something you could have had and wondering if maybe it's already too late."
431133466546036737,2014-02-05 18:33:23,Moving on doesn't take a day. It takes a lot of little steps to be able to break free of your broken self.
431113849719111680,2014-02-05 17:15:26,"Respect people's relationships. There's so many other fish in the sea, so why mess with one that's already been caught?"
431093921569988608,2014-02-05 15:56:14,"Just love me day by day, you don't have to promise me forever."
431074250623967234,2014-02-05 14:38:04,Sometimes we don’t need advice; we just need somebody to listen.
431054156468465665,2014-02-05 13:18:14,"Dust off your heart, take it off the shelf, you gotta remember to love yourself."
431033882779975682,2014-02-05 11:57:40,"It’s hard to let someone in when every time you do, your heart was left in a million pieces."
431013720647401472,2014-02-05 10:37:33,"The sweetest sound of all, is your own name spoken by the only boy you care about."
430994137978908672,2014-02-05 09:19:44,Never fall for someone unless they are willing to catch you.
430973540330782720,2014-02-05 07:57:53,"You know what? I'm not anybody's last resort, I'm somebody's first priority."
430953390005186560,2014-02-05 06:37:49,"When you realize you want to spend the rest of your life with somebody, you want the rest of your life to start as soon as possible."
430813463720386560,2014-02-04 21:21:48,"Just love me day by day, you don't have to promise me forever."
430793925167550464,2014-02-04 20:04:10,"No, it's not selfish to want someone to need you. All you are guilty of is the desire for love. Something that everyone deserves."
430645802000588800,2014-02-04 10:15:34,"At one point, your heart has to choose between the one you have always loved, and the one you truly love."
430625316365537280,2014-02-04 08:54:10,"People don't fall in love with what is right in front of them. They want the dream, the more unattainable, the more attractive."
430605802483642369,2014-02-04 07:36:38,The cruelest thing you can do to a person is pretend they mean more to you than they actually do.
430586527458926592,2014-02-04 06:20:02,"If I fall asleep texting you, it's because I don't want the conversation to end"
430567088395018240,2014-02-04 05:02:48,Why does Cupid never grow old? It symbolizes that love never gets old. And why does he throw arrows? To remind us that true love hurts.
430547705400549376,2014-02-04 03:45:46,I feel like I've gotten a lot smarter since I've met you. Not necessarily within my brain but my heart.
430401960261332992,2014-02-03 18:06:38,"Sometimes there is no next time, no time outs, no second chances. Sometimes it's now or never."
430380708075302912,2014-02-03 16:42:11,You know the feeling you got when you first rode on a roller-coaster? Flew you high. That's how I feel when you're around.
430360524954411008,2014-02-03 15:21:59,"You fight like a married couple, talk like best friends, and flirt like first loves, obviously its meant to be."
430339790857199618,2014-02-03 13:59:36,"Never be ashamed of what you feel. You have the right to feel any emotion that you want, and to do what makes you happy."
430319816239357952,2014-02-03 12:40:13,"I'm not afraid to try again, I'm just afraid of getting hurt for the same reason."
430300125538177024,2014-02-03 11:21:59,"To be honest, ""I'm sorry"" doesn't mean shit to me. Don't keep saying you're sorry if you're going to keep doing the same shit."
430280208361336832,2014-02-03 10:02:50,You take a while to fall in love with someone. Trust takes time. You tend to give more than take in relationships.
430260670928404480,2014-02-03 08:45:12,"It's there. I know it is, because when I look at you, I can feel it."
430240356781678592,2014-02-03 07:24:29,"If he misses you, he'll call. If he cares, he'll show it. If not, he can't be worth your time because you're obviously not worth his."
430220101220982785,2014-02-03 06:03:59,"All I want is someone to put up a little bit of a fight, to try and keep me instead of just letting me go so easily."
430199783517483008,2014-02-03 04:43:15,"Same typical story that everyone knows, one heart holding on; on heart letting go."
430179478296199168,2014-02-03 03:22:34,Mr. right is coming. But his plane crashed in Africa and he's walking.
430157225642819584,2014-02-03 01:54:09,"If he takes the time to argue with you, then he cares more than you think."
430136747683360768,2014-02-03 00:32:46,"I don't want something perfect, I want something real. Something between the two of us, something we can feel."
430116106729058305,2014-02-02 23:10:45,"It's hard to tell yourself that you aren't in love, when the only time you smile is when you think about the one who broke your heart."
430095509605203969,2014-02-02 21:48:54,The first person who's on your mind the moment you open your eyes after a long sleep is the reason of either your happiness or your pain.
430074832407904256,2014-02-02 20:26:45,"I'm falling back on you, after all that we've been through."
430053946128736256,2014-02-02 19:03:45,"I liked him. Actually, no. I loved him. But there were parts of me that weren’t completely ready to give him another chance."
430033028560080896,2014-02-02 17:40:38,"I'd like to say that I don't care, almost. But the thing is I do, I probably care more than anyone that you will ever know."
430011705444139008,2014-02-02 16:15:54,There is nothing worse in the world than thinking you have a chance when you really don’t.
429990901142679553,2014-02-02 14:53:14,Stay close enough to have fun but far away enough so that you don't get hurt.
429970157578899456,2014-02-02 13:30:48,Trust is like a piece of paper. Once it’s crumbled it can’t be perfect.
429948846815199232,2014-02-02 12:06:07,"Here, let me tie your shoelaces so you won't fall for anyone else."
429926915655208960,2014-02-02 10:38:59,"If he misses you, he'll call. If he cares, he'll show it. If not, he can't be worth your time because you're obviously not worth his."
429900387588403200,2014-02-02 08:53:34,I don't want to forgive. I want to forget.
429879916079767553,2014-02-02 07:32:13,I miss you. I really do. You just don’t know how much I miss you.
429522278854819840,2014-02-01 07:51:06,Do I miss you? Yeah. Do I want you back? No.
429487191018848257,2014-02-01 05:31:40,I like long text messages because I appreciate a complete thought.
429467155738804224,2014-02-01 04:12:03,Her: Why don't you go find some other girl who's not gonna hurt you? Him: Because I love you ♥
429447068831080448,2014-02-01 02:52:14,"Relationships start with ""Can we talk?"" and end with ""We need to talk."""
429427070981001216,2014-02-01 01:32:46,I just wish you knew what I feel about you. That's it.
429406943463997441,2014-02-01 00:12:47,When you're right. No one remembers. When you're wrong. No one forgets.
429386818392297472,2014-01-31 22:52:49,Don't make time for people that don't make time for you.
429366578967093248,2014-01-31 21:32:24,#ImAttractedTo Guys with dimples.
429346109270421504,2014-01-31 20:11:03,"Never ignore a person who loves and cares for you, because one day you may realize that you’ve lost the moon while counting the stars."
429325417367883776,2014-01-31 18:48:50,It always rains the hardest on those who deserve the sun!..
429303851779252224,2014-01-31 17:23:09,Sometimes the best moments are the ones you didn't plan at all.
429283510134665216,2014-01-31 16:02:19,Arguments may bring out the worst but it can also show how much someone truly cares.
429262021578612736,2014-01-31 14:36:55,"If he misses you, he'll call. If he cares, he'll show it. If not, he can't be worth your time because you're obviously not worth his."
429240832495865856,2014-01-31 13:12:44,The people with the biggest hearts seem to suffer the most.
429219072081788929,2014-01-31 11:46:15,"So many words I could use, yet none seem to be able to describe exactly how I feel about you."
429197895259004928,2014-01-31 10:22:07,The best relationship is when you can completely act yourself and they can still love you for who you are.
429177695428034560,2014-01-31 09:01:50,"Sometimes, I'm scared to be happy because when I'm happy, something bad always happen."
429156965839671296,2014-01-31 07:39:28,"If a girl is silent, it's dangerous. They're either: about to blow up, need a hug, falling apart, crying inside or all of the above."
429136199798632448,2014-01-31 06:16:57,Find someone you can be yourself around.
429115318040944641,2014-01-31 04:53:59,"Relationships or friendships are worth fighting for, but not if you're the only one fighting."
429094550376697858,2014-01-31 03:31:27,"I tried my best for you, and even that wasn't enough"
429073325692706816,2014-01-31 02:07:07,"It’s not the people that stand by your side when you’re at your best, but the ones who stand beside you when you’re at your WORST"
429052286229172224,2014-01-31 00:43:31,All I need is someone who can stay no matter how hard it is to be with me.
429031570213584899,2014-01-30 23:21:12,"I don't give up on people, they give up on me, so trust me when I tell you I'm not going anywhere."
429010808933085184,2014-01-30 21:58:42,"Every relationship has ups and downs, you should never expect perfection from somebody."
428990378314723328,2014-01-30 20:37:31,"Just because you miss someone, doesn't mean you need them back in your life. Missing is just a part of moving on."
428969543902306304,2014-01-30 19:14:43,I miss you so badly.
428760018708467712,2014-01-30 05:22:09,I replay our conversation in my head all the time.
428724815654965248,2014-01-30 03:02:16,"Every Summer: ""Let's make this the best one yet!"" ... End of Summer: ""Wow, this Summer sucked."""
428704076323241984,2014-01-30 01:39:51,"Looking great in mirrors, then terrible in pictures. -.-"
428683899485425664,2014-01-30 00:19:40,Who else thinks their life could make a perfect reality show?
428663396444012544,2014-01-29 22:58:12,"That awkward moment when someone says ""you two should go out"", when you actually do like the person. &gt;.&lt;"
428643611345813504,2014-01-29 21:39:35,If only you could delete feelings the same way you delete text messages.
428624058284916737,2014-01-29 20:21:53,"3 facts about you. 1) You can't say ""M"" without your lips touching. 2) You're trying it now looking like an idiot. 3) Now you're smiling."
428604396012728320,2014-01-29 19:03:45,I love finding money in my clothes. It's like a gift to me from me.
428584328616894465,2014-01-29 17:44:01,She wants to be your girl.. not one of your girls.
428561054046490624,2014-01-29 16:11:32,The best feeling comes when you realize you’re perfectly happy without the people you thought you needed the most.
428540592281227264,2014-01-29 14:50:13,My best friend and I can speak to each other through facial expressions.
428391979219574784,2014-01-29 04:59:41,okay = everything's cool. okay? = you make no sense. okay... = you're creepy. okayy = i don't care. k. = i'm so pissed off.
428370796960940032,2014-01-29 03:35:31,Don't ever expect me to come halfway if you ain't ready to take the other.
428350454615900160,2014-01-29 02:14:41,Normal Teenager: Makes sure to be quiet while sneaking out of the house at 1am. Me: Makes sure to be quiet while making a sandwich at 1am.
428330460003848192,2014-01-29 00:55:14,That awkward moment when you tell your parents something funny and they take it too seriously.
428255439294173184,2014-01-28 19:57:07,If you only knew how much l think about you.
428069757405769728,2014-01-28 07:39:17,One day you're gonna remember me &amp; how much I loved you. Then you're gonna hate yourself for letting go.
428049440822136832,2014-01-28 06:18:34,The worst feeling is feeling unwanted by the person you want the most.
427904430386581504,2014-01-27 20:42:20,"I like conversations where I don't have to think about what to say, it just comes naturally."
427884719200403456,2014-01-27 19:24:01,I want you to know that I love you more than anything else.
427865016809705472,2014-01-27 18:05:44,"She stay quiet, but she play smart."
427845357460942848,2014-01-27 16:47:36,"You can never ""just be friends"" with someone you fell in love with."
427825575554605056,2014-01-27 15:29:00,"3 common lies from guys: I'm sorry, I love you, I won't hurt u. 3 common lies from girls: I'm fine, I'm not mad at u, I don't love you."
427805486159646721,2014-01-27 14:09:10,"I Have A Habit Of Falling Too Hard And Falling Too Fast, And Getting My Hopes Up For Something That Won't Last."
427785781470453760,2014-01-27 12:50:52,Promise is a big word. It either makes something or it breaks everything.
427766118405505025,2014-01-27 11:32:44,"She'll chase after you for a while, but one day she'll be gone for good. Cause one day she'll get tired of putting up with your shit. ."
427746240797757440,2014-01-27 10:13:45,The dumbest thing ever is when you both love each other but aren't together...
427725985006374912,2014-01-27 08:53:16,"""Sorry"" Used To Mean That You Wont Do It Again. Today It Just Means ""I Messed Up But I'll Try Not To Get Caught Next Time."""
427704966057193472,2014-01-27 07:29:44,"Loyalty is rare; if you find it, keep it."
427683643268415489,2014-01-27 06:05:01,"Fuck everyone who said they were there for me, and then left.."
427568057767047168,2014-01-26 22:25:43,"A real boyfriend: Calls you for nothing, texts you all the time, wants to see you, cries,gets jealous, is overprotective and loves you."
427548855161217025,2014-01-26 21:09:25,Smiling doesn’t mean that I’m happy. Laughing doesn’t mean I don’t cry &amp; loving you doesn’t mean I’ll wait for you for the rest
427529496103620608,2014-01-26 19:52:29,"For a very short period of time, you were the youngest person in the world. MIND = BLOWN"
427510378692493313,2014-01-26 18:36:31,I'm not some back-up for you to come running back to whenever you're alone.
427491220865036288,2014-01-26 17:20:24,"""Hi, Can I help you?"" ""No, I just waited in line for 15 minutes to say nice shoes"" -__-"
427472092179619840,2014-01-26 16:04:23,"I hate the fact that you ignore me for so long, then you start talking to me like nothing happened."
427452884574158848,2014-01-26 14:48:04,Facebook wants to know what I'm thinking. Twitter wants to know what I'm doing. I think they were created by my parents.
427433770971443201,2014-01-26 13:32:07,"""Do you realize how many calories are in that?"" ""Do you realize how much I dont care?"""
427414590213742595,2014-01-26 12:15:53,When I'm bored nobody texts me. When I'm busy I'm the most popular person in the world.
427395363394183168,2014-01-26 10:59:29,That ridiculous smile that decides to show up whenever you're talking to the person you like.
427375970828296192,2014-01-26 09:42:26,"Dear Twitter, Sometimes I need more than 140 characters to describe what's on my mind.."
427356655894814720,2014-01-26 08:25:41,"Don't wait for Prince Charming, because he's too lazy to leave his castle. Wait for your knight in shining armor who will fight for you. :)"
427337489292877825,2014-01-26 07:09:31,"""You're like a coin."" ... ""Awwww, valuable?"" ... ""No, two faced"""
427318064871256064,2014-01-26 05:52:20,Sometimes the people you think don't want to talk to you are the ones waiting for you to talk to them.
427298962370859009,2014-01-26 04:36:26,"Brain: ""I hate you"" .. Heart: ""I love you"""
427279715657711616,2014-01-26 03:19:57,That awesome feeling when someone is making an effort to make you smile. :D
427260307304505344,2014-01-26 02:02:50,The first to apologize is the bravest. The first to forgive is the strongest. The first to forget is the happiest.
427240878487257088,2014-01-26 00:45:37,I was smiling yesterday. I am smiling today &amp; I will smile tomorrow simply because life is too short to cry for anything.
427221717824438273,2014-01-25 23:29:29,"No matter how good or bad you have it, wake up each day thankful for your life. Someone somewhere else is desperately fighting for theirs."
427202456007614464,2014-01-25 22:12:57,"We don't talk anymore, and the saddest part is, we used to talk everyday."
427183268895526913,2014-01-25 20:56:42,"It's hard to pretend you like someone when you don't, but it's harder to pretend you don't love someone when you really do."
427164012007018496,2014-01-25 19:40:11,"Even though we don't talk anymore, I will never forget our memories."
427144523878121473,2014-01-25 18:22:45,"Me: Have you seen the matter sexy today? You: What's the matter sexy? Me: Aww, I'm fine, How about you?"
427125156020903937,2014-01-25 17:05:47,"Dear Twitter, You should feel special. I'm always choosing you over sleep."
427105857159983105,2014-01-25 15:49:06,"Dear forever, you didn't last."
427086319047540736,2014-01-25 14:31:28,"DORA: ""Where's the castle?"" BOOTS: ""Uh Dora, it’s right behind us."" DORA: ""Shut up monkey. I'm talking to the kids."""
427066723024392192,2014-01-25 13:13:35,If I could remember school work like I remember lyrics ... I would be a genius.
427047132206333952,2014-01-25 11:55:45,"When I find it, I don't need it. When I need it, I can't find it."
427027733797826560,2014-01-25 10:38:40,Looking at an old picture and wishing you could go back to that moment.
427008234910519296,2014-01-25 09:21:11,"Life doesn't change, but people do. So learn to accept that not everybody is who you thought you knew."
426988480300720128,2014-01-25 08:02:41,"When People say, ""When I was little I..."" And I`m just sitting there awkwardly like, ""I still do that..."""
426968498242220032,2014-01-25 06:43:17,The PAST is where you learned the lesson. ♥ The FUTURE is where you apply the lesson.
426948420767473666,2014-01-25 05:23:30,"You can go wherever you want. In the end, you'll always come back to those who are really meant for you."
426928159812882433,2014-01-25 04:02:59,Smiling doesn’t mean that I’m happy. Laughing doesn’t mean I don’t cry &amp; loving you doesn’t mean I’ll wait for you for the rest
426908039409446912,2014-01-25 02:43:02,"Expect the best, be prepared for the worst, forget what others think and do your own thing."
426887702961614848,2014-01-25 01:22:14,"Everytime I say ""How are you?"" My head says ""I miss you"". Everytime I say ""Take care"" My heart whispers ""I love you""."
426867434033672192,2014-01-25 00:01:41,I wish I can delete you from my mind as easy as deleting some files on my computer!
426847128359424000,2014-01-24 22:41:00,"Don't count the minutes, hours, days, weeks, months, or years... count the memories."
426824635510833152,2014-01-24 21:11:37,"Be a girl with a mind, a bitch with an attitude, and a lady with class."
426802673564672000,2014-01-24 19:44:21,#ThingsThatIWant to be loved by him &lt;3
426777858678071296,2014-01-24 18:05:45,Everyone makes mistakes. The most important thing is that you learn from them &amp; not repeat them.
426756680102068225,2014-01-24 16:41:35,That awkward moment when you flip your hair and boys don't get overwhelmed.
426736084320407555,2014-01-24 15:19:45,"That awkward moment when you can't read your own handwriting &amp; you're like, ""WTF did I just write?!"""
426715640863289346,2014-01-24 13:58:31,"It's funny how in the end, you always go back, to the ones that have been there from the very beginning."
426695381720653824,2014-01-24 12:38:01,Just because we don't talk doesn't mean I don't think about you. I'm just trying to distance myself because I know I can't have you.
426675162331639808,2014-01-24 11:17:40,"That moment when you REALLY wanna talk to someone, but you don't have ANYTHING to talk about."
426654661349617664,2014-01-24 09:56:12,"""We need to talk"" Scariest thing someone could ever say."
426042689629331456,2014-01-22 17:24:27,"Forever is a long time, but I would spend it with you."
426026547091222529,2014-01-22 16:20:18,"You will always in my heart, but never in my life."
426010509456855040,2014-01-22 15:16:35,You have to fight for who you love and Love who your fighting for.
425994202539769856,2014-01-22 14:11:47,"If you're truly meant to be together, life will find a way to make it happen."
425977958235271170,2014-01-22 13:07:14,"Feel the pain, but never stop living. Never stop giving your heart and never stop searching for love. It's worth everything."
425961576533741569,2014-01-22 12:02:08,What hurts a girl the most? Its the improper response from the one she really loves.
425945175718780928,2014-01-22 10:56:58,"You're everything I ever thought I wanted, but something just doesn't feel right about this."
425928729269768192,2014-01-22 09:51:37,"'You're mine forever' is one of the most selfish phrases, but is also one of the most loving things that someone can say."
425911972677173249,2014-01-22 08:45:02,The one who moves forward is the one who doesn't look back.
425895611548725248,2014-01-22 07:40:01,Treats the woman as if she were a gift and you can't wait to explore the treasure inside.
425877849526902784,2014-01-22 06:29:26,You never know how much you really love someone until you watch them love someone else.
425861301932273664,2014-01-22 05:23:41,"When you miss someone, eventhough you are one day further from the last time you saw them, you are one day closer to the next time you will."
425844734527938562,2014-01-22 04:17:51,I don't want anyone else to realize how amazing you are.
425828031198818304,2014-01-22 03:11:28,"I can't find a reason why I like you, I just do. I can't find a reason why you should like me, it's up to you."
425811254779707392,2014-01-22 02:04:48,"When there is love in a relationship, things you do and things you say aren't just said with no feelings."
425794518122647552,2014-01-22 00:58:18,No one is perfect until you fall in love with them.
425777628423798784,2014-01-21 23:51:11,I love how you make me feel.
425760788104491008,2014-01-21 22:44:16,"You are my heart most wanted. Nobody can stop me for loving you, even you can't stop me!"
425743928332021760,2014-01-21 21:37:17,"I talk to the stars pretending that its you and it acts same as you, far away and never replies."
425726919301013504,2014-01-21 20:29:41,"Sometimes love waits for you, sometimes it moves on. Always remember love is there when you don't even realize it."
