id,created_at,text
476383783084896256,2014-06-10 15:21:59,"You get in the biggest fights with the people you care about the most, because they are the relationships you're willing to fight for."
468357994548568065,2014-05-19 11:50:22,"Girls want a guy that can openly say: ""Yes that's my girlfriend and yes I do love her."""
468336015430942720,2014-05-19 10:23:02,"I need to stop getting attached to people so fast, because attachments lead to expectations and expectations lead to disappointments."
457266831539990528,2014-04-18 21:18:02,"I just want you that's it. All your flaws, mistakes, smiles, giggles, jokes, sarcasm. Everything. I just want you."
457252532369121281,2014-04-18 20:21:13,"Believe me when I say this, I really do miss you."
457238286524633088,2014-04-18 19:24:37,I wish you were here to tell me that everything is gonna be okay.
457223849398919168,2014-04-18 18:27:15,"I try not to miss you, I try to let go, but in the end, you're always on my mind."
457209645086420992,2014-04-18 17:30:48,Always be positive. Don't let negative people hold you back from your dreams.
457195276973797377,2014-04-18 16:33:42,It's scary how much one person can mean so much to you.
457180928079433728,2014-04-18 15:36:41,"""Sometimes you have to forget how you feel and remember what you deserve."""
457166331624714242,2014-04-18 14:38:41,Don't allow your wounds to transform you into someone you are not.
457151910227623936,2014-04-18 13:41:23,I have never seen seen a smiling face that was not beautiful.
457137446837182464,2014-04-18 12:43:55,"Take your relationship as a test. If he cheats on you, then he has failed in getting the perfect person."
457123095174598656,2014-04-18 11:46:53,"I wanna be the reason behind your smile, because you surely are the reason behind mine."
457108719113760769,2014-04-18 10:49:45,"""To release the old and embrace the new, some people you know need to become some people you knew."""
457094434920734720,2014-04-18 09:53:00,"When people cut you down or talk behind your back, remember, they took time out of their pathetic lives to think about you."
457080238736809984,2014-04-18 08:56:35,"Don't change yourself just to make someone love you, be yourself &amp; let the right one fall for you."
457066072500228097,2014-04-18 08:00:18,"Don't worry about the people who hate you, worry about the people who love you."
457051510577197056,2014-04-18 07:02:26,"Sometimes, it's not the person you miss. It's the feelings and moments you had with them."
457036861953695744,2014-04-18 06:04:13,"When I text you, that means I miss you. When I don’t text you, that just means I’m waiting for you to miss me."
457022527626153985,2014-04-18 05:07:16,"""Guys, tell her you love her at least once a day. Put a smile on her face."""
457008214232420352,2014-04-18 04:10:23,Delete your message? Done. Delete your contact? Done. Delete you of my life? Sorry I can't promise.
456994024595787776,2014-04-18 03:14:00,"I wanna be the reason behind your smile, because surely you're the reason behind mine."
456979804059758593,2014-04-18 02:17:30,Your crush + fast replies = best feeling.
456965331500552192,2014-04-18 01:19:59,"Maturity has nothing to do with age. Maturity comes from experiences, mistakes, learning, and understanding."
456950990965862400,2014-04-18 00:23:00,"Believe me when I say this, I really do miss you."
456936566250668032,2014-04-17 23:25:41,RT if you're following us and wanted our follow back! ❤
456922125010751488,2014-04-17 22:28:18,"Announcing the winner of the Galaxy Tab soon! For now, keep your entries coming with the hashtag: #TattAwards2013!"
456907848778539009,2014-04-17 21:31:34,Don't question why you are single. Question why there hasn't been anyone out there that made you want to change that.
456893247088898048,2014-04-17 20:33:33,I have never seen seen a smiling face that was not beautiful.
456878936883208193,2014-04-17 19:36:41,#10peopleItreasure... can't it be all my 2 million followers? ;)
456864380655656961,2014-04-17 18:38:51,"#iHateWhenPeopleSay: ""I'm always here for you"" but they're nowhere to be found when I need someone."
456849616315486209,2014-04-17 17:40:11,"Be with someone who knows exactly what they have, not someone who will realize it when they've lost you."
456834714548981760,2014-04-17 16:40:58,"I get jealous, I get mad, I get curious. But it's only because I care."
456819497005887489,2014-04-17 15:40:30,"You can't make the same mistake twice, the second time, it's not a mistake, it's a choice."
456804432785973248,2014-04-17 14:40:38,You can't blame someone for walking away if you didn't do anything to make them stay.
456788107195457536,2014-04-17 13:35:46,"If a person doesn't want to be with you anymore, don't ask questions. Just let it go and they'll realize they lost something good."
456772205540831232,2014-04-17 12:32:34,I want to meet someone who is afraid to lose me.
456757442689241088,2014-04-17 11:33:55,"Being deeply loved by someone gives you strength, while loving someone deeply gives you courage."
456742327587852288,2014-04-17 10:33:51,Your crush + fast replies = best feeling.
456727132882731008,2014-04-17 09:33:28,I have never seen seen a smiling face that was not beautiful.
456712315040063488,2014-04-17 08:34:35,Grades do not measure intelligence nor does age define maturity.
456697303772839936,2014-04-17 07:34:56,"I just want you that's it. All your flaws, mistakes, smiles, giggles, jokes, sarcasm. Everything. I just want you."
456682476891426816,2014-04-17 06:36:01,Relationships are like drugs. They either kill you or give you the best feeling of your life.
456668214844334080,2014-04-17 05:39:21,"Forgive your enemies, but never forget their names."
450789362498691072,2014-04-01 00:18:53,"Be strong, smile your problems away, things will get better, there's always a rainbow behind rain storm."
450766323727888384,2014-03-31 22:47:21,"People lie, actions don't."
450745238777118720,2014-03-31 21:23:34,"Have you realized that people will tell you they care, but they don't seem to show it unless you get sick, die, or become famous."
450724708351107072,2014-03-31 20:01:59,"A beautiful life does not just happen, it is built daily by prayer, hard work, sacrifice, and love."
450704752175611905,2014-03-31 18:42:41,"I love talking to someone who understands. I don't have to get judged, or worry about the right or wrong things to say."
450685021485953024,2014-03-31 17:24:17,Don't rush things. Anything worth having is worth waiting for.
450664607657365504,2014-03-31 16:03:10,You are never too old to set another goal or to dream a new dream.
450644536084013057,2014-03-31 14:43:24,"The goal isn't to survive, it's to live."
450624347862863872,2014-03-31 13:23:11,"Dont trust words,Trust actions."
450604603348750336,2014-03-31 12:04:43,"There is no growth without change, no change without fear or loss, and no loss without pain."
450584742560153600,2014-03-31 10:45:48,"Good relationship don’t just happen. They take time, patience, and two people who truly want to be together. Remember, only TWO."
450434794187280384,2014-03-31 00:49:58,"A billion feelings, a thousand thoughts, hundreds of memories, all for that one person."
450414392098582528,2014-03-30 23:28:54,"Life isn't getting what you want, but getting what you need."
450394329131917312,2014-03-30 22:09:10,One of the best feeling in the world is when you’re hugging the person you love and they hug you back even tighter.
450374035772149760,2014-03-30 20:48:32,Family : (F)ather (A)nd (M)other (I) (L)ove (Y)ou.
450353931265126401,2014-03-30 19:28:39,"Life can either be accepted or changed. If it is not accepted, it must be changed. If it cannot be changed, then it must be accepted."
450334007754911744,2014-03-30 18:09:28,"""Be strong."" Easy to say, hard to do."
450313624070795264,2014-03-30 16:48:29,"Sometimes people don't want to hurt you, but they don't realize that they already did."
450293470591078401,2014-03-30 15:28:24,"Everything happens for a reason. So don't worry, be happy."
450273579448274945,2014-03-30 14:09:21,You are not fully dressed until you wear a smile.
450253536903692288,2014-03-30 12:49:43,"Don't let me get attached, if you're gonna end up leaving me"
450233636151783425,2014-03-30 11:30:38,Nothing is over until you stop trying.
450084329209622529,2014-03-30 01:37:20,Rules to a better life: 1. Never hate 2. Live simply. 3. Expect a little. 4. Give a lot. 5. Always smile. 6. Live with love. 7. Be with God.
450063839342514177,2014-03-30 00:15:55,Bad times make you appreciate the good times.
450043707090161664,2014-03-29 22:55:55,The best relationship is when you can act like lovers and best friends at the same time.
450023682950193152,2014-03-29 21:36:21,"A true relationship is having someone who accepts your past, supports your present, and encourages your future."
450003364604964864,2014-03-29 20:15:37,"Never accept to be second to someone, when you can be first to someone else."
449983321045356544,2014-03-29 18:55:58,"Move on, be strong inside, smile, look happy and act like there's nothing wrong."
449963356007301120,2014-03-29 17:36:38,"At the end of the day before you close your eyes, be content with were you've been, and proud of who you are!"
449943438645923841,2014-03-29 16:17:29,Be thankful for everything you have.
449923372684554242,2014-03-29 14:57:45,"Dear bestfriend, I honestly don't know what I'd do without you, please never leave me."
449903299324420096,2014-03-29 13:38:00,"Always remember that no matter how useless you feel, you are someones reason to smile."
449753230432432128,2014-03-29 03:41:40,"Just because a relationship ends, doesn't mean two people stopped loving each other. They just stopped hurting each other."
449732901563662337,2014-03-29 02:20:54,Hurting someone with the truth is better than making them happy with a lie.
449712740026687488,2014-03-29 01:00:47,Your happiness is what truly matters most.
449692740993835009,2014-03-28 23:41:19,Some people come into your life as a blessing. Some come as a lesson.
449672727427702785,2014-03-28 22:21:47,"No matter how much you tell yourself you're over someone, your heart knows the truth."
449652873421283328,2014-03-28 21:02:53,"Sometimes, people just say ""I'm fine"" because it's difficult to find someone who actually listens and cares about your life."
449633300617773056,2014-03-28 19:45:07,You want me in your life? Put me there. I shouldn't have to fight for a spot.
449633032119795712,2014-03-28 19:44:03,Friends make the bad times good and the good times unforgettable!
449613170470965248,2014-03-28 18:25:07,Go to sleep. Don't you weep. Tomorrow's gonna be a brand new day.
449593537307213824,2014-03-28 17:07:07,Life becomes too hard when you stop believing in God.
449452948204961793,2014-03-28 07:48:27,Life is too short to waste time with anyone who doesn't fully appreciate you.
449432587828613120,2014-03-28 06:27:33,"In life, we need someone to teach us, love us, hurt us, protect us. In a way, to help us to be a better person."
449411780972773377,2014-03-28 05:04:52,Save your smiles for the people who deserve to see them.
449260815665745920,2014-03-27 19:04:59,Silence is a girl's loudest cry.
449105818554605568,2014-03-27 08:49:05,"The new emojis MOVE! I'm sorry, but if you don't have the animated emojis (Dynamojis), burn your phone. #ad"
449085091998748672,2014-03-27 07:26:44,"As you waste your breath complaining about life, Someone out there is breathing their last. Appreciate what you have."
449064734579376129,2014-03-27 06:05:50,"Laugh a little more, cry a little less."
449044272533078016,2014-03-27 04:44:32,I miss how we used to talk every minute of every day &amp; how I was able to tell you everything that was on my mind. I miss our conversations.
449023604282241024,2014-03-27 03:22:24,The principle of life is that life responds by corresponding; your life becomes the thing you have decided it shall be.
449003208250097665,2014-03-27 02:01:21,The best feeling comes when you realize that you're perfectly happy without the people you thought you needed most.
448851381370114050,2014-03-26 15:58:03,"Learn things from those around you, enjoy life with those beside you. Don't underestimate those below you."
448830764260397056,2014-03-26 14:36:07,It's hard to find the good in someone when you've already found the best in someone else.
448809285959438336,2014-03-26 13:10:46,"Dear girls, it is more important to be respected, rather than being beautiful."
448788618530652161,2014-03-26 11:48:39,Sorry for caring. Sorry for trying. Sorry for it all. But most of all... . . . . I'm sorry I let you in.
448768360696664064,2014-03-26 10:28:09,"Best Friend is someone who helps you up when you are down, and if they can’t help you up they lay down and listen."
448747950567473152,2014-03-26 09:07:03,There is beauty in simplicity.
448727704041295873,2014-03-26 07:46:36,"There's ""hell"" in hello, ""good"" in goodbye, ""lie"" in believe, ""over"" in lover, ""end"" in friend, ""ex"" in ""next"", ""if"" in life."
448706251573047296,2014-03-26 06:21:21,"Anyone can make you smile. Many people can make you cry but, it takes someone very special to make you laugh with tears still in your eyes."
448539808768348160,2014-03-25 19:19:58,"Think big, dream big, believe big."
448519052626231296,2014-03-25 17:57:29,"No matter how much you tell yourself you're over someone, your heart knows the truth."
448497905964310528,2014-03-25 16:33:28,"When someone talks about their problems, it doesn't just mean they're complaining, it means they trust you enough to tell you."
448477113775955970,2014-03-25 15:10:50,"When something bad happens you have three choices: you can either let it define you, let it destroy you, or let it strengthen you."
448455589090193408,2014-03-25 13:45:19,"You get in the biggest fights with the people you care about the most, because they are the relationships you're willing to fight for."
448435035964596224,2014-03-25 12:23:38,The only thing worse than a mistake is not learning from it.
448414861785976832,2014-03-25 11:03:28,My life. My choices. My problems. My mistakes. My lessons. Not your business. Mind your own problems before you talk about mine.
448393487281438720,2014-03-25 09:38:32,A true friend can go long periods of time without speaking to you and never question the friendship.
448373604808269824,2014-03-25 08:19:32,Today is the day for the perfect day. Make the best of it.
448353256138215424,2014-03-25 06:58:40,"About life: ""It goes on."" About love: ""It doesn't last."" About people: ""They change fast."""
448332857836990464,2014-03-25 05:37:37,"You could be happy. Stop thinking about how good your past was, start living in the present and prepare for your future."
448312507656970240,2014-03-25 04:16:45,"Don't chase people. Be you, do your own thing and work hard. The right people who belong in your life will come to you, and stay."
448291285028184064,2014-03-25 02:52:25,Some pursue happiness. Others create it.
448268724345126912,2014-03-25 01:22:46,"Keep smiling, because life is beautiful and there is so much to smile about."
448247987890688000,2014-03-25 00:00:23,You will learn that the best experiences are sometimes made by mistake.
448226817166413824,2014-03-24 22:36:15,"Arguments may bring out the worst, but they can also show how much someone truly cares."
448206760751267841,2014-03-24 21:16:33,"If you want it, pursue it and get it."
448041438257762304,2014-03-24 10:19:37,"Laugh a little more, cry a little less."
448020695541223425,2014-03-24 08:57:12,Live for today and not tomorrow. Live for the Now and what's here. Stop living for what may or may not come. Live for the day already here.
447999098411433985,2014-03-24 07:31:23,"I'm mature enough to forgive you, but I'm not dumb enough to trust you again."
447975869714137088,2014-03-24 05:59:04,"No matter how long it takes.. if you keep moving,..one step at a time..you will reach your goal."
447952713070821377,2014-03-24 04:27:04,"Always remember, that no matter how useless you think you are, you are still someone's reason to smile."
447927792244498432,2014-03-24 02:48:02,You only have the strength to deny it because you're too afraid to admit it.
447905670000435200,2014-03-24 01:20:08,"Always remember that no matter how useless you feel, you are someones reason to smile."
447883466571382784,2014-03-23 23:51:54,Stop regretting things and start accepting them. Our most significant opportunities will be found in times of greatest difficulty.
447861599022219264,2014-03-23 22:25:00,A life without dreaming is a life without meaning. DREAM BIG!
447839823949094912,2014-03-23 20:58:29,"Whenever you're to say something, think twice. Because everything that's been spoken can only be forgiven, not forgotten."
447669975742816258,2014-03-23 09:43:34,"Sometimes you have to stop worrying. Have faith that things will work out, maybe not how you planned, but just how they're supposed to."
447646165895352320,2014-03-23 08:08:57,"Eventually all things fall into place. Until then, laugh at the confusion, live for the moments, and know everything happens for a reason."
445299234409943040,2014-03-16 20:43:05,"If you're ambitious and daring, there's nothing that can stop you from getting what you want. You'll always find a way."
445154844781735937,2014-03-16 11:09:20,"Falling in love is not always a happily ever after story. Most of the time, it's just once upon a time."
445133876600397824,2014-03-16 09:46:01,"In a world where we all desire to love, it's amazing how many people are hurting."
445113334568718336,2014-03-16 08:24:23,"When someone helps you get back on your feet, make sure you don't just walk away as soon as you feel the ground underneath you."
445093333929431041,2014-03-16 07:04:54,"Everyone makes mistakes, but make sure you admit to your own before you point out another person's mistakes."
445072078580899840,2014-03-16 05:40:27,"Love is like a rose. It looks perfect, beautiful, and flawless, but when you hold it...it's actually quite painful."
445052186641182721,2014-03-16 04:21:24,"You know you've got it bad, when you miss something you never had."
445032004522754048,2014-03-16 03:01:12,Single and in a relationship are just titles. Your heart determines your true relationship status.
445012093243097089,2014-03-16 01:42:05,"People love to hate, but hate to love."
444992110949695488,2014-03-16 00:22:41,"I smile a lot these days, and everybody knows. Everybody knows its because of you, everybody knows except you."
444972148449222656,2014-03-15 23:03:22,The way you started loving her is the way she should always be loved.
444950968493289472,2014-03-15 21:39:12,"I can go days without talking to you, months without seeing you, but not a second goes by that I don't think about you."
444930341422129152,2014-03-15 20:17:14,Changing your looks and personality to please someone is a waste of time because if they really love you they would accept ALL of you.
444909101428924417,2014-03-15 18:52:50,Happy is the person who finds a true friend and far happier is the person who finds that true friend in his or her true love.
444888290873724928,2014-03-15 17:30:08,"Sometimes, the only thing that gets me out of bed in the morning is the chance I might get to talk to you."
444867183546335233,2014-03-15 16:06:16,You're the only person I want to fall asleep next to.
444847178352037888,2014-03-15 14:46:46,"Everyone makes mistakes, but make sure you admit to your own before you point out another person's mistakes."
444827290535329793,2014-03-15 13:27:45,"There's this thing called love and I think I may feel it for you, but you have to promise me you wont let me down."
444806967538634753,2014-03-15 12:06:59,"It takes guts to fall in love, but it takes nerve to go back to the one who broke you."
444787005763772416,2014-03-15 10:47:40,Don't make the mistake of drifting away from someone you once had the time of your life with. Treasure them with all you have.
444765624976166912,2014-03-15 09:22:43,"I'm in love with the thought of you, not the things you do..."
444743865031856129,2014-03-15 07:56:15,"I love seeing Old Couples, it makes me believe that love can last forever."
444720858037104640,2014-03-15 06:24:49,"As much as I want to be with someone, I'm too afraid to let anyone in. I've tried, and it ends up with me being hurt and hating myself more."
444698055611125760,2014-03-15 04:54:13,"Go on and hurt me with the truth, just don't comfort me with a lie."
444675154744844288,2014-03-15 03:23:13,"Behind every strong soldier, there is a strong woman who stands behind him, supports him, and loves him with all her heart."
444652241455042562,2014-03-15 01:52:10,"No matter how much a girl denies it, she will always remember every detail, every moment and every piece of memory you've left with her."
444629524592873472,2014-03-15 00:21:54,Life is about making choices that you can live with. Love is about making choices that you can't live without.
444606773136093184,2014-03-14 22:51:29,Nobody can make you happy until you're happy with yourself first.
444584839123984386,2014-03-14 21:24:20,"I may not be perfect in your eyes, but I sure am perfect in the eyes of God."
444561092690206720,2014-03-14 19:49:58,"They keep saying the right person will come along, I think mine got hit by a truck."
444535022314201089,2014-03-14 18:06:23,You are the one who decides your role in life and your own identity. Society should not be the one doing that.
444509852518199296,2014-03-14 16:26:22,"Find someone who can change your life, and not just your relationship status."
444486947692503040,2014-03-14 14:55:21,"It takes guts to fall in love, but it takes nerve to go back to the one who broke you."
444466093680115712,2014-03-14 13:32:29,"The best kind of love, starts with an unexpected hello."
444444912839176192,2014-03-14 12:08:19,That moment you fall for your bestfriend. And everybody asks if you guys are going out and it's hurts so bad to say no we are just friends.
444422471911882752,2014-03-14 10:39:08,"Love knows no reasons, love knows no lies. Love defies all reasons, love has no eyes but love is not blind, love sees but doesn't mind."
444397017121312768,2014-03-14 08:58:00,Nobody's perfect...but you're perfect for me.
444351999518064640,2014-03-14 05:59:07,"I'm smiling on the outside, but I'm swearing at you on the inside."
444332033213353984,2014-03-14 04:39:46,Another month. Another year. Another smile. Another tear. Another winter and another summer too. But there can never be another you. ♥
444312104187621378,2014-03-14 03:20:35,"The more I spend time with you, the more I realize that I'm doing the one thing I told myself I would never do again: Fall in love."
444292318737076224,2014-03-14 02:01:58,A Smile is like a band-aid: it covers pain but deep inside it hurts..
444272215911968768,2014-03-14 00:42:05,"Never make someone your everything, because once they're gone you have nothing."
444251675826466816,2014-03-13 23:20:27,"I hate texting first, it makes me feel unwanted, awkward, and annoying."
444231452792614912,2014-03-13 22:00:06,"I'm tired of fighting, I want to be fought for. I'm tired of caring, I want to be cared for. I'm tired of being just me, I wanna be yours."
444211360809762816,2014-03-13 20:40:16,''LSHIFOMUALIAPOG! xD'' ''What?!'' ''Laughing So Hard I Fall Off My Unicorn And Land In A Pile Of Glitter... Duhh.''
444191299621507072,2014-03-13 19:20:33,"If two people are happy together, leave them the fuck alone!"
444170862812348416,2014-03-13 17:59:20,I want you. I want you. I want you.
444150765393686528,2014-03-13 16:39:29,A real man never stops trying to show his girl how much she means to him. Even after he's got her.
444130405717794816,2014-03-13 15:18:34,"I hate it when you text me first, but then you disappear just like you never texted me at all."
444110343829078017,2014-03-13 13:58:51,"Voldemort is like a teenage girl. He has a diary, a tiara, a special cup, a pet he adores, and an obsession with a famous teenage boy."
444090420071366656,2014-03-13 12:39:41,"To me, you are so damn perfect."
444070235591557120,2014-03-13 11:19:29,#ItsHardForMeTo trust you again.
444050268917743616,2014-03-13 10:00:08,Don't let a bad day make you feel like you'll have a bad life.
444030028930494464,2014-03-13 08:39:43,I kinda like someone who gets jealous and protective but still trusts me.
444010267928576000,2014-03-13 07:21:11,"Beauty isn't about having a pretty face. It's about having a pretty mind, a pretty heart, and a pretty soul. ❤"
443990125085609984,2014-03-13 06:01:09,"Sometimes you have to be your own hero, because the people you can't live without can live without you."
443970458757521408,2014-03-13 04:43:00,That one best friend that turned into a stranger.
443950422001086464,2014-03-13 03:23:23,"Relationships start with ""Can we talk?"" and end with ""We need to talk."""
443930635699109888,2014-03-13 02:04:46,Yeah forgiving someone is easy but being able to trust them again is a totally different story.
443910973154279425,2014-03-13 00:46:38,I wanna be kissed by you. Hugged by you. Just you. And nobody else but you.
443891146943508480,2014-03-12 23:27:51,"If you're important, they find a way, if not, they find an excuse."
443870605817823232,2014-03-12 22:06:13,I'll be a phone call away. I swear I'll take the pain away. I won't rest until I know you're okay.
443850736426688512,2014-03-12 20:47:16,Can we start all over again? Do it right this time?
443830157690675200,2014-03-12 19:25:30,"Never wait for the perfect moment, use the moment and make it perfect."
443809228965175296,2014-03-12 18:02:20,"All my time is spent thinking about you. I hope you think of me too, even after you tell me you love me."
443788321500577792,2014-03-12 16:39:15,"Forget the rest, you're the only one I need."
