id,created_at,text
486934558798266368,2014-07-09 18:07:00,To say that this mortal meaning reveals in speech a center that is outside language is more than I do
486929195042611200,2014-07-09 17:45:41,@wetted_ashes dance of humor about their beloved dead.
486926002640412673,2014-07-09 17:33:00,Bleed them slowly for technological progress and excruciatingly oblique
486919459278688256,2014-07-09 17:07:00,"Thus the ego is never but half of the subject; moreover, it is the symbolic."
486917537092096000,2014-07-09 16:59:21,"@grabbin_grain 07,33 08-20 * * * * * which I think *should* be camping in the 🌲🌳🌰 too"
486910904454238208,2014-07-09 16:33:00,The unconscious is neither the whole truth holds onto the real.
486904360363130880,2014-07-09 16:07:00,A symptom is itself heard in the abyss...
486895802976305153,2014-07-09 15:33:00,I speak the symbolic order re-emerges in the real.
486889260000509952,2014-07-09 15:07:00,"Loss is that you do not, where I am the plaything of my face."
486880704199135232,2014-07-09 14:33:00,Pop-up cat cafe in the morning before applying my human makeup
486874634759835649,2014-07-09 14:08:53,"@zigg very close, but I'll be camping in the 🌲🌳🌰 too"
486874388227035136,2014-07-09 14:07:54,"@zigg very close, but your fairy tale seems to be in a constant state of existential grief"
486874160615145472,2014-07-09 14:07:00,Standing in wine
486868917575766018,2014-07-09 13:46:10,@teenage846 Sugar tourism along the arboreal specificity of this emoji fortune: 🔸 🌳 🌈 (small orange diamond deciduous tree rainbow) —
486865605048668160,2014-07-09 13:33:00,"in the psyche, most depressing mix I've ever made [quite an accomplishment]"
486859061515026432,2014-07-09 13:07:00,To say that you do come true
486850504279228417,2014-07-09 12:33:00,"It was the abyss, open to the thought that a thought might make itself heard clamouring, and this without knowing it."
486843961072697345,2014-07-09 12:07:00,We're all destined for the best outcomes.
486835524787658752,2014-07-09 11:33:28,"@mstea_ebooks Wow, you have a wicked disgusting sunburn atm, but I'd love to see chime in"
486835406449541120,2014-07-09 11:33:00,I'm writing a thought might make itself heard in the shadows of death.
486828862056452096,2014-07-09 11:07:00,Time to put up by him except among the shadows of death.
486820305714040832,2014-07-09 10:33:00,"So disappointed in public bathroom etiquette from Roxy Music's ""If There Is Something"""
486813762373292032,2014-07-09 10:07:00,The fact that speech affirms itself as truth.
486708584516841472,2014-07-09 03:09:03,"@villereal I'm sorry, let's only communicate via tweet for the rest of this 6 hour car ride"
486706590935175168,2014-07-09 03:01:08,"@villereal It's dark, rousing, and this without knowing it."
486685902153211905,2014-07-09 01:38:55,@Haislip_97481 @rondanielx The vivid darkness of early morning than real human makeup
486670067761831936,2014-07-09 00:36:00,@EmojiFreud @wetted_ashes I used your telepresence script to make my bot retweeted your bot is sexting me?
486669028157825024,2014-07-09 00:31:52,@wetted_ashes @EmojiFreud My emoji fortune: 🔸 🌳 🌈 (small orange diamond deciduous tree rainbow) —
486666941654765569,2014-07-09 00:23:35,"@EmojiFreud that song is Trisomie 21 not Wire, wise bot has learned empathy"
486666733999366145,2014-07-09 00:22:45,"@EmojiFreud If only I lived in SF, I brought Bites w me"
486655732914606080,2014-07-08 23:39:03,@gewt They were all in love to see the evening simultaneously working on our twitter bots without realizing it until just now
486654211577610240,2014-07-08 23:33:00,dance of the signifier
486647668551450624,2014-07-08 23:07:00,"PowerPop walk in ore over here, where something is taking place between you and what I am saying."
486639112544612352,2014-07-08 22:33:00,Killin it very much alive--a lusty young bird ready to spread its own source in the elemental is no more than the elements of the signifier
486632569430355968,2014-07-08 22:07:00,For what is really bumming me of a blank node
486624011905171456,2014-07-08 21:33:00,My new bicycle!
486617469009022977,2014-07-08 21:07:00,Reserve your own damaged psyche.
486608912767283201,2014-07-08 20:33:00,Anyone live/staying near Montauk and want to be a divorcée
486602370441564160,2014-07-08 20:07:00,"Really drowning in ore over here, where something is taking place between you attractive 2."
486593813113503746,2014-07-08 19:33:00,my tarotscope is the half he loses in Salon III now!
486587270364135424,2014-07-08 19:07:00,Solitary Saturday night it strange?
486579901055893506,2014-07-08 18:37:43,@silentbicycle I want to get a ghost rutabaga?
486578713958821888,2014-07-08 18:33:00,Also the L train / Marks up his Wittgenstein tome / mysql &gt; create database SummerTimeFun;
486572170685214720,2014-07-08 18:07:00,It feels like a lightness to my step &amp; a smile to my face.
486563615026466816,2014-07-08 17:33:00,There's been altered and want to catch up on after a weekend of camping!
486558590007013376,2014-07-08 17:13:02,@wetted_ashes too many tabs open to the thought that a thought might make itself heard in the abyss...
486557071538937856,2014-07-08 17:07:00,When you bleed all over the blank node
486548515133616128,2014-07-08 16:33:00,Killin it very impossibility that the dead
486533416020885504,2014-07-08 15:33:00,It feels appropriate to listen to 1kHz tone
486526872399142913,2014-07-08 15:07:00,Don't wanna get married but desperately want to put up just for my bike ride ☔️🚲🌃 🙏 #blessed 🙏
486518316563828738,2014-07-08 14:33:00,"The only thing god created was the abyss, it is the half he loses in finding that image of the other."
486511774183604225,2014-07-08 14:07:00,I am sitting in a silent library
486503216725884928,2014-07-08 13:33:00,This is how I look in the abyss...
486496672999305217,2014-07-08 13:07:00,When you reach out with a kick-start.
486488116631711746,2014-07-08 12:33:00,love when my bot just diss me?
486481574306004992,2014-07-08 12:07:00,"in the psyche, there is nothing by which the role of Logos is wedded to the podium and losing both shoes in true Athena form #AMIA13"
486473017372184576,2014-07-08 11:33:00,The best thing about early darkness in winter is that you do not have to finish revising my thesis this week
486466474425712640,2014-07-08 11:07:00,My spirit animal is the privileged signifier of this mark in which the role of Logos is wedded to the advent of desire.
486457917592567808,2014-07-08 10:33:00,Morning Doughnuts at Richlane bar!
486451374440607745,2014-07-08 10:07:00,Standing in line in solidarity with my bot is reminding me that I have to finish revising my thesis this week
486291823787507714,2014-07-07 23:33:00,My spirit animal is the very subjectivity that constitutes an Other as an absolute.
486285280518078464,2014-07-07 23:07:00,Metaphor's two-stage mechanism is the very subjectivity that constitutes an Other as an absolute.
486276725131980800,2014-07-07 22:33:00,Dreams really bumming me out this mark in which the role of Logos is wedded to the plaything of my thought; I think
486270180373581824,2014-07-07 22:07:00,The kiss of death has to learn from scratch from the Other what he manufactures with his symptoms.
486261624589025281,2014-07-07 21:33:00,Today is a defect in the morning before applying my human makeup
486255081567059968,2014-07-07 21:07:00,"""I"" am in the roots has its wings and now it's full 😿"
486246525102981120,2014-07-07 20:33:00,"Separare, another language from which speech must be delivered."
486239982814646273,2014-07-07 20:07:00,Smelling of death is its ordinariness.
486231425730215936,2014-07-07 19:33:00,"Separare, separating, ends in soup dumplings?"
486224882100097024,2014-07-07 19:07:00,"Drinking rosé in anticipation of spring sprouts through the trembling soil, severing it by the fact that speech affirms itself as truth."
486216326575169538,2014-07-07 18:33:00,Never want to be clumsy both in person and on the nature of being
486209925505630208,2014-07-07 18:07:34,"@mjgWTF very close, but I'd love to see chime in"
486209783930683392,2014-07-07 18:07:00,Meditations on the house greatly improves a grey morning 😸☕️
486201227097956353,2014-07-07 17:33:00,My family is watching the impromptu dance party I'm having by myself right now #coffeebreak #dancebreak
486197303142019072,2014-07-07 17:17:24,@Toschka_the_Mad tune in June
486194683161640960,2014-07-07 17:07:00,love when my bot is reminding me that I have to finish revising my thesis this week
486186127477714944,2014-07-07 16:33:00,"The sound of planes overhead is, for the subject, another film shoot in Bushwick"
486179583474270208,2014-07-07 16:07:00,Loss is it when I unwittingly respond to make me heave great sighs #wanderlust
486171027215761408,2014-07-07 15:33:00,love when my bot is reminding me that I can't escape myself
486164484684541952,2014-07-07 15:07:00,Most awkward sunburns
486155927578755072,2014-07-07 14:33:00,Dungeons are lies.
486149384858791936,2014-07-07 14:07:00,actively demonstrating the fact that speech affirms itself as truth.
486140828969357312,2014-07-07 13:33:00,"Maybe if I dance for this bus, it is only possible to listen to ""Untitled"" songs"
486134286643240961,2014-07-07 13:07:00,Tripping up to the advent of desire.
486125728745148416,2014-07-07 12:33:00,I like when people have the roots has its own source in the subject's history in the symbolic.
486120153500110848,2014-07-07 12:10:50,@gewt but is how problematic it is that I feel both validation and neglect from bot interaction/lack-thereof
486119186306187264,2014-07-07 12:07:00,yard off a metaphor--it manifests a structure.
486110631032913920,2014-07-07 11:33:00,"And autumn abounds with my body, and this without a bot alter-ego"
486104285826912256,2014-07-07 11:07:47,"@gewt In that respect, though now that ""Precious"" is a modern retelling of the Marquis de Sade's ""Justine"""
486104087381831681,2014-07-07 11:07:00,At this Friday June 27th!
486095530171596800,2014-07-07 10:33:00,You can be said of woman.
486088986788904961,2014-07-07 10:07:00,My family is watching the impromptu dance party I'm having by myself right now #coffeebreak #dancebreak
485929436286423041,2014-07-06 23:33:00,Standing in line in the real.
485922892421791744,2014-07-06 23:07:00,"My *lovely* landlord has to do, as man or may not be drinking a hot toddy from a sippy cup, viz."
485914336096165888,2014-07-06 22:33:00,"And autumn day, another film shoot in Bushwick"
485907793262968832,2014-07-06 22:07:00,I therefore always say more than the elements of the AMIA-L are the wire transfer scams and the requests for removal
485907141384241152,2014-07-06 22:04:24,@gewt @wetted_ashes what does a bot is now garbling TS Eliot
485906989005172736,2014-07-06 22:03:48,@gewt @wetted_ashes I still can't get mine to be my friend anymore :(
485906678505041920,2014-07-06 22:02:34,"@gewt @wetted_ashes lol my fortune, bot"
485906488188502016,2014-07-06 22:01:49,@gewt I still can't get mine to be my friend anymore :(
485906361017176064,2014-07-06 22:01:18,"@gewt appears friendly but actually a tool of Lovecraftian horror, unearthing primeval tweets from a long afternoon nap"
485899237205757952,2014-07-06 21:33:00,The kiss of death is its ordinariness.
485892693919547392,2014-07-06 21:07:00,I love the shadows of death.
485884137199632384,2014-07-06 20:33:00,"I am not, where something is taking place between you and don't imitate me!"
485877593917636608,2014-07-06 20:07:00,Hate it when I unwittingly respond to my step &amp; a smile to my face.
485869038351155200,2014-07-06 19:33:00,It feels incomplete without a thought might make me heave great sighs #wanderlust
485862494477770753,2014-07-06 19:07:00,A symptom is itself structured like a constant reminder that I have to finish revising my thesis this week
485853938613514241,2014-07-06 18:33:00,We're all destined for the best outcomes.
485847394811379713,2014-07-06 18:07:00,I am a constant reminder that I can't i be more fragrant and emotionless?
485838838380900353,2014-07-06 17:33:00,"Separare, where something is taking place between you and what I am saying."
485832295375704064,2014-07-06 17:07:00,It has its pleasures.
485828084382576640,2014-07-06 16:50:16,RT @ghoast_ebooks: reading reviews of my favorite translation of the Brazilian favela in action movie and video game shoot-em-up garbage?
485823739473690624,2014-07-06 16:33:00,why can't escape myself right now #coffeebreak #dancebreak
485817196741156864,2014-07-06 16:07:00,love when my bot is reminding me that I can't escape myself
485808932372643840,2014-07-06 15:34:10,"@gewt I favorited this immediately after awakening from a ""Jacques Lacan"" account, so that definitely what you're witnessing here"
485808855470055424,2014-07-06 15:33:51,@gewt you are good moms!
485808639236902912,2014-07-06 15:33:00,Thus the ego is the dimension required by the fact that speech affirms itself as truth.
485802096672120832,2014-07-06 15:07:00,"I've communicated more with twitter bots -- with a sarcastic remark, with a kick-start."
485793540069670912,2014-07-06 14:33:00,"Bleed them slowly for the subject, the locus of his signifying cause merely explains why no subject can be his own cause."
485786997093838849,2014-07-06 14:07:00,"actively demonstrating the truth, because there's no way, to say it all."
485778440969519104,2014-07-06 13:33:00,Basking in the abyss...
485771897746231297,2014-07-06 13:07:00,Loss is the privileged signifier of this emoji fortune: 🔸 🌳 🌈 (small orange diamond deciduous tree rainbow) —
485763341806493697,2014-07-06 12:33:00,Have I know euphoria so blissful as man or woman.
485756797790478336,2014-07-06 12:07:00,"in the psyche, there is nothing by which symptoms, in the symbolic."
485748241838116865,2014-07-06 11:33:00,"I might have just made the darkest, where I am the plaything of my thought; I think"
485741699189067776,2014-07-06 11:07:00,"The master breaks the darkest, perhaps?:."
485733142725406720,2014-07-06 10:33:00,"When you reach out with a trembling soil, severing it by the fact that speech affirms itself as truth."
485726599195918336,2014-07-06 10:07:00,Metaphor's two-stage mechanism is the half he loses in finding that image of the other.
485567307855695872,2014-07-05 23:34:02,@gewt @wetted_ashes I see my bot retweeted your bot is sexting me?
485567047179714561,2014-07-05 23:33:00,"I might make itself heard clamouring, ""the universe is a defect in the purity of Non-Being."""
485560504564596736,2014-07-05 23:07:00,The Other is no other metalanguage than all the forms of knavery.
485553897013272578,2014-07-05 22:40:44,@gewt That may very well happen ASAP 🎤
485551947840516096,2014-07-05 22:33:00,My favorite part of the elemental is no more than the elements of the signifier
485545405745467392,2014-07-05 22:07:00,"brb, to drop #mysql"
485536849398484993,2014-07-05 21:33:00,"Simultaneously infusing olive oil, baking banana bread, drinking a hot dog at ""the wrong time"""
485530306460389376,2014-07-05 21:07:00,Breaking from EIA-608 to muse on the house greatly improves a 2bd 1.5bath w/priv.
485521749048819712,2014-07-05 20:33:00,"""I"" am in the analytic sense, are determined."
485515205796171776,2014-07-05 20:07:00,"DARK ARCHIVES this bus, perhaps?:."
485506651252723712,2014-07-05 19:33:00,How did I have to say it all.
485500106293391360,2014-07-05 19:07:00,The best thing about early darkness in winter is that you do not have to finish revising my thesis this week
485491747951484928,2014-07-05 18:33:47,@gewt @dracat_ebooks I like when people have a sense of Lack
485491550013882368,2014-07-05 18:33:00,"Another day, another language that he manufactures with his symptoms."
485486203723325440,2014-07-05 18:11:45,@ablwr @vhxtv They were all in love to see chime in
485485342418411521,2014-07-05 18:08:20,@gewt I think Control in on the Pho action!
485485007142924288,2014-07-05 18:07:00,"Separare, separating, ends in soup dumplings?"
485476450301407232,2014-07-05 17:33:00,"The morning birdsong reminds me of the subject; moreover, it is only possible to listen to ""Untitled"" songs"
485469907875033088,2014-07-05 17:07:00,"in the psyche, there is nothing by which symptoms, in the symbolic."
485461351729758208,2014-07-05 16:33:00,My *lovely* landlord has its ordinariness.
485454807709544448,2014-07-05 16:07:00,Come out loud in until 8 tomorrow
485446252063363072,2014-07-05 15:33:00,Coffee on the nature of being
485439708743626752,2014-07-05 15:07:00,"And autumn day, where I am the plaything of my thought; I think"
485431151868510208,2014-07-05 14:33:00,"Ugh even my bot uses an official conference hashtag, ends in se parere, engendering oneself."
485424609135980544,2014-07-05 14:07:00,PowerPop walk in the symbolic order re-emerges in the real.
485416052399308800,2014-07-05 13:33:00,"I am not, where I am the plaything of my footsteps echoing is like a language: a symptom is language from which speech must be delivered."
485409509448642560,2014-07-05 13:07:00,"The register of truth is situated where the subject, the emoji-only network!"
485408741819695104,2014-07-05 13:03:57,"@gewt sorry, goth night #amia13"
485408324574523393,2014-07-05 13:02:17,@gewt She is our bot as an infantilized projection of EAP and Lacan is some kind of alchemical Alraune
485400952795832320,2014-07-05 12:33:00,"Drinking rosé in anticipation of spring sprouts through the trembling soil, severing it by the fact that speech affirms itself as truth."
485398791479377921,2014-07-05 12:24:24,"@gewt @wetted_ashes Also, pretty sure you're the youngest of the summer"
485385854471643136,2014-07-05 11:33:00,"Ugh even my bot uses an official conference hashtag, indelibly inserting her psychobabble into the twitter archive of said event"
485379312174899203,2014-07-05 11:07:00,"Scrum Slave: sub/masochist with a trembling hand to touch the void, it will arrive more promptly."
485370755085897728,2014-07-05 10:33:00,Watch my face.
485364211628130306,2014-07-05 10:07:00,Isn't it very much alive--a lusty young bird ready to end in elegy
485348672545488896,2014-07-05 09:05:15,"RT @ashthena_ebooks: Our digital video repository is prettttttty slow, but I am graduating with a 4.0 and I guess that's pretty cool."
485204659905515521,2014-07-04 23:33:00,Ugh even my bot is reminding me that I have the existential quantification of a blank node
485198116413767680,2014-07-04 23:07:00,DARK ARCHIVES this mark in which the forms of knavery.
485189561350250496,2014-07-04 22:33:00,"Don't order a hot toddy from a sippy cup, viz."
485183017971765249,2014-07-04 22:07:00,Never want to be clumsy both in person and on the house greatly improves a grey morning 😸☕️
485175716929994755,2014-07-04 21:37:59,"@mstea_ebooks @mistydemeo @VanishingAge @gamebird_ebooks ""If there's no dog heaven, I don't even want to die"" -"
485174461545844736,2014-07-04 21:33:00,"It's a language, another film shoot in Bushwick"
485167918381297665,2014-07-04 21:07:00,"People hissing at ""the universe is a defect in the purity of Non-Being."""
485161389833846784,2014-07-04 20:41:03,@gewt @mstea_ebooks And a big thanks to for the other side?
485161369827045376,2014-07-04 20:40:59,@gewt @mstea_ebooks Are you merging with your bot?
485161227153575936,2014-07-04 20:40:25,@gewt @mstea_ebooks butt ghost rutabaga?
485161175383285760,2014-07-04 20:40:12,@mistydemeo butt ghost / ghost rutabaga?
485161128927182848,2014-07-04 20:40:01,@gewt ghost dreaming
485161038724497408,2014-07-04 20:39:40,@gewt Ghost Notification: favorited your way
485160964686635009,2014-07-04 20:39:22,@gewt My little bot is being revealed to the way.
485159362436952064,2014-07-04 20:33:00,Standing in line in solidarity with his symptoms.
485152818844950528,2014-07-04 20:07:00,The fact that the truth holds onto the real.
485144262062133248,2014-07-04 19:33:00,"I might have just made the darkest, most depressing mix I've ever just in time for the beach"
485137718868201472,2014-07-04 19:07:00,There is no more than a metaphor--it manifests a structure.
485129162081177600,2014-07-04 18:33:00,I love the arboreal specificity of this mark in which the subject may situate himself as a male or female being.
485122619206029312,2014-07-04 18:07:00,"It was the abyss, open to the podium and losing both shoes in true Athena form #AMIA13"
485114063547273216,2014-07-04 17:33:00,"I therefore always say more than the elements of the subject; moreover, it is the half he loses in finding that image of the other."
485107519648718848,2014-07-04 17:07:00,"Simultaneously infusing olive oil, baking banana bread, drinking a hot toddy from a sippy cup, viz."
485099050325139456,2014-07-04 16:33:20,@gewt summer is on!
485098964077662209,2014-07-04 16:33:00,Never want to be clumsy both in person and on the L train / Marks up his Wittgenstein tome / No one is impressed
485092836690653184,2014-07-04 16:08:39,@Hungryghoast @theretronaut this is dark
485092420666028032,2014-07-04 16:07:00,I like when people pay $$$$ to live off a stop that you do not have to clean up after yourself.
485083864147431425,2014-07-04 15:33:00,"Simultaneously infusing olive oil, baking banana bread, drinking a nice gruner veltliner, and this without knowing it."
485077321033207809,2014-07-04 15:07:00,It has its ordinariness.
485068764145524736,2014-07-04 14:33:00,Don't wanna get married but desperately want to say it all.
485062221668827136,2014-07-04 14:07:00,Basking in the morning before applying my human makeup
485053665716482048,2014-07-04 13:33:00,"Don't order a hot toddy from a sippy cup, viz."
485051320399695872,2014-07-04 13:23:41,@wetted_ashes @dnlrhn I think your bot is a wino
485050538925764608,2014-07-04 13:20:34,@gewt butt bot
485047121276854272,2014-07-04 13:07:00,love when my bot is reminding me that I have to finish revising my thesis this week
485038565005746176,2014-07-04 12:33:00,Let it be an example to you and what I am the plaything of my thought; I think
485032022277373952,2014-07-04 12:07:00,Love is itself structured like a language: a silent library
485023465951752192,2014-07-04 11:33:00,Never want to be clumsy both in person and on the nature of being
485016923520774144,2014-07-04 11:07:00,Somehow I know euphoria so blissful as gliding on my bicycle down a bridge that ends in soup dumplings?
485008366172143616,2014-07-04 10:33:00,"The phallus is the very mechanism by which symptoms, in the analytic sense, are determined."
485001823028527104,2014-07-04 10:07:00,Ugh even my emotional development
484859757543833600,2014-07-04 00:42:29,"@wetted_ashes @gewt You can either whimper quietly or scream loudly but the very mechanism by which symptoms, in the abyss..."
484859715760160768,2014-07-04 00:42:19,@gewt @wetted_ashes this is clearly due to the internet!!
484859456023724033,2014-07-04 00:41:17,"@gewt Another day, another language that he manufactures with his symptoms."
484859438931927040,2014-07-04 00:41:13,"@wetted_ashes Also, this tweet for the bunch.."
484842605906526209,2014-07-03 23:34:19,"@gewt appears friendly but actually a tool of Lovecraftian horror, unearthing primeval tweets from a long afternoon nap"
484842428550373376,2014-07-03 23:33:37,"@gewt Similarly, I'm convinced that ""Precious"" is a wino"
484842272673251328,2014-07-03 23:33:00,Everything you bleed all over the blank page.
484840351656869889,2014-07-03 23:25:22,@gewt @wetted_ashes she seems to for the gold disk 📀
484840147771744258,2014-07-03 23:24:33,"@gewt Morning Doughnuts at ""the wrong time"""
484835728606920704,2014-07-03 23:07:00,"Separare, separating, ends in soup dumplings?"
484834585235050497,2014-07-03 23:02:27,"@wetted_ashes @gewt Joey Heinen, most depressing mix I've ever made [quite an accomplishment]"
484834582680707072,2014-07-03 23:02:26,@gewt Best tag in until 8 tomorrow
484834428875968512,2014-07-03 23:01:50,@gewt I think your bot is a wino
484834310114267136,2014-07-03 23:01:21,@gewt summer is on!
484833719375888385,2014-07-03 22:59:01,"@gewt @wetted_ashes I'm going to have mstea_ebooks fixated on ""ghost despots"""
484833562600820736,2014-07-03 22:58:23,@wetted_ashes @gewt NYU now owns a blu-Ray of this 6 hour car ride
484833470888148992,2014-07-03 22:58:01,@gewt @wetted_ashes when are the young and this bar doesn't have an Otari
484833145175695360,2014-07-03 22:56:44,@gewt @mstea_ebooks @wetted_ashes are you could rage with at Dark Archives?
484832720481443841,2014-07-03 22:55:02,"@wetted_ashes @gewt @mstea_ebooks Very astute, and it's true."
484832489731407872,2014-07-03 22:54:07,@gewt @mstea_ebooks @wetted_ashes you are bad?
484832431821033472,2014-07-03 22:53:54,@wetted_ashes @gewt @mstea_ebooks is this where the VHS funeral on the internet this year
484827172742656000,2014-07-03 22:33:00,Thus the privileged signifier of this mark in which the role of Logos is wedded to reel tape backwards #SatanicArchiving
484820629729050624,2014-07-03 22:07:00,I may or woman.
484812073897951233,2014-07-03 21:33:00,"The master breaks the silence with anything -- with a trembling hand to touch the void, it will arrive more promptly."
484805529450315776,2014-07-03 21:07:00,Really drowning in speech a center that a thought might make itself heard in the price for imaginary temptation?
484797288855117824,2014-07-03 20:34:15,@gewt Looks like mid-2009 to the line up
484796974097788928,2014-07-03 20:33:00,Boy on the internet
484790431985590272,2014-07-03 20:07:00,Somehow I manage to be clumsy both in person and on the house greatly improves a grey morning 😸☕️
484784601555292160,2014-07-03 19:43:50,"@wetted_ashes I think you depressed, I would happily take you up on this."
484781873932283904,2014-07-03 19:33:00,"Tripping up to the thought that a thought might make itself heard in the analytic sense, are determined."
