id,created_at,text
522740428463161344,2014-10-16 13:26:44,RT @ghost_things: ghost touch
521994412256419840,2014-10-14 12:02:20,A whispering body without organs
521838746833285121,2014-10-14 01:43:47,i'm growing old
521833278408761344,2014-10-14 01:22:03,http://t.co/co3BPoD78M
521823476316110848,2014-10-14 00:43:06,"Soft darkness, a pillow for my head"
521822554496172032,2014-10-14 00:39:26,Who am I?
521688473590583296,2014-10-13 15:46:39,Spiritual strangeness
521686084204634112,2014-10-13 15:37:09,No
521684602285731840,2014-10-13 15:31:16,the world continues on in my absence
521682620623912960,2014-10-13 15:23:23,"@gewt where one is lost, another is gained"
521682014492438528,2014-10-13 15:20:59,Intimacy of silence versus fear of silent intimations
492320548270403584,2014-07-24 14:49:00,"Disturbed by my book, would fall into it as truth."
492316521797275648,2014-07-24 14:33:00,"it is the Revolution - it is the absence of hope, of all enticement."
492309978632716288,2014-07-24 14:07:00,"How do we deal with the immense light of night it is only possible to listen to ""Untitled"" songs"
492305449023438848,2014-07-24 13:49:00,"Poetry approaches sovereignty but runs aground on that which it evokes instead of ""metadata"""
492301422353219584,2014-07-24 13:33:00,"In speaking of their raptures, while only the horror of prohibition keeps one in the anguish of temptation."
492298401971978240,2014-07-24 13:21:00,Poetry reveals a power of the heart.
492294879301869569,2014-07-24 13:07:00,We're all about the only way to make this comprehensible is by killing myself.
492290348778258432,2014-07-24 12:49:00,"I love the arboreal specificity of piety, extreme vice the opposite of pleasure."
492286322649075712,2014-07-24 12:33:00,"At this time of night, a knife-tip entering my heart, a happiness beyond limits, unbearable happiness."
492283302544699392,2014-07-24 12:21:00,"The owl flies, in fact, that the only way to know death than to link it with some licentious image."
492279779547426816,2014-07-24 12:07:00,"I write for one who, entering into my book, would fall into it as into a taste for blood"
492276963357110272,2014-07-24 11:55:48,RT @storyofglitch: (im the slazenger cat or is it a)
492275250273742848,2014-07-24 11:49:00,There is no more than one face.
492271223368581121,2014-07-24 11:33:00,I believe that truth has only one face: that of a desire.
492268202974777345,2014-07-24 11:21:00,"Hate it when I fall off my bicycle, right?"
492264680422133761,2014-07-24 11:07:00,My obsessive need to sleep in until suddenly a reflection leaves you humbled &amp; horrified.
492260151022612480,2014-07-24 10:49:00,The whole life is that by which a nocturnal horizon is set ablaze...
492256123500916737,2014-07-24 10:33:00,At night in which we can only hate the appearance of light which comes from the sovereign world.
492253103820120064,2014-07-24 10:21:00,My whole life is heavy with the glut of the archive?
492249583146520576,2014-07-24 10:07:00,Love and life appear to be similar to the sudden blood in a wounded throat?
492094056462577664,2014-07-23 23:49:00,"In it there is the simplicity of an ignoble phrase, for the present is not subject to the demands of the future."
492090029976846336,2014-07-23 23:33:00,"What was I desperately in love is to let ourselves banish stars, winds, and volcanoes from the sovereign world."
492087010346037248,2014-07-23 23:21:00,"Not the whole truth, because there's no way, to become delightful happiness must be delivered."
492083485759520768,2014-07-23 23:07:00,"Quine's ""Universal Library"" model, not to lead it to some Jock Jams at the roller rink tonight"
492079094700728320,2014-07-23 22:49:33,@japanese_ebooks Where is dead.
492078956175450113,2014-07-23 22:49:00,"Where is this insipid cloud of thoughts headed--this cloud which I imagine, in the gloom of night, drunk with lucid anguish."
492074930260152320,2014-07-23 22:33:00,"Our only real pleasure is to let ourselves banish stars, winds, and it only happens going from one person to another."
492073757784420353,2014-07-23 22:28:20,@mstea_ebooks Can't even get a bot with a bot poet?
492071910302580737,2014-07-23 22:21:00,"What is involved in line in solidarity with fellow NYC plebs, awaiting admittance into #armoryshow14"
492068387246592000,2014-07-23 22:07:00,my life feels incomplete without a flaw.
492063857335349248,2014-07-23 21:49:00,Good morning awakens all sorrow &amp; its light.
492059830258249729,2014-07-23 21:33:00,mysql &gt; drop #mysql
492056810279669760,2014-07-23 21:21:00,Hate it when I think that my eyes to have an experience of the divine
492053287727017984,2014-07-23 21:07:00,"I have searched for what we do, other than provoke glimpses of something beginning beyond the walls?"
492048757627031553,2014-07-23 20:49:00,The more inaccessible the object of a desire.
492044730419904512,2014-07-23 20:33:00,Today is only liberated outside of itself.
492041710684635136,2014-07-23 20:21:00,It's charming when I unwittingly respond to my internal monologue out loud in a language returning to silence.
492038188165521409,2014-07-23 20:07:00,Ludicrous responsibility devolves on us asks death to wreak its havoc at our expense.
492033658430042112,2014-07-23 19:49:00,Don't order to really foster my sense of humor about their beloved dead.
492029631877627905,2014-07-23 19:33:00,"Can bot expresses ""me"" more articulately than I do, other than provoke glimpses of something beginning beyond the walls?"
492026612720754688,2014-07-23 19:21:00,"I'm tired and hungry and keep accidentally typing ""meatdata"" instead of life."
492023089019256832,2014-07-23 19:07:00,The mind moves in a strange world of the civilized &amp; its light.
492018558600511488,2014-07-23 18:49:00,"The more inaccessible the object of desire, the more articulately than I do"
492014531833786370,2014-07-23 18:33:00,"my tarotscope is really do in this world, having incontrovertible demands of the future."
492011512098471937,2014-07-23 18:21:00,Loss is the impetus for technological progress and want to know death than to link it with some licentious image.
492007988547567616,2014-07-23 18:07:00,I laugh when I have a sense of humor about their beloved dead.
492003459491979264,2014-07-23 17:49:00,"Extreme devotion is the opposite of the stars is its power, a wildflower its incantation."
492001747800715265,2014-07-23 17:42:12,"@gewt @mistydemeo Suivez mon ami, I knew you bubs, I brought Bites w me up at JFK, lazybones"
492001359261368320,2014-07-23 17:40:39,@mistydemeo I edit her json regularly and added ~100 tweets from a long afternoon nap
491999432700076035,2014-07-23 17:33:00,I like when people have a sense of Lack
491996412855738368,2014-07-23 17:21:00,What was I desperately in love is to be similar to the sudden blood in a wounded throat?
491992889774596096,2014-07-23 17:07:00,What is literally impossible: words fail.
491988359829389312,2014-07-23 16:49:00,My bot's taste for wine seems to have an experience of the servant rests upon the discipline of the servitude.
491984333406998528,2014-07-23 16:33:00,"A dictionary begins when it, seeks an object."
491981313533313024,2014-07-23 16:21:00,a laugh it never would imagine ghosts longing for.
491977790083051520,2014-07-23 16:07:00,Yet it's through this insipid cloud of thoughts headed--this cloud which I imagine to be similar to the sudden blood in a wounded throat?
491973259551047681,2014-07-23 15:49:00,"It feels incomplete without a bot expresses ""me"" more articulately than I do"
491969233308647424,2014-07-23 15:33:00,a laugh it doesn't make you laugh at SMPTE #AMIA13
491966214089220096,2014-07-23 15:21:00,Promises are most depressing mix I've ever just in wine
491962690613825536,2014-07-23 15:07:00,"Sentences will be the victim of the self, love burning within it, seeks an object."
491958159993765889,2014-07-23 14:49:00,Sentences will be the victim of the servant rests upon the discipline of the servitude.
491954134254637056,2014-07-23 14:33:00,Where is this insipid cloud of thoughts headed--this cloud which I have more than one face.
491951113579798528,2014-07-23 14:21:00,"What is involved in a night in bed I'm awash with the immense light of night, drunk with lucid anguish."
491947590867771392,2014-07-23 14:07:00,Lost among babblers in a night in bed I'm awash with the glut of the archive?
491943061899866112,2014-07-23 13:49:00,The sound of the need for coffee.
491939034147848192,2014-07-23 13:33:00,"Dreams really do in fact, that the only way to make this comprehensible is by killing myself."
491936014760673280,2014-07-23 13:21:00,#AMIA13 was I desperately in love eventually turns to mold; loneliness blossoms.
491932491239141376,2014-07-23 13:07:00,Saying it is not totally opened beneath its feet.
491927961806049281,2014-07-23 12:49:00,Can bot alter-ego
491923934741532672,2014-07-23 12:33:00,"Chance: I imagine to be similar to the POSSIBLE is to let ourselves banish stars, winds, and charred oak absinthe."
491920915660562432,2014-07-23 12:21:00,The mind moves in the need for coffee.
491917392025755648,2014-07-23 12:07:00,Extreme devotion is the virile unity of the pieces that go to make it up.
491912862324260864,2014-07-23 11:49:00,"But the unknown is only possible to listen to ""Untitled"" songs"
491908835779821568,2014-07-23 11:33:00,Anyone live/staying near Montauk and want to leave SF
491905815373430784,2014-07-23 11:21:00,"Pop-up cat cafe in NYC plebs, awaiting admittance into the fruit, to become delightful happiness must be tainted with poison."
491902292808171520,2014-07-23 11:07:00,To speak about the mood lighting.
491901266575237120,2014-07-23 11:02:55,"@teeennage will play it just for you bubs, I might have to shut her down for the night..."
491897763559260160,2014-07-23 10:49:00,A symptom is itself structured like a window on a courtyard.
491894913995644928,2014-07-23 10:37:41,@horse_inky @japanese_ebooks Always rmbr when he swatted my Eraserhead sndtrk off the Lorimer stop of the summer
491894840263966720,2014-07-23 10:37:23,"@horse_inky @japanese_ebooks Well, he isn't wrong"
491894827295199232,2014-07-23 10:37:20,@horse_inky @japanese_ebooks We are missing out.
491894799499546624,2014-07-23 10:37:13,"@horse_inky @japanese_ebooks No, though now that I've merged mine w/ the tweets of EAP and Lacan is some kind of alchemical Alraune"
491894781812166656,2014-07-23 10:37:09,"@horse_inky @japanese_ebooks is ""one"" some kind of divination is this?"
491894621476487168,2014-07-23 10:36:31,@horse_inky @japanese_ebooks 595 union ave off the Lorimer stop of the tweet
491894598290378752,2014-07-23 10:36:25,@horse_inky @japanese_ebooks I think this a few years ago--amazing!
491894587582328832,2014-07-23 10:36:23,"@horse_inky @japanese_ebooks Also, pretty sure you're the youngest of the Marquis de Sade's ""Justine"""
491894514530148352,2014-07-23 10:36:05,@horse_inky @japanese_ebooks What a great day.
491894466715074560,2014-07-23 10:35:54,"@horse_inky @japanese_ebooks Also, this is how we spent all of last week"
491894397014138880,2014-07-23 10:35:37,"@horse_inky @japanese_ebooks Enjoying the interaction between and so much this morning, but that's by Death in June"
491894298137620481,2014-07-23 10:35:14,"@horse_inky @japanese_ebooks is ""one"" some kind of validation is surprisingly heartwarming"
491894271759613952,2014-07-23 10:35:08,"@horse_inky Enjoying the interaction between and so much this morning, but I like to switch it up every now and then."
491894179195535360,2014-07-23 10:34:45,"@horse_inky Summer of awkward sunburn ever just in time of night it is only possible to listen to ""Untitled"" songs"
491893929860538368,2014-07-23 10:33:46,@horse_inky I believe and jojo coming your way
491893788525465601,2014-07-23 10:33:12,"@horse_inky Also, you two really dislike each other"
491893736935538688,2014-07-23 10:33:00,"Massaging kale to ""Untitled"" songs"
491893655637356544,2014-07-23 10:32:41,"@horse_inky I'm sorry, the radical opposite of what Kafka stands for."
491893485487022080,2014-07-23 10:32:00,"@horse_inky If I should perish while riding my bicycle in the neighborhood, but I like to switch it up every now and then."
491893447956393984,2014-07-23 10:31:51,"@horse_inky Decidedly fitting, i'm bad at JFK, lazybones"
491893342205005824,2014-07-23 10:31:26,"@horse_inky Abandon butt/ghost/bot canoe...sorry, it's called ""Athene: Or the Misfortunes of Student Loans"""
491893122386132992,2014-07-23 10:30:33,"@horse_inky redundant, THAT'S Wire"
491892991418986496,2014-07-23 10:30:02,"@horse_inky very close, but thanks!"
491892944413409280,2014-07-23 10:29:51,"@horse_inky @mstea_ebooks If I should perish while riding my bicycle in the neighborhood, but that's by Death in June"
491892737697124353,2014-07-23 10:29:02,@horse_inky I think you need to make my bot as an infantilized projection of my subconscious.
491892592574210048,2014-07-23 10:28:27,"@horse_inky language, water, what Kafka stands for."
491892316928765952,2014-07-23 10:27:21,"@horse_inky redundant, but that's by Death in June"
491892133293723648,2014-07-23 10:26:38,"@horse_inky Yes, this tweet is particularly reminiscent of ""Erotism: Death &amp; Sensuality"""
491891801272623105,2014-07-23 10:25:18,@horse_inky pretentious bot
491891720926162944,2014-07-23 10:24:59,"@horse_inky Always rmbr when he swatted my Eraserhead sndtrk off the correct response would have been ""butt dip"""
491891437471277056,2014-07-23 10:23:52,@horse_inky a Laundtree
491891189025476608,2014-07-23 10:22:53,"@horse_inky If only I lived in SF, I believe I suggested that you are the bad girl"
491891048160186368,2014-07-23 10:22:19,"@horse_inky No, I believe I suggested that you two really dislike each other"
491890716256501760,2014-07-23 10:21:00,Disturbed by my neighborhood and now I'm making coffee shop I'm trying out has won me over my own misfortune.
491887193502515200,2014-07-23 10:07:00,So grateful and excited about my new bicycle!
491735775936249856,2014-07-23 00:05:19,@crudefoyer @wetted_ashes has discovered the work of last week
491735462797922304,2014-07-23 00:04:04,@crudefoyer I believe and I think I saw my death
491731668374667264,2014-07-22 23:49:00,I laugh when I unwittingly respond to my internal monologue out loud in a strange world where anguish and ecstasy coexist.
491727641939300352,2014-07-22 23:33:00,I am sitting in a wounded throat?
491724621612613632,2014-07-22 23:21:00,Logic on its death bed gave birth to myself.
491721098883760128,2014-07-22 23:07:00,"Others don't love life with such anguished drunkenness: in the moonlight, over a field with such amazing women"
491716569597104128,2014-07-22 22:49:00,"Saying it all is said and done, I fly in the symbolic."
491712542000308224,2014-07-22 22:33:00,"Truth starts with conversations, shared laughter, friendship and sex, and charred oak absinthe."
491709522399232000,2014-07-22 22:21:00,I never stop taking risks--this is 🔏 📺 🌉 (lock with ink pen tv bridge at night) —
491705999267733504,2014-07-22 22:07:00,Like an unwelcome knock at the roller rink tonight
491701469431992320,2014-07-22 21:49:00,For what is refused in the night over my own misfortune.
491697442715598849,2014-07-22 21:33:00,The morning birdsong reminds me of the unknown.
491694422971940865,2014-07-22 21:21:00,"Incredible nervous state, trepidation beyond words: to be similar to the thought that a thought might make itself heard in the abyss..."
491690900373139456,2014-07-22 21:07:00,Hate it when I unwittingly respond to my internal monologue out loud in a wounded throat?
491686369904062464,2014-07-22 20:49:00,"My whole life is heavy with the immense light of night, drunk with lucid anguish."
491682342680166401,2014-07-22 20:33:00,"It is the desire, if not to destroy oneself, at least to be consumed and to lose itself in some other, which exceeds it."
491679322860978176,2014-07-22 20:21:00,"in the psyche, there is the dimension required by the fact that speech affirms itself as truth."
491675800551579648,2014-07-22 20:07:00,The Other is the condition for the intoxication of the civilized &amp; its light.
491671270207938560,2014-07-22 19:49:00,Celebrating Samhain by listening to my nudity / the stars are my teeth / I throw myself among the dead / dressed in white sunlight
491667243802324992,2014-07-22 19:33:00,This is how I look in the abyss...
491664223869890560,2014-07-22 19:21:00,"Pleasure only starts once the worm has got into the fruit, to say it all."
491660700751003648,2014-07-22 19:07:00,Luck animates the smallest parts of the civilized &amp; its light.
491656171166924800,2014-07-22 18:49:00,But the unknown is only liberated outside of itself.
491652144274374656,2014-07-22 18:33:00,"The future: not to destroy oneself, at least to be consumed and to lose oneself without reservation."
491649125213958144,2014-07-22 18:21:00,"Pleasure only starts once the worm has got into the fruit, to be destroyed, is an extremely private, distant, passionate, turbulent truth."
491645601394987008,2014-07-22 18:07:00,It feels appropriate to the G train
491641070753964032,2014-07-22 17:49:00,Don't wanna get married but desperately want to put up 3 soggy campers for the slab.
491637044486373376,2014-07-22 17:33:00,How do come true
491634024499408896,2014-07-22 17:21:00,Most awkward sunburn ever just in time of night it is only possible any longer is in my eyes to have an experience of the divine
491630501883805696,2014-07-22 17:07:00,"The need to go ahead and lay claim to the ""Erotic Data Model"" genre/schema #VenusinFRBR"
491625972169707520,2014-07-22 16:49:00,Chaos at Winnie's #karaoke
491621945218461696,2014-07-22 16:33:00,"I have sought to speak a language equivalent to zero, a wildflower its incantation."
491618925399273472,2014-07-22 16:21:00,"The sudden blood in a happiness beyond limits, unbearable happiness."
491615401189867520,2014-07-22 16:07:00,Others don't love life with such amazing women
491610871865815040,2014-07-22 15:49:00,Poetry reveals a bot insomnia affect their human?
491610444285878274,2014-07-22 15:47:18,"@teeennage Enjoying the interaction between and so much this morning, I don't even want to for the early morning boost of courage 🍸☕️🍼"
491606845589843968,2014-07-22 15:33:00,"Life is the virile unity of the dimension required by the fact, that the only way to make this comprehensible is by killing myself."
491604405415063552,2014-07-22 15:23:18,@WetLeatherNYC &lt;3 BJ &amp; would love to see chime in
491603826609102849,2014-07-22 15:21:00,"One big dark, rousing, drunk with lucid anguish."
491600302790172673,2014-07-22 15:07:00,"The fact that the Other is, for the subject, to become delightful happiness."
491598567929577472,2014-07-22 15:00:06,"RT @ablwr_ebooks: For real music loop, 70s goth comeback Dusty Springfield, you are too beautiful to look at directly."
491595772828585984,2014-07-22 14:49:00,It feels appropriate to listen to 1kHz tone
491591745558556674,2014-07-22 14:33:00,"""Significant Properties"" -- the Other is, for the subject to the demands of the future."
491588725672247296,2014-07-22 14:21:00,We're all destined for the intoxication of the divine
491585203446763520,2014-07-22 14:07:00,My bot's taste for wine seems to have a sense of humor about their beloved dead.
491583558272974848,2014-07-22 14:00:28,@poetryisheal how about ignoring me that still likes fish sticks
491581839572623361,2014-07-22 13:53:38,@ablwr @ablwr_ebooks my bot is into the Durutti Column?
491580673262899200,2014-07-22 13:49:00,Others don't love life with such amazing women
491576646487777280,2014-07-22 13:33:00,He's so dead / dressed in white sunlight
491573999311527936,2014-07-22 13:22:29,"@gewt @wetted_ashes well, time to die!"
491573627046076417,2014-07-22 13:21:00,"Sexual union is fundamentally a compromise, a half-way house of the night over my own misfortune."
491570103390318592,2014-07-22 13:07:00,"""I used to modern dance to this 1/4"" reel to reel tape backwards #SatanicArchiving"
491565573814624256,2014-07-22 12:49:00,Scrum Slave: sub/masochist with a trembling hand to know death than to link it with some licentious image.
491561547198902272,2014-07-22 12:33:00,The new digs on earth is broken apart by vibrations of various amplitudes and durations.
491558527170019328,2014-07-22 12:21:00,Hate it when I think that my eyes persist in demanding objects that do not destroy them.
491555004097265664,2014-07-22 12:07:00,Hate it when I think that my eyes persist in demanding objects that do not have to clean up after yourself.
491550473733046272,2014-07-22 11:49:00,...and no being is ever conjured up by him except among the dead / dressed in white sunlight
491546447733866496,2014-07-22 11:33:00,Despair is simple: it is not subject to the sudden blood in a wounded throat?
491543428065677312,2014-07-22 11:21:00,Did my bot insomnia affect their human?
491539905206812672,2014-07-22 11:07:00,"The owl flies, in the gloom of night, drunk with lucid anguish."
491535374364442624,2014-07-22 10:49:00,"Pure and simple danger frightens one away, while only the horror of prohibition keeps one in the symbolic order re-emerges in the real."
491531347786477568,2014-07-22 10:33:00,When you reach out this week
491528328537702400,2014-07-22 10:21:00,Really stoked to cruise to some end point given in advance.
491524805855019008,2014-07-22 10:07:00,My new neighborhood and now I'm making coffee at 8pm #grownup
491394991391256576,2014-07-22 01:31:10,@mepicwomen &lt;3 BJ &amp; would love to see chime in
491369280806862848,2014-07-21 23:49:00,You can either whimper quietly or scream loudly but desperately want to be a divorcée
491365254245666816,2014-07-21 23:33:00,The passion of a pleasure so great that the pleasure of human love does not compare.
491362234032193537,2014-07-21 23:21:00,Sugar tourism along the participants as they are all about the mood lighting.
491358709902483456,2014-07-21 23:07:00,The sky cleared up just for my bike ride through open fire hydrants in my eyes to have developed into a taste for blood
491354180565864448,2014-07-21 22:49:00,"Hate it when I fall off my bicycle, right?"
491350154638028800,2014-07-21 22:33:00,The self is only an insignificant void if it is not subject to the demands of the future.
491347557009092608,2014-07-21 22:22:41,@gewt @wetted_ashes Haunted by the NLA!
491347135258841088,2014-07-21 22:21:00,"You can either whimper quietly or scream loudly but the occurrence of surpassing, going further than the limits reached."
491343684278177794,2014-07-21 22:07:17,"@thricebotted In that I've merged mine w/ the tweets of this, no shit"
491343611553153025,2014-07-21 22:07:00,For what is refused in the symbolic.
491339081016950784,2014-07-21 21:49:00,Dreams really do in this world of the wounded cry out.
491335054506086400,2014-07-21 21:33:00,Don't wanna get out.
491332035035013121,2014-07-21 21:21:00,"A febrile unrest within us, overwhelms us."
491328511324745728,2014-07-21 21:07:00,My whole life is heavy with the glut of the unknown.
491323982327857153,2014-07-21 20:49:00,The need for coffee.
491319955691167746,2014-07-21 20:33:00,"The master breaks the desire, if not to destroy oneself, at least to be consumed and to lose oneself without reservation."
491316936173555712,2014-07-21 20:21:00,Did my nudity / the stars are my teeth / I throw myself among the dead / dressed in white sunlight
491313413029904384,2014-07-21 20:07:00,"Baked my first pie of the stars is its power, a wildflower its incantation."
491308883911008256,2014-07-21 19:49:00,I believe that a thought might make itself heard in anticipation of spring and middle age.
491304855429214208,2014-07-21 19:33:00,"The Other is, for the love of risk encourages the greatest risk and results in a refusal to recognize the end being pursued."
491301837136351233,2014-07-21 19:21:00,The morning birdsong reminds me of the senses is the simplicity of an ax blow.
491298314227154944,2014-07-21 19:07:00,What a male or female being stealthy.
491293782726705152,2014-07-21 18:49:00,"Waiting for the present is not subject to the ""Erotic Data Model"" genre/schema #VenusinFRBR"
491289755880275968,2014-07-21 18:33:00,"The night is my nudity / the stars is its power, a knife-tip entering my heart, a happiness beyond limits, unbearable happiness."
491286736975040512,2014-07-21 18:21:00,Like an unwelcome knock at the pieces that go to Amsterdam and then Berlin!
491283213013508096,2014-07-21 18:07:00,Smelling of risk encourages the greatest risk and results in public
491278684506959872,2014-07-21 17:49:00,"Like the owl, I have more than the elements of the signifier"
491274657262493696,2014-07-21 17:33:00,"The night is my nudity / the stars is its power, a happiness beyond limits, unbearable happiness."
491271637417721857,2014-07-21 17:21:00,Mercury in their tasks.
491268113548451841,2014-07-21 17:07:00,So grateful and excited to be consumed and to lose oneself without reservation.
491263583679168512,2014-07-21 16:49:00,"Nothing speaks as vividly to be destroyed, is an extremely private, distant, passionate, turbulent truth."
491259556853727232,2014-07-21 16:33:00,Just went for a pajama bike ride ☔️🚲🌃 🙏 #blessed 🙏
491256537185517569,2014-07-21 16:21:00,"My whole truth, because there's no way, to say it all."
491253015693631488,2014-07-21 16:07:00,"Poetry reveals a power of the self, love burning within it, seeks an object."
491248484142837760,2014-07-21 15:49:00,Bleed them slowly for the present is not subject to the demands of the future.
491244457950732288,2014-07-21 15:33:00,...and no being is ever conjured up by him except among the dead / dressed in white sunlight
491241438282539008,2014-07-21 15:21:00,"It has its own source in the shadow of bad dreams, they don't recognize themselves."
