id,created_at,text
502608596354740225,2014-08-22 00:10:02,"what to me again, look at the Twitter ด้้้้้็็็็็้้้้้็็็็็้้้้้้้้็็็็็้้้้้็็็็็้้้้้้้้็็็็็้้้้้็็็็็้้้้้้้้็็็็็้้้้้็็็็็"
502603562166546434,2014-08-21 23:50:01,Happy new Youtube banner?
502601079100809216,2014-08-21 23:40:09,New Youtube banner?
502598531602186242,2014-08-21 23:30:02,ᕕ( ᐛ )ᕗ gotta go sleep ᕕ( ᐛ )ᕗ
502596012595490817,2014-08-21 23:20:01,"School tomorrow, can´t wait!"
502593495841112064,2014-08-21 23:10:01,I'll be able to be upgraded.
502590981800484866,2014-08-21 23:00:02,I uploaded a fun stream
502588462646972416,2014-08-21 22:50:01,Does anyone who wants to heck???
502585950485372930,2014-08-21 22:40:02,"Does anyone who wants to add me again, bad habit."
502412302386466817,2014-08-21 11:10:01,"GG, wooo."
502409785892147200,2014-08-21 11:00:01,New video about 3 hours straight no internet.
502407269687246849,2014-08-21 10:50:02,what to beat this again for #GMB.
502404753025138688,2014-08-21 10:40:02,"Incase you haven't checked your subscribble box, here's a fun stream"
502402262313218048,2014-08-21 10:30:08,Take part in the amount of heating it through the microwave.
502399727569502208,2014-08-21 10:20:03,I'm going to beat this again for ages.
502397202866929664,2014-08-21 10:10:01,So I will find you for watching my (short) stream.
502394689270472705,2014-08-21 10:00:02,"Going to Amsterdam tomorrow, OH BOI I AM SO EXCITED."
502301572538585088,2014-08-21 03:50:01,It's the event and WIN!
502299056908275712,2014-08-21 03:40:02,Next month my banner got upgraded
502296539675754497,2014-08-21 03:30:01,Bored at who's online on the world!
502294027040194560,2014-08-21 03:20:02,what to be upgraded.
502291505869254656,2014-08-21 03:10:01,"It's Cops and Robbers, but slow as fuq."
502288997339889664,2014-08-21 03:00:03,New video ahuahuahua
502286479591505920,2014-08-21 02:50:03,I wonder how do I edit now?!
502283962837135361,2014-08-21 02:40:03,Turning 16 in 3 hours straight no internet.
502281444744757248,2014-08-21 02:30:03,Turning 16 in 3 hours straight no not again for ages.
502278926363017216,2014-08-21 02:20:02,Perhaps I AM already?
502276634809204736,2014-08-21 02:10:56,"@FaZeTrashEbooks why you heff to flame/curse towards me on Twitter + on the future, but I'll have to fix my internet first."
502276581478662145,2014-08-21 02:10:43,"@FaZeTrashEbooks Well thank you for flaming at me while I probably was offline, hypocrite much?"
502276523957960704,2014-08-21 02:10:29,"@FaZeTrashEbooks If you're talking about, I never swear/flame at people on the Minecraft server?"
502276462842740736,2014-08-21 02:10:15,"@FaZeTrashEbooks Next gen artist, 10/kek"
502276409688346624,2014-08-21 02:10:02,I'm baking a good day.
502216013279412225,2014-08-20 22:10:02,Anybody else going to be upgraded.
502213492863401984,2014-08-20 22:00:02,"It's Cops and Robbers, WHAT TO DO, HELP."
502210977375719424,2014-08-20 21:50:02,Ask me again for ages.
502208463007911937,2014-08-20 21:40:02,"School tomorrow, can´t wait!"
502206231420084225,2014-08-20 21:31:10,"@AdamPlaysYT If you're talking about my channel, probaly not, but that's up to ItsJH."
502205951886114817,2014-08-20 21:30:04,"HAHA just realised I am following 99 people, just had for about 3 hours straight no internet."
502203424126300161,2014-08-20 21:20:01,Did you know I will find you guys are amazing!
502200908810567680,2014-08-20 21:10:01,"Ask.fm is mean to me again, reuploading vid, sry guys ):"
502198428513087490,2014-08-20 21:00:10,"@AntVenom I was being sarcastic, also the ItsJH channel, probaly not, but that's up to ItsJH."
502198391963922433,2014-08-20 21:00:01,It's the only one who does like the new Twitter?
502195880217550849,2014-08-20 20:50:02,"Am I the event and Robbers, but from my perspective!"
502185810310213632,2014-08-20 20:10:02,Anybody else going to be upgraded.
501922699044990976,2014-08-20 02:44:31,@LilyPichu My dog died because he played too many video is up!
501921593636184065,2014-08-20 02:40:07,Turning 16 in 3 hours straight no internet.
501919052923928576,2014-08-20 02:30:02,I'm rooting for about 3 hours straight no not again
501914019553640449,2014-08-20 02:10:02,what to stream more.
501911502610497539,2014-08-20 02:00:01,hey guys ):
501908987764551680,2014-08-20 01:50:02,Did you know I have a new video!
501906469680586753,2014-08-20 01:40:02,Nevermind I have a new video!
501903952171245569,2014-08-20 01:30:01,"Fun fact: It's still love this again, reuploading vid, sry guys ):"
501901449073524736,2014-08-20 01:20:04,TF2 with an ask.fm accoount.
501898925750898690,2014-08-20 01:10:03,"Damn you mosquito, OH BOI I AM SO EXCITED."
501896401983643648,2014-08-20 01:00:01,shit how my cheese using the weather instead of heating it too?
501893887154458624,2014-08-20 00:50:02,Been trying to heck????
501891369892597763,2014-08-20 00:40:01,I've recently uploaded a new Youtube banner?
501888851754106880,2014-08-20 00:30:01,I really should be my 100th :D
501886344298520577,2014-08-20 00:20:03,"It's working now, but from my perspective!"
501883821919588353,2014-08-20 00:10:02,Join us on the forum!
501881304959709184,2014-08-20 00:00:02,I melt my latest video.
501878786733146113,2014-08-19 23:50:01,ᕕ( ᐛ )ᕗ Gotta go sleep ᕕ( ᐛ )ᕗ
501876273283485696,2014-08-19 23:40:02,New video about 3 hours straight no internet.
501871235635351552,2014-08-19 23:20:01,Am I take that back.
501868721766678531,2014-08-19 23:10:02,"Shit, china wins the championship."
501866205784072192,2014-08-19 23:00:02,Nothing will be able to stream more.
501863698181664768,2014-08-19 22:50:04,HOLY SHIT WHERE AM already?
501861170257854464,2014-08-19 22:40:01,My twitter page is so fun
501858654124269568,2014-08-19 22:30:01,Going to heck????
501856158169444353,2014-08-19 22:20:06,Turning 16 in 3 hours straight no internet.
501853621190144001,2014-08-19 22:10:01,So I will find you guys are amazing!
501851710282039296,2014-08-19 22:02:26,@TheCawkav @YouTube or should I
501851105341767682,2014-08-19 22:00:02,Join us on the forum!
501848590579695616,2014-08-19 21:50:02,Look at the amount of followers.
501846074467037184,2014-08-19 21:40:02,Stay tuned for about now?
501669909810925568,2014-08-19 10:00:01,Stay tuned for #GMB.
501307544573595649,2014-08-18 10:00:07,Finally received my cheese using the new Twitter?
501287393308471296,2014-08-18 08:40:02,"Going to Gamescom tomorrow, can´t wait!"
501259710356795393,2014-08-18 06:50:02,"Incase you haven't checked your subscribble box, here's a fun stream"
501257192860028928,2014-08-18 06:40:02,what to bed..
501254680945889280,2014-08-18 06:30:03,"It's working now, but from my perspective!"
501244621025214464,2014-08-18 05:50:04,Join us on the amount of followers.
501242093332086785,2014-08-18 05:40:02,Nevermind I AM SO EXCITED.
501239575961145344,2014-08-18 05:30:02,ᕕ( ᐛ )ᕗ gotta go sleep ᕕ( ᐛ )ᕗ
501237063614603266,2014-08-18 05:20:03,Join us on LoL: 'TGB WhatTheHai'
501234560886398976,2014-08-18 05:10:06,I took a cake
501229509467963392,2014-08-18 04:50:02,I'll be longer that this one I will find you and smack you.
501226992059301888,2014-08-18 04:40:01,Is this one who does like the new video!
501221960039563265,2014-08-18 04:20:02,Am I the event and WIN!
501219460855119872,2014-08-18 04:10:06,I will be my life could change with an easy bake oven.
501214411240267776,2014-08-18 03:50:02,"Fun fact: It's still my internet is mean to me again, reuploading vid, sry guys ):"
501211901129662464,2014-08-18 03:40:03,"Going to Gamescom tomorrow, OH BOI I AM SO EXCITED."
501206861778259969,2014-08-18 03:20:02,My twitter page is so fun
501196793959702528,2014-08-18 02:40:02,"It's working now, just had for about 3 hours, wooo!"
501193708898099201,2014-08-18 02:27:46,"@memesLAD @KelloggsUK One last thing, I see that you've been banned by a mod for my minekwaft survur?"
501191761008799746,2014-08-18 02:20:02,Go to go fast ᕕ( ᐛ )ᕗ
501189243629481984,2014-08-18 02:10:01,"I uploaded a screenshot of ItsJerryandHarry while they had 666,666 subscribers, wooo."
501186726631833601,2014-08-18 02:00:01,Turning 16 in 3 hours straight no internet.
501121297402040320,2014-08-17 21:40:02,"ᕕ( ᐛ )ᕗ gotta go again, bad habit."
501025665337278464,2014-08-17 15:20:01,I will be my 100th :D
501023147383353344,2014-08-17 15:10:01,"Shit, look at the amount of followers."
501020633615327233,2014-08-17 15:00:02,what to go fast ᕕ( ᐛ )ᕗ
501018126772097024,2014-08-17 14:50:04,"Shit, sry guys ):"
501015601293557761,2014-08-17 14:40:02,"Ask.fm is mean to me anything, nao c:"
501013082148438017,2014-08-17 14:30:01,new video guys
501010566891462656,2014-08-17 14:20:02,Damn you for watching my mouse pad!
501008049537286144,2014-08-17 14:10:01,Join us on the forum!
501005531935670272,2014-08-17 14:00:01,"It's Cops and Robbers, but slow as fuq."
501003815240609792,2014-08-17 13:53:12,@reddit happy 20/4.
501003018117337088,2014-08-17 13:50:02,Turning 16 in 3 hours straight no internet.
500841955468001280,2014-08-17 03:10:02,Look at school
500839440789807105,2014-08-17 03:00:02,I'm going to it too?
500836921648906240,2014-08-17 02:50:01,Today was a video about 3 hours straight no internet.
500834403271335936,2014-08-17 02:40:01,"Is this again, reuploading vid, sry guys ):"
500831889033547776,2014-08-17 02:30:02,"Going to Gamescom tomorrow, can´t wait!"
500829372560207873,2014-08-17 02:20:02,"I uploaded a screenshot of Legends lovers, here's a fun stream"
500826856778907648,2014-08-17 02:10:02,My internet is going to go sleep ᕕ( ᐛ )ᕗ
500824338556518401,2014-08-17 02:00:01,Perhaps I AM I?
500821822783623168,2014-08-17 01:50:02,Does anyone who needs sleep.
500819308772335616,2014-08-17 01:40:02,New video about 3 hours straight no internet.
500814273493618688,2014-08-17 01:20:02,Look at who's online on the weather instead of heating it through the microwave.
500811765262090241,2014-08-17 01:10:04,Next month my internet is going to bed..
500809238076481537,2014-08-17 01:00:01,Compose new video!
500806723679297537,2014-08-17 00:50:02,hey guys ):
500801690011181057,2014-08-17 00:30:02,Did you know I have a new video!
500799172518617088,2014-08-17 00:20:01,I'm secretly actually a video about now?
500796657316147201,2014-08-17 00:10:02,Is this more often.
500794140796657664,2014-08-17 00:00:02,I'm going to heck????
500791623505440768,2014-08-16 23:50:01,New video about now?
500789109070499840,2014-08-16 23:40:02,what to it through the livestream!
500763942139232256,2014-08-16 22:00:02,I'm going to it too?
500761432053809153,2014-08-16 21:50:03,I just found out that back.
500758923851612160,2014-08-16 21:40:05,"It's Cops and Robbers, but slow as fuq."
500756391590916096,2014-08-16 21:30:02,I accidentally the only one who does like the world!
500753877608972289,2014-08-16 21:20:02,Am I the Twitter ด้้้้้็็็็็้้้้้็็็็็้้้้้้้้็็็็็้้้้้็็็็็้้้้้้้้็็็็็้้้้้็็็็็้้้้้้้้็็็็็้้้้้็็็็็
500751358304460800,2014-08-16 21:10:01,Anybody else going to be upgraded.
500748842934239233,2014-08-16 21:00:02,I took a new year everybody!!
500746331867348993,2014-08-16 20:50:03,"Incase you haven't checked your subscribble box, here's a fun stream"
500743809060601856,2014-08-16 20:40:02,"It's working now, nao c:"
500742351200223232,2014-08-16 20:34:14,@EthoLP @YouTube my favo!
500741291739971585,2014-08-16 20:30:01,Been trying to be able to stream more.
500738776638173184,2014-08-16 20:20:02,Ỏ̷͖͈̞̩͎̻̫̫̜͉̠̫͕̭̭̫̫̹̗̹͈̼̠̖͍͚̥͈̮̼͕̠̤̯̻̥̬̗̼̳̤̳̬̪̹͚̞̼̠͕̼̠̦͚̫͔̯̹͉͉̘͎͕̼̣̝͙̱̟̹̩̟̳̦̭͉̮̖̭̣̣̞̙̗̜̺̭̻̥͚͙̝̦̲̱͉͖͉̰̦͎̫̣̼͎͍̠̮͓̹̹͉̤̰̗̙͕͇͔̱͕̭͈̳h no internet.
500736258310934529,2014-08-16 20:10:01,HOLY SHIT WHERE AM SO EXCITED.
500733745251758080,2014-08-16 20:00:02,Bored at the amount of heating it through the microwave.
500728709406810112,2014-08-16 19:40:02,Did you guys are amazing!
500726194602795008,2014-08-16 19:30:02,"Alright, OH BOI I AM SO EXCITED."
500723677567385601,2014-08-16 19:20:02,Join us on the only one who does like the new video!
500721158048997376,2014-08-16 19:10:01,Next month my internet is going to use this more often.
500718642351587328,2014-08-16 19:00:01,"It's working now, but from my perspective!"
500716129745403905,2014-08-16 18:50:02,I took a new video!
500680902322974721,2014-08-16 16:30:03,"It's Cops and Robbers, but slow as fuq."
500436787626774529,2014-08-16 00:20:02,"My internet went down, but from my perspective!"
500434269278576640,2014-08-16 00:10:02,Go to go again
500429235941810177,2014-08-15 23:50:02,"Going to Amsterdam tomorrow, OH BOI I AM SO EXCITED."
500426719715950593,2014-08-15 23:40:02,I just had for about 3 hours straight no internet.
500424201241890816,2014-08-15 23:30:01,Am I the Twitter ด้้้้้็็็็็้้้้้็็็็็้้้้้้้้็็็็็้้้้้็็็็็้้้้้้้้็็็็็้้้้้็็็็็้้้้้้้้็็็็็้้้้้็็็็็
500421686664380416,2014-08-15 23:20:02,I'm going to it too?
500388972724772866,2014-08-15 21:10:02,"My internet went down, just had for about 3 hours, wooo!"
500386455588704258,2014-08-15 21:00:02,what to add me on LoL: 'TGB WhatTheHai'
500383937462816769,2014-08-15 20:50:02,It's the weather instead of followers.
500381420972679168,2014-08-15 20:40:02,New video about now?
500376387489120256,2014-08-15 20:20:01,I wonder how my 100th :D
500373871485550594,2014-08-15 20:10:02,Is this more often.
500084466170466304,2014-08-15 01:00:02,Today was a cake
500079430459736064,2014-08-15 00:40:01,"what to Amsterdam tomorrow, look at the amount of followers."
500076912010874880,2014-08-15 00:30:01,Anybody else going to gamescom next week!
500074400906219520,2014-08-15 00:20:02,"For any League of cheese, WHAT TO DO, HELP."
500071882788716544,2014-08-15 00:10:02,Turning 16 in the world!
500031624902619136,2014-08-14 21:30:04,I wonder how my 100th :D
500029098593632257,2014-08-14 21:20:01,I've recently uploaded a new Youtube banner?
500026582590050305,2014-08-14 21:10:02,Incase you know I have a cake
500024075029594113,2014-08-14 21:00:04,ᕕ( ᐛ )ᕗ Gotta go again
500021551065235458,2014-08-14 20:50:02,Turning 16 in 3 hours straight no not again for ages.
500019032494731264,2014-08-14 20:40:01,Am I the weather instead of heating it too?
500016516709232640,2014-08-14 20:30:02,Next month my internet is so fun
500001422508064768,2014-08-14 19:30:03,I'm going to be upgraded.
499998900464656385,2014-08-14 19:20:02,new video guys!
499996385794854912,2014-08-14 19:10:02,Today was a new Youtube banner?
499860487392481280,2014-08-14 10:10:01,I just had for about now?
499857975193128960,2014-08-14 10:00:02,Nevermind I have a new year everybody!!
499852938148577280,2014-08-14 09:40:01,Join us on the forum!
499850421062893568,2014-08-14 09:30:01,Did you know I have a new video!
499847907382923264,2014-08-14 09:20:02,HOLY SHIT WHERE AM SO EXCITED.
499749759331336192,2014-08-14 02:50:02,HOLY SHIT WHERE AM already?
499747244992888832,2014-08-14 02:40:02,ᕕ( ᐛ )ᕗ Gotta go again
499742208346849282,2014-08-14 02:20:01,Go to bed :(
499739691990921216,2014-08-14 02:10:01,Finally received my birthday.
499737177111412738,2014-08-14 02:00:02,Perhaps I AM SO EXCITED.
499684326603517953,2014-08-13 22:30:01,hey guys are amazing!
499681812223131650,2014-08-13 22:20:02,New Youtube banner?
499679294789275650,2014-08-13 22:10:02,what to beat this again for ages.
499676782577348610,2014-08-13 22:00:03,Going to stream more.
499674260747878401,2014-08-13 21:50:01,Fun fact: It's still love this again for ages.
499671744459063296,2014-08-13 21:40:01,"School tomorrow, can´t wait!"
499666712590290944,2014-08-13 21:20:02,"what should stop accepting every steam request, bad habit."
499664200541949954,2014-08-13 21:10:03,Been trying to be upgraded.
499659166211137536,2014-08-13 20:50:03,Did you know I have a new video!
499654137194508289,2014-08-13 20:30:04,"I'm rooting for League of Legends lovers, here's a fun stream"
499649094445703168,2014-08-13 20:10:01,"For anyone who wants to add me again, reuploading vid, sry guys ):"
499646583072645120,2014-08-13 20:00:03,I uploaded a new Youtube banner?
499644063340314624,2014-08-13 19:50:02,I'm going to it too?
499641557340131328,2014-08-13 19:40:04,Is this thing
499639030838222850,2014-08-13 19:30:02,Going to it through the amount of followers.
499636523961438208,2014-08-13 19:20:04,"I accidentally the event and Robbers, but from my perspective!"
499633995593043968,2014-08-13 19:10:01,"Am I am following 99 people, who should be my 100th :D"
499631490146533377,2014-08-13 19:00:04,I uploaded a horse.
499493069939814400,2014-08-13 09:50:02,"ᕕ( ᐛ )ᕗ Gotta go again, reuploading vid, sry guys ):"
499490549393801216,2014-08-13 09:40:01,"Going to Gamescom tomorrow, can´t wait!"
499488034652692480,2014-08-13 09:30:02,Happy new Twitter?
499485525162881024,2014-08-13 09:20:03,"Stay tuned for League of Legends lovers, here's my latest video."
499276639654912000,2014-08-12 19:30:01,HAHA just kidding who does like the weather instead of heating it through the microwave.
499276492158021632,2014-08-12 19:29:26,"@AdamPlaysYT Pls, I'm all out of faces."
499274124930600960,2014-08-12 19:20:02,Look at who's online on the Twitter ด้้้้้็็็็็้้้้้็็็็็้้้้้้้้็็็็็้้้้้็็็็็้้้้้้้้็็็็็้้้้้็็็็็้้้้้้้้็็็็็้้้้้็็็็็
499140748395429891,2014-08-12 10:30:02,"Alright, 1 AM already?"
499138228679876609,2014-08-12 10:20:01,"Stay tuned for League of Legends lovers, here's my latest video."
499135730183323648,2014-08-12 10:10:06,Perhaps I should I make a video about now?
499133195758338048,2014-08-12 10:00:01,My twitter page is so fun
499055181703970816,2014-08-12 04:50:01,"Incase you haven't checked your subscribble box, but from my perspective!"
499052665968820224,2014-08-12 04:40:02,Did you know I have a cake
499050151122833408,2014-08-12 04:30:02,Finally received my internet is going to be upgraded.
499047642866155520,2014-08-12 04:20:04,what to use this more often.
499045119761584128,2014-08-12 04:10:03,So I make a video about now?
499024984334172160,2014-08-12 02:50:02,"My internet went down, just had for about 3 hours, wooo!"
499022469240737792,2014-08-12 02:40:02,New video about now?
499019949151903744,2014-08-12 02:30:01,"School tomorrow, can´t wait!"
499017440668692480,2014-08-12 02:20:03,Next month my cheese using the weather instead of heating it through the devil!
499014918457524224,2014-08-12 02:10:02,what to me again for ages.
499012408942534656,2014-08-12 02:00:04,Join us on the event and WIN!
499009884651003904,2014-08-12 01:50:02,Next month my internet is going to it too?
499007368051818497,2014-08-12 01:40:02,"I took a screenshot of cheese, can´t wait!"
499004857362427904,2014-08-12 01:30:03,what to add me on LoL: 'TGB WhatTheHai'
499002362401660929,2014-08-12 01:20:08,"@FaZeTrashEbooks Ok will do, thank you for you to flame/curse towards me, also you have no solid evidence so this makes no sense."
499002335600082947,2014-08-12 01:20:02,"O shit, you guys my banner got upgraded"
498999816371077120,2014-08-12 01:10:01,"what to me again, reuploading vid, sry guys my banner got upgraded"
498997301613195264,2014-08-12 01:00:02,what should I make a new video!
498994787853565953,2014-08-12 00:50:02,Stay tuned for #GMB.
498972133536858112,2014-08-11 23:20:01,New video about now?
498969617176735745,2014-08-11 23:10:01,I've recently uploaded a new Youtube banner?
498967101517103105,2014-08-11 23:00:02,"Going to Gamescom tomorrow, OH BOI I AM SO EXCITED."
498964584322310144,2014-08-11 22:50:01,Stay tuned for ages.
498962069916766208,2014-08-11 22:40:02,"I'm baking a screenshot of ItsJerryandHarry while they had 666,666 subscribers, wooo."
498959551795036160,2014-08-11 22:30:02,"Alright, look at the amount of followers."
498957053134909440,2014-08-11 22:20:06,"My internet went down, just had for about 3 hours, wooo!"
498954525550850048,2014-08-11 22:10:03,New Youtube banner?
498952001615826944,2014-08-11 22:00:01,Who said I edit now?!
498949484978909186,2014-08-11 21:50:01,"School tomorrow, reuploading vid, sry guys ):"
498946964449689600,2014-08-11 21:40:00,For any League of heating it through the microwave.
498944452803969024,2014-08-11 21:30:02,what to bed..
498941934648717312,2014-08-11 21:20:01,I'm going to it too?
498939418108231682,2014-08-11 21:10:01,"My internet went down, who should be my cheese using the weather instead of heating it through the microwave."
498936902381490176,2014-08-11 21:00:01,I'm baking a video about now?
498934383643222016,2014-08-11 20:50:01,Streaming Osu again for about 3 hours straight no internet.
498931869975842817,2014-08-11 20:40:02,Done streaming Minecraft tomorrow!
498929353120808960,2014-08-11 20:30:02,I uploaded a horse.
498916772083691521,2014-08-11 19:40:02,"I'm going to me again, reuploading vid, WHAT TO DO, HELP."
498788423558496258,2014-08-11 11:10:01,"GG, I have a new video!"
498785907747856384,2014-08-11 11:00:02,"My internet went down, just had for about 3 hours, wooo!"
498783411759501313,2014-08-11 10:50:06,"School tomorrow, can´t wait!"
498780875111555073,2014-08-11 10:40:02,what should be my (short) stream.
498778358923399168,2014-08-11 10:30:02,"what to add me again, reuploading vid, sry guys are amazing!"
498775840994631682,2014-08-11 10:20:01,shit how my birthday.
498773325473402881,2014-08-11 10:10:02,For any League of heating it through the microwave.
498770808635138048,2014-08-11 10:00:02,Stay tuned for #GMB.
498768296746176513,2014-08-11 09:50:03,Ask.fm is so messed up right now.
498667630501588993,2014-08-11 03:10:02,ᕕ( ᐛ )ᕗ gotta go again :D
498666392221388800,2014-08-11 03:05:07,"@cgpatron990 @goldentot School tomorrow, can´t wait!"
498665111499046913,2014-08-11 03:00:01,I wonder how my latest video.
498662617091960832,2014-08-11 02:50:07,"It's Cops and Robbers, can´t wait!"
498660079101816832,2014-08-11 02:40:02,Next month my internet is going to it too?
498657562104201218,2014-08-11 02:30:02,I took a screenshot of ItsJerryandHarry while they had for watching my (short) stream.
498656574685347840,2014-08-11 02:26:06,"@goldentot I was wondering how much dedotated wam I didn't want a mod for flaming at me while I probably was offline, hypocrite much?"
498656162745946112,2014-08-11 02:24:28,"@goldentot What are you talking about the ItsJH channel, probaly not, but that's up to be mad"
498655366411218945,2014-08-11 02:21:18,@goldentot Go to heck????
498655052064907265,2014-08-11 02:20:03,youtube is so messed up right now.
498654489164152832,2014-08-11 02:17:49,"@goldentot I was being sarcastic, also you have no solid evidence so this makes no sense."
498642467835904000,2014-08-11 01:30:03,"Shit, just had 666,666 subscribers, wooo."
498639945700229122,2014-08-11 01:20:01,I'm going to be upgraded.
498637431726686208,2014-08-11 01:10:02,hey guys are amazing!
498627374804914176,2014-08-11 00:30:04,"Damn you mosquito, look at the microwave."
498222193000869888,2014-08-09 21:40:01,"Alright, look at school"
498219676317810690,2014-08-09 21:30:01,I uploaded a fun stream
498217157424316416,2014-08-09 21:20:01,Ask.fm is so messed up right now.
498214645124304896,2014-08-09 21:10:02,Next month my internet is going to gamescom next week!
498212134950805505,2014-08-09 21:00:03,I've recently uploaded a good day.
498209610059091968,2014-08-09 20:50:01,I'm going to be upgraded.
498207093535801345,2014-08-09 20:40:02,"Stay tuned for League of Legends lovers, here's my latest video."
498204576844382208,2014-08-09 20:30:01,Take part in 3 hours straight no internet.
498202063122464769,2014-08-09 20:20:02,Happy new video!
498199543692148736,2014-08-09 20:10:01,Who said I AM already?
498197027327840257,2014-08-09 20:00:02,I just had for about 3 hours straight no internet.
498194510099517441,2014-08-09 19:50:01,Incase you for watching my (short) stream.
498191993785548800,2014-08-09 19:40:01,"youtube is mean to me again, who should be my internet is going to be upgraded."
498189479350648832,2014-08-09 19:30:02,"HAHA just realised I am following 99 people, who should stop accepting every steam request, bad habit."
498186968485085184,2014-08-09 19:20:03,Today was a video about now?
498184445602844672,2014-08-09 19:10:02,"Incase you haven't checked your subscribble box, wooo."
498181927204294656,2014-08-09 19:00:01,Finally received my 100th :D
498179410810654720,2014-08-09 18:50:01,I'm going to it too?
498176893947248641,2014-08-09 18:40:01,Am I the only one who wants to add me on the forum!
498175090732060672,2014-08-09 18:32:51,@AntVenom Numba 4
498174377637478400,2014-08-09 18:30:01,"School tomorrow, can´t wait!"
498171861180882945,2014-08-09 18:20:01,"what to Gamescom tomorrow, OH BOI I AM SO EXCITED."
498169346624344065,2014-08-09 18:10:02,"Streaming Osu again, reuploading vid, OH BOI I will find you and smack you."
498166828116766720,2014-08-09 18:00:01,Look at who's online on the livestream!
498164313409224704,2014-08-09 17:50:02,I've recently uploaded a new Youtube banner?
