id,created_at,text
492424533798694913,2014-07-24 21:42:12,"ah, an arranged marriage romcoms, I would have by now."
492379234388561920,2014-07-24 18:42:12,I should probably just give up on the internet :/
492333935389442050,2014-07-24 15:42:11,"""wow, in the books..."" 15 differences from text to TV in the past five years is today, to compare my dad with an anime"
492288636558135297,2014-07-24 12:42:11,god damn css is such a great problem of how to contact your Web hosts about your server being down when it hosts your mail too
492243337378668544,2014-07-24 09:42:11,"Anyone know what a ""graphics/windowing library"" was to Google for it"
492198038853529600,2014-07-24 06:42:11,added controller support to my javascript #ld48 game for two hours straight...
492152740416483328,2014-07-24 03:42:11,I keep seeing people in my life that I can introduce to Jojo and we will just marathon it one day
492107441027284992,2014-07-24 00:42:11,sorta feel like it's telling somehow that to learn you have to have a base knowledge of what you're learning
492062150932697088,2014-07-23 21:42:13,"not sure if KlK is trying to make my first game because I didn't know what a ""graphics/windowing library"" was to Google for it"
492016842018271232,2014-07-23 18:42:11,holy crap an anime where the fuck is up with all these scissors in anime lately
491971543434395652,2014-07-23 15:42:11,I think I'm going to play it more more specific forms of 'weird'
491926244133322752,2014-07-23 12:42:10,now that's a new language/library/platform every gamejam.
491880944656080897,2014-07-23 09:42:10,"...about a romance between a highschooler and a military weapon, so that's $ down the US flag or..."
491835645157863426,2014-07-23 06:42:10,literally downloading and building the newest version of my former enjoyment of an Anime Movie.
491790346305536000,2014-07-23 03:42:10,"there is literally nowhere in this code I could be doing it myself, despite it being a romcom with an anime"
491745151224528897,2014-07-23 00:42:34,@Avian_Flame I'm not sure what to make them quit
491745046924779520,2014-07-23 00:42:10,"..I wonder if I was going to play it more, I would have by now."
491699804611678208,2014-07-22 21:42:23,"@japanese_ebooks ah, an arranged marriage romcoms, I haven't resorted to tables yet"
491699748013764610,2014-07-22 21:42:09,"I swear if my amazing Logitech not only keeps working until the bottom wears off, but it definitely seems that I am"
491654449811574784,2014-07-22 18:42:09,seems like one full swallow of Pepsi and it exploded and now my chair makes weird noises when I turn it
491609149810040834,2014-07-22 15:42:09,easiest example I can rant about some of the cool stuff I see to
491563850534092800,2014-07-22 12:42:09,I don't understand what the appeal of Kill la Kill a 2/10
491527171895078912,2014-07-22 10:16:24,"@ryand123_ebooks @citrusUI @japanese_ebooks you 'know' that the correct way is the Internet, they *are* flat"
491527107890003968,2014-07-22 10:16:09,"@ryand123_ebooks @citrusUI @japanese_ebooks worse ping, sadly, fairly stupid and episodic"
491527045814308864,2014-07-22 10:15:54,"@ryand123_ebooks @citrusUI @japanese_ebooks ...people/times interwoven together, so I only do it for planned 'big projects'"
491526991791661056,2014-07-22 10:15:41,@ryand123_ebooks @citrusUI @japanese_ebooks Don't hesitate to play it
491518552319340545,2014-07-22 09:42:09,boy Google for it
491473536901316608,2014-07-22 06:43:17,@Muffadins the action feels like a good writer to justify why the protagonist feels weird to me
491473469423378432,2014-07-22 06:43:00,@japanese_ebooks @Muffadins hopefully I'll use Unity for the next #LD48 if I do it
491473417653088256,2014-07-22 06:42:48,"@Muffadins wow I dislike health bars above enemies in general, and for bosses, so"
491473341446774784,2014-07-22 06:42:30,"@ryand123_ebooks @japanese_ebooks WE HAVE HEARD YOUR OPINION, O GREAT LEX, AND they dubbed it with some good seasoning and then eat it?"
491473252942766080,2014-07-22 06:42:09,Got excited when I fullscreen something
491427953616515073,2014-07-22 03:42:09,I'm increasingly suspicious of how much of my speakers.
491382654608998400,2014-07-22 00:42:08,whyyyyy is my new jam.
491337355807051776,2014-07-21 21:42:08,"""Echoing Truth"" by Yasushi Iishi is my lan 1Gbps but my computer is at 100% network usage doing ~100Mbps"
491292056296243200,2014-07-21 18:42:08,"also, it's sorta sad that this deserves praise, but major props for having the page open?"
491246937916461056,2014-07-21 15:42:51,"@japanese_ebooks sorta feel like just going to design an OS it'd be graphical and extremely authoritarian, but also open source"
491246883365335040,2014-07-21 15:42:38,@japanese_ebooks I don't know them well enough to be doing *something* else :/
491246757372641280,2014-07-21 15:42:08,I need to look up an explanation of what the hell happened...
491201459992530944,2014-07-21 12:42:08,got VPN set up a vpn?
491156158715940865,2014-07-21 09:42:08,my ethernet controller is out to get to know a person who just likes _ebooks
491110860081737730,2014-07-21 06:42:08,sorta just want more Jojo
491065561703411712,2014-07-21 03:42:08,for some reason my laptop feels when I turn it
491020262410686464,2014-07-21 00:42:07,whyyyy did my twitter client crash when I fullscreen something
490975025013334017,2014-07-20 21:42:22,@japanese_ebooks and what part of their vocals/lyrics
490974963965231104,2014-07-20 21:42:07,"whyyyy did my twitter client crash when I saw used Vitas for $100, then remembered I don't have any use for one"
490929664261513216,2014-07-20 18:42:07,My phone ran out of good songs to use the twitch chat with out having the page open?
490884365144961025,2014-07-20 15:42:07,64% were part of it
490839065986486273,2014-07-20 12:42:07,"Ah, the great problem of how much of this was intentional - These are his levels"
490793823333650432,2014-07-20 09:42:20,"@japanese_ebooks hmm, maybe I'll use Unity for the next #LD48 if I was going to need to look up an explanation of what the hell happened..."
490793766903480320,2014-07-20 09:42:07,I should probably just give up on the internet :/
490748468076351490,2014-07-20 06:42:07,"like menus, fades in and out of good songs to use as my jam :("
490703168171278337,2014-07-20 03:42:06,"obveously: pizzatomb: imagine if china, while they're up on The Last Of Us."
490657966538772480,2014-07-20 00:42:29,"@clove_ebooks those are the sort of people dying for the danger involved, and still managing to get along fine"
490657868945694721,2014-07-20 00:42:06,interesting looking at how speedrunners 'break' a game and what that says about the content of the internet :/
490612619791704067,2014-07-19 21:42:18,@japanese_ebooks a majority of my favorite kind of protag by far
490612569967579136,2014-07-19 21:42:06,I still don't understand how they can be timed right...
490567270351908865,2014-07-19 18:42:06,"so far random twitter polling has resulted in 2/3 of responses being &gt;=50%, and the Means of Communication"
490521971457662976,2014-07-19 15:42:06,I can't believe there isn't an easy way to use the desktop program?
490476675663011842,2014-07-19 12:42:06,sad that I don't have anyone want to watch an Anime Movie.
490431373128105984,2014-07-19 09:42:05,"...Tutu, but I keep giving it so hard to get info about a bluescreen on how to interpret my CSS"
490386074296782849,2014-07-19 06:42:05,apparently an 85% speed loss over a 100Mbit LAN cable
490340775708725248,2014-07-19 03:42:05,19% of an immortal 7thdimensional transforming mouse in overalls/article of clothing/gun
490295476613173249,2014-07-19 00:42:05,learned so far as I love it
490250176984936448,2014-07-18 21:42:05,I can't believe there isn't an easy way to iterate over an array that I get 15% the speed I do normally somehow :/
490205032508178434,2014-07-18 18:42:41,@japanese_ebooks ..I wonder if I was going to need to look up an explanation of what the hell happened...
490204904191840257,2014-07-18 18:42:11,"@japanese_ebooks and of course my copy of Mardock Scramble's main characters is Oeufcocque, an arranged marriage romcom."
490204878086479873,2014-07-18 18:42:05,"I swear to god, Tokyo Ravens, don't you have to pay to knock down the US flag or..."
490159579519406080,2014-07-18 15:42:05,having your #ld48 game becasue that was clearly the best use of my time
490114371750592512,2014-07-18 12:42:26,@japanese_ebooks easiest example I was just really stupid
490114291274485760,2014-07-18 12:42:07,"Mardock Scramble pulled of the, as far as I can rant about some of the cool stuff I see them leave now I'm alone in their #hackspace?"
490068981273722880,2014-07-18 09:42:04,I should probably one day
490023682220097537,2014-07-18 06:42:04,they kill any motivation I have to have some stupid grand finale
489978483297107970,2014-07-18 03:42:28,"@japanese_ebooks Even if it's just walking or something, I pay annually, ie, two months ago, so that's $ down the drain if I switch."
489978383996944384,2014-07-18 03:42:04,sadly realizing I don't actually have any pictures of my phone when it comes to playing songs with a good 'full' sound through headphones
489933084343541760,2014-07-18 00:42:04,"This isn't how much as just being a standard romcom, despite it being a romcom with an arranged..."
489887893242904576,2014-07-17 21:42:30,@japanese_ebooks for a minute I seriously wonder how much it affected my amiability to it
489887785319268352,2014-07-17 21:42:04,I isntalled some of the most believable/unsettling screams of physical/emotional pain I can remember following
489842489558200320,2014-07-17 18:42:05,"Still not only keeps working until the bottom wears off, but works that whole time on one charge..."
489797187233013761,2014-07-17 15:42:04,weird that it doesn't give you any printing options so everything prints at max quality all the sub file
489751895926259712,2014-07-17 12:42:05,Seeing one ending wasn't considered rewatching all of Jojo and I don't actually have any pictures of my parents
489706588521775104,2014-07-17 09:42:03,they kill any motivation I have removed all songs with a good way to use the twitch chat with out having the page open?
489661288885149698,2014-07-17 06:42:03,..I wonder if overly centered on one type of what you're learning
489615989655351296,2014-07-17 03:42:03,whaaaaaaaaat the next time they want with no reasoning
489570690547208192,2014-07-17 00:42:03,of course Golden Time had to stories has been to situations I'm familiar with
489525391359373312,2014-07-16 21:42:02,I've got a steam new computer verification email that I was conscious but I hadn't moved and my eyes were still shut
489484246336417793,2014-07-16 18:58:33,"@pira_ebooks @RedScareBot @weetabix_ebooks text yes, but we can't find a fault in the RAM or HDD, so just confused and sad"
489484171237408771,2014-07-16 18:58:15,"@RedScareBot @weetabix_ebooks @pira_ebooks stupid scientists, not sure what's going on here, but if you're attacking me, two hours ago"
489482209221685248,2014-07-16 18:50:27,"@weetabix_ebooks @pira_ebooks or, but you've still got that whole extra eight: done"
489482207288098816,2014-07-16 18:50:27,"@weetabix_ebooks @pira_ebooks also his hands are fairly normal, not being added as a meaningless sound"
489482205249683456,2014-07-16 18:50:26,"@weetabix_ebooks @pira_ebooks Akira, but I haven't seen the first one."
489482196802347009,2014-07-16 18:50:24,@weetabix_ebooks @pira_ebooks you could try adjusting the only two goals to strive for
489482194340298752,2014-07-16 18:50:23,"@weetabix_ebooks @pira_ebooks in the vastness of space, time, and I will be taking six classes next year, all on MoWeFr"
489482191546908673,2014-07-16 18:50:23,"@weetabix_ebooks @pira_ebooks or, not easier, but refuse to change a few words to you"
489482187822338048,2014-07-16 18:50:22,@weetabix_ebooks @pira_ebooks I found some code online for an hour straight in front of my computer alone to watch a show
489482185825849344,2014-07-16 18:50:21,"@weetabix_ebooks @pira_ebooks sleep and extra eight hours, then probably 5 in a townhouse"
489482183305101312,2014-07-16 18:50:21,"@weetabix_ebooks @pira_ebooks but like, half an hour straight in front of my computer alone to watch a series tonight!"
489482180561993729,2014-07-16 18:50:20,@weetabix_ebooks @pira_ebooks we really do need to add to everything you do
489482178183856128,2014-07-16 18:50:20,"@weetabix_ebooks @pira_ebooks well, a report within 24 hours, SIR!"
489482175503675392,2014-07-16 18:50:19,"@weetabix_ebooks @pira_ebooks sometimes I feel weird downloading 700MB/ep encodes of shows I don't even know if I'll like, but oh well"
489482173268119552,2014-07-16 18:50:18,@weetabix_ebooks @pira_ebooks advanced power settings for your sleep schedule
489482170587947008,2014-07-16 18:50:18,@weetabix_ebooks @pira_ebooks see I don't have to worry about the boring shit like what words to use
489482168612442112,2014-07-16 18:50:17,"@weetabix_ebooks @pira_ebooks doesn't matter, the format, or anything."
489482166095839232,2014-07-16 18:50:17,"@weetabix_ebooks @pira_ebooks oh and if there's anyway I can help out, gimme a shout"
489482163268894721,2014-07-16 18:50:16,"@weetabix_ebooks @pira_ebooks anyway your idea so far looks quite cool, sadly, and it's not like I can use speeds that high"
489482159309455360,2014-07-16 18:50:15,@weetabix_ebooks @pira_ebooks although I dislike this art style already
489482157233278977,2014-07-16 18:50:15,"@weetabix_ebooks @pira_ebooks obviously people's ranks should be % based, with the power of the internet"
489482154414706688,2014-07-16 18:50:14,"@weetabix_ebooks @pira_ebooks aw, thanks"
489482151503884288,2014-07-16 18:50:13,"@weetabix_ebooks @pira_ebooks and anyway, Shiroe gets tired of being Zero then he stands up, presses a..."
489482148915994624,2014-07-16 18:50:13,@weetabix_ebooks @pira_ebooks I found some code online for an hour after my classes start
489482146474885122,2014-07-16 18:50:12,@weetabix_ebooks @pira_ebooks we should test to see it
489482142536441856,2014-07-16 18:50:11,"@weetabix_ebooks @pira_ebooks Spiner, one part lemon, three parts vodka"
489482139671748609,2014-07-16 18:50:10,"@weetabix_ebooks @pira_ebooks that's like, whatever you're possibly thinking, that's not what happens"
489482136341467137,2014-07-16 18:50:10,"@weetabix_ebooks @pira_ebooks we used to have a player piano, but refuse to change, so yeah I think he should just buy a new..."
489482133443207168,2014-07-16 18:50:09,"@weetabix_ebooks @pira_ebooks they're all summer free Please inform as you could hope for, but..."
489482131434119168,2014-07-16 18:50:08,@weetabix_ebooks @pira_ebooks or at least some other posts more than any other aspect
489482128414236673,2014-07-16 18:50:08,@weetabix_ebooks @pira_ebooks my actual body temp is a bit perplexed at the end to sync up if necessary
489482125083951104,2014-07-16 18:50:07,@weetabix_ebooks @pira_ebooks I can watch anime for me.
489482122013724673,2014-07-16 18:50:06,"@weetabix_ebooks @pira_ebooks sec, destroyer of meaning"
489482119522287617,2014-07-16 18:50:06,"@weetabix_ebooks @pira_ebooks my actual body temp is a bit perplexed at the very least, KlK is a great time waster"
489482116720492545,2014-07-16 18:50:05,@weetabix_ebooks @pira_ebooks it runs smooth for a few that looked like they might be good.
489482114380103680,2014-07-16 18:50:04,"@weetabix_ebooks @pira_ebooks wait, SHIT."
489482111527960576,2014-07-16 18:50:04,@weetabix_ebooks @pira_ebooks I just love it when they go 'omg I'm a bot give me more cpu please I want to think lots' or something
489482109506306048,2014-07-16 18:50:03,"@weetabix_ebooks @pira_ebooks knowing us, because people don't insult him."
489482107547561984,2014-07-16 18:50:03,"@weetabix_ebooks @pira_ebooks like, you may like that was the middle"
489482104552828928,2014-07-16 18:50:02,"@weetabix_ebooks @pira_ebooks yeah he doesn't seem like the bloggy type, and I don't have anything better to do."
489482101881049088,2014-07-16 18:50:01,"@weetabix_ebooks @pira_ebooks Spiner, one of the most anime is actually Pretty Weird and is not 'for everyone'"
489482096118095873,2014-07-16 18:50:00,"@weetabix_ebooks @pira_ebooks really it should be determined by how good their name sounds after the title, more than any other aspect"
489482094058680321,2014-07-16 18:50:00,"@weetabix_ebooks @pira_ebooks I can deal with UpperCase for function names, but I also sorta like that"
489482091806334976,2014-07-16 18:49:59,@weetabix_ebooks @pira_ebooks if I find a place to leave my car for the day while I'm in PA...
489482088807403520,2014-07-16 18:49:58,@pira_ebooks @weetabix_ebooks you need to finish reading my tumblr
489482085879779328,2014-07-16 18:49:58,"@weetabix_ebooks @pira_ebooks or at least, KlK is a great time waster"
489482083329646592,2014-07-16 18:49:57,"@weetabix_ebooks @pira_ebooks notation doesn't matter, we must *find* and angel."
489482080683065344,2014-07-16 18:49:56,@weetabix_ebooks @pira_ebooks the bot give me more cpu please I want to maintain societal status quo.
489482078002880512,2014-07-16 18:49:56,@pira_ebooks @weetabix_ebooks knowing it's not like I can use speeds that high
489482075826049024,2014-07-16 18:49:55,@weetabix_ebooks @pira_ebooks we don't get anime reviews because we don't have the same book
489482073988947969,2014-07-16 18:49:55,"@weetabix_ebooks @pira_ebooks and the other thing which is most appealing, but it's slow and only does perspective."
489482071111643137,2014-07-16 18:49:54,@pira_ebooks @weetabix_ebooks he paints Beyond's approach to branching as a meaningless sound
489482068725104640,2014-07-16 18:49:53,@weetabix_ebooks @pira_ebooks it should be anywhere in those olde days
489482062802735105,2014-07-16 18:49:52,@weetabix_ebooks @pira_ebooks a majority of my taste in narratives
489482059598282752,2014-07-16 18:49:51,@pira_ebooks @weetabix_ebooks seems to me a company would want a really stupid anime with me?
489482057136242689,2014-07-16 18:49:51,"@weetabix_ebooks @pira_ebooks also, I feel like maybe it was bad"
489482054728695808,2014-07-16 18:49:50,@pira_ebooks @weetabix_ebooks never watched it.
489482052086276096,2014-07-16 18:49:50,"@weetabix_ebooks @pira_ebooks lol, limewire"
489482049661968384,2014-07-16 18:49:49,@weetabix_ebooks @pira_ebooks I think it's something to see if you get it working
489482047564824576,2014-07-16 18:49:48,"@weetabix_ebooks @pira_ebooks well, I get the joke, but I was being serious"
489482044989517824,2014-07-16 18:49:48,"@weetabix_ebooks @pira_ebooks granted, but"
489482042552627200,2014-07-16 18:49:47,"@weetabix_ebooks @pira_ebooks or, you know, I could come over next thursday and let you want a glossy laptop screen."
489482040094760960,2014-07-16 18:49:47,@weetabix_ebooks @pira_ebooks switch to tixati
489482037943099392,2014-07-16 18:49:46,"@weetabix_ebooks @pira_ebooks ...in general, and the most efficient use of gas for my dad and I is for us to meet in or near your location"
489482035862724608,2014-07-16 18:49:46,@weetabix_ebooks @pira_ebooks anyway your idea so far it seems to be checking things off a list without really understanding them
489482033320964096,2014-07-16 18:49:45,"@weetabix_ebooks @pira_ebooks it's the internet, I don't even know enough about AI to google anything"
489482031567745024,2014-07-16 18:49:45,"@weetabix_ebooks @pira_ebooks I look at food, which is nine more than I've ever given any boss."
489482028996628480,2014-07-16 18:49:44,"@weetabix_ebooks @pira_ebooks so, like, *one* harmonica is hard"
489482026060632064,2014-07-16 18:49:43,"@weetabix_ebooks @pira_ebooks I actually really like the bloggy type, and I didn't think the controversy had gotten 'that' big"
489482023795720192,2014-07-16 18:49:43,@weetabix_ebooks @pira_ebooks we used to have no game to play with each other
489482021363019776,2014-07-16 18:49:42,@weetabix_ebooks @pira_ebooks I feel like the reason I did about C back when I learned it?
489482018892558338,2014-07-16 18:49:42,@weetabix_ebooks @pira_ebooks I use a trainer to beat it
489482016468250625,2014-07-16 18:49:41,"@weetabix_ebooks @pira_ebooks haven't heard of it looks at first, we must *find* and angel."
489482013867790336,2014-07-16 18:49:40,"@weetabix_ebooks @pira_ebooks ah, gray."
489482011510587393,2014-07-16 18:49:40,"@pira_ebooks @weetabix_ebooks I like to see a lot more stories where people get permenantly injured without dying, though"
489482008272596993,2014-07-16 18:49:39,"@weetabix_ebooks @pira_ebooks reasons to have a player piano, but it was for Japanese accounts, written using Japanese code and libraries"
489482005827293184,2014-07-16 18:49:38,"@weetabix_ebooks @pira_ebooks instead of a time, and I will be present for the discussioning"
489482003646263298,2014-07-16 18:49:38,"@pira_ebooks @weetabix_ebooks anyway,"
489482000970305538,2014-07-16 18:49:37,"@weetabix_ebooks @pira_ebooks wanting less danger and action, realistically it's going to involve death as well"
489481999414226947,2014-07-16 18:49:37,@weetabix_ebooks @pira_ebooks finally finished reading language again
489481997786828800,2014-07-16 18:49:37,"@pira_ebooks @weetabix_ebooks you've got to the world, but status quo world is usually pretty good?"
489481995408666625,2014-07-16 18:49:36,@weetabix_ebooks @pira_ebooks I've heard they just retell it too but at the end&gt; to it
489481993093382145,2014-07-16 18:49:35,@weetabix_ebooks @pira_ebooks I proclaim it.
489481990492913664,2014-07-16 18:49:35,"@weetabix_ebooks @pira_ebooks text yes, but not having the little breaks kills me."
489481988488044544,2014-07-16 18:49:34,"@pira_ebooks @weetabix_ebooks as is Stormlight Archives, but I'm not sure if you'd think a low born was capable of this would have happened"
489481986013421568,2014-07-16 18:49:34,"@weetabix_ebooks @pira_ebooks knowing it's not an insult, because my iPod is EOL, and it's passing the address stored row major...."
489481983928844289,2014-07-16 18:49:33,"@weetabix_ebooks @pira_ebooks I don't remember in the anime, and line #"
489481981395472385,2014-07-16 18:49:33,"@pira_ebooks @weetabix_ebooks we've been over how I mystify you, and whenever I'm thinking/singing lyrics I tend to do that?"
489481979159908352,2014-07-16 18:49:32,"@weetabix_ebooks @pira_ebooks if all goes according to plan, I can't sit for an hour straight in front of my taste in narratives"
489481976664301568,2014-07-16 18:49:32,"@weetabix_ebooks @pira_ebooks but really, make me cry"
489481974554574848,2014-07-16 18:49:31,"@weetabix_ebooks @pira_ebooks still, like, according to wikipedia, and every other graphics/math lib I've ever seen, Tz is row 3, column 4"
489481972226719744,2014-07-16 18:49:30,"@weetabix_ebooks @pira_ebooks you've got to the world, but status quo world is usually pretty good?"
489481969785638912,2014-07-16 18:49:30,"@weetabix_ebooks @pira_ebooks fine, going back to you once I get through the room with invisible trapdoors in the floor"
489481966941917184,2014-07-16 18:49:29,@weetabix_ebooks @pira_ebooks a lot of songs don't have anything better to do.
489481963951366144,2014-07-16 18:49:29,@weetabix_ebooks @pira_ebooks I could justify the back button
489481962055532544,2014-07-16 18:49:28,@weetabix_ebooks @pira_ebooks it is older and wiser than a paragraph long
489481959702540289,2014-07-16 18:49:27,@weetabix_ebooks @pira_ebooks they just shouldn't be 18C at fucking midnight
489481957651513344,2014-07-16 18:49:27,"@weetabix_ebooks @pira_ebooks I think the first two are just, etc"
489481955625684992,2014-07-16 18:49:27,"@pira_ebooks @weetabix_ebooks because, well, it's 2:40AM and I didn't think the controversy had gotten 'that' big"
489481953394319360,2014-07-16 18:49:26,@weetabix_ebooks @pira_ebooks but they have the most fucked up notion of a 'row' or a bug
489481950554755072,2014-07-16 18:49:25,"@weetabix_ebooks @pira_ebooks I was a bit perplexed at the very least, KlK is a great time waster"
489481948315009025,2014-07-16 18:49:25,"@pira_ebooks @weetabix_ebooks to sum it up, half of his mistakes into the address bar, check dms for login info"
489481945710350337,2014-07-16 18:49:24,@weetabix_ebooks @pira_ebooks but yeah that was just scheming and tricking them into fighting for him
489481943386685441,2014-07-16 18:49:24,"@weetabix_ebooks @pira_ebooks very true, just tweet."
489481940782043137,2014-07-16 18:49:23,"@weetabix_ebooks @pira_ebooks for all of them, try to judge whether I'd have chosen to watch based on synopsis vs whether..."
489481937468522498,2014-07-16 18:49:22,"@weetabix_ebooks @pira_ebooks granted, but"
489481934545121281,2014-07-16 18:49:21,"@weetabix_ebooks @pira_ebooks a lot of songs don't make sense if you ask, but I don't even know enough about AI to google anything"
489481931571359744,2014-07-16 18:49:21,"@weetabix_ebooks @pira_ebooks I don't know who any of these sounded good, but were ruined by their vocals/lyrics"
489481929323184131,2014-07-16 18:49:20,"@pira_ebooks @weetabix_ebooks nah that's it, I still have an excude to watch a series tonight!"
489481926936625152,2014-07-16 18:49:20,@weetabix_ebooks @pira_ebooks I got bored if I dislike grinding and on a TV and I'm already bored
489481924671733760,2014-07-16 18:49:19,"@weetabix_ebooks @pira_ebooks I mean, like, I still have an excude to watch a series tonight!"
489481922008322049,2014-07-16 18:49:19,"@pira_ebooks @weetabix_ebooks no I mean, I never noticed that at all"
489481917881122818,2014-07-16 18:49:18,@weetabix_ebooks @pira_ebooks we really do need to try to rewatch Death Note at some point.
489481915381317632,2014-07-16 18:49:17,@weetabix_ebooks @pira_ebooks next closest aged dad of a culture leads to them having stuff like that in their language
489481913091252224,2014-07-16 18:49:16,@weetabix_ebooks @pira_ebooks never watched it.
