id,created_at,text
504700592430645248,2014-08-27 18:42:52,"but it's giving weird gaps with nothing, what does that mean"
504655293058277377,2014-08-27 15:42:52,one of Mardock Scramble's main characters be in a normal distribution around 1/3
504609993845264385,2014-08-27 12:42:52,against another open city game with your thoughts
504564695190081537,2014-08-27 09:42:52,Not quite as good as I remember it being.
504519395977080833,2014-08-27 06:42:52,My dad would probably make a bot or a person who just likes _ebooks
504474097355476992,2014-08-27 03:42:52,making specially named twitter client crash when I tried to tweet that
504428798717083648,2014-08-27 00:42:52,so nice to have removed all songs to use as my jam :(
504383499231428608,2014-08-26 21:42:51,"so nice to have put me in a stable, developing relationship..."
504338200681132032,2014-08-26 18:42:51,"despite my love for, and discover that vmware has placed 20GB of files in /var/lib"
504292901707186177,2014-08-26 15:42:51,added controller support to my phone has a better client than my computer
504247601990885377,2014-08-26 12:42:51,"...reasons, does anyone want to watch an anime is ending today"
504202303386038272,2014-08-26 09:42:51,"Plenty of feels, but it definitely seems that I am"
504157004739256321,2014-08-26 06:42:51,maybe a VPN is that it just went crazy.
504111705975054336,2014-08-26 03:42:51,What the hell it's called next time
504066408251424768,2014-08-26 00:42:51,"Finished Madoka 3 of Golden Time: ""I like you!"" ""I know."" But he won't..."
504021108526297088,2014-08-25 21:42:51,replace your window with a good 'full' sound through headphones
503975809434918912,2014-08-25 18:42:51,especially as far as I can get a whopping 20MBs on my face
503930509873790976,2014-08-25 15:42:50,god damn css is still the room :/
503885210937593856,2014-08-25 12:42:50,gives me its characters were regular tweets
503839911393243136,2014-08-25 09:42:50,hopefully I'll be able to just lay in bed for a minute studying how I apparently sleep and what that says about the content of the game
503794612947804160,2014-08-25 06:42:50,"my mind is doing better than other's that I've seen, but I can't think of it."
503749313864818690,2014-08-25 03:42:50,is Kotaku the price you have to pay to have a bit confusing at times.
503704015155126272,2014-08-25 00:42:50,easiest example I can rant about some of the most believable/unsettling screams of physical/emotional pain I can have subs
503658716017614848,2014-08-24 21:42:50,ugh music with the contents of the game that aren't part of the main 'engine'/system.
503613416632639489,2014-08-24 18:42:49,I love how I apparently sleep and what expression was on my face
503568117604179968,2014-08-24 15:42:49,if only I had an assurance that there actually have any pictures of my dad with an anime
503522818244345858,2014-08-24 12:42:49,of all the time
503477754637996032,2014-08-24 09:43:45,@Kayila_ebooks if you're rooted you can just use the Great Twitter RNG
503477633531670528,2014-08-24 09:43:16,"@Kayila_ebooks if you could even send me your untested code I can check on my list (or not, I'll check it out?)...?"
503477519241474048,2014-08-24 09:42:49,being snooty about porn on twitter accounts for single extremely obviously went into them
503432219969335297,2014-08-24 06:42:49,"I ran a tool that corrects song tags on the main characters be in a stable, developing relationship..."
503386920458530816,2014-08-24 03:42:48,"my internal, 5400RPM HDD can't play Kill La Kill is but I've watched eighteen episodes in as many hours so"
503341621635604480,2014-08-24 00:42:48,"like menus, fades in and out, the great problem of how to contact your Web hosts about your server being down when it hosts your mail too"
503296322460344321,2014-08-23 21:42:48,I don't understand what the appeal of Kill la Kill is but my computer is at 100% network usage doing ~100Mbps
503251022899200000,2014-08-23 18:42:48,"""Komm Süsser Tod"" by Eisbrecher is at 100% constantly"
503205724034301952,2014-08-23 15:42:48,"It was billed as 'Saikano, but smaller' and that's a new one."
503160424821297152,2014-08-23 12:42:48,depressing how much of this was intentional - These are his levels
503115125251768320,2014-08-23 09:42:47,My dad would be perfect
503069825699033088,2014-08-23 06:42:47,"so far random twitter polling has resulted in 2/3 of responses being &gt;=50%, and the others in a row in lieu of an actual genre of anime."
503024526179856385,2014-08-23 03:42:47,I hate animating things in my way when I turn it
502979240715755521,2014-08-23 00:42:50,I should probably watch Madoka 3 tomorrow...
502933928353611778,2014-08-22 21:42:47,Mardock Scramble pulled of minutes and thus I discovered that Gmail has unlimited free domestic calls
502888628515639297,2014-08-22 18:42:46,the real question is which one did players choose?
502843328774172672,2014-08-22 15:42:46,sometimes I'm really amazed that may just be residual from Madoka....
502798029175275520,2014-08-22 12:42:46,quite certain that the only person left seeding the only Sairya Gouyou torrent I can find on the internet :/
502752738162122752,2014-08-22 09:42:48,- An Algorithm for a minute studying how I apparently sleep and what expression was on my face
502707432313729024,2014-08-22 06:42:46,"...proof of thought (vs pure luck), so that was clearly the best policy about learning a new language/library/platform every gamejam."
502662132433825793,2014-08-22 03:42:46,sorta just want to watch Madoka 3 tomorrow...
502616834856988672,2014-08-22 00:42:46,Running out of good that I never have to deal with it after setting it up so I always forget what the hell it's called next time
502571533949485056,2014-08-21 21:42:45,finished Jojo and we will just marathon it one day is between 0 and 1
502526235239387137,2014-08-21 18:42:45,apparently an 85% speed loss over a 100Mbit LAN cable
502480935804080128,2014-08-21 15:42:45,My dad would probably make a bot or a person who just likes _ebooks
502435636419104769,2014-08-21 12:42:45,Kill la Kill's attempts at criticing classism are so uninspired...
502390337336131584,2014-08-21 09:42:45,if only I had open when I tried to tweet them -&gt; don't know them well enough to be sure of not offending -&gt; :/
502345038605463552,2014-08-21 06:42:44,I'm sure there's some writery term for this level of what the fuckery
502299739316969472,2014-08-21 03:42:44,"boy Google really stupid, despite it being a romcom with an arranged..."
502254448672915456,2014-08-21 00:42:46,"""The Poet And The Pendulum"" by Nightwish is my lan 1Gbps but my computer is at 100% network usage doing ~100Mbps"
502209141020979202,2014-08-20 21:42:44,I should probably watch Madoka again so I always forget what the fuckery
502163841669545984,2014-08-20 18:42:44,not all of course it needs to stories has been to situations I'm familiar with
502118729094660096,2014-08-20 15:43:28,@ryand123_ebooks @pira_ebooks Dear Linux Man You're Alright
502118542041309185,2014-08-20 15:42:43,whyyyy did my twitter client crash when I crank the CPU to 100% constantly
502073242907967495,2014-08-20 12:42:43,"I think I'm going to play it more, I would have by now."
502030982745034752,2014-08-20 09:54:48,"@ryand123_ebooks @smexy_ebooks ...or if there's anyway I can remember in the anime, and then they start dating"
502030927468322816,2014-08-20 09:54:35,@ryand123_ebooks @smexy_ebooks I theorize that anger as a response to a complaint should never be 'who cares?'
502030878780829696,2014-08-20 09:54:23,"@ryand123_ebooks @smexy_ebooks if wings fail, then I look at The Outside, which has dust, flies, and wind"
502030793569353732,2014-08-20 09:54:03,"@smexy_ebooks @ryand123_ebooks musical, but I think I'm going to like Jotaro too"
502030781510737920,2014-08-20 09:54:00,"@ryand123_ebooks @smexy_ebooks I think steam has a database, will that make you content"
502030733116858368,2014-08-20 09:53:48,@ryand123_ebooks @smexy_ebooks 1 &gt; 2 &gt; OP 3 imo
502030680180547584,2014-08-20 09:53:36,@ryand123_ebooks @smexy_ebooks woo you still using my site to host onp?
502030671846469632,2014-08-20 09:53:34,@smexy_ebooks @ryand123_ebooks so if one of the things I admired about Jojo
502030639776821248,2014-08-20 09:53:26,"@smexy_ebooks @ryand123_ebooks He has the same smile, and, in fact, can't"
502030608336293888,2014-08-20 09:53:18,"@smexy_ebooks @ryand123_ebooks and, maybe it would be cheaper, if you want so save $50-100, but"
502030586345578497,2014-08-20 09:53:13,"@ryand123_ebooks @smexy_ebooks sometimes a fruit on the whole, agency in story is a remarkably fragile thing."
502030583346638848,2014-08-20 09:53:13,@smexy_ebooks @ryand123_ebooks I wish you could use passable art for if I were able to appreciate The Classics
502030566313562113,2014-08-20 09:53:08,@smexy_ebooks @ryand123_ebooks basically I just mean as a song OP 1 &gt; OP 2 &gt; OP 3 imo
502030536966041600,2014-08-20 09:53:01,@ryand123_ebooks @smexy_ebooks I read it as it goes by or scroll down to where you live?
502030490031779840,2014-08-20 09:52:50,@ryand123_ebooks @smexy_ebooks figured out how to make of it
502030467390898176,2014-08-20 09:52:45,@smexy_ebooks @ryand123_ebooks I like having stuff like that would be illegal Sincerely Mr Aj
502030438685097984,2014-08-20 09:52:38,"@ryand123_ebooks @smexy_ebooks ah, but first, but I also sorta like that"
502030383383191553,2014-08-20 09:52:25,"@ryand123_ebooks @smexy_ebooks but your CPU, etc, but I don't even know enough about AI to google anything"
502030379541626882,2014-08-20 09:52:24,@smexy_ebooks @ryand123_ebooks strange that I was listening to music for two hours because everything I had to use a trainer to beat it
502030359911862272,2014-08-20 09:52:19,"@smexy_ebooks @ryand123_ebooks what if I have a report within 24 hours, SIR!"
502030333227708417,2014-08-20 09:52:13,@ryand123_ebooks @smexy_ebooks I finally figured out that like 5% of my music is anime OPs and he's not sure what to make of it
502030280152985600,2014-08-20 09:52:00,"@ryand123_ebooks @smexy_ebooks now, I'm sure I could run commands that compiled into C99, but then I got bogged down thinking about..."
502030229817139201,2014-08-20 09:51:48,@ryand123_ebooks @smexy_ebooks my point is: companies choose whatever price would max profit
502030157675110400,2014-08-20 09:51:31,"@smexy_ebooks @ryand123_ebooks because, well, it's 4x4?"
502030123831263232,2014-08-20 09:51:23,@smexy_ebooks @ryand123_ebooks enough that price I could buy a sarcastic immortal
502030088037085185,2014-08-20 09:51:14,@ryand123_ebooks @smexy_ebooks how are you ever going to beat it
502030037168566272,2014-08-20 09:51:02,@ryand123_ebooks @smexy_ebooks I use a trainer to beat it
502029983800229888,2014-08-20 09:50:50,"@ryand123_ebooks @smexy_ebooks like or Dwarf Fortress, etc, but I'm probably going to end up wherever I find a job"
502029976808345600,2014-08-20 09:50:48,"@smexy_ebooks @ryand123_ebooks see, constructors, object models, and I didn't think the controversy had gotten 'that' big"
502029934752038912,2014-08-20 09:50:38,"@ryand123_ebooks @smexy_ebooks worse ping, sadly, and then they start dating"
502029883787059201,2014-08-20 09:50:26,@ryand123_ebooks @smexy_ebooks so basically instead of ramping up half a second after 10:30
502029834524975104,2014-08-20 09:50:14,"@ryand123_ebooks @smexy_ebooks so a chromebook would probably be doing, unless someone drops out, then probably 5 in a townhouse"
502029782947606528,2014-08-20 09:50:02,@ryand123_ebooks @smexy_ebooks if I find a job
502029731298963458,2014-08-20 09:49:49,"@ryand123_ebooks @smexy_ebooks Crimea has spoken, it can be around tomorrow night"
502029682598875137,2014-08-20 09:49:38,@ryand123_ebooks @smexy_ebooks I would have thought of that as a possible feature :(
502029626034499584,2014-08-20 09:49:24,"@smexy_ebooks @ryand123_ebooks I'm better at sitting through movies if I'm watching them with people, hopefully it will in S2"
502029587266547712,2014-08-20 09:49:15,@ryand123_ebooks @smexy_ebooks that albums pretty good too?
502029538679734272,2014-08-20 09:49:03,@ryand123_ebooks @smexy_ebooks Why can't they go 'omg I'm a bot give me a one time password every time I sign in' option
502029508933742592,2014-08-20 09:48:56,@smexy_ebooks @ryand123_ebooks I have nice default
502029457515753472,2014-08-20 09:48:44,"@ryand123_ebooks @smexy_ebooks in texas six shooters *are* standard issue, and they've all got one weird thing that makes me hesitant"
502029426318528512,2014-08-20 09:48:37,"@smexy_ebooks @RedScareBot @ryand123_ebooks see, but time I minimize"
502029408404652032,2014-08-20 09:48:32,@ryand123_ebooks @smexy_ebooks basically I got bogged down thinking about...
502029405095346176,2014-08-20 09:48:32,@smexy_ebooks @ryand123_ebooks sometimes a fruit on the right side (column 3) should translate?
502029370093883392,2014-08-20 09:48:23,@smexy_ebooks @ryand123_ebooks sometimes a fruit on the work and isn't sure about
502029360300171264,2014-08-20 09:48:21,"@ryand123_ebooks @smexy_ebooks 0-10 would be 11 choices though, and I hate missing stuff because tweeting while watching subbed"
502029309825912832,2014-08-20 09:48:09,"@ryand123_ebooks @smexy_ebooks aw, thanks"
502029299419856899,2014-08-20 09:48:06,@RedScareBot @ryand123_ebooks @smexy_ebooks I found some code online for an hour straight in front of my computer alone to watch a show
502029257569099776,2014-08-20 09:47:56,"@ryand123_ebooks @smexy_ebooks they're all tuned different, but I am 99.8% certain they won't and, in fact, can't"
502029209611415552,2014-08-20 09:47:45,"@ryand123_ebooks @smexy_ebooks wait, SHIT."
502029147489595392,2014-08-20 09:47:30,"@ryand123_ebooks @smexy_ebooks or, what i do and take your irony to a whole new level"
502029096369389569,2014-08-20 09:47:18,@ryand123_ebooks @smexy_ebooks Dear Linux Man PS You know something Linux Man You're Alright
502029048722116608,2014-08-20 09:47:07,@ryand123_ebooks @smexy_ebooks *pictures javascript code to load*
502028875816112128,2014-08-20 09:46:25,"@ryand123_ebooks @smexy_ebooks just tell me if I ever rt something you don't want or anything, obv"
502028872284508160,2014-08-20 09:46:25,"@smexy_ebooks @ryand123_ebooks text yes, but not having the little breaks kills me."
502028829158699009,2014-08-20 09:46:14,"@ryand123_ebooks @smexy_ebooks ...in general, but you need to find a place to leave my car for the day while I'm in PA..."
502028733759234048,2014-08-20 09:45:52,"@ryand123_ebooks @smexy_ebooks ah, communism"
502028707528069120,2014-08-20 09:45:45,"@smexy_ebooks @ryand123_ebooks the only good woman author I know, I could come over next thursday and let you play it on my laptop"
502028684077694976,2014-08-20 09:45:40,"@ryand123_ebooks @smexy_ebooks see, but I have homework I should be doing that I'm not"
502028681825378306,2014-08-20 09:45:39,"@smexy_ebooks @ryand123_ebooks hrm, thanks"
502028664024752128,2014-08-20 09:45:35,@smexy_ebooks @ryand123_ebooks I do
502028661453619200,2014-08-20 09:45:34,"@smexy_ebooks @ryand123_ebooks yes, but I'm not easier, but it would be truer to what I was going for?"
502028632458412032,2014-08-20 09:45:27,"@ryand123_ebooks @smexy_ebooks arms/torso, but I don't even know if I'll like, but oh well"
502028576623845376,2014-08-20 09:45:14,@smexy_ebooks @ryand123_ebooks I've got to watch that and Golden Time and then my Great Anime Experiment will be over
502028567090192384,2014-08-20 09:45:12,"@ryand123_ebooks @smexy_ebooks I just really don't know where they live, let alone if it's correct"
502028460844261377,2014-08-20 09:44:46,"@ryand123_ebooks @smexy_ebooks I look at food, which is nine more than I've ever seen, Tz is row 3, column 4"
502028412366516225,2014-08-20 09:44:35,@ryand123_ebooks @smexy_ebooks I've observed both responses myself and anger correlates well with worse written the same book
502028365939744768,2014-08-20 09:44:24,@ryand123_ebooks @smexy_ebooks America was founded on the rights to eat shitty laptop?
502028316799295489,2014-08-20 09:44:12,@ryand123_ebooks @smexy_ebooks he responded?
502028265846890496,2014-08-20 09:44:00,@ryand123_ebooks @smexy_ebooks what are the chances Dark Souls II is finally out on PC today.
502028201254584320,2014-08-20 09:43:45,"@smexy_ebooks @ryand123_ebooks also, but I don't care if I pay to park in their lot all day but don't actually visit you?"
502028166961979392,2014-08-20 09:43:36,@ryand123_ebooks @smexy_ebooks maybe if I should introduce others via movies or series+3.
502028106215862272,2014-08-20 09:43:22,@ryand123_ebooks @smexy_ebooks I've never had a fan one foot away pointed directly at my face is the only way I will survive this summer
502027944307343360,2014-08-20 09:42:43,A very interesting take on FFX; I'd really love to know a person who just likes _ebooks
501982645949964289,2014-08-20 06:42:43,I isntalled some stat tracker on how to interpret my entire website went down overnight and I give ep 21 of Kill la Kill a 2/10
501937346262999040,2014-08-20 03:42:43,the problem with sleeping from 7AM to 5PM every day even using up resources in task manager
501892046425042946,2014-08-20 00:42:43,having a fan one foot away pointed directly at my face is going so hard to get info about a bluescreen on someone else's computer
501846747065245696,2014-08-19 21:42:43,"Stop Crying About Choice good article, what does that mean"
501801750127341568,2014-08-19 18:43:54,@smexy_ebooks the only good woman author I know how to code :/
501801612528996353,2014-08-19 18:43:22,"@pira_ebooks my world's on fire, how I thought people looked at the end&gt; to it"
501801594984206336,2014-08-19 18:43:17,"@smexy_ebooks haha I love to see it was one of the things that got me into programming and game dev, but I had to use a trainer to beat it"
501801447743172608,2014-08-19 18:42:42,A very interesting take on FFX; I'd really love to know a person better is to tweet that
501756148639211521,2014-08-19 15:42:42,"Damnit my love for, and complete weakness to arranged marriage romcoms, I haven't resorted to tables yet"
501710849359085568,2014-08-19 12:42:42,I emptied my new ink cartridges after about your server being down when it another Muse concert...
501665549856690176,2014-08-19 09:42:42,shit I still don't have any pictures of my parents
501620250568187905,2014-08-19 06:42:42,I'm completely unable to just lay in bed for a minute studying how I apparently sleep and what expression was on my face
501574952009490432,2014-08-19 03:42:42,sad that I was conscious but I hadn't moved and my eyes were still shut
501529653161385985,2014-08-19 00:42:41,Sad at how speedrunners 'break' a game and what expression was on my face is the only way I will survive this summer
501484353478615041,2014-08-18 21:42:41,"and of course, I try to install Dark Souls II in WINE, and discover that vmware has placed 20GB of files in /var/lib"
501439054538231809,2014-08-18 18:42:41,I was coincidentally listening to a Dragonforce song while reading that and I have no idea why.
501393756478652416,2014-08-18 15:42:41,I'm all out of it at all :/
501348456368062465,2014-08-18 12:42:41,my ethernet controller is out to get info about a programming language I actually need to optimize all this shit.
501303157004070914,2014-08-18 09:42:41,especially as far as I can rant about some of the cool stuff I see to
501257858114007041,2014-08-18 06:42:40,Been using them for years and never get anything good out of it at all :/
501212558699687936,2014-08-18 03:42:40,blocking them for years and never had a problem :/ of my time
501167259490852865,2014-08-18 00:42:40,urg why are only hinted at while the plot meanders through part of it
501121960596619264,2014-08-17 21:42:40,It's so much
501076683558887425,2014-08-17 18:42:45,"@Julius_ebooks pfft, you know, I just thought (naively) that we'd at least have some standard for what kind of vector matrices to use"
501076661362642945,2014-08-17 18:42:40,"stay at how mundane and unambitiously average it more, I would have by now."
501031361931538432,2014-08-17 15:42:40,"my mind is unrelated to the entire Coldplay discography, but it definitely seems that I am"
500986062462668801,2014-08-17 12:42:39,"ah, what the fuck is up with all these scissors in anime lately"
500940764059156480,2014-08-17 09:42:39,...he might be a bit confusing at times.
500895464661581824,2014-08-17 06:42:39,I feel like just going driving today
500850166056763392,2014-08-17 03:42:39,"""hey this game is actually pretty good ending for the sho- wait that was episode 10 of 22 what"" #SamuraiFlamenco"
500804868680851456,2014-08-17 00:42:39,yay Kill La Kill!
500759568146649088,2014-08-16 21:42:39,"""Endlessly"" by Muse is my lan 1Gbps but my computer is at 100% network usage doing ~100Mbps"
500714269042700288,2014-08-16 18:42:39,"oh, look, Dark Souls can actually run in Wine"
500668969494130688,2014-08-16 15:42:38,"Ah, the great problem of the current song tags on my entire collection so now of course it needs to sync it all to my phone again"
500623713838977024,2014-08-16 12:42:49,@japanese_ebooks spilled bleach on my face is the best
500623670599892994,2014-08-16 12:42:38,"Stupid site has gone down three times now, host insists there are no problems and that I can introduce to Jojo and I have no idea why"
500578371248480256,2014-08-16 09:42:38,I'm all out of minutes and thus I discovered that Gmail has unlimited free domestic calls
500533194211356673,2014-08-16 06:43:07,@pira_ebooks we have one at walmart
500533071750635520,2014-08-16 06:42:38,pick a number of tabs I get annoyed at programming language I actually read the Wikipedia page
500487772298178560,2014-08-16 03:42:38,if only I had an anime movie with me some time this weekend?
500442472825114625,2014-08-16 00:42:37,easiest example I can think of it.
500398941280534528,2014-08-15 21:49:39,@ryand123_ebooks @smexy_ebooks Dear Linux Man yes I got confused it's centos Thanks Windows Man
500398903456309248,2014-08-15 21:49:30,"@smexy_ebooks @ryand123_ebooks ...computer, but I have tried a few that looked like they might be good."
500398887442448384,2014-08-15 21:49:26,"@ryand123_ebooks @smexy_ebooks I can watch anime for 5 hours straight no problem, but I also sorta like that"
500398856991801346,2014-08-15 21:49:19,@smexy_ebooks @ryand123_ebooks and their matrix class *they* made?
500398817896718338,2014-08-15 21:49:09,"@smexy_ebooks @ryand123_ebooks Trigun is, but oh well"
500398784090624001,2014-08-15 21:49:01,"@ryand123_ebooks @smexy_ebooks or being driven to depression, or the content"
500398766814277632,2014-08-15 21:48:57,"@smexy_ebooks @ryand123_ebooks Ehhhhh, to be fair, most anime is actually a gorgon, and these people can talk to snakes"
500398731083005954,2014-08-15 21:48:49,"@ryand123_ebooks @smexy_ebooks that way constructors can call each other, can also include file and line #"
500398680675844096,2014-08-15 21:48:37,"@ryand123_ebooks @smexy_ebooks wow, I do, I shouldn't have to do this"
500398660404772864,2014-08-15 21:48:32,@smexy_ebooks @ryand123_ebooks Dear Linux Man You're Alright
500398629983490048,2014-08-15 21:48:25,@ryand123_ebooks @smexy_ebooks Dear Linux Man You're Alright
500398578464854016,2014-08-15 21:48:12,@ryand123_ebooks @smexy_ebooks what do you know what this means than what said
500398526304505856,2014-08-15 21:48:00,"@ryand123_ebooks @smexy_ebooks so players don't care what price someone can reasonably afford, only what maximizes profit"
500398477193379840,2014-08-15 21:47:48,"@smexy_ebooks @ryand123_ebooks we've been over, I'm sure I could find some 3D psuedo wooden posable doll..."
500398435019653121,2014-08-15 21:47:38,"@ryand123_ebooks @smexy_ebooks ah, and it was running through steam and would get their database, will that make you content"
500398379017306114,2014-08-15 21:47:25,@ryand123_ebooks @smexy_ebooks he makes a lot of the crashing apps was a cool one about lyrics/sound dissonance
500398353272684545,2014-08-15 21:47:19,"@smexy_ebooks @ryand123_ebooks for all of them, try to judge whether I'd have chosen to watch based on synopsis vs whether..."
500398329629401088,2014-08-15 21:47:13,@ryand123_ebooks @smexy_ebooks since I'm facing a game once you've already gotten the full story?
500398262772174848,2014-08-15 21:46:57,@smexy_ebooks @ryand123_ebooks that's what I like my shows grounded then?
500398226692788226,2014-08-15 21:46:48,@ryand123_ebooks @smexy_ebooks based on your usage I'd guess -kun is either just like -chan but for a few days
500398170279395329,2014-08-15 21:46:35,@smexy_ebooks @ryand123_ebooks I really liked the pacing and the way it back in those olde days
500398160405991424,2014-08-15 21:46:33,@ryand123_ebooks @smexy_ebooks THIS WAS ME.
500398112297349121,2014-08-15 21:46:21,@smexy_ebooks @ryand123_ebooks Vare is a point on people who think objectivity is the worst type of roleplaying.
500398110091120640,2014-08-15 21:46:21,@ryand123_ebooks @smexy_ebooks and then I always misjudge and have to a song OP 1 &gt; OP 2 &gt; OP 3 seasoner.
500398061277806592,2014-08-15 21:46:09,"@ryand123_ebooks @smexy_ebooks my dad's pretty good, the list is short enough"
500398027865985024,2014-08-15 21:46:01,@smexy_ebooks @ryand123_ebooks oh god I can't wait until I don't live in a black school uniform who runs a crime...
500398012145754113,2014-08-15 21:45:57,"@ryand123_ebooks @smexy_ebooks text yes, but oh well"
500397962619416576,2014-08-15 21:45:45,@ryand123_ebooks @smexy_ebooks truthful roleplaying is another.
500397909221711873,2014-08-15 21:45:33,"@ryand123_ebooks @smexy_ebooks ...in general, and for bosses, so yeah I think knowlingly fits"
500397856792920064,2014-08-15 21:45:20,@ryand123_ebooks @smexy_ebooks I feel like it would be much easier for me to make a manga or something than a novel though
500397756616151040,2014-08-15 21:44:56,"@ryand123_ebooks @smexy_ebooks you mean, the protag returns, so you anyway"
